#SampleID	BarcodeSequence	LinkerPrimerSequence	ampliconconcentration	center_name	center_project_name	experiment_center	experiment_design_description	experiment_title	extractedby	illumina_technology	library_construction_protocol	linker	pcr_primers	pcrplate	platform	region	run_center	run_date	run_prefix	samp_size	sample_center	sequencing_meth	target_gene	target_subfragment	wellinpcrplate	age	age_units	altitude	anonymized_name	body_habitat	body_mass_index	body_product	body_site	collection_date	collection_timestamp	collectiontime	country	date_of_birth	depth	dna_extracted	elevation	env_biome	env_feature	extracted_dna_avail_now	familyid	host_common_name	host_scientific_name	host_subject_id	host_taxid	individualid	latitude	longitude	physical_samp_avail_now	physical_specimen_location	physical_specimen_remaining	public	sample_location	sample_type	sex	shipmentnumber	sourcesamplebarcode	title	zygosity	Description
2014.Plate9.96	CAGTAGCGATAT	GTGCCAGCMGCCGCGGTAA	12.779	Cornell	UK_Twins	Cornell	fecal samples from TwinsUK MiSeq runs	TwinsUK Miseq	Jess	MiSeq	This analysis was done as in Caporaso et al 2011 Genome research. The PCR primers F515 and R806 were developed against the V4 region of the 16S rRNA, both bacteria and archaea, which we determined would yield optimal community clustering with reads of this length The reverse PCR primer is barcoded with a 12-base error-correcting Golay code to facilitate multiplexing of up to 1,500 samples per lane, and both PCR primers contain sequencer adapter regions.	GT	FWD:GTGCCAGCMGCCGCGGTAA; REV:GGACTACHVGGGTWTCTAAT	Plate9	Illumina	V4	Cornell	2/19/13	TwinsUKPlate9	0.1,gram	Kings College London	sequencing by synthesis	16S rRNA	V4	H12	58	years	0	5021	UBERON:feces	22.62745094	UBERON:feces	UBERON:feces	3/10/12	2012-03-10 07:30:00	7:30:00	GAZ:United Kingdom	7/3/53	0	true	10.4516	ENVO:dense settlement biome	ENVO:human-associated habitat	true	502	human	Homo sapiens	5021	9606	5021	51.5	-0.12	true	Cornell	true	false	King's College, London, UK	Stool	female	6	1006309	TwinsUK gut microbiome	DZ	TwinsUK Fecal Sample
2014.Plate9.91	GTCCCTATTATC	GTGCCAGCMGCCGCGGTAA	6.699	Cornell	UK_Twins	Cornell	fecal samples from TwinsUK MiSeq runs	TwinsUK Miseq	Jess	MiSeq	This analysis was done as in Caporaso et al 2011 Genome research. The PCR primers F515 and R806 were developed against the V4 region of the 16S rRNA, both bacteria and archaea, which we determined would yield optimal community clustering with reads of this length The reverse PCR primer is barcoded with a 12-base error-correcting Golay code to facilitate multiplexing of up to 1,500 samples per lane, and both PCR primers contain sequencer adapter regions.	GT	FWD:GTGCCAGCMGCCGCGGTAA; REV:GGACTACHVGGGTWTCTAAT	Plate9	Illumina	V4	Cornell	2/19/13	TwinsUKPlate9	0.1,gram	Kings College London	sequencing by synthesis	16S rRNA	V4	H7	64	years	0	7772	UBERON:feces	20.07842064	UBERON:feces	UBERON:feces	12/12/11	2011-12-12 09:40:00	9:40:00	GAZ:United Kingdom	12/16/46	0	true	10.4516	ENVO:dense settlement biome	ENVO:human-associated habitat	true	777	human	Homo sapiens	7772	9606	7772	51.5	-0.12	true	Cornell	true	false	King's College, London, UK	Stool	female	6	1003591	TwinsUK gut microbiome	DZ	TwinsUK Fecal Sample
2014.Plate9.9	GATCAACCCACA	GTGCCAGCMGCCGCGGTAA	9.249	Cornell	UK_Twins	Cornell	fecal samples from TwinsUK MiSeq runs	TwinsUK Miseq	Jess	MiSeq	This analysis was done as in Caporaso et al 2011 Genome research. The PCR primers F515 and R806 were developed against the V4 region of the 16S rRNA, both bacteria and archaea, which we determined would yield optimal community clustering with reads of this length The reverse PCR primer is barcoded with a 12-base error-correcting Golay code to facilitate multiplexing of up to 1,500 samples per lane, and both PCR primers contain sequencer adapter regions.	GT	FWD:GTGCCAGCMGCCGCGGTAA; REV:GGACTACHVGGGTWTCTAAT	Plate9	Illumina	V4	Cornell	2/19/13	TwinsUKPlate9	0.1,gram	Kings College London	sequencing by synthesis	16S rRNA	V4	A9	51	years	0	4002	UBERON:feces	23.20487976	UBERON:feces	UBERON:feces	1/11/12	2012-01-11 23:00:00	23:00:00	GAZ:United Kingdom	4/25/60	0	true	10.4516	ENVO:dense settlement biome	ENVO:human-associated habitat	true	400	human	Homo sapiens	4002	9606	4002	51.5	-0.12	true	Cornell	true	false	King's College, London, UK	Stool	female	6	1003504	TwinsUK gut microbiome	DZ	TwinsUK Fecal Sample
2014.Plate9.87	GCCGAGATAATT	GTGCCAGCMGCCGCGGTAA	9.249	Cornell	UK_Twins	Cornell	fecal samples from TwinsUK MiSeq runs	TwinsUK Miseq	Jess	MiSeq	This analysis was done as in Caporaso et al 2011 Genome research. The PCR primers F515 and R806 were developed against the V4 region of the 16S rRNA, both bacteria and archaea, which we determined would yield optimal community clustering with reads of this length The reverse PCR primer is barcoded with a 12-base error-correcting Golay code to facilitate multiplexing of up to 1,500 samples per lane, and both PCR primers contain sequencer adapter regions.	GT	FWD:GTGCCAGCMGCCGCGGTAA; REV:GGACTACHVGGGTWTCTAAT	Plate9	Illumina	V4	Cornell	2/19/13	TwinsUKPlate9	0.1,gram	Kings College London	sequencing by synthesis	16S rRNA	V4	H3	56	years	0	5342	UBERON:feces	28.18869019	UBERON:feces	UBERON:feces	3/19/12	2012-03-19 07:45:00	7:45:00	GAZ:United Kingdom	4/10/55	0	true	10.4516	ENVO:dense settlement biome	ENVO:human-associated habitat	true	534	human	Homo sapiens	5342	9606	5342	51.5	-0.12	true	Cornell	true	false	King's College, London, UK	Stool	female	6	1003603	TwinsUK gut microbiome	DZ	TwinsUK Fecal Sample
2014.Plate9.84	TCTGCGAGTCTG	GTGCCAGCMGCCGCGGTAA	10.622	Cornell	UK_Twins	Cornell	fecal samples from TwinsUK MiSeq runs	TwinsUK Miseq	Jess	MiSeq	This analysis was done as in Caporaso et al 2011 Genome research. The PCR primers F515 and R806 were developed against the V4 region of the 16S rRNA, both bacteria and archaea, which we determined would yield optimal community clustering with reads of this length The reverse PCR primer is barcoded with a 12-base error-correcting Golay code to facilitate multiplexing of up to 1,500 samples per lane, and both PCR primers contain sequencer adapter regions.	GT	FWD:GTGCCAGCMGCCGCGGTAA; REV:GGACTACHVGGGTWTCTAAT	Plate9	Illumina	V4	Cornell	2/19/13	TwinsUKPlate9	0.1,gram	Kings College London	sequencing by synthesis	16S rRNA	V4	G12	51	years	0	4021	UBERON:feces	23.9437809	UBERON:feces	UBERON:feces	2/12/12	2012-02-12 10:15:00	10:15:00	GAZ:United Kingdom	8/8/60	0	true	10.4516	ENVO:dense settlement biome	ENVO:human-associated habitat	true	402	human	Homo sapiens	4021	9606	4021	51.5	-0.12	true	Cornell	true	false	King's College, London, UK	Stool	female	6	1006321	TwinsUK gut microbiome	DZ	TwinsUK Fecal Sample
2014.Plate9.81	ACAATGTCACAG	GTGCCAGCMGCCGCGGTAA	7.876	Cornell	UK_Twins	Cornell	fecal samples from TwinsUK MiSeq runs	TwinsUK Miseq	Jess	MiSeq	This analysis was done as in Caporaso et al 2011 Genome research. The PCR primers F515 and R806 were developed against the V4 region of the 16S rRNA, both bacteria and archaea, which we determined would yield optimal community clustering with reads of this length The reverse PCR primer is barcoded with a 12-base error-correcting Golay code to facilitate multiplexing of up to 1,500 samples per lane, and both PCR primers contain sequencer adapter regions.	GT	FWD:GTGCCAGCMGCCGCGGTAA; REV:GGACTACHVGGGTWTCTAAT	Plate9	Illumina	V4	Cornell	2/19/13	TwinsUKPlate9	0.1,gram	Kings College London	sequencing by synthesis	16S rRNA	V4	G9	67	years	0	5262	UBERON:feces	28.74312019	UBERON:feces	UBERON:feces	12/6/11	2011-12-06 16:00:00	16:00:00	GAZ:United Kingdom	7/5/44	0	true	10.4516	ENVO:dense settlement biome	ENVO:human-associated habitat	true	526	human	Homo sapiens	5262	9606	5262	51.5	-0.12	true	Cornell	true	false	King's College, London, UK	Stool	female	6	1003465	TwinsUK gut microbiome	DZ	TwinsUK Fecal Sample
2014.Plate9.79	CAGCGTTTAGCC	GTGCCAGCMGCCGCGGTAA	11.406	Cornell	UK_Twins	Cornell	fecal samples from TwinsUK MiSeq runs	TwinsUK Miseq	Jess	MiSeq	This analysis was done as in Caporaso et al 2011 Genome research. The PCR primers F515 and R806 were developed against the V4 region of the 16S rRNA, both bacteria and archaea, which we determined would yield optimal community clustering with reads of this length The reverse PCR primer is barcoded with a 12-base error-correcting Golay code to facilitate multiplexing of up to 1,500 samples per lane, and both PCR primers contain sequencer adapter regions.	GT	FWD:GTGCCAGCMGCCGCGGTAA; REV:GGACTACHVGGGTWTCTAAT	Plate9	Illumina	V4	Cornell	2/19/13	TwinsUKPlate9	0.1,gram	Kings College London	sequencing by synthesis	16S rRNA	V4	G7	63	years	0	5401	UBERON:feces	21.54169083	UBERON:feces	UBERON:feces	2/9/12	2012-02-09 08:05:00	8:05:00	GAZ:United Kingdom	9/2/48	0	true	10.4516	ENVO:dense settlement biome	ENVO:human-associated habitat	true	540	human	Homo sapiens	5401	9606	5401	51.5	-0.12	true	Cornell	true	false	King's College, London, UK	Stool	female	6	1003543	TwinsUK gut microbiome	DZ	TwinsUK Fecal Sample
2014.Plate9.78	CCTGACACACAC	GTGCCAGCMGCCGCGGTAA	13.368	Cornell	UK_Twins	Cornell	fecal samples from TwinsUK MiSeq runs	TwinsUK Miseq	Jess	MiSeq	This analysis was done as in Caporaso et al 2011 Genome research. The PCR primers F515 and R806 were developed against the V4 region of the 16S rRNA, both bacteria and archaea, which we determined would yield optimal community clustering with reads of this length The reverse PCR primer is barcoded with a 12-base error-correcting Golay code to facilitate multiplexing of up to 1,500 samples per lane, and both PCR primers contain sequencer adapter regions.	GT	FWD:GTGCCAGCMGCCGCGGTAA; REV:GGACTACHVGGGTWTCTAAT	Plate9	Illumina	V4	Cornell	2/19/13	TwinsUKPlate9	0.1,gram	Kings College London	sequencing by synthesis	16S rRNA	V4	G6	66	years	0	8092	UBERON:feces	20.7963295	UBERON:feces	UBERON:feces	3/23/12	2012-03-23 11:45:00	11:45:00	GAZ:United Kingdom	10/24/45	0	true	10.4516	ENVO:dense settlement biome	ENVO:human-associated habitat	true	809	human	Homo sapiens	8092	9606	8092	51.5	-0.12	true	Cornell	true	false	King's College, London, UK	Stool	female	6	1003594	TwinsUK gut microbiome	DZ	TwinsUK Fecal Sample
2014.Plate9.75	TTCTCGGTTCTC	GTGCCAGCMGCCGCGGTAA	12.583	Cornell	UK_Twins	Cornell	fecal samples from TwinsUK MiSeq runs	TwinsUK Miseq	Jess	MiSeq	This analysis was done as in Caporaso et al 2011 Genome research. The PCR primers F515 and R806 were developed against the V4 region of the 16S rRNA, both bacteria and archaea, which we determined would yield optimal community clustering with reads of this length The reverse PCR primer is barcoded with a 12-base error-correcting Golay code to facilitate multiplexing of up to 1,500 samples per lane, and both PCR primers contain sequencer adapter regions.	GT	FWD:GTGCCAGCMGCCGCGGTAA; REV:GGACTACHVGGGTWTCTAAT	Plate9	Illumina	V4	Cornell	2/19/13	TwinsUKPlate9	0.1,gram	Kings College London	sequencing by synthesis	16S rRNA	V4	G3	68	years	0	7832	UBERON:feces	24.63184929	UBERON:feces	UBERON:feces	12/6/11	2011-12-06 07:30:00	7:30:00	GAZ:United Kingdom	4/22/43	0	true	10.4516	ENVO:dense settlement biome	ENVO:human-associated habitat	true	783	human	Homo sapiens	7832	9606	7832	51.5	-0.12	true	Cornell	true	false	King's College, London, UK	Stool	female	6	1003493	TwinsUK gut microbiome	DZ	TwinsUK Fecal Sample
2014.Plate9.73	TCGTAAGCCGTC	GTGCCAGCMGCCGCGGTAA	18.204	Cornell	UK_Twins	Cornell	fecal samples from TwinsUK MiSeq runs	TwinsUK Miseq	Jess	MiSeq	This analysis was done as in Caporaso et al 2011 Genome research. The PCR primers F515 and R806 were developed against the V4 region of the 16S rRNA, both bacteria and archaea, which we determined would yield optimal community clustering with reads of this length The reverse PCR primer is barcoded with a 12-base error-correcting Golay code to facilitate multiplexing of up to 1,500 samples per lane, and both PCR primers contain sequencer adapter regions.	GT	FWD:GTGCCAGCMGCCGCGGTAA; REV:GGACTACHVGGGTWTCTAAT	Plate9	Illumina	V4	Cornell	2/19/13	TwinsUKPlate9	0.1,gram	Kings College London	sequencing by synthesis	16S rRNA	V4	G1	73	years	0	5572	UBERON:feces	28.63810921	UBERON:feces	UBERON:feces	3/3/12	2012-03-03 10:10:00	10:10:00	GAZ:United Kingdom	8/14/38	0	true	10.4516	ENVO:dense settlement biome	ENVO:human-associated habitat	true	557	human	Homo sapiens	5572	9606	5572	51.5	-0.12	true	Cornell	true	false	King's College, London, UK	Stool	female	6	1003576	TwinsUK gut microbiome	DZ	TwinsUK Fecal Sample
2014.Plate9.72	GTATAGTCCGTG	GTGCCAGCMGCCGCGGTAA	12.387	Cornell	UK_Twins	Cornell	fecal samples from TwinsUK MiSeq runs	TwinsUK Miseq	Jess	MiSeq	This analysis was done as in Caporaso et al 2011 Genome research. The PCR primers F515 and R806 were developed against the V4 region of the 16S rRNA, both bacteria and archaea, which we determined would yield optimal community clustering with reads of this length The reverse PCR primer is barcoded with a 12-base error-correcting Golay code to facilitate multiplexing of up to 1,500 samples per lane, and both PCR primers contain sequencer adapter regions.	GT	FWD:GTGCCAGCMGCCGCGGTAA; REV:GGACTACHVGGGTWTCTAAT	Plate9	Illumina	V4	Cornell	2/19/13	TwinsUKPlate9	0.1,gram	Kings College London	sequencing by synthesis	16S rRNA	V4	F12	66	years	0	3961	UBERON:feces	21.67481995	UBERON:feces	UBERON:feces	3/5/12	2012-03-05 18:30:00	18:30:00	GAZ:United Kingdom	2/15/46	0	true	10.4516	ENVO:dense settlement biome	ENVO:human-associated habitat	true	396	human	Homo sapiens	3961	9606	3961	51.5	-0.12	true	Cornell	true	false	King's College, London, UK	Stool	female	6	1003574	TwinsUK gut microbiome	DZ	TwinsUK Fecal Sample
2014.Plate9.71	TTACACAAAGGC	GTGCCAGCMGCCGCGGTAA	18.271	Cornell	UK_Twins	Cornell	fecal samples from TwinsUK MiSeq runs	TwinsUK Miseq	Jess	MiSeq	This analysis was done as in Caporaso et al 2011 Genome research. The PCR primers F515 and R806 were developed against the V4 region of the 16S rRNA, both bacteria and archaea, which we determined would yield optimal community clustering with reads of this length The reverse PCR primer is barcoded with a 12-base error-correcting Golay code to facilitate multiplexing of up to 1,500 samples per lane, and both PCR primers contain sequencer adapter regions.	GT	FWD:GTGCCAGCMGCCGCGGTAA; REV:GGACTACHVGGGTWTCTAAT	Plate9	Illumina	V4	Cornell	2/19/13	TwinsUKPlate9	0.1,gram	Kings College London	sequencing by synthesis	16S rRNA	V4	F11	68	years	0	8212	UBERON:feces	25.49752998	UBERON:feces	UBERON:feces	1/18/12	2012-01-18 10:20:00	10:20:00	GAZ:United Kingdom	8/29/43	0	true	10.4516	ENVO:dense settlement biome	ENVO:human-associated habitat	true	821	human	Homo sapiens	8212	9606	8212	51.5	-0.12	true	Cornell	true	false	King's College, London, UK	Stool	female	6	1003529	TwinsUK gut microbiome	DZ	TwinsUK Fecal Sample
2014.Plate9.70	CGTCACTCCAAG	GTGCCAGCMGCCGCGGTAA	9.053	Cornell	UK_Twins	Cornell	fecal samples from TwinsUK MiSeq runs	TwinsUK Miseq	Jess	MiSeq	This analysis was done as in Caporaso et al 2011 Genome research. The PCR primers F515 and R806 were developed against the V4 region of the 16S rRNA, both bacteria and archaea, which we determined would yield optimal community clustering with reads of this length The reverse PCR primer is barcoded with a 12-base error-correcting Golay code to facilitate multiplexing of up to 1,500 samples per lane, and both PCR primers contain sequencer adapter regions.	GT	FWD:GTGCCAGCMGCCGCGGTAA; REV:GGACTACHVGGGTWTCTAAT	Plate9	Illumina	V4	Cornell	2/19/13	TwinsUKPlate9	0.1,gram	Kings College London	sequencing by synthesis	16S rRNA	V4	F10	64	years	0	6962	UBERON:feces	19.9948597	UBERON:feces	UBERON:feces	2/19/12	2012-02-19 18:00:00	18:00:00	GAZ:United Kingdom	8/12/47	0	true	10.4516	ENVO:dense settlement biome	ENVO:human-associated habitat	true	696	human	Homo sapiens	6962	9606	6962	51.5	-0.12	true	Cornell	true	false	King's College, London, UK	Stool	female	6	1003573	TwinsUK gut microbiome	MZ	TwinsUK Fecal Sample
2014.Plate9.68	AGGGAAAGGATC	GTGCCAGCMGCCGCGGTAA	9.641	Cornell	UK_Twins	Cornell	fecal samples from TwinsUK MiSeq runs	TwinsUK Miseq	Jess	MiSeq	This analysis was done as in Caporaso et al 2011 Genome research. The PCR primers F515 and R806 were developed against the V4 region of the 16S rRNA, both bacteria and archaea, which we determined would yield optimal community clustering with reads of this length The reverse PCR primer is barcoded with a 12-base error-correcting Golay code to facilitate multiplexing of up to 1,500 samples per lane, and both PCR primers contain sequencer adapter regions.	GT	FWD:GTGCCAGCMGCCGCGGTAA; REV:GGACTACHVGGGTWTCTAAT	Plate9	Illumina	V4	Cornell	2/19/13	TwinsUKPlate9	0.1,gram	Kings College London	sequencing by synthesis	16S rRNA	V4	F8	64	years	0	7762	UBERON:feces		UBERON:feces	UBERON:feces	3/4/12	2012-03-04 04:00:00	4:00:00	GAZ:United Kingdom	7/30/47	0	true	10.4516	ENVO:dense settlement biome	ENVO:human-associated habitat	true	776	human	Homo sapiens	7762	9606	7762	51.5	-0.12	true	Cornell	true	false	King's College, London, UK	Stool	female	6	1003568	TwinsUK gut microbiome	DZ	TwinsUK Fecal Sample
2014.Plate9.66	GCTCCACAACGT	GTGCCAGCMGCCGCGGTAA	11.21	Cornell	UK_Twins	Cornell	fecal samples from TwinsUK MiSeq runs	TwinsUK Miseq	Jess	MiSeq	This analysis was done as in Caporaso et al 2011 Genome research. The PCR primers F515 and R806 were developed against the V4 region of the 16S rRNA, both bacteria and archaea, which we determined would yield optimal community clustering with reads of this length The reverse PCR primer is barcoded with a 12-base error-correcting Golay code to facilitate multiplexing of up to 1,500 samples per lane, and both PCR primers contain sequencer adapter regions.	GT	FWD:GTGCCAGCMGCCGCGGTAA; REV:GGACTACHVGGGTWTCTAAT	Plate9	Illumina	V4	Cornell	2/19/13	TwinsUKPlate9	0.1,gram	Kings College London	sequencing by synthesis	16S rRNA	V4	F6	63	years	0	6501	UBERON:feces	26.48438072	UBERON:feces	UBERON:feces	3/5/12	2012-03-05 09:30:00	9:30:00	GAZ:United Kingdom	3/4/49	0	true	10.4516	ENVO:dense settlement biome	ENVO:human-associated habitat	true	650	human	Homo sapiens	6501	9606	6501	51.5	-0.12	true	Cornell	true	false	King's College, London, UK	Stool	female	6	1003582	TwinsUK gut microbiome	DZ	TwinsUK Fecal Sample
2014.Plate9.65	ATCAGCCAGCTC	GTGCCAGCMGCCGCGGTAA	12.387	Cornell	UK_Twins	Cornell	fecal samples from TwinsUK MiSeq runs	TwinsUK Miseq	Jess	MiSeq	This analysis was done as in Caporaso et al 2011 Genome research. The PCR primers F515 and R806 were developed against the V4 region of the 16S rRNA, both bacteria and archaea, which we determined would yield optimal community clustering with reads of this length The reverse PCR primer is barcoded with a 12-base error-correcting Golay code to facilitate multiplexing of up to 1,500 samples per lane, and both PCR primers contain sequencer adapter regions.	GT	FWD:GTGCCAGCMGCCGCGGTAA; REV:GGACTACHVGGGTWTCTAAT	Plate9	Illumina	V4	Cornell	2/19/13	TwinsUKPlate9	0.1,gram	Kings College London	sequencing by synthesis	16S rRNA	V4	F5	64	years	0	6681	UBERON:feces	31.44379044	UBERON:feces	UBERON:feces	2/7/12	2012-02-07 09:40:00	9:40:00	GAZ:United Kingdom	6/26/47	0	true	10.4516	ENVO:dense settlement biome	ENVO:human-associated habitat	true	668	human	Homo sapiens	6681	9606	6681	51.5	-0.12	true	Cornell	true	false	King's College, London, UK	Stool	female	6	1003538	TwinsUK gut microbiome	MZ	TwinsUK Fecal Sample
2014.Plate9.64	CCTTTCACCTGT	GTGCCAGCMGCCGCGGTAA	10.426	Cornell	UK_Twins	Cornell	fecal samples from TwinsUK MiSeq runs	TwinsUK Miseq	Jess	MiSeq	This analysis was done as in Caporaso et al 2011 Genome research. The PCR primers F515 and R806 were developed against the V4 region of the 16S rRNA, both bacteria and archaea, which we determined would yield optimal community clustering with reads of this length The reverse PCR primer is barcoded with a 12-base error-correcting Golay code to facilitate multiplexing of up to 1,500 samples per lane, and both PCR primers contain sequencer adapter regions.	GT	FWD:GTGCCAGCMGCCGCGGTAA; REV:GGACTACHVGGGTWTCTAAT	Plate9	Illumina	V4	Cornell	2/19/13	TwinsUKPlate9	0.1,gram	Kings College London	sequencing by synthesis	16S rRNA	V4	F4	65	years	0	7171	UBERON:feces	30.7793293	UBERON:feces	UBERON:feces	12/12/11	2011-12-12 09:30:00	9:30:00	GAZ:United Kingdom	3/29/46	0	true	10.4516	ENVO:dense settlement biome	ENVO:human-associated habitat	true	717	human	Homo sapiens	7171	9606	7171	51.5	-0.12	true	Cornell	true	false	King's College, London, UK	Stool	female	6	1003466	TwinsUK gut microbiome	DZ	TwinsUK Fecal Sample
2014.Plate9.62	GGACTCAACTAA	GTGCCAGCMGCCGCGGTAA	9.641	Cornell	UK_Twins	Cornell	fecal samples from TwinsUK MiSeq runs	TwinsUK Miseq	Jess	MiSeq	This analysis was done as in Caporaso et al 2011 Genome research. The PCR primers F515 and R806 were developed against the V4 region of the 16S rRNA, both bacteria and archaea, which we determined would yield optimal community clustering with reads of this length The reverse PCR primer is barcoded with a 12-base error-correcting Golay code to facilitate multiplexing of up to 1,500 samples per lane, and both PCR primers contain sequencer adapter regions.	GT	FWD:GTGCCAGCMGCCGCGGTAA; REV:GGACTACHVGGGTWTCTAAT	Plate9	Illumina	V4	Cornell	2/19/13	TwinsUKPlate9	0.1,gram	Kings College London	sequencing by synthesis	16S rRNA	V4	F2	56	years	0	7141	UBERON:feces	31.59320068	UBERON:feces	UBERON:feces	2/29/12	2012-02-29 08:20:00	8:20:00	GAZ:United Kingdom	7/25/55	0	true	10.4516	ENVO:dense settlement biome	ENVO:human-associated habitat	true	714	human	Homo sapiens	7141	9606	7141	51.5	-0.12	true	Cornell	true	false	King's College, London, UK	Stool	female	6	1003572	TwinsUK gut microbiome	DZ	TwinsUK Fecal Sample
2014.Plate9.61	GTCCTGACACTG	GTGCCAGCMGCCGCGGTAA	13.673	Cornell	UK_Twins	Cornell	fecal samples from TwinsUK MiSeq runs	TwinsUK Miseq	Jess	MiSeq	This analysis was done as in Caporaso et al 2011 Genome research. The PCR primers F515 and R806 were developed against the V4 region of the 16S rRNA, both bacteria and archaea, which we determined would yield optimal community clustering with reads of this length The reverse PCR primer is barcoded with a 12-base error-correcting Golay code to facilitate multiplexing of up to 1,500 samples per lane, and both PCR primers contain sequencer adapter regions.	GT	FWD:GTGCCAGCMGCCGCGGTAA; REV:GGACTACHVGGGTWTCTAAT	Plate9	Illumina	V4	Cornell	2/19/13	TwinsUKPlate9	0.1,gram	Kings College London	sequencing by synthesis	16S rRNA	V4	F1	43	years	0	4822	UBERON:feces	21.57438087	UBERON:feces	UBERON:feces	2/24/12	2012-02-24 09:30:00	9:30:00	GAZ:United Kingdom	10/3/68	0	true	10.4516	ENVO:dense settlement biome	ENVO:human-associated habitat	true	482	human	Homo sapiens	4822	9606	4822	51.5	-0.12	true	Cornell	true	false	King's College, London, UK	Stool	female	6	1003583	TwinsUK gut microbiome	DZ	TwinsUK Fecal Sample
2014.Plate9.60	ACCTAGCTAGTG	GTGCCAGCMGCCGCGGTAA	8.661	Cornell	UK_Twins	Cornell	fecal samples from TwinsUK MiSeq runs	TwinsUK Miseq	Jess	MiSeq	This analysis was done as in Caporaso et al 2011 Genome research. The PCR primers F515 and R806 were developed against the V4 region of the 16S rRNA, both bacteria and archaea, which we determined would yield optimal community clustering with reads of this length The reverse PCR primer is barcoded with a 12-base error-correcting Golay code to facilitate multiplexing of up to 1,500 samples per lane, and both PCR primers contain sequencer adapter regions.	GT	FWD:GTGCCAGCMGCCGCGGTAA; REV:GGACTACHVGGGTWTCTAAT	Plate9	Illumina	V4	Cornell	2/19/13	TwinsUKPlate9	0.1,gram	Kings College London	sequencing by synthesis	16S rRNA	V4	E12	62	years	0	5871	UBERON:feces	21.02687073	UBERON:feces	UBERON:feces	1/15/12	2012-01-15 13:15:00	13:15:00	GAZ:United Kingdom	1/8/50	0	true	10.4516	ENVO:dense settlement biome	ENVO:human-associated habitat	true	587	human	Homo sapiens	5871	9606	5871	51.5	-0.12	true	Cornell	true	false	King's College, London, UK	Stool	female	6	1003528	TwinsUK gut microbiome	DZ	TwinsUK Fecal Sample
2014.Plate9.6	AGCACTTTGAGA	GTGCCAGCMGCCGCGGTAA	5.719	Cornell	UK_Twins	Cornell	fecal samples from TwinsUK MiSeq runs	TwinsUK Miseq	Jess	MiSeq	This analysis was done as in Caporaso et al 2011 Genome research. The PCR primers F515 and R806 were developed against the V4 region of the 16S rRNA, both bacteria and archaea, which we determined would yield optimal community clustering with reads of this length The reverse PCR primer is barcoded with a 12-base error-correcting Golay code to facilitate multiplexing of up to 1,500 samples per lane, and both PCR primers contain sequencer adapter regions.	GT	FWD:GTGCCAGCMGCCGCGGTAA; REV:GGACTACHVGGGTWTCTAAT	Plate9	Illumina	V4	Cornell	2/19/13	TwinsUKPlate9	0.1,gram	Kings College London	sequencing by synthesis	16S rRNA	V4	A6	62	years	0	5701	UBERON:feces	26.41081047	UBERON:feces	UBERON:feces	3/15/12	2012-03-15 08:00:00	8:00:00	GAZ:United Kingdom	6/1/49	0	true	10.4516	ENVO:dense settlement biome	ENVO:human-associated habitat	true	570	human	Homo sapiens	5701	9606	5701	51.5	-0.12	true	Cornell	true	false	King's College, London, UK	Stool	female	6	1006317	TwinsUK gut microbiome	DZ	TwinsUK Fecal Sample
2014.Plate9.59	ATAGGTGTGCTA	GTGCCAGCMGCCGCGGTAA	9.837	Cornell	UK_Twins	Cornell	fecal samples from TwinsUK MiSeq runs	TwinsUK Miseq	Jess	MiSeq	This analysis was done as in Caporaso et al 2011 Genome research. The PCR primers F515 and R806 were developed against the V4 region of the 16S rRNA, both bacteria and archaea, which we determined would yield optimal community clustering with reads of this length The reverse PCR primer is barcoded with a 12-base error-correcting Golay code to facilitate multiplexing of up to 1,500 samples per lane, and both PCR primers contain sequencer adapter regions.	GT	FWD:GTGCCAGCMGCCGCGGTAA; REV:GGACTACHVGGGTWTCTAAT	Plate9	Illumina	V4	Cornell	2/19/13	TwinsUKPlate9	0.1,gram	Kings College London	sequencing by synthesis	16S rRNA	V4	E11	63	years	0	6502	UBERON:feces	30.6372509	UBERON:feces	UBERON:feces	3/5/12	2012-03-05 07:00:00	7:00:00	GAZ:United Kingdom	3/4/49	0	true	10.4516	ENVO:dense settlement biome	ENVO:human-associated habitat	true	650	human	Homo sapiens	6502	9606	6502	51.5	-0.12	true	Cornell	true	false	King's College, London, UK	Stool	female	6	1003585	TwinsUK gut microbiome	DZ	TwinsUK Fecal Sample
2014.Plate9.58	GCAGCCATATTG	GTGCCAGCMGCCGCGGTAA	10.033	Cornell	UK_Twins	Cornell	fecal samples from TwinsUK MiSeq runs	TwinsUK Miseq	Jess	MiSeq	This analysis was done as in Caporaso et al 2011 Genome research. The PCR primers F515 and R806 were developed against the V4 region of the 16S rRNA, both bacteria and archaea, which we determined would yield optimal community clustering with reads of this length The reverse PCR primer is barcoded with a 12-base error-correcting Golay code to facilitate multiplexing of up to 1,500 samples per lane, and both PCR primers contain sequencer adapter regions.	GT	FWD:GTGCCAGCMGCCGCGGTAA; REV:GGACTACHVGGGTWTCTAAT	Plate9	Illumina	V4	Cornell	2/19/13	TwinsUKPlate9	0.1,gram	Kings College London	sequencing by synthesis	16S rRNA	V4	E10	59	years	0	5482	UBERON:feces	24.4056797	UBERON:feces	UBERON:feces	3/21/12	2012-03-21 22:15:00	22:15:00	GAZ:United Kingdom	4/11/52	0	true	10.4516	ENVO:dense settlement biome	ENVO:human-associated habitat	true	548	human	Homo sapiens	5482	9606	5482	51.5	-0.12	true	Cornell	true	false	King's College, London, UK	Stool	female	6	1003595	TwinsUK gut microbiome	DZ	TwinsUK Fecal Sample
2014.Plate9.57	ACGGTTTCTGGA	GTGCCAGCMGCCGCGGTAA	5.13	Cornell	UK_Twins	Cornell	fecal samples from TwinsUK MiSeq runs	TwinsUK Miseq	Jess	MiSeq	This analysis was done as in Caporaso et al 2011 Genome research. The PCR primers F515 and R806 were developed against the V4 region of the 16S rRNA, both bacteria and archaea, which we determined would yield optimal community clustering with reads of this length The reverse PCR primer is barcoded with a 12-base error-correcting Golay code to facilitate multiplexing of up to 1,500 samples per lane, and both PCR primers contain sequencer adapter regions.	GT	FWD:GTGCCAGCMGCCGCGGTAA; REV:GGACTACHVGGGTWTCTAAT	Plate9	Illumina	V4	Cornell	2/19/13	TwinsUKPlate9	0.1,gram	Kings College London	sequencing by synthesis	16S rRNA	V4	E9	67	years	0	6222	UBERON:feces	29.7050209	UBERON:feces	UBERON:feces	3/25/12	2012-03-25 09:30:00	9:30:00	GAZ:United Kingdom	3/31/44	0	true	10.4516	ENVO:dense settlement biome	ENVO:human-associated habitat	true	622	human	Homo sapiens	6222	9606	6222	51.5	-0.12	true	Cornell	true	false	King's College, London, UK	Stool	female	6	1003600	TwinsUK gut microbiome	DZ	TwinsUK Fecal Sample
2014.Plate9.54	GTCCACTTGGAC	GTGCCAGCMGCCGCGGTAA	10.23	Cornell	UK_Twins	Cornell	fecal samples from TwinsUK MiSeq runs	TwinsUK Miseq	Jess	MiSeq	This analysis was done as in Caporaso et al 2011 Genome research. The PCR primers F515 and R806 were developed against the V4 region of the 16S rRNA, both bacteria and archaea, which we determined would yield optimal community clustering with reads of this length The reverse PCR primer is barcoded with a 12-base error-correcting Golay code to facilitate multiplexing of up to 1,500 samples per lane, and both PCR primers contain sequencer adapter regions.	GT	FWD:GTGCCAGCMGCCGCGGTAA; REV:GGACTACHVGGGTWTCTAAT	Plate9	Illumina	V4	Cornell	2/19/13	TwinsUKPlate9	0.1,gram	Kings College London	sequencing by synthesis	16S rRNA	V4	E6	43	years	0	4821	UBERON:feces	22.42843056	UBERON:feces	UBERON:feces	2/24/12	2012-02-24 09:20:00	9:20:00	GAZ:United Kingdom	10/3/68	0	true	10.4516	ENVO:dense settlement biome	ENVO:human-associated habitat	true	482	human	Homo sapiens	4821	9606	4821	51.5	-0.12	true	Cornell	true	false	King's College, London, UK	Stool	female	6	1003577	TwinsUK gut microbiome	DZ	TwinsUK Fecal Sample
2014.Plate9.53	TTCTGGTCTTGT	GTGCCAGCMGCCGCGGTAA	9.641	Cornell	UK_Twins	Cornell	fecal samples from TwinsUK MiSeq runs	TwinsUK Miseq	Jess	MiSeq	This analysis was done as in Caporaso et al 2011 Genome research. The PCR primers F515 and R806 were developed against the V4 region of the 16S rRNA, both bacteria and archaea, which we determined would yield optimal community clustering with reads of this length The reverse PCR primer is barcoded with a 12-base error-correcting Golay code to facilitate multiplexing of up to 1,500 samples per lane, and both PCR primers contain sequencer adapter regions.	GT	FWD:GTGCCAGCMGCCGCGGTAA; REV:GGACTACHVGGGTWTCTAAT	Plate9	Illumina	V4	Cornell	2/19/13	TwinsUKPlate9	0.1,gram	Kings College London	sequencing by synthesis	16S rRNA	V4	E5	62	years	0	4062	UBERON:feces	29.67407036	UBERON:feces	UBERON:feces	3/19/12	2012-03-19 06:50:00	6:50:00	GAZ:United Kingdom	11/20/49	0	true	10.4516	ENVO:dense settlement biome	ENVO:human-associated habitat	true	406	human	Homo sapiens	4062	9606	4062	51.5	-0.12	true	Cornell	true	false	King's College, London, UK	Stool	female	6	1006324	TwinsUK gut microbiome	MZ	TwinsUK Fecal Sample
2014.Plate9.52	TCTCGCACTGGA	GTGCCAGCMGCCGCGGTAA	14.152	Cornell	UK_Twins	Cornell	fecal samples from TwinsUK MiSeq runs	TwinsUK Miseq	Jess	MiSeq	This analysis was done as in Caporaso et al 2011 Genome research. The PCR primers F515 and R806 were developed against the V4 region of the 16S rRNA, both bacteria and archaea, which we determined would yield optimal community clustering with reads of this length The reverse PCR primer is barcoded with a 12-base error-correcting Golay code to facilitate multiplexing of up to 1,500 samples per lane, and both PCR primers contain sequencer adapter regions.	GT	FWD:GTGCCAGCMGCCGCGGTAA; REV:GGACTACHVGGGTWTCTAAT	Plate9	Illumina	V4	Cornell	2/19/13	TwinsUKPlate9	0.1,gram	Kings College London	sequencing by synthesis	16S rRNA	V4	E4	50	years	0	6831	UBERON:feces	26.34634972	UBERON:feces	UBERON:feces	12/20/11	2011-12-20 07:30:00	7:30:00	GAZ:United Kingdom	5/7/61	0	true	10.4516	ENVO:dense settlement biome	ENVO:human-associated habitat	true	683	human	Homo sapiens	6831	9606	6831	51.5	-0.12	true	Cornell	true	false	King's College, London, UK	Stool	female	6	1003503	TwinsUK gut microbiome	DZ	TwinsUK Fecal Sample
2014.Plate9.50	GTTACAGTTGGC	GTGCCAGCMGCCGCGGTAA	6.699	Cornell	UK_Twins	Cornell	fecal samples from TwinsUK MiSeq runs	TwinsUK Miseq	Jess	MiSeq	This analysis was done as in Caporaso et al 2011 Genome research. The PCR primers F515 and R806 were developed against the V4 region of the 16S rRNA, both bacteria and archaea, which we determined would yield optimal community clustering with reads of this length The reverse PCR primer is barcoded with a 12-base error-correcting Golay code to facilitate multiplexing of up to 1,500 samples per lane, and both PCR primers contain sequencer adapter regions.	GT	FWD:GTGCCAGCMGCCGCGGTAA; REV:GGACTACHVGGGTWTCTAAT	Plate9	Illumina	V4	Cornell	2/19/13	TwinsUKPlate9	0.1,gram	Kings College London	sequencing by synthesis	16S rRNA	V4	E2	47	years	0	4151	UBERON:feces	20.97266006	UBERON:feces	UBERON:feces	4/2/12	2012-04-02 10:30:00	10:30:00	GAZ:United Kingdom	10/30/64	0	true	10.4516	ENVO:dense settlement biome	ENVO:human-associated habitat	true	415	human	Homo sapiens	4151	9606	4151	51.5	-0.12	true	Cornell	true	false	King's College, London, UK	Stool	female	6	1003599	TwinsUK gut microbiome	MZ	TwinsUK Fecal Sample
2014.Plate9.5	TGGTTCATCCTT	GTGCCAGCMGCCGCGGTAA	9.445	Cornell	UK_Twins	Cornell	fecal samples from TwinsUK MiSeq runs	TwinsUK Miseq	Jess	MiSeq	This analysis was done as in Caporaso et al 2011 Genome research. The PCR primers F515 and R806 were developed against the V4 region of the 16S rRNA, both bacteria and archaea, which we determined would yield optimal community clustering with reads of this length The reverse PCR primer is barcoded with a 12-base error-correcting Golay code to facilitate multiplexing of up to 1,500 samples per lane, and both PCR primers contain sequencer adapter regions.	GT	FWD:GTGCCAGCMGCCGCGGTAA; REV:GGACTACHVGGGTWTCTAAT	Plate9	Illumina	V4	Cornell	2/19/13	TwinsUKPlate9	0.1,gram	Kings College London	sequencing by synthesis	16S rRNA	V4	A5	60	years	0	5961	UBERON:feces	22.60780907	UBERON:feces	UBERON:feces	2/12/12	2012-02-12 10:45:00	10:45:00	GAZ:United Kingdom	1/27/52	0	true	10.4516	ENVO:dense settlement biome	ENVO:human-associated habitat	true	596	human	Homo sapiens	5961	9606	5961	51.5	-0.12	true	Cornell	true	false	King's College, London, UK	Stool	female	6	1003557	TwinsUK gut microbiome	DZ	TwinsUK Fecal Sample
2014.Plate9.49	CATGTCTTCCAT	GTGCCAGCMGCCGCGGTAA	5.398	Cornell	UK_Twins	Cornell	fecal samples from TwinsUK MiSeq runs	TwinsUK Miseq	Jess	MiSeq	This analysis was done as in Caporaso et al 2011 Genome research. The PCR primers F515 and R806 were developed against the V4 region of the 16S rRNA, both bacteria and archaea, which we determined would yield optimal community clustering with reads of this length The reverse PCR primer is barcoded with a 12-base error-correcting Golay code to facilitate multiplexing of up to 1,500 samples per lane, and both PCR primers contain sequencer adapter regions.	GT	FWD:GTGCCAGCMGCCGCGGTAA; REV:GGACTACHVGGGTWTCTAAT	Plate9	Illumina	V4	Cornell	2/19/13	TwinsUKPlate9	0.1,gram	Kings College London	sequencing by synthesis	16S rRNA	V4	E1	58	years	0	7722	UBERON:feces	22.61825943	UBERON:feces	UBERON:feces	2/12/12	2012-02-12 08:30:00	8:30:00	GAZ:United Kingdom	8/23/53	0	true	10.4516	ENVO:dense settlement biome	ENVO:human-associated habitat	true	772	human	Homo sapiens	7722	9606	7722	51.5	-0.12	true	Cornell	true	false	King's College, London, UK	Stool	female	6	1003540	TwinsUK gut microbiome	DZ	TwinsUK Fecal Sample
2014.Plate9.46	ACGCCTTTCTTA	GTGCCAGCMGCCGCGGTAA	9.641	Cornell	UK_Twins	Cornell	fecal samples from TwinsUK MiSeq runs	TwinsUK Miseq	Jess	MiSeq	This analysis was done as in Caporaso et al 2011 Genome research. The PCR primers F515 and R806 were developed against the V4 region of the 16S rRNA, both bacteria and archaea, which we determined would yield optimal community clustering with reads of this length The reverse PCR primer is barcoded with a 12-base error-correcting Golay code to facilitate multiplexing of up to 1,500 samples per lane, and both PCR primers contain sequencer adapter regions.	GT	FWD:GTGCCAGCMGCCGCGGTAA; REV:GGACTACHVGGGTWTCTAAT	Plate9	Illumina	V4	Cornell	2/19/13	TwinsUKPlate9	0.1,gram	Kings College London	sequencing by synthesis	16S rRNA	V4	D10	67	years	0	7651	UBERON:feces	29.38034058	UBERON:feces	UBERON:feces	1/22/12	2012-01-22 19:00:00	19:00:00	GAZ:United Kingdom	1/13/45	0	true	10.4516	ENVO:dense settlement biome	ENVO:human-associated habitat	true	765	human	Homo sapiens	7651	9606	7651	51.5	-0.12	true	Cornell	true	false	King's College, London, UK	Stool	female	6	1003475	TwinsUK gut microbiome	DZ	TwinsUK Fecal Sample
2014.Plate9.45	ACTTACGCCACG	GTGCCAGCMGCCGCGGTAA	19.252	Cornell	UK_Twins	Cornell	fecal samples from TwinsUK MiSeq runs	TwinsUK Miseq	Jess	MiSeq	This analysis was done as in Caporaso et al 2011 Genome research. The PCR primers F515 and R806 were developed against the V4 region of the 16S rRNA, both bacteria and archaea, which we determined would yield optimal community clustering with reads of this length The reverse PCR primer is barcoded with a 12-base error-correcting Golay code to facilitate multiplexing of up to 1,500 samples per lane, and both PCR primers contain sequencer adapter regions.	GT	FWD:GTGCCAGCMGCCGCGGTAA; REV:GGACTACHVGGGTWTCTAAT	Plate9	Illumina	V4	Cornell	2/19/13	TwinsUKPlate9	0.1,gram	Kings College London	sequencing by synthesis	16S rRNA	V4	D9	64	years	0	6961	UBERON:feces	21.28742981	UBERON:feces	UBERON:feces	2/17/12	2012-02-17 08:10:00	8:10:00	GAZ:United Kingdom	8/12/47	0	true	10.4516	ENVO:dense settlement biome	ENVO:human-associated habitat	true	696	human	Homo sapiens	6961	9606	6961	51.5	-0.12	true	Cornell	true	false	King's College, London, UK	Stool	female	6	1003567	TwinsUK gut microbiome	MZ	TwinsUK Fecal Sample
2014.Plate9.44	GAATGACGTTTG	GTGCCAGCMGCCGCGGTAA	6.307	Cornell	UK_Twins	Cornell	fecal samples from TwinsUK MiSeq runs	TwinsUK Miseq	Jess	MiSeq	This analysis was done as in Caporaso et al 2011 Genome research. The PCR primers F515 and R806 were developed against the V4 region of the 16S rRNA, both bacteria and archaea, which we determined would yield optimal community clustering with reads of this length The reverse PCR primer is barcoded with a 12-base error-correcting Golay code to facilitate multiplexing of up to 1,500 samples per lane, and both PCR primers contain sequencer adapter regions.	GT	FWD:GTGCCAGCMGCCGCGGTAA; REV:GGACTACHVGGGTWTCTAAT	Plate9	Illumina	V4	Cornell	2/19/13	TwinsUKPlate9	0.1,gram	Kings College London	sequencing by synthesis	16S rRNA	V4	D8	64	years	0	7771	UBERON:feces	20.84052086	UBERON:feces	UBERON:feces	12/12/11	2011-12-12 08:30:00	8:30:00	GAZ:United Kingdom	12/16/46	0	true	10.4516	ENVO:dense settlement biome	ENVO:human-associated habitat	true	777	human	Homo sapiens	7771	9606	7771	51.5	-0.12	true	Cornell	true	false	King's College, London, UK	Stool	female	6	1003491	TwinsUK gut microbiome	DZ	TwinsUK Fecal Sample
2014.Plate9.42	GGACCGCTTTCA	GTGCCAGCMGCCGCGGTAA	6.895	Cornell	UK_Twins	Cornell	fecal samples from TwinsUK MiSeq runs	TwinsUK Miseq	Jess	MiSeq	This analysis was done as in Caporaso et al 2011 Genome research. The PCR primers F515 and R806 were developed against the V4 region of the 16S rRNA, both bacteria and archaea, which we determined would yield optimal community clustering with reads of this length The reverse PCR primer is barcoded with a 12-base error-correcting Golay code to facilitate multiplexing of up to 1,500 samples per lane, and both PCR primers contain sequencer adapter regions.	GT	FWD:GTGCCAGCMGCCGCGGTAA; REV:GGACTACHVGGGTWTCTAAT	Plate9	Illumina	V4	Cornell	2/19/13	TwinsUKPlate9	0.1,gram	Kings College London	sequencing by synthesis	16S rRNA	V4	D6	69	years	0	6321	UBERON:feces	17.76185989	UBERON:feces	UBERON:feces	12/4/11	2011-12-04 19:15:00	19:15:00	GAZ:United Kingdom	10/16/42	0	true	10.4516	ENVO:dense settlement biome	ENVO:human-associated habitat	true	632	human	Homo sapiens	6321	9606	6321	51.5	-0.12	true	Cornell	true	false	King's College, London, UK	Stool	female	6	1003481	TwinsUK gut microbiome	DZ	TwinsUK Fecal Sample
2014.Plate9.40	GAAGATCTATCG	GTGCCAGCMGCCGCGGTAA	6.503	Cornell	UK_Twins	Cornell	fecal samples from TwinsUK MiSeq runs	TwinsUK Miseq	Jess	MiSeq	This analysis was done as in Caporaso et al 2011 Genome research. The PCR primers F515 and R806 were developed against the V4 region of the 16S rRNA, both bacteria and archaea, which we determined would yield optimal community clustering with reads of this length The reverse PCR primer is barcoded with a 12-base error-correcting Golay code to facilitate multiplexing of up to 1,500 samples per lane, and both PCR primers contain sequencer adapter regions.	GT	FWD:GTGCCAGCMGCCGCGGTAA; REV:GGACTACHVGGGTWTCTAAT	Plate9	Illumina	V4	Cornell	2/19/13	TwinsUKPlate9	0.1,gram	Kings College London	sequencing by synthesis	16S rRNA	V4	D4	71	years	0	6631	UBERON:feces	21.92837906	UBERON:feces	UBERON:feces	3/12/12	2012-03-12 08:00:00	8:00:00	GAZ:United Kingdom	6/5/40	0	true	10.4516	ENVO:dense settlement biome	ENVO:human-associated habitat	true	663	human	Homo sapiens	6631	9606	6631	51.5	-0.12	true	Cornell	true	false	King's College, London, UK	Stool	female	6	1006322	TwinsUK gut microbiome	DZ	TwinsUK Fecal Sample
2014.Plate9.38	CACAAAGCGATT	GTGCCAGCMGCCGCGGTAA	12.387	Cornell	UK_Twins	Cornell	fecal samples from TwinsUK MiSeq runs	TwinsUK Miseq	Jess	MiSeq	This analysis was done as in Caporaso et al 2011 Genome research. The PCR primers F515 and R806 were developed against the V4 region of the 16S rRNA, both bacteria and archaea, which we determined would yield optimal community clustering with reads of this length The reverse PCR primer is barcoded with a 12-base error-correcting Golay code to facilitate multiplexing of up to 1,500 samples per lane, and both PCR primers contain sequencer adapter regions.	GT	FWD:GTGCCAGCMGCCGCGGTAA; REV:GGACTACHVGGGTWTCTAAT	Plate9	Illumina	V4	Cornell	2/19/13	TwinsUKPlate9	0.1,gram	Kings College London	sequencing by synthesis	16S rRNA	V4	D2	66	years	0	5582	UBERON:feces	25.72112083	UBERON:feces	UBERON:feces	2/10/12	2012-02-10 08:30:00	8:30:00	GAZ:United Kingdom	12/15/45	0	true	10.4516	ENVO:dense settlement biome	ENVO:human-associated habitat	true	558	human	Homo sapiens	5582	9606	5582	51.5	-0.12	true	Cornell	true	false	King's College, London, UK	Stool	female	6	1003544	TwinsUK gut microbiome	DZ	TwinsUK Fecal Sample
2014.Plate9.37	TCACGAGTCACA	GTGCCAGCMGCCGCGGTAA	5.989	Cornell	UK_Twins	Cornell	fecal samples from TwinsUK MiSeq runs	TwinsUK Miseq	Jess	MiSeq	This analysis was done as in Caporaso et al 2011 Genome research. The PCR primers F515 and R806 were developed against the V4 region of the 16S rRNA, both bacteria and archaea, which we determined would yield optimal community clustering with reads of this length The reverse PCR primer is barcoded with a 12-base error-correcting Golay code to facilitate multiplexing of up to 1,500 samples per lane, and both PCR primers contain sequencer adapter regions.	GT	FWD:GTGCCAGCMGCCGCGGTAA; REV:GGACTACHVGGGTWTCTAAT	Plate9	Illumina	V4	Cornell	2/19/13	TwinsUKPlate9	0.1,gram	Kings College London	sequencing by synthesis	16S rRNA	V4	D1	65	years	0	6022	UBERON:feces	27.60498047	UBERON:feces	UBERON:feces	2/9/12	2012-02-09 08:00:00	8:00:00	GAZ:United Kingdom	3/29/46	0	true	10.4516	ENVO:dense settlement biome	ENVO:human-associated habitat	true	602	human	Homo sapiens	6022	9606	6022	51.5	-0.12	true	Cornell	true	false	King's College, London, UK	Stool	female	6	1003548	TwinsUK gut microbiome	DZ	TwinsUK Fecal Sample
2014.Plate9.35	CCGCGATTTCGA	GTGCCAGCMGCCGCGGTAA	13.956	Cornell	UK_Twins	Cornell	fecal samples from TwinsUK MiSeq runs	TwinsUK Miseq	Jess	MiSeq	This analysis was done as in Caporaso et al 2011 Genome research. The PCR primers F515 and R806 were developed against the V4 region of the 16S rRNA, both bacteria and archaea, which we determined would yield optimal community clustering with reads of this length The reverse PCR primer is barcoded with a 12-base error-correcting Golay code to facilitate multiplexing of up to 1,500 samples per lane, and both PCR primers contain sequencer adapter regions.	GT	FWD:GTGCCAGCMGCCGCGGTAA; REV:GGACTACHVGGGTWTCTAAT	Plate9	Illumina	V4	Cornell	2/19/13	TwinsUKPlate9	0.1,gram	Kings College London	sequencing by synthesis	16S rRNA	V4	C11	59	years	0	4941	UBERON:feces	30.44664955	UBERON:feces	UBERON:feces	3/12/12	2012-03-12 03:00:00	3:00:00	GAZ:United Kingdom	1/3/53	0	true	10.4516	ENVO:dense settlement biome	ENVO:human-associated habitat	true	494	human	Homo sapiens	4941	9606	4941	51.5	-0.12	true	Cornell	true	false	King's College, London, UK	Stool	female	6	1006328	TwinsUK gut microbiome	DZ	TwinsUK Fecal Sample
2014.Plate9.34	AGTCCGAGTTGT	GTGCCAGCMGCCGCGGTAA	12.387	Cornell	UK_Twins	Cornell	fecal samples from TwinsUK MiSeq runs	TwinsUK Miseq	Jess	MiSeq	This analysis was done as in Caporaso et al 2011 Genome research. The PCR primers F515 and R806 were developed against the V4 region of the 16S rRNA, both bacteria and archaea, which we determined would yield optimal community clustering with reads of this length The reverse PCR primer is barcoded with a 12-base error-correcting Golay code to facilitate multiplexing of up to 1,500 samples per lane, and both PCR primers contain sequencer adapter regions.	GT	FWD:GTGCCAGCMGCCGCGGTAA; REV:GGACTACHVGGGTWTCTAAT	Plate9	Illumina	V4	Cornell	2/19/13	TwinsUKPlate9	0.1,gram	Kings College London	sequencing by synthesis	16S rRNA	V4	C10	61	years	0	7521	UBERON:feces	34.64844131	UBERON:feces	UBERON:feces	3/10/12	2012-03-10 19:15:00	19:15:00	GAZ:United Kingdom	10/16/50	0	true	10.4516	ENVO:dense settlement biome	ENVO:human-associated habitat	true	752	human	Homo sapiens	7521	9606	7521	51.5	-0.12	true	Cornell	true	false	King's College, London, UK	Stool	female	6	1006315	TwinsUK gut microbiome	DZ	TwinsUK Fecal Sample
2014.Plate9.33	TGGAAACCATTG	GTGCCAGCMGCCGCGGTAA	7.288	Cornell	UK_Twins	Cornell	fecal samples from TwinsUK MiSeq runs	TwinsUK Miseq	Jess	MiSeq	This analysis was done as in Caporaso et al 2011 Genome research. The PCR primers F515 and R806 were developed against the V4 region of the 16S rRNA, both bacteria and archaea, which we determined would yield optimal community clustering with reads of this length The reverse PCR primer is barcoded with a 12-base error-correcting Golay code to facilitate multiplexing of up to 1,500 samples per lane, and both PCR primers contain sequencer adapter regions.	GT	FWD:GTGCCAGCMGCCGCGGTAA; REV:GGACTACHVGGGTWTCTAAT	Plate9	Illumina	V4	Cornell	2/19/13	TwinsUKPlate9	0.1,gram	Kings College London	sequencing by synthesis	16S rRNA	V4	C9	69	years	0	6322	UBERON:feces	18.13588905	UBERON:feces	UBERON:feces	11/2/11	2011-11-02 09:40:00	9:40:00	GAZ:United Kingdom	10/16/42	0	true	10.4516	ENVO:dense settlement biome	ENVO:human-associated habitat	true	632	human	Homo sapiens	6322	9606	6322	51.5	-0.12	true	Cornell	true	false	King's College, London, UK	Stool	female	6	1003472	TwinsUK gut microbiome	DZ	TwinsUK Fecal Sample
2014.Plate9.32	AGTAGACTTACG	GTGCCAGCMGCCGCGGTAA	9.641	Cornell	UK_Twins	Cornell	fecal samples from TwinsUK MiSeq runs	TwinsUK Miseq	Jess	MiSeq	This analysis was done as in Caporaso et al 2011 Genome research. The PCR primers F515 and R806 were developed against the V4 region of the 16S rRNA, both bacteria and archaea, which we determined would yield optimal community clustering with reads of this length The reverse PCR primer is barcoded with a 12-base error-correcting Golay code to facilitate multiplexing of up to 1,500 samples per lane, and both PCR primers contain sequencer adapter regions.	GT	FWD:GTGCCAGCMGCCGCGGTAA; REV:GGACTACHVGGGTWTCTAAT	Plate9	Illumina	V4	Cornell	2/19/13	TwinsUKPlate9	0.1,gram	Kings College London	sequencing by synthesis	16S rRNA	V4	C8	67	years	0	4311	UBERON:feces	23.1067009	UBERON:feces	UBERON:feces	1/9/12	2012-01-09 09:30:00	9:30:00	GAZ:United Kingdom	12/24/44	0	true	10.4516	ENVO:dense settlement biome	ENVO:human-associated habitat	true	431	human	Homo sapiens	4311	9606	4311	51.5	-0.12	true	Cornell	true	false	King's College, London, UK	Stool	female	6	1003494	TwinsUK gut microbiome	MZ	TwinsUK Fecal Sample
2014.Plate9.30	ACCTCCCGGATA	GTGCCAGCMGCCGCGGTAA	8.464	Cornell	UK_Twins	Cornell	fecal samples from TwinsUK MiSeq runs	TwinsUK Miseq	Jess	MiSeq	This analysis was done as in Caporaso et al 2011 Genome research. The PCR primers F515 and R806 were developed against the V4 region of the 16S rRNA, both bacteria and archaea, which we determined would yield optimal community clustering with reads of this length The reverse PCR primer is barcoded with a 12-base error-correcting Golay code to facilitate multiplexing of up to 1,500 samples per lane, and both PCR primers contain sequencer adapter regions.	GT	FWD:GTGCCAGCMGCCGCGGTAA; REV:GGACTACHVGGGTWTCTAAT	Plate9	Illumina	V4	Cornell	2/19/13	TwinsUKPlate9	0.1,gram	Kings College London	sequencing by synthesis	16S rRNA	V4	C6	67	years	0	5261	UBERON:feces	24.60444069	UBERON:feces	UBERON:feces	11/22/11	2011-11-22 14:00:00	14:00:00	GAZ:United Kingdom	7/5/44	0	true	10.4516	ENVO:dense settlement biome	ENVO:human-associated habitat	true	526	human	Homo sapiens	5261	9606	5261	51.5	-0.12	true	Cornell	true	false	King's College, London, UK	Stool	female	6	1003478	TwinsUK gut microbiome	DZ	TwinsUK Fecal Sample
2014.Plate9.3	TCGCGCAACTGT	GTGCCAGCMGCCGCGGTAA	16.31	Cornell	UK_Twins	Cornell	fecal samples from TwinsUK MiSeq runs	TwinsUK Miseq	Jess	MiSeq	This analysis was done as in Caporaso et al 2011 Genome research. The PCR primers F515 and R806 were developed against the V4 region of the 16S rRNA, both bacteria and archaea, which we determined would yield optimal community clustering with reads of this length The reverse PCR primer is barcoded with a 12-base error-correcting Golay code to facilitate multiplexing of up to 1,500 samples per lane, and both PCR primers contain sequencer adapter regions.	GT	FWD:GTGCCAGCMGCCGCGGTAA; REV:GGACTACHVGGGTWTCTAAT	Plate9	Illumina	V4	Cornell	2/19/13	TwinsUKPlate9	0.1,gram	Kings College London	sequencing by synthesis	16S rRNA	V4	A3	79	years	0	5911	UBERON:feces	24.3260994	UBERON:feces	UBERON:feces	1/30/12	2012-01-30 08:30:00	8:30:00	GAZ:United Kingdom	11/18/32	0	true	10.4516	ENVO:dense settlement biome	ENVO:human-associated habitat	true	591	human	Homo sapiens	5911	9606	5911	51.5	-0.12	true	Cornell	true	false	King's College, London, UK	Stool	female	6	1003556	TwinsUK gut microbiome	DZ	TwinsUK Fecal Sample
2014.Plate9.28	TGCTGTGACCAC	GTGCCAGCMGCCGCGGTAA	14.152	Cornell	UK_Twins	Cornell	fecal samples from TwinsUK MiSeq runs	TwinsUK Miseq	Jess	MiSeq	This analysis was done as in Caporaso et al 2011 Genome research. The PCR primers F515 and R806 were developed against the V4 region of the 16S rRNA, both bacteria and archaea, which we determined would yield optimal community clustering with reads of this length The reverse PCR primer is barcoded with a 12-base error-correcting Golay code to facilitate multiplexing of up to 1,500 samples per lane, and both PCR primers contain sequencer adapter regions.	GT	FWD:GTGCCAGCMGCCGCGGTAA; REV:GGACTACHVGGGTWTCTAAT	Plate9	Illumina	V4	Cornell	2/19/13	TwinsUKPlate9	0.1,gram	Kings College London	sequencing by synthesis	16S rRNA	V4	C4	73	years	0	4292	UBERON:feces	22.89746094	UBERON:feces	UBERON:feces	3/14/12	2012-03-14 03:30:00	3:30:00	GAZ:United Kingdom	6/23/38	0	true	10.4516	ENVO:dense settlement biome	ENVO:human-associated habitat	true	429	human	Homo sapiens	4292	9606	4292	51.5	-0.12	true	Cornell	true	false	King's College, London, UK	Stool	female	6	1006308	TwinsUK gut microbiome	DZ	TwinsUK Fecal Sample
2014.Plate9.27	AGGTCATCTTGG	GTGCCAGCMGCCGCGGTAA	10.622	Cornell	UK_Twins	Cornell	fecal samples from TwinsUK MiSeq runs	TwinsUK Miseq	Jess	MiSeq	This analysis was done as in Caporaso et al 2011 Genome research. The PCR primers F515 and R806 were developed against the V4 region of the 16S rRNA, both bacteria and archaea, which we determined would yield optimal community clustering with reads of this length The reverse PCR primer is barcoded with a 12-base error-correcting Golay code to facilitate multiplexing of up to 1,500 samples per lane, and both PCR primers contain sequencer adapter regions.	GT	FWD:GTGCCAGCMGCCGCGGTAA; REV:GGACTACHVGGGTWTCTAAT	Plate9	Illumina	V4	Cornell	2/19/13	TwinsUKPlate9	0.1,gram	Kings College London	sequencing by synthesis	16S rRNA	V4	C3	56	years	0	4402	UBERON:feces	20.75115013	UBERON:feces	UBERON:feces	12/8/11	2011-12-08 00:00:00		GAZ:United Kingdom	9/13/55	0	true	10.4516	ENVO:dense settlement biome	ENVO:human-associated habitat	true	440	human	Homo sapiens	4402	9606	4402	51.5	-0.12	true	Cornell	true	false	King's College, London, UK	Stool	female	6	1003470	TwinsUK gut microbiome	DZ	TwinsUK Fecal Sample
2014.Plate9.26	TAGTAGCACCTG	GTGCCAGCMGCCGCGGTAA	9.837	Cornell	UK_Twins	Cornell	fecal samples from TwinsUK MiSeq runs	TwinsUK Miseq	Jess	MiSeq	This analysis was done as in Caporaso et al 2011 Genome research. The PCR primers F515 and R806 were developed against the V4 region of the 16S rRNA, both bacteria and archaea, which we determined would yield optimal community clustering with reads of this length The reverse PCR primer is barcoded with a 12-base error-correcting Golay code to facilitate multiplexing of up to 1,500 samples per lane, and both PCR primers contain sequencer adapter regions.	GT	FWD:GTGCCAGCMGCCGCGGTAA; REV:GGACTACHVGGGTWTCTAAT	Plate9	Illumina	V4	Cornell	2/19/13	TwinsUKPlate9	0.1,gram	Kings College London	sequencing by synthesis	16S rRNA	V4	C2	61	years	0	8462	UBERON:feces	24.16896057	UBERON:feces	UBERON:feces	3/11/12	2012-03-11 19:15:00	19:15:00	GAZ:United Kingdom	11/3/50	0	true	10.4516	ENVO:dense settlement biome	ENVO:human-associated habitat	true	846	human	Homo sapiens	8462	9606	8462	51.5	-0.12	true	Cornell	true	false	King's College, London, UK	Stool	female	6	1006310	TwinsUK gut microbiome	DZ	TwinsUK Fecal Sample
2014.Plate9.25	ACGTCTCAGTGC	GTGCCAGCMGCCGCGGTAA	16.431	Cornell	UK_Twins	Cornell	fecal samples from TwinsUK MiSeq runs	TwinsUK Miseq	Jess	MiSeq	This analysis was done as in Caporaso et al 2011 Genome research. The PCR primers F515 and R806 were developed against the V4 region of the 16S rRNA, both bacteria and archaea, which we determined would yield optimal community clustering with reads of this length The reverse PCR primer is barcoded with a 12-base error-correcting Golay code to facilitate multiplexing of up to 1,500 samples per lane, and both PCR primers contain sequencer adapter regions.	GT	FWD:GTGCCAGCMGCCGCGGTAA; REV:GGACTACHVGGGTWTCTAAT	Plate9	Illumina	V4	Cornell	2/19/13	TwinsUKPlate9	0.1,gram	Kings College London	sequencing by synthesis	16S rRNA	V4	C1	66	years	0	5581	UBERON:feces	21.60172081	UBERON:feces	UBERON:feces	2/9/12	2012-02-09 08:30:00	8:30:00	GAZ:United Kingdom	12/15/45	0	true	10.4516	ENVO:dense settlement biome	ENVO:human-associated habitat	true	558	human	Homo sapiens	5581	9606	5581	51.5	-0.12	true	Cornell	true	false	King's College, London, UK	Stool	female	6	1003539	TwinsUK gut microbiome	DZ	TwinsUK Fecal Sample
2014.Plate9.24	CGATTAGGAATC	GTGCCAGCMGCCGCGGTAA	12.583	Cornell	UK_Twins	Cornell	fecal samples from TwinsUK MiSeq runs	TwinsUK Miseq	Jess	MiSeq	This analysis was done as in Caporaso et al 2011 Genome research. The PCR primers F515 and R806 were developed against the V4 region of the 16S rRNA, both bacteria and archaea, which we determined would yield optimal community clustering with reads of this length The reverse PCR primer is barcoded with a 12-base error-correcting Golay code to facilitate multiplexing of up to 1,500 samples per lane, and both PCR primers contain sequencer adapter regions.	GT	FWD:GTGCCAGCMGCCGCGGTAA; REV:GGACTACHVGGGTWTCTAAT	Plate9	Illumina	V4	Cornell	2/19/13	TwinsUKPlate9	0.1,gram	Kings College London	sequencing by synthesis	16S rRNA	V4	B12	56	years	0	4401	UBERON:feces	25.67452049	UBERON:feces	UBERON:feces	12/7/11	2011-12-07 08:10:00	8:10:00	GAZ:United Kingdom	9/13/55	0	true	10.4516	ENVO:dense settlement biome	ENVO:human-associated habitat	true	440	human	Homo sapiens	4401	9606	4401	51.5	-0.12	true	Cornell	true	false	King's College, London, UK	Stool	female	6	1003467	TwinsUK gut microbiome	DZ	TwinsUK Fecal Sample
2014.Plate9.21	AGTAGGAGGCAC	GTGCCAGCMGCCGCGGTAA	12.583	Cornell	UK_Twins	Cornell	fecal samples from TwinsUK MiSeq runs	TwinsUK Miseq	Jess	MiSeq	This analysis was done as in Caporaso et al 2011 Genome research. The PCR primers F515 and R806 were developed against the V4 region of the 16S rRNA, both bacteria and archaea, which we determined would yield optimal community clustering with reads of this length The reverse PCR primer is barcoded with a 12-base error-correcting Golay code to facilitate multiplexing of up to 1,500 samples per lane, and both PCR primers contain sequencer adapter regions.	GT	FWD:GTGCCAGCMGCCGCGGTAA; REV:GGACTACHVGGGTWTCTAAT	Plate9	Illumina	V4	Cornell	2/19/13	TwinsUKPlate9	0.1,gram	Kings College London	sequencing by synthesis	16S rRNA	V4	B9	61	years	0	5442	UBERON:feces	18.97903061	UBERON:feces	UBERON:feces	2/8/12	2012-02-08 08:00:00	8:00:00	GAZ:United Kingdom	11/4/50	0	true	10.4516	ENVO:dense settlement biome	ENVO:human-associated habitat	true	544	human	Homo sapiens	5442	9606	5442	51.5	-0.12	true	Cornell	true	false	King's College, London, UK	Stool	female	6	1003580	TwinsUK gut microbiome	DZ	TwinsUK Fecal Sample
2014.Plate9.20	GTGCTGCGCTTA	GTGCCAGCMGCCGCGGTAA	11.995	Cornell	UK_Twins	Cornell	fecal samples from TwinsUK MiSeq runs	TwinsUK Miseq	Jess	MiSeq	This analysis was done as in Caporaso et al 2011 Genome research. The PCR primers F515 and R806 were developed against the V4 region of the 16S rRNA, both bacteria and archaea, which we determined would yield optimal community clustering with reads of this length The reverse PCR primer is barcoded with a 12-base error-correcting Golay code to facilitate multiplexing of up to 1,500 samples per lane, and both PCR primers contain sequencer adapter regions.	GT	FWD:GTGCCAGCMGCCGCGGTAA; REV:GGACTACHVGGGTWTCTAAT	Plate9	Illumina	V4	Cornell	2/19/13	TwinsUKPlate9	0.1,gram	Kings College London	sequencing by synthesis	16S rRNA	V4	B8	71	years	0	6632	UBERON:feces	24.5093708	UBERON:feces	UBERON:feces	3/12/12	2012-03-12 07:30:00	7:30:00	GAZ:United Kingdom	6/5/40	0	true	10.4516	ENVO:dense settlement biome	ENVO:human-associated habitat	true	663	human	Homo sapiens	6632	9606	6632	51.5	-0.12	true	Cornell	true	false	King's College, London, UK	Stool	female	6	1006313	TwinsUK gut microbiome	DZ	TwinsUK Fecal Sample
2014.Plate9.2	GTCCAGCTATGA	GTGCCAGCMGCCGCGGTAA	6.895	Cornell	UK_Twins	Cornell	fecal samples from TwinsUK MiSeq runs	TwinsUK Miseq	Jess	MiSeq	This analysis was done as in Caporaso et al 2011 Genome research. The PCR primers F515 and R806 were developed against the V4 region of the 16S rRNA, both bacteria and archaea, which we determined would yield optimal community clustering with reads of this length The reverse PCR primer is barcoded with a 12-base error-correcting Golay code to facilitate multiplexing of up to 1,500 samples per lane, and both PCR primers contain sequencer adapter regions.	GT	FWD:GTGCCAGCMGCCGCGGTAA; REV:GGACTACHVGGGTWTCTAAT	Plate9	Illumina	V4	Cornell	2/19/13	TwinsUKPlate9	0.1,gram	Kings College London	sequencing by synthesis	16S rRNA	V4	A2	67	years	0	4892	UBERON:feces	25.56212997	UBERON:feces	UBERON:feces	2/4/12	2012-02-04 11:30:00	11:30:00	GAZ:United Kingdom	6/4/44	0	true	10.4516	ENVO:dense settlement biome	ENVO:human-associated habitat	true	489	human	Homo sapiens	4892	9606	4892	51.5	-0.12	true	Cornell	true	false	King's College, London, UK	Stool	female	6	1003545	TwinsUK gut microbiome	DZ	TwinsUK Fecal Sample
2014.Plate9.15	CAGAGCTAATTG	GTGCCAGCMGCCGCGGTAA	14.544	Cornell	UK_Twins	Cornell	fecal samples from TwinsUK MiSeq runs	TwinsUK Miseq	Jess	MiSeq	This analysis was done as in Caporaso et al 2011 Genome research. The PCR primers F515 and R806 were developed against the V4 region of the 16S rRNA, both bacteria and archaea, which we determined would yield optimal community clustering with reads of this length The reverse PCR primer is barcoded with a 12-base error-correcting Golay code to facilitate multiplexing of up to 1,500 samples per lane, and both PCR primers contain sequencer adapter regions.	GT	FWD:GTGCCAGCMGCCGCGGTAA; REV:GGACTACHVGGGTWTCTAAT	Plate9	Illumina	V4	Cornell	2/19/13	TwinsUKPlate9	0.1,gram	Kings College London	sequencing by synthesis	16S rRNA	V4	B3	64	years	0	5421	UBERON:feces	22.46998978	UBERON:feces	UBERON:feces	1/7/12	2012-01-07 09:15:00	9:15:00	GAZ:United Kingdom	7/10/47	0	true	10.4516	ENVO:dense settlement biome	ENVO:human-associated habitat	true	542	human	Homo sapiens	5421	9606	5421	51.5	-0.12	true	Cornell	true	false	King's College, London, UK	Stool	female	6	1003496	TwinsUK gut microbiome	DZ	TwinsUK Fecal Sample
2014.Plate9.1	GGCACACCCTTA	GTGCCAGCMGCCGCGGTAA	15.249	Cornell	UK_Twins	Cornell	fecal samples from TwinsUK MiSeq runs	TwinsUK Miseq	Jess	MiSeq	This analysis was done as in Caporaso et al 2011 Genome research. The PCR primers F515 and R806 were developed against the V4 region of the 16S rRNA, both bacteria and archaea, which we determined would yield optimal community clustering with reads of this length The reverse PCR primer is barcoded with a 12-base error-correcting Golay code to facilitate multiplexing of up to 1,500 samples per lane, and both PCR primers contain sequencer adapter regions.	GT	FWD:GTGCCAGCMGCCGCGGTAA; REV:GGACTACHVGGGTWTCTAAT	Plate9	Illumina	V4	Cornell	2/19/13	TwinsUKPlate9	0.1,gram	Kings College London	sequencing by synthesis	16S rRNA	V4	A1	63	years	0	6491	UBERON:feces	30.87346077	UBERON:feces	UBERON:feces	3/9/12	2012-03-09 08:20:00	8:20:00	GAZ:United Kingdom	2/6/49	0	true	10.4516	ENVO:dense settlement biome	ENVO:human-associated habitat	true	649	human	Homo sapiens	6491	9606	6491	51.5	-0.12	true	Cornell	true	false	King's College, London, UK	Stool	female	6	1006314	TwinsUK gut microbiome	DZ	TwinsUK Fecal Sample
2014.Plate8.9	AACCCAGATGAT	GTGCCAGCMGCCGCGGTAA	24.762	Cornell	UK_Twins	Cornell	fecal samples from TwinsUK MiSeq runs	TwinsUK Miseq	Nick	MiSeq	This analysis was done as in Caporaso et al 2011 Genome research. The PCR primers F515 and R806 were developed against the V4 region of the 16S rRNA, both bacteria and archaea, which we determined would yield optimal community clustering with reads of this length The reverse PCR primer is barcoded with a 12-base error-correcting Golay code to facilitate multiplexing of up to 1,500 samples per lane, and both PCR primers contain sequencer adapter regions.	GT	FWD:GTGCCAGCMGCCGCGGTAA; REV:GGACTACHVGGGTWTCTAAT	Plate8	Illumina	V4	Cornell	2/4/13	TwinsUKPlate8	0.1,gram	Kings College London	sequencing by synthesis	16S rRNA	V4	A9	47	years	0	3861	UBERON:feces	32.63763046	UBERON:feces	UBERON:feces	5/29/11	2011-05-29 12:00:00	12:00:00	GAZ:United Kingdom	3/28/64	0	true	10.4516	ENVO:dense settlement biome	ENVO:human-associated habitat	true	386	human	Homo sapiens	3861	9606	3861	51.5	-0.12	true	Cornell	true	false	King's College, London, UK	Stool	female	4	1002843	TwinsUK gut microbiome	DZ	TwinsUK Fecal Sample
2014.Plate8.89	TTACGTGGCGAT	GTGCCAGCMGCCGCGGTAA	10.601	Cornell	UK_Twins	Cornell	fecal samples from TwinsUK MiSeq runs	TwinsUK Miseq	Jess	MiSeq	This analysis was done as in Caporaso et al 2011 Genome research. The PCR primers F515 and R806 were developed against the V4 region of the 16S rRNA, both bacteria and archaea, which we determined would yield optimal community clustering with reads of this length The reverse PCR primer is barcoded with a 12-base error-correcting Golay code to facilitate multiplexing of up to 1,500 samples per lane, and both PCR primers contain sequencer adapter regions.	GT	FWD:GTGCCAGCMGCCGCGGTAA; REV:GGACTACHVGGGTWTCTAAT	Plate8	Illumina	V4	Cornell	2/4/13	TwinsUKPlate8	0.1,gram	Kings College London	sequencing by synthesis	16S rRNA	V4	H7	64	years	0	4961	UBERON:feces	27.40657043	UBERON:feces	UBERON:feces	11/10/11	2011-11-10 10:00:00	10:00:00	GAZ:United Kingdom	4/2/47	0	true	10.4516	ENVO:dense settlement biome	ENVO:human-associated habitat	true	496	human	Homo sapiens	4961	9606	4961	51.5	-0.12	true	Cornell	true	false	King's College, London, UK	Stool	female	5	1003461	TwinsUK gut microbiome	DZ	TwinsUK Fecal Sample
2014.Plate8.88	TGAGTTCGGTCC	GTGCCAGCMGCCGCGGTAA	23.262	Cornell	UK_Twins	Cornell	fecal samples from TwinsUK MiSeq runs	TwinsUK Miseq	Jess	MiSeq	This analysis was done as in Caporaso et al 2011 Genome research. The PCR primers F515 and R806 were developed against the V4 region of the 16S rRNA, both bacteria and archaea, which we determined would yield optimal community clustering with reads of this length The reverse PCR primer is barcoded with a 12-base error-correcting Golay code to facilitate multiplexing of up to 1,500 samples per lane, and both PCR primers contain sequencer adapter regions.	GT	FWD:GTGCCAGCMGCCGCGGTAA; REV:GGACTACHVGGGTWTCTAAT	Plate8	Illumina	V4	Cornell	2/4/13	TwinsUKPlate8	0.1,gram	Kings College London	sequencing by synthesis	16S rRNA	V4	H6	65	years	0	7471	UBERON:feces	24.84251976	UBERON:feces	UBERON:feces	10/29/11	2011-10-29 00:00:00	0:00:00	GAZ:United Kingdom	11/9/45	0	true	10.4516	ENVO:dense settlement biome	ENVO:human-associated habitat	true	747	human	Homo sapiens	7471	9606	7471	51.5	-0.12	true	Cornell	true	false	King's College, London, UK	Stool	female	5	1003344	TwinsUK gut microbiome	MZ	TwinsUK Fecal Sample
2014.Plate8.84	GAGTCTTGGTAA	GTGCCAGCMGCCGCGGTAA	44.838	Cornell	UK_Twins	Cornell	fecal samples from TwinsUK MiSeq runs	TwinsUK Miseq	Jess	MiSeq	This analysis was done as in Caporaso et al 2011 Genome research. The PCR primers F515 and R806 were developed against the V4 region of the 16S rRNA, both bacteria and archaea, which we determined would yield optimal community clustering with reads of this length The reverse PCR primer is barcoded with a 12-base error-correcting Golay code to facilitate multiplexing of up to 1,500 samples per lane, and both PCR primers contain sequencer adapter regions.	GT	FWD:GTGCCAGCMGCCGCGGTAA; REV:GGACTACHVGGGTWTCTAAT	Plate8	Illumina	V4	Cornell	2/4/13	TwinsUKPlate8	0.1,gram	Kings College London	sequencing by synthesis	16S rRNA	V4	H2	61	years	0	6821	UBERON:feces	24.65279007	UBERON:feces	UBERON:feces	11/20/11	2011-11-20 14:45:00	14:45:00	GAZ:United Kingdom	3/3/50	0	true	10.4516	ENVO:dense settlement biome	ENVO:human-associated habitat	true	682	human	Homo sapiens	6821	9606	6821	51.5	-0.12	true	Cornell	true	false	King's College, London, UK	Stool	female	5	1003325	TwinsUK gut microbiome	MZ	TwinsUK Fecal Sample
2014.Plate8.83	GTGACGTTAGTC	GTGCCAGCMGCCGCGGTAA	31.099	Cornell	UK_Twins	Cornell	fecal samples from TwinsUK MiSeq runs	TwinsUK Miseq	Jess	MiSeq	This analysis was done as in Caporaso et al 2011 Genome research. The PCR primers F515 and R806 were developed against the V4 region of the 16S rRNA, both bacteria and archaea, which we determined would yield optimal community clustering with reads of this length The reverse PCR primer is barcoded with a 12-base error-correcting Golay code to facilitate multiplexing of up to 1,500 samples per lane, and both PCR primers contain sequencer adapter regions.	GT	FWD:GTGCCAGCMGCCGCGGTAA; REV:GGACTACHVGGGTWTCTAAT	Plate8	Illumina	V4	Cornell	2/4/13	TwinsUKPlate8	0.1,gram	Kings College London	sequencing by synthesis	16S rRNA	V4	H1	52	years	0	5452	UBERON:feces	26.42713928	UBERON:feces	UBERON:feces	10/15/11	2011-10-15 09:10:00	9:10:00	GAZ:United Kingdom	8/7/59	0	true	10.4516	ENVO:dense settlement biome	ENVO:human-associated habitat	true	545	human	Homo sapiens	5452	9606	5452	51.5	-0.12	true	Cornell	true	false	King's College, London, UK	Stool	female	5	1003309	TwinsUK gut microbiome	DZ	TwinsUK Fecal Sample
2014.Plate8.8	TTCCACACGTGG	GTGCCAGCMGCCGCGGTAA	37.516	Cornell	UK_Twins	Cornell	fecal samples from TwinsUK MiSeq runs	TwinsUK Miseq	Nick	MiSeq	This analysis was done as in Caporaso et al 2011 Genome research. The PCR primers F515 and R806 were developed against the V4 region of the 16S rRNA, both bacteria and archaea, which we determined would yield optimal community clustering with reads of this length The reverse PCR primer is barcoded with a 12-base error-correcting Golay code to facilitate multiplexing of up to 1,500 samples per lane, and both PCR primers contain sequencer adapter regions.	GT	FWD:GTGCCAGCMGCCGCGGTAA; REV:GGACTACHVGGGTWTCTAAT	Plate8	Illumina	V4	Cornell	2/4/13	TwinsUKPlate8	0.1,gram	Kings College London	sequencing by synthesis	16S rRNA	V4	A8	35	years	0	4082	UBERON:feces		UBERON:feces	UBERON:feces	5/5/11	2011-05-05 06:00:00	6:00:00	GAZ:United Kingdom	8/19/75	0	true	10.4516	ENVO:dense settlement biome	ENVO:human-associated habitat	true	408	human	Homo sapiens	4082	9606	4082	51.5	-0.12	true	Cornell	true	false	King's College, London, UK	Stool	female	4	1002830	TwinsUK gut microbiome	DZ	TwinsUK Fecal Sample
2014.Plate8.75	CTTAGCTACTCT	GTGCCAGCMGCCGCGGTAA	29.808	Cornell	UK_Twins	Cornell	fecal samples from TwinsUK MiSeq runs	TwinsUK Miseq	Jess	MiSeq	This analysis was done as in Caporaso et al 2011 Genome research. The PCR primers F515 and R806 were developed against the V4 region of the 16S rRNA, both bacteria and archaea, which we determined would yield optimal community clustering with reads of this length The reverse PCR primer is barcoded with a 12-base error-correcting Golay code to facilitate multiplexing of up to 1,500 samples per lane, and both PCR primers contain sequencer adapter regions.	GT	FWD:GTGCCAGCMGCCGCGGTAA; REV:GGACTACHVGGGTWTCTAAT	Plate8	Illumina	V4	Cornell	2/4/13	TwinsUKPlate8	0.1,gram	Kings College London	sequencing by synthesis	16S rRNA	V4	G5	64	years	0	6482	UBERON:feces	28.94816971	UBERON:feces	UBERON:feces	9/25/11	2011-09-25 10:50:00	10:50:00	GAZ:United Kingdom	11/10/46	0	true	10.4516	ENVO:dense settlement biome	ENVO:human-associated habitat	true	648	human	Homo sapiens	6482	9606	6482	51.5	-0.12	true	Cornell	true	false	King's College, London, UK	Stool	female	5	1003364	TwinsUK gut microbiome	DZ	TwinsUK Fecal Sample
2014.Plate8.72	GACAGAGGTGCA	GTGCCAGCMGCCGCGGTAA	42.441	Cornell	UK_Twins	Cornell	fecal samples from TwinsUK MiSeq runs	TwinsUK Miseq	Jess	MiSeq	This analysis was done as in Caporaso et al 2011 Genome research. The PCR primers F515 and R806 were developed against the V4 region of the 16S rRNA, both bacteria and archaea, which we determined would yield optimal community clustering with reads of this length The reverse PCR primer is barcoded with a 12-base error-correcting Golay code to facilitate multiplexing of up to 1,500 samples per lane, and both PCR primers contain sequencer adapter regions.	GT	FWD:GTGCCAGCMGCCGCGGTAA; REV:GGACTACHVGGGTWTCTAAT	Plate8	Illumina	V4	Cornell	2/4/13	TwinsUKPlate8	0.1,gram	Kings College London	sequencing by synthesis	16S rRNA	V4	G2	57	years	0	6162	UBERON:feces	22.84664917	UBERON:feces	UBERON:feces	10/13/11	2011-10-13 13:50:00	13:50:00	GAZ:United Kingdom	10/24/53	0	true	10.4516	ENVO:dense settlement biome	ENVO:human-associated habitat	true	616	human	Homo sapiens	6162	9606	6162	51.5	-0.12	true	Cornell	true	false	King's College, London, UK	Stool	female	5	1003308	TwinsUK gut microbiome	DZ	TwinsUK Fecal Sample
2014.Plate8.7	GTTGGTTGGCAT	GTGCCAGCMGCCGCGGTAA	35.141	Cornell	UK_Twins	Cornell	fecal samples from TwinsUK MiSeq runs	TwinsUK Miseq	Nick	MiSeq	This analysis was done as in Caporaso et al 2011 Genome research. The PCR primers F515 and R806 were developed against the V4 region of the 16S rRNA, both bacteria and archaea, which we determined would yield optimal community clustering with reads of this length The reverse PCR primer is barcoded with a 12-base error-correcting Golay code to facilitate multiplexing of up to 1,500 samples per lane, and both PCR primers contain sequencer adapter regions.	GT	FWD:GTGCCAGCMGCCGCGGTAA; REV:GGACTACHVGGGTWTCTAAT	Plate8	Illumina	V4	Cornell	2/4/13	TwinsUKPlate8	0.1,gram	Kings College London	sequencing by synthesis	16S rRNA	V4	A7	48	years	0	8002	UBERON:feces	21.86701012	UBERON:feces	UBERON:feces	5/4/11	2011-05-04 19:00:00	19:00:00	GAZ:United Kingdom	10/9/62	0	true	10.4516	ENVO:dense settlement biome	ENVO:human-associated habitat	true	800	human	Homo sapiens	8002	9606	8002	51.5	-0.12	true	Cornell	true	false	King's College, London, UK	Stool	female	4	1002841	TwinsUK gut microbiome	MZ	TwinsUK Fecal Sample
2014.Plate8.67	CAACTAGACTCG	GTGCCAGCMGCCGCGGTAA	23.091	Cornell	UK_Twins	Cornell	fecal samples from TwinsUK MiSeq runs	TwinsUK Miseq	Jess	MiSeq	This analysis was done as in Caporaso et al 2011 Genome research. The PCR primers F515 and R806 were developed against the V4 region of the 16S rRNA, both bacteria and archaea, which we determined would yield optimal community clustering with reads of this length The reverse PCR primer is barcoded with a 12-base error-correcting Golay code to facilitate multiplexing of up to 1,500 samples per lane, and both PCR primers contain sequencer adapter regions.	GT	FWD:GTGCCAGCMGCCGCGGTAA; REV:GGACTACHVGGGTWTCTAAT	Plate8	Illumina	V4	Cornell	2/4/13	TwinsUKPlate8	0.1,gram	Kings College London	sequencing by synthesis	16S rRNA	V4	F9	47	years	0	8032	UBERON:feces	24.42462921	UBERON:feces	UBERON:feces	11/15/11	2011-11-15 20:00:00	20:00:00	GAZ:United Kingdom	7/15/64	0	true	10.4516	ENVO:dense settlement biome	ENVO:human-associated habitat	true	803	human	Homo sapiens	8032	9606	8032	51.5	-0.12	true	Cornell	true	false	King's College, London, UK	Stool	female	5	1003460	TwinsUK gut microbiome	DZ	TwinsUK Fecal Sample
2014.Plate8.60	GTGGCCTACTAC	GTGCCAGCMGCCGCGGTAA	14.686	Cornell	UK_Twins	Cornell	fecal samples from TwinsUK MiSeq runs	TwinsUK Miseq	Jess	MiSeq	This analysis was done as in Caporaso et al 2011 Genome research. The PCR primers F515 and R806 were developed against the V4 region of the 16S rRNA, both bacteria and archaea, which we determined would yield optimal community clustering with reads of this length The reverse PCR primer is barcoded with a 12-base error-correcting Golay code to facilitate multiplexing of up to 1,500 samples per lane, and both PCR primers contain sequencer adapter regions.	GT	FWD:GTGCCAGCMGCCGCGGTAA; REV:GGACTACHVGGGTWTCTAAT	Plate8	Illumina	V4	Cornell	2/4/13	TwinsUKPlate8	0.1,gram	Kings College London	sequencing by synthesis	16S rRNA	V4	F2	64	years	0	7752	UBERON:feces	24.85847092	UBERON:feces	UBERON:feces	9/12/11	2011-09-12 09:55:00	9:55:00	GAZ:United Kingdom	1/23/47	0	true	10.4516	ENVO:dense settlement biome	ENVO:human-associated habitat	true	775	human	Homo sapiens	7752	9606	7752	51.5	-0.12	true	Cornell	true	false	King's College, London, UK	Stool	female	5	1003430	TwinsUK gut microbiome	DZ	TwinsUK Fecal Sample
2014.Plate8.6	ACTCGGCCAACT	GTGCCAGCMGCCGCGGTAA	28.149	Cornell	UK_Twins	Cornell	fecal samples from TwinsUK MiSeq runs	TwinsUK Miseq	Nick	MiSeq	This analysis was done as in Caporaso et al 2011 Genome research. The PCR primers F515 and R806 were developed against the V4 region of the 16S rRNA, both bacteria and archaea, which we determined would yield optimal community clustering with reads of this length The reverse PCR primer is barcoded with a 12-base error-correcting Golay code to facilitate multiplexing of up to 1,500 samples per lane, and both PCR primers contain sequencer adapter regions.	GT	FWD:GTGCCAGCMGCCGCGGTAA; REV:GGACTACHVGGGTWTCTAAT	Plate8	Illumina	V4	Cornell	2/4/13	TwinsUKPlate8	0.1,gram	Kings College London	sequencing by synthesis	16S rRNA	V4	A6	55	years	0	4601	UBERON:feces	31.19256973	UBERON:feces	UBERON:feces	5/7/11	2011-05-07 11:00:00	11:00:00	GAZ:United Kingdom	11/6/55	0	true	10.4516	ENVO:dense settlement biome	ENVO:human-associated habitat	true	460	human	Homo sapiens	4601	9606	4601	51.5	-0.12	true	Cornell	true	false	King's College, London, UK	Stool	female	4	1002831	TwinsUK gut microbiome	DZ	TwinsUK Fecal Sample
2014.Plate8.59	ACCAACAGATTG	GTGCCAGCMGCCGCGGTAA	27.319	Cornell	UK_Twins	Cornell	fecal samples from TwinsUK MiSeq runs	TwinsUK Miseq	Jess	MiSeq	This analysis was done as in Caporaso et al 2011 Genome research. The PCR primers F515 and R806 were developed against the V4 region of the 16S rRNA, both bacteria and archaea, which we determined would yield optimal community clustering with reads of this length The reverse PCR primer is barcoded with a 12-base error-correcting Golay code to facilitate multiplexing of up to 1,500 samples per lane, and both PCR primers contain sequencer adapter regions.	GT	FWD:GTGCCAGCMGCCGCGGTAA; REV:GGACTACHVGGGTWTCTAAT	Plate8	Illumina	V4	Cornell	2/4/13	TwinsUKPlate8	0.1,gram	Kings College London	sequencing by synthesis	16S rRNA	V4	F1	64	years	0	4962	UBERON:feces	39.85084915	UBERON:feces	UBERON:feces	11/9/11	2011-11-09 08:00:00	8:00:00	GAZ:United Kingdom	4/2/47	0	true	10.4516	ENVO:dense settlement biome	ENVO:human-associated habitat	true	496	human	Homo sapiens	4962	9606	4962	51.5	-0.12	true	Cornell	true	false	King's College, London, UK	Stool	female	5	1003421	TwinsUK gut microbiome	DZ	TwinsUK Fecal Sample
2014.Plate8.54	TTCACCTGTATC	GTGCCAGCMGCCGCGGTAA	32.502	Cornell	UK_Twins	Cornell	fecal samples from TwinsUK MiSeq runs	TwinsUK Miseq	Jess	MiSeq	This analysis was done as in Caporaso et al 2011 Genome research. The PCR primers F515 and R806 were developed against the V4 region of the 16S rRNA, both bacteria and archaea, which we determined would yield optimal community clustering with reads of this length The reverse PCR primer is barcoded with a 12-base error-correcting Golay code to facilitate multiplexing of up to 1,500 samples per lane, and both PCR primers contain sequencer adapter regions.	GT	FWD:GTGCCAGCMGCCGCGGTAA; REV:GGACTACHVGGGTWTCTAAT	Plate8	Illumina	V4	Cornell	2/4/13	TwinsUKPlate8	0.1,gram	Kings College London	sequencing by synthesis	16S rRNA	V4	E8	46	years	0	6842	UBERON:feces	20.91397095	UBERON:feces	UBERON:feces	11/28/11	2011-11-28 09:00:00	9:00:00	GAZ:United Kingdom	4/12/65	0	true	10.4516	ENVO:dense settlement biome	ENVO:human-associated habitat	true	684	human	Homo sapiens	6842	9606	6842	51.5	-0.12	true	Cornell	true	false	King's College, London, UK	Stool	female	5	1003416	TwinsUK gut microbiome	DZ	TwinsUK Fecal Sample
2014.Plate8.53	CCTCGGGTACTA	GTGCCAGCMGCCGCGGTAA	20.188	Cornell	UK_Twins	Cornell	fecal samples from TwinsUK MiSeq runs	TwinsUK Miseq	Nick	MiSeq	This analysis was done as in Caporaso et al 2011 Genome research. The PCR primers F515 and R806 were developed against the V4 region of the 16S rRNA, both bacteria and archaea, which we determined would yield optimal community clustering with reads of this length The reverse PCR primer is barcoded with a 12-base error-correcting Golay code to facilitate multiplexing of up to 1,500 samples per lane, and both PCR primers contain sequencer adapter regions.	GT	FWD:GTGCCAGCMGCCGCGGTAA; REV:GGACTACHVGGGTWTCTAAT	Plate8	Illumina	V4	Cornell	2/4/13	TwinsUKPlate8	0.1,gram	Kings College London	sequencing by synthesis	16S rRNA	V4	E7	47	years	0	6711	UBERON:feces	20.14768028	UBERON:feces	UBERON:feces	5/18/11	2011-05-18 08:30:00	8:30:00	GAZ:United Kingdom	5/20/63	0	true	10.4516	ENVO:dense settlement biome	ENVO:human-associated habitat	true	671	human	Homo sapiens	6711	9606	6711	51.5	-0.12	true	Cornell	true	false	King's College, London, UK	Stool	female	4	1002899	TwinsUK gut microbiome	DZ	TwinsUK Fecal Sample
2014.Plate8.52	TAAACGCGACTC	GTGCCAGCMGCCGCGGTAA	35.71	Cornell	UK_Twins	Cornell	fecal samples from TwinsUK MiSeq runs	TwinsUK Miseq	Nick	MiSeq	This analysis was done as in Caporaso et al 2011 Genome research. The PCR primers F515 and R806 were developed against the V4 region of the 16S rRNA, both bacteria and archaea, which we determined would yield optimal community clustering with reads of this length The reverse PCR primer is barcoded with a 12-base error-correcting Golay code to facilitate multiplexing of up to 1,500 samples per lane, and both PCR primers contain sequencer adapter regions.	GT	FWD:GTGCCAGCMGCCGCGGTAA; REV:GGACTACHVGGGTWTCTAAT	Plate8	Illumina	V4	Cornell	2/4/13	TwinsUKPlate8	0.1,gram	Kings College London	sequencing by synthesis	16S rRNA	V4	E6	71	years	0	8421	UBERON:feces	28.78906059	UBERON:feces	UBERON:feces	4/21/11	2011-04-21 13:00:00	13:00:00	GAZ:United Kingdom	7/27/39	0	true	10.4516	ENVO:dense settlement biome	ENVO:human-associated habitat	true	842	human	Homo sapiens	8421	9606	8421	51.5	-0.12	true	Cornell	true	false	King's College, London, UK	Stool	female	4	1002894	TwinsUK gut microbiome	DZ	TwinsUK Fecal Sample
2014.Plate8.51	ATTCAGATGGCA	GTGCCAGCMGCCGCGGTAA	33.681	Cornell	UK_Twins	Cornell	fecal samples from TwinsUK MiSeq runs	TwinsUK Miseq	Nick	MiSeq	This analysis was done as in Caporaso et al 2011 Genome research. The PCR primers F515 and R806 were developed against the V4 region of the 16S rRNA, both bacteria and archaea, which we determined would yield optimal community clustering with reads of this length The reverse PCR primer is barcoded with a 12-base error-correcting Golay code to facilitate multiplexing of up to 1,500 samples per lane, and both PCR primers contain sequencer adapter regions.	GT	FWD:GTGCCAGCMGCCGCGGTAA; REV:GGACTACHVGGGTWTCTAAT	Plate8	Illumina	V4	Cornell	2/4/13	TwinsUKPlate8	0.1,gram	Kings College London	sequencing by synthesis	16S rRNA	V4	E5	48	years	0	6712	UBERON:feces	23.45520973	UBERON:feces	UBERON:feces	5/26/11	2011-05-26 11:20:00	11:20:00	GAZ:United Kingdom	5/20/63	0	true	10.4516	ENVO:dense settlement biome	ENVO:human-associated habitat	true	671	human	Homo sapiens	6712	9606	6712	51.5	-0.12	true	Cornell	true	false	King's College, London, UK	Stool	female	4	1002900	TwinsUK gut microbiome	DZ	TwinsUK Fecal Sample
2014.Plate8.50	ATTATACGGCGC	GTGCCAGCMGCCGCGGTAA	44.562	Cornell	UK_Twins	Cornell	fecal samples from TwinsUK MiSeq runs	TwinsUK Miseq	Nick	MiSeq	This analysis was done as in Caporaso et al 2011 Genome research. The PCR primers F515 and R806 were developed against the V4 region of the 16S rRNA, both bacteria and archaea, which we determined would yield optimal community clustering with reads of this length The reverse PCR primer is barcoded with a 12-base error-correcting Golay code to facilitate multiplexing of up to 1,500 samples per lane, and both PCR primers contain sequencer adapter regions.	GT	FWD:GTGCCAGCMGCCGCGGTAA; REV:GGACTACHVGGGTWTCTAAT	Plate8	Illumina	V4	Cornell	2/4/13	TwinsUKPlate8	0.1,gram	Kings College London	sequencing by synthesis	16S rRNA	V4	E4	60	years	0	7501	UBERON:feces	28.68004036	UBERON:feces	UBERON:feces	4/26/11	2011-04-26 04:30:00	4:30:00	GAZ:United Kingdom	5/30/50	0	true	10.4516	ENVO:dense settlement biome	ENVO:human-associated habitat	true	750	human	Homo sapiens	7501	9606	7501	51.5	-0.12	true	Cornell	true	false	King's College, London, UK	Stool	female	4	1002904	TwinsUK gut microbiome	MZ	TwinsUK Fecal Sample
2014.Plate8.5	TGTCCGTGGATC	GTGCCAGCMGCCGCGGTAA	41.703	Cornell	UK_Twins	Cornell	fecal samples from TwinsUK MiSeq runs	TwinsUK Miseq	Nick	MiSeq	This analysis was done as in Caporaso et al 2011 Genome research. The PCR primers F515 and R806 were developed against the V4 region of the 16S rRNA, both bacteria and archaea, which we determined would yield optimal community clustering with reads of this length The reverse PCR primer is barcoded with a 12-base error-correcting Golay code to facilitate multiplexing of up to 1,500 samples per lane, and both PCR primers contain sequencer adapter regions.	GT	FWD:GTGCCAGCMGCCGCGGTAA; REV:GGACTACHVGGGTWTCTAAT	Plate8	Illumina	V4	Cornell	2/4/13	TwinsUKPlate8	0.1,gram	Kings College London	sequencing by synthesis	16S rRNA	V4	A5	57	years	0	6551	UBERON:feces	26.01656914	UBERON:feces	UBERON:feces	5/3/11	2011-05-03 06:45:00	6:45:00	GAZ:United Kingdom	4/19/54	0	true	10.4516	ENVO:dense settlement biome	ENVO:human-associated habitat	true	655	human	Homo sapiens	6551	9606	6551	51.5	-0.12	true	Cornell	true	false	King's College, London, UK	Stool	female	4	1002839	TwinsUK gut microbiome	MZ	TwinsUK Fecal Sample
2014.Plate8.49	ACACAGTCCTGA	GTGCCAGCMGCCGCGGTAA	16.899	Cornell	UK_Twins	Cornell	fecal samples from TwinsUK MiSeq runs	TwinsUK Miseq	Nick	MiSeq	This analysis was done as in Caporaso et al 2011 Genome research. The PCR primers F515 and R806 were developed against the V4 region of the 16S rRNA, both bacteria and archaea, which we determined would yield optimal community clustering with reads of this length The reverse PCR primer is barcoded with a 12-base error-correcting Golay code to facilitate multiplexing of up to 1,500 samples per lane, and both PCR primers contain sequencer adapter regions.	GT	FWD:GTGCCAGCMGCCGCGGTAA; REV:GGACTACHVGGGTWTCTAAT	Plate8	Illumina	V4	Cornell	2/4/13	TwinsUKPlate8	0.1,gram	Kings College London	sequencing by synthesis	16S rRNA	V4	E3	58	years	0	7132	UBERON:feces	21.50651932	UBERON:feces	UBERON:feces	5/25/11	2011-05-25 05:25:00	5:25:00	GAZ:United Kingdom	7/30/52	0	true	10.4516	ENVO:dense settlement biome	ENVO:human-associated habitat	true	713	human	Homo sapiens	7132	9606	7132	51.5	-0.12	true	Cornell	true	false	King's College, London, UK	Stool	female	4	1002903	TwinsUK gut microbiome	DZ	TwinsUK Fecal Sample
2014.Plate8.48	GCTTCCAGACAA	GTGCCAGCMGCCGCGGTAA	35.156	Cornell	UK_Twins	Cornell	fecal samples from TwinsUK MiSeq runs	TwinsUK Miseq	Nick	MiSeq	This analysis was done as in Caporaso et al 2011 Genome research. The PCR primers F515 and R806 were developed against the V4 region of the 16S rRNA, both bacteria and archaea, which we determined would yield optimal community clustering with reads of this length The reverse PCR primer is barcoded with a 12-base error-correcting Golay code to facilitate multiplexing of up to 1,500 samples per lane, and both PCR primers contain sequencer adapter regions.	GT	FWD:GTGCCAGCMGCCGCGGTAA; REV:GGACTACHVGGGTWTCTAAT	Plate8	Illumina	V4	Cornell	2/4/13	TwinsUKPlate8	0.1,gram	Kings College London	sequencing by synthesis	16S rRNA	V4	E2	48	years	0	4561	UBERON:feces	33.15042877	UBERON:feces	UBERON:feces	5/15/11	2011-05-15 10:30:00	10:30:00	GAZ:United Kingdom	1/11/63	0	true	10.4516	ENVO:dense settlement biome	ENVO:human-associated habitat	true	456	human	Homo sapiens	4561	9606	4561	51.5	-0.12	true	Cornell	true	false	King's College, London, UK	Stool	female	4	1002892	TwinsUK gut microbiome	DZ	TwinsUK Fecal Sample
2014.Plate8.47	ATCCCAGCATGC	GTGCCAGCMGCCGCGGTAA	37.277	Cornell	UK_Twins	Cornell	fecal samples from TwinsUK MiSeq runs	TwinsUK Miseq	Nick	MiSeq	This analysis was done as in Caporaso et al 2011 Genome research. The PCR primers F515 and R806 were developed against the V4 region of the 16S rRNA, both bacteria and archaea, which we determined would yield optimal community clustering with reads of this length The reverse PCR primer is barcoded with a 12-base error-correcting Golay code to facilitate multiplexing of up to 1,500 samples per lane, and both PCR primers contain sequencer adapter regions.	GT	FWD:GTGCCAGCMGCCGCGGTAA; REV:GGACTACHVGGGTWTCTAAT	Plate8	Illumina	V4	Cornell	2/4/13	TwinsUKPlate8	0.1,gram	Kings College London	sequencing by synthesis	16S rRNA	V4	E1	48	years	0	4562	UBERON:feces	25.97948074	UBERON:feces	UBERON:feces	5/14/11	2011-05-14 07:15:00	7:15:00	GAZ:United Kingdom	1/11/63	0	true	10.4516	ENVO:dense settlement biome	ENVO:human-associated habitat	true	456	human	Homo sapiens	4562	9606	4562	51.5	-0.12	true	Cornell	true	false	King's College, London, UK	Stool	female	4	1002893	TwinsUK gut microbiome	DZ	TwinsUK Fecal Sample
2014.Plate8.45	ATAAAGAGGAGG	GTGCCAGCMGCCGCGGTAA	31.623	Cornell	UK_Twins	Cornell	fecal samples from TwinsUK MiSeq runs	TwinsUK Miseq	Nick	MiSeq	This analysis was done as in Caporaso et al 2011 Genome research. The PCR primers F515 and R806 were developed against the V4 region of the 16S rRNA, both bacteria and archaea, which we determined would yield optimal community clustering with reads of this length The reverse PCR primer is barcoded with a 12-base error-correcting Golay code to facilitate multiplexing of up to 1,500 samples per lane, and both PCR primers contain sequencer adapter regions.	GT	FWD:GTGCCAGCMGCCGCGGTAA; REV:GGACTACHVGGGTWTCTAAT	Plate8	Illumina	V4	Cornell	2/4/13	TwinsUKPlate8	0.1,gram	Kings College London	sequencing by synthesis	16S rRNA	V4	D11	59	years	0	7202	UBERON:feces	24.5226593	UBERON:feces	UBERON:feces	5/23/11	2011-05-23 21:15:00	21:15:00	GAZ:United Kingdom	5/11/52	0	true	10.4516	ENVO:dense settlement biome	ENVO:human-associated habitat	true	720	human	Homo sapiens	7202	9606	7202	51.5	-0.12	true	Cornell	true	false	King's College, London, UK	Stool	female	4	1002889	TwinsUK gut microbiome	MZ	TwinsUK Fecal Sample
2014.Plate8.44	GCCCAAGTTCAC	GTGCCAGCMGCCGCGGTAA	29.864	Cornell	UK_Twins	Cornell	fecal samples from TwinsUK MiSeq runs	TwinsUK Miseq	Nick	MiSeq	This analysis was done as in Caporaso et al 2011 Genome research. The PCR primers F515 and R806 were developed against the V4 region of the 16S rRNA, both bacteria and archaea, which we determined would yield optimal community clustering with reads of this length The reverse PCR primer is barcoded with a 12-base error-correcting Golay code to facilitate multiplexing of up to 1,500 samples per lane, and both PCR primers contain sequencer adapter regions.	GT	FWD:GTGCCAGCMGCCGCGGTAA; REV:GGACTACHVGGGTWTCTAAT	Plate8	Illumina	V4	Cornell	2/4/13	TwinsUKPlate8	0.1,gram	Kings College London	sequencing by synthesis	16S rRNA	V4	D10	63	years	0	6452	UBERON:feces	20.4863205	UBERON:feces	UBERON:feces	5/23/11	2011-05-23 08:00:00	8:00:00	GAZ:United Kingdom	7/25/47	0	true	10.4516	ENVO:dense settlement biome	ENVO:human-associated habitat	true	645	human	Homo sapiens	6452	9606	6452	51.5	-0.12	true	Cornell	true	false	King's College, London, UK	Stool	female	4	1002884	TwinsUK gut microbiome	DZ	TwinsUK Fecal Sample
2014.Plate8.43	GCCTGCAGTACT	GTGCCAGCMGCCGCGGTAA	14.647	Cornell	UK_Twins	Cornell	fecal samples from TwinsUK MiSeq runs	TwinsUK Miseq	Nick	MiSeq	This analysis was done as in Caporaso et al 2011 Genome research. The PCR primers F515 and R806 were developed against the V4 region of the 16S rRNA, both bacteria and archaea, which we determined would yield optimal community clustering with reads of this length The reverse PCR primer is barcoded with a 12-base error-correcting Golay code to facilitate multiplexing of up to 1,500 samples per lane, and both PCR primers contain sequencer adapter regions.	GT	FWD:GTGCCAGCMGCCGCGGTAA; REV:GGACTACHVGGGTWTCTAAT	Plate8	Illumina	V4	Cornell	2/4/13	TwinsUKPlate8	0.1,gram	Kings College London	sequencing by synthesis	16S rRNA	V4	D9	38	years	0	5131	UBERON:feces		UBERON:feces	UBERON:feces	5/19/11	2011-05-19 15:00:00	15:00:00	GAZ:United Kingdom	5/31/72	0	true	10.4516	ENVO:dense settlement biome	ENVO:human-associated habitat	true	513	human	Homo sapiens	5131	9606	5131	51.5	-0.12	true	Cornell	true	false	King's College, London, UK	Stool	female	4	1002882	TwinsUK gut microbiome	DZ	TwinsUK Fecal Sample
2014.Plate8.42	TCCTCACTATCA	GTGCCAGCMGCCGCGGTAA	27.137	Cornell	UK_Twins	Cornell	fecal samples from TwinsUK MiSeq runs	TwinsUK Miseq	Nick	MiSeq	This analysis was done as in Caporaso et al 2011 Genome research. The PCR primers F515 and R806 were developed against the V4 region of the 16S rRNA, both bacteria and archaea, which we determined would yield optimal community clustering with reads of this length The reverse PCR primer is barcoded with a 12-base error-correcting Golay code to facilitate multiplexing of up to 1,500 samples per lane, and both PCR primers contain sequencer adapter regions.	GT	FWD:GTGCCAGCMGCCGCGGTAA; REV:GGACTACHVGGGTWTCTAAT	Plate8	Illumina	V4	Cornell	2/4/13	TwinsUKPlate8	0.1,gram	Kings College London	sequencing by synthesis	16S rRNA	V4	D8	60	years	0	4971	UBERON:feces	25.46198082	UBERON:feces	UBERON:feces	5/21/11	2011-05-21 09:00:00	9:00:00	GAZ:United Kingdom	10/26/50	0	true	10.4516	ENVO:dense settlement biome	ENVO:human-associated habitat	true	497	human	Homo sapiens	4971	9606	4971	51.5	-0.12	true	Cornell	true	false	King's College, London, UK	Stool	female	4	1002881	TwinsUK gut microbiome	DZ	TwinsUK Fecal Sample
2014.Plate8.41	TCCTAGGTCCGA	GTGCCAGCMGCCGCGGTAA	32.239	Cornell	UK_Twins	Cornell	fecal samples from TwinsUK MiSeq runs	TwinsUK Miseq	Nick	MiSeq	This analysis was done as in Caporaso et al 2011 Genome research. The PCR primers F515 and R806 were developed against the V4 region of the 16S rRNA, both bacteria and archaea, which we determined would yield optimal community clustering with reads of this length The reverse PCR primer is barcoded with a 12-base error-correcting Golay code to facilitate multiplexing of up to 1,500 samples per lane, and both PCR primers contain sequencer adapter regions.	GT	FWD:GTGCCAGCMGCCGCGGTAA; REV:GGACTACHVGGGTWTCTAAT	Plate8	Illumina	V4	Cornell	2/4/13	TwinsUKPlate8	0.1,gram	Kings College London	sequencing by synthesis	16S rRNA	V4	D7	61	years	0	4091	UBERON:feces	32.71469116	UBERON:feces	UBERON:feces	5/17/11	2011-05-17 18:30:00	18:30:00	GAZ:United Kingdom	3/15/50	0	true	10.4516	ENVO:dense settlement biome	ENVO:human-associated habitat	true	409	human	Homo sapiens	4091	9606	4091	51.5	-0.12	true	Cornell	true	false	King's College, London, UK	Stool	female	4	1002875	TwinsUK gut microbiome	DZ	TwinsUK Fecal Sample
2014.Plate8.40	TTGGAACGGCTT	GTGCCAGCMGCCGCGGTAA	35.802	Cornell	UK_Twins	Cornell	fecal samples from TwinsUK MiSeq runs	TwinsUK Miseq	Nick	MiSeq	This analysis was done as in Caporaso et al 2011 Genome research. The PCR primers F515 and R806 were developed against the V4 region of the 16S rRNA, both bacteria and archaea, which we determined would yield optimal community clustering with reads of this length The reverse PCR primer is barcoded with a 12-base error-correcting Golay code to facilitate multiplexing of up to 1,500 samples per lane, and both PCR primers contain sequencer adapter regions.	GT	FWD:GTGCCAGCMGCCGCGGTAA; REV:GGACTACHVGGGTWTCTAAT	Plate8	Illumina	V4	Cornell	2/4/13	TwinsUKPlate8	0.1,gram	Kings College London	sequencing by synthesis	16S rRNA	V4	D6	59	years	0	7201	UBERON:feces	28.1985302	UBERON:feces	UBERON:feces	5/23/11	2011-05-23 23:00:00	23:00:00	GAZ:United Kingdom	5/11/52	0	true	10.4516	ENVO:dense settlement biome	ENVO:human-associated habitat	true	720	human	Homo sapiens	7201	9606	7201	51.5	-0.12	true	Cornell	true	false	King's College, London, UK	Stool	female	4	1002888	TwinsUK gut microbiome	MZ	TwinsUK Fecal Sample
2014.Plate8.4	CATCTGGGCAAT	GTGCCAGCMGCCGCGGTAA	44.931	Cornell	UK_Twins	Cornell	fecal samples from TwinsUK MiSeq runs	TwinsUK Miseq	Nick	MiSeq	This analysis was done as in Caporaso et al 2011 Genome research. The PCR primers F515 and R806 were developed against the V4 region of the 16S rRNA, both bacteria and archaea, which we determined would yield optimal community clustering with reads of this length The reverse PCR primer is barcoded with a 12-base error-correcting Golay code to facilitate multiplexing of up to 1,500 samples per lane, and both PCR primers contain sequencer adapter regions.	GT	FWD:GTGCCAGCMGCCGCGGTAA; REV:GGACTACHVGGGTWTCTAAT	Plate8	Illumina	V4	Cornell	2/4/13	TwinsUKPlate8	0.1,gram	Kings College London	sequencing by synthesis	16S rRNA	V4	A4	50	years	0	6152	UBERON:feces	25.15723038	UBERON:feces	UBERON:feces	5/5/11	2011-05-05 19:10:00	19:10:00	GAZ:United Kingdom	6/6/60	0	true	10.4516	ENVO:dense settlement biome	ENVO:human-associated habitat	true	615	human	Homo sapiens	6152	9606	6152	51.5	-0.12	true	Cornell	true	false	King's College, London, UK	Stool	female	4	1002838	TwinsUK gut microbiome	DZ	TwinsUK Fecal Sample
2014.Plate8.39	GACCGTCAATAC	GTGCCAGCMGCCGCGGTAA	26.12	Cornell	UK_Twins	Cornell	fecal samples from TwinsUK MiSeq runs	TwinsUK Miseq	Nick	MiSeq	This analysis was done as in Caporaso et al 2011 Genome research. The PCR primers F515 and R806 were developed against the V4 region of the 16S rRNA, both bacteria and archaea, which we determined would yield optimal community clustering with reads of this length The reverse PCR primer is barcoded with a 12-base error-correcting Golay code to facilitate multiplexing of up to 1,500 samples per lane, and both PCR primers contain sequencer adapter regions.	GT	FWD:GTGCCAGCMGCCGCGGTAA; REV:GGACTACHVGGGTWTCTAAT	Plate8	Illumina	V4	Cornell	2/4/13	TwinsUKPlate8	0.1,gram	Kings College London	sequencing by synthesis	16S rRNA	V4	D5	61	years	0	4092	UBERON:feces	21.64966965	UBERON:feces	UBERON:feces	5/15/11	2011-05-15 08:50:00	8:50:00	GAZ:United Kingdom	3/15/50	0	true	10.4516	ENVO:dense settlement biome	ENVO:human-associated habitat	true	409	human	Homo sapiens	4092	9606	4092	51.5	-0.12	true	Cornell	true	false	King's College, London, UK	Stool	female	4	1002876	TwinsUK gut microbiome	DZ	TwinsUK Fecal Sample
2014.Plate8.36	GATCTAATCGAG	GTGCCAGCMGCCGCGGTAA	36.079	Cornell	UK_Twins	Cornell	fecal samples from TwinsUK MiSeq runs	TwinsUK Miseq	Nick	MiSeq	This analysis was done as in Caporaso et al 2011 Genome research. The PCR primers F515 and R806 were developed against the V4 region of the 16S rRNA, both bacteria and archaea, which we determined would yield optimal community clustering with reads of this length The reverse PCR primer is barcoded with a 12-base error-correcting Golay code to facilitate multiplexing of up to 1,500 samples per lane, and both PCR primers contain sequencer adapter regions.	GT	FWD:GTGCCAGCMGCCGCGGTAA; REV:GGACTACHVGGGTWTCTAAT	Plate8	Illumina	V4	Cornell	2/4/13	TwinsUKPlate8	0.1,gram	Kings College London	sequencing by synthesis	16S rRNA	V4	D2	56	years	0	6521	UBERON:feces	27.76342964	UBERON:feces	UBERON:feces	5/16/11	2011-05-16 22:30:00	22:30:00	GAZ:United Kingdom	2/19/55	0	true	10.4516	ENVO:dense settlement biome	ENVO:human-associated habitat	true	652	human	Homo sapiens	6521	9606	6521	51.5	-0.12	true	Cornell	true	false	King's College, London, UK	Stool	female	4	1002885	TwinsUK gut microbiome	DZ	TwinsUK Fecal Sample
2014.Plate8.35	GCATGCATCCCA	GTGCCAGCMGCCGCGGTAA	42.164	Cornell	UK_Twins	Cornell	fecal samples from TwinsUK MiSeq runs	TwinsUK Miseq	Nick	MiSeq	This analysis was done as in Caporaso et al 2011 Genome research. The PCR primers F515 and R806 were developed against the V4 region of the 16S rRNA, both bacteria and archaea, which we determined would yield optimal community clustering with reads of this length The reverse PCR primer is barcoded with a 12-base error-correcting Golay code to facilitate multiplexing of up to 1,500 samples per lane, and both PCR primers contain sequencer adapter regions.	GT	FWD:GTGCCAGCMGCCGCGGTAA; REV:GGACTACHVGGGTWTCTAAT	Plate8	Illumina	V4	Cornell	2/4/13	TwinsUKPlate8	0.1,gram	Kings College London	sequencing by synthesis	16S rRNA	V4	D1	62	years	0	4581	UBERON:feces	22.07177925	UBERON:feces	UBERON:feces	5/15/11	2011-05-15 09:50:00	9:50:00	GAZ:United Kingdom	1/7/49	0	true	10.4516	ENVO:dense settlement biome	ENVO:human-associated habitat	true	458	human	Homo sapiens	4581	9606	4581	51.5	-0.12	true	Cornell	true	false	King's College, London, UK	Stool	female	4	1002879	TwinsUK gut microbiome	DZ	TwinsUK Fecal Sample
2014.Plate8.34	ACTCATCTTCCA	GTGCCAGCMGCCGCGGTAA	30.215	Cornell	UK_Twins	Cornell	fecal samples from TwinsUK MiSeq runs	TwinsUK Miseq	Nick	MiSeq	This analysis was done as in Caporaso et al 2011 Genome research. The PCR primers F515 and R806 were developed against the V4 region of the 16S rRNA, both bacteria and archaea, which we determined would yield optimal community clustering with reads of this length The reverse PCR primer is barcoded with a 12-base error-correcting Golay code to facilitate multiplexing of up to 1,500 samples per lane, and both PCR primers contain sequencer adapter regions.	GT	FWD:GTGCCAGCMGCCGCGGTAA; REV:GGACTACHVGGGTWTCTAAT	Plate8	Illumina	V4	Cornell	2/4/13	TwinsUKPlate8	0.1,gram	Kings College London	sequencing by synthesis	16S rRNA	V4	C11	44	years	0	3922	UBERON:feces	18.9392395	UBERON:feces	UBERON:feces	5/16/11	2011-05-16 09:45:00	9:45:00	GAZ:United Kingdom	12/16/66	0	true	10.4516	ENVO:dense settlement biome	ENVO:human-associated habitat	true	392	human	Homo sapiens	3922	9606	3922	51.5	-0.12	true	Cornell	true	false	King's College, London, UK	Stool	female	4	1002874	TwinsUK gut microbiome	MZ	TwinsUK Fecal Sample
2014.Plate8.33	AAGATCGTACTG	GTGCCAGCMGCCGCGGTAA	25.466	Cornell	UK_Twins	Cornell	fecal samples from TwinsUK MiSeq runs	TwinsUK Miseq	Nick	MiSeq	This analysis was done as in Caporaso et al 2011 Genome research. The PCR primers F515 and R806 were developed against the V4 region of the 16S rRNA, both bacteria and archaea, which we determined would yield optimal community clustering with reads of this length The reverse PCR primer is barcoded with a 12-base error-correcting Golay code to facilitate multiplexing of up to 1,500 samples per lane, and both PCR primers contain sequencer adapter regions.	GT	FWD:GTGCCAGCMGCCGCGGTAA; REV:GGACTACHVGGGTWTCTAAT	Plate8	Illumina	V4	Cornell	2/4/13	TwinsUKPlate8	0.1,gram	Kings College London	sequencing by synthesis	16S rRNA	V4	C10	71	years	0	4142	UBERON:feces	26.64061928	UBERON:feces	UBERON:feces	5/14/11	2011-05-14 11:30:00	11:30:00	GAZ:United Kingdom	9/14/39	0	true	10.4516	ENVO:dense settlement biome	ENVO:human-associated habitat	true	414	human	Homo sapiens	4142	9606	4142	51.5	-0.12	true	Cornell	true	false	King's College, London, UK	Stool	female	4	1002878	TwinsUK gut microbiome	MZ	TwinsUK Fecal Sample
2014.Plate8.32	TACGCCCATCAG	GTGCCAGCMGCCGCGGTAA	35.757	Cornell	UK_Twins	Cornell	fecal samples from TwinsUK MiSeq runs	TwinsUK Miseq	Nick	MiSeq	This analysis was done as in Caporaso et al 2011 Genome research. The PCR primers F515 and R806 were developed against the V4 region of the 16S rRNA, both bacteria and archaea, which we determined would yield optimal community clustering with reads of this length The reverse PCR primer is barcoded with a 12-base error-correcting Golay code to facilitate multiplexing of up to 1,500 samples per lane, and both PCR primers contain sequencer adapter regions.	GT	FWD:GTGCCAGCMGCCGCGGTAA; REV:GGACTACHVGGGTWTCTAAT	Plate8	Illumina	V4	Cornell	2/4/13	TwinsUKPlate8	0.1,gram	Kings College London	sequencing by synthesis	16S rRNA	V4	C9	56	years	0	6522	UBERON:feces	31.15924072	UBERON:feces	UBERON:feces	5/18/11	2011-05-18 09:30:00	9:30:00	GAZ:United Kingdom	2/19/55	0	true	10.4516	ENVO:dense settlement biome	ENVO:human-associated habitat	true	652	human	Homo sapiens	6522	9606	6522	51.5	-0.12	true	Cornell	true	false	King's College, London, UK	Stool	female	4	1002886	TwinsUK gut microbiome	DZ	TwinsUK Fecal Sample
2014.Plate8.31	ATCGGGCTTAAC	GTGCCAGCMGCCGCGGTAA	39.011	Cornell	UK_Twins	Cornell	fecal samples from TwinsUK MiSeq runs	TwinsUK Miseq	Nick	MiSeq	This analysis was done as in Caporaso et al 2011 Genome research. The PCR primers F515 and R806 were developed against the V4 region of the 16S rRNA, both bacteria and archaea, which we determined would yield optimal community clustering with reads of this length The reverse PCR primer is barcoded with a 12-base error-correcting Golay code to facilitate multiplexing of up to 1,500 samples per lane, and both PCR primers contain sequencer adapter regions.	GT	FWD:GTGCCAGCMGCCGCGGTAA; REV:GGACTACHVGGGTWTCTAAT	Plate8	Illumina	V4	Cornell	2/4/13	TwinsUKPlate8	0.1,gram	Kings College London	sequencing by synthesis	16S rRNA	V4	C8	62	years	0	4582	UBERON:feces	20.84152031	UBERON:feces	UBERON:feces	5/17/11	2011-05-17 09:00:00	9:00:00	GAZ:United Kingdom	1/7/49	0	true	10.4516	ENVO:dense settlement biome	ENVO:human-associated habitat	true	458	human	Homo sapiens	4582	9606	4582	51.5	-0.12	true	Cornell	true	false	King's College, London, UK	Stool	female	4	1002880	TwinsUK gut microbiome	DZ	TwinsUK Fecal Sample
2014.Plate8.30	GAAACTCCTAGA	GTGCCAGCMGCCGCGGTAA	32.414	Cornell	UK_Twins	Cornell	fecal samples from TwinsUK MiSeq runs	TwinsUK Miseq	Nick	MiSeq	This analysis was done as in Caporaso et al 2011 Genome research. The PCR primers F515 and R806 were developed against the V4 region of the 16S rRNA, both bacteria and archaea, which we determined would yield optimal community clustering with reads of this length The reverse PCR primer is barcoded with a 12-base error-correcting Golay code to facilitate multiplexing of up to 1,500 samples per lane, and both PCR primers contain sequencer adapter regions.	GT	FWD:GTGCCAGCMGCCGCGGTAA; REV:GGACTACHVGGGTWTCTAAT	Plate8	Illumina	V4	Cornell	2/4/13	TwinsUKPlate8	0.1,gram	Kings College London	sequencing by synthesis	16S rRNA	V4	C7	52	years	0	8162	UBERON:feces	27.81320953	UBERON:feces	UBERON:feces	5/26/11	2011-05-26 08:30:00	8:30:00	GAZ:United Kingdom	4/5/59	0	true	10.4516	ENVO:dense settlement biome	ENVO:human-associated habitat	true	816	human	Homo sapiens	8162	9606	8162	51.5	-0.12	true	Cornell	true	false	King's College, London, UK	Stool	female	4	1002858	TwinsUK gut microbiome	DZ	TwinsUK Fecal Sample
2014.Plate8.29	GCGTAGAGAGAC	GTGCCAGCMGCCGCGGTAA	32.575	Cornell	UK_Twins	Cornell	fecal samples from TwinsUK MiSeq runs	TwinsUK Miseq	Nick	MiSeq	This analysis was done as in Caporaso et al 2011 Genome research. The PCR primers F515 and R806 were developed against the V4 region of the 16S rRNA, both bacteria and archaea, which we determined would yield optimal community clustering with reads of this length The reverse PCR primer is barcoded with a 12-base error-correcting Golay code to facilitate multiplexing of up to 1,500 samples per lane, and both PCR primers contain sequencer adapter regions.	GT	FWD:GTGCCAGCMGCCGCGGTAA; REV:GGACTACHVGGGTWTCTAAT	Plate8	Illumina	V4	Cornell	2/4/13	TwinsUKPlate8	0.1,gram	Kings College London	sequencing by synthesis	16S rRNA	V4	C6	70	years	0	7362	UBERON:feces	36.5304718	UBERON:feces	UBERON:feces	5/20/11	2011-05-20 19:00:00	19:00:00	GAZ:United Kingdom	12/2/40	0	true	10.4516	ENVO:dense settlement biome	ENVO:human-associated habitat	true	736	human	Homo sapiens	7362	9606	7362	51.5	-0.12	true	Cornell	true	false	King's College, London, UK	Stool	female	4	1002870	TwinsUK gut microbiome	DZ	TwinsUK Fecal Sample
2014.Plate8.28	TCCAGGGCTATA	GTGCCAGCMGCCGCGGTAA	25.106	Cornell	UK_Twins	Cornell	fecal samples from TwinsUK MiSeq runs	TwinsUK Miseq	Nick	MiSeq	This analysis was done as in Caporaso et al 2011 Genome research. The PCR primers F515 and R806 were developed against the V4 region of the 16S rRNA, both bacteria and archaea, which we determined would yield optimal community clustering with reads of this length The reverse PCR primer is barcoded with a 12-base error-correcting Golay code to facilitate multiplexing of up to 1,500 samples per lane, and both PCR primers contain sequencer adapter regions.	GT	FWD:GTGCCAGCMGCCGCGGTAA; REV:GGACTACHVGGGTWTCTAAT	Plate8	Illumina	V4	Cornell	2/4/13	TwinsUKPlate8	0.1,gram	Kings College London	sequencing by synthesis	16S rRNA	V4	C5	32	years	0	7072	UBERON:feces	25.29394913	UBERON:feces	UBERON:feces	5/24/11	2011-05-24 19:00:00	19:00:00	GAZ:United Kingdom	1/18/79	0	true	10.4516	ENVO:dense settlement biome	ENVO:human-associated habitat	true	707	human	Homo sapiens	7072	9606	7072	51.5	-0.12	true	Cornell	true	false	King's College, London, UK	Stool	female	4	1002864	TwinsUK gut microbiome	DZ	TwinsUK Fecal Sample
2014.Plate8.27	TTGGACGTCCAC	GTGCCAGCMGCCGCGGTAA	36.355	Cornell	UK_Twins	Cornell	fecal samples from TwinsUK MiSeq runs	TwinsUK Miseq	Nick	MiSeq	This analysis was done as in Caporaso et al 2011 Genome research. The PCR primers F515 and R806 were developed against the V4 region of the 16S rRNA, both bacteria and archaea, which we determined would yield optimal community clustering with reads of this length The reverse PCR primer is barcoded with a 12-base error-correcting Golay code to facilitate multiplexing of up to 1,500 samples per lane, and both PCR primers contain sequencer adapter regions.	GT	FWD:GTGCCAGCMGCCGCGGTAA; REV:GGACTACHVGGGTWTCTAAT	Plate8	Illumina	V4	Cornell	2/4/13	TwinsUKPlate8	0.1,gram	Kings College London	sequencing by synthesis	16S rRNA	V4	C4	32	years	0	7071	UBERON:feces	21.60409927	UBERON:feces	UBERON:feces	5/23/11	2011-05-23 17:30:00	17:30:00	GAZ:United Kingdom	1/18/79	0	true	10.4516	ENVO:dense settlement biome	ENVO:human-associated habitat	true	707	human	Homo sapiens	7071	9606	7071	51.5	-0.12	true	Cornell	true	false	King's College, London, UK	Stool	female	4	1002863	TwinsUK gut microbiome	DZ	TwinsUK Fecal Sample
2014.Plate8.26	TTATGTACGGCG	GTGCCAGCMGCCGCGGTAA	31.376	Cornell	UK_Twins	Cornell	fecal samples from TwinsUK MiSeq runs	TwinsUK Miseq	Nick	MiSeq	This analysis was done as in Caporaso et al 2011 Genome research. The PCR primers F515 and R806 were developed against the V4 region of the 16S rRNA, both bacteria and archaea, which we determined would yield optimal community clustering with reads of this length The reverse PCR primer is barcoded with a 12-base error-correcting Golay code to facilitate multiplexing of up to 1,500 samples per lane, and both PCR primers contain sequencer adapter regions.	GT	FWD:GTGCCAGCMGCCGCGGTAA; REV:GGACTACHVGGGTWTCTAAT	Plate8	Illumina	V4	Cornell	2/4/13	TwinsUKPlate8	0.1,gram	Kings College London	sequencing by synthesis	16S rRNA	V4	C3	53	years	0	7161	UBERON:feces	31.00465012	UBERON:feces	UBERON:feces	5/19/11	2011-05-19 21:15:00	21:15:00	GAZ:United Kingdom	2/20/58	0	true	10.4516	ENVO:dense settlement biome	ENVO:human-associated habitat	true	716	human	Homo sapiens	7161	9606	7161	51.5	-0.12	true	Cornell	true	false	King's College, London, UK	Stool	female	4	1002865	TwinsUK gut microbiome	DZ	TwinsUK Fecal Sample
2014.Plate8.25	TCACTTGGTGCG	GTGCCAGCMGCCGCGGTAA	50.555	Cornell	UK_Twins	Cornell	fecal samples from TwinsUK MiSeq runs	TwinsUK Miseq	Nick	MiSeq	This analysis was done as in Caporaso et al 2011 Genome research. The PCR primers F515 and R806 were developed against the V4 region of the 16S rRNA, both bacteria and archaea, which we determined would yield optimal community clustering with reads of this length The reverse PCR primer is barcoded with a 12-base error-correcting Golay code to facilitate multiplexing of up to 1,500 samples per lane, and both PCR primers contain sequencer adapter regions.	GT	FWD:GTGCCAGCMGCCGCGGTAA; REV:GGACTACHVGGGTWTCTAAT	Plate8	Illumina	V4	Cornell	2/4/13	TwinsUKPlate8	0.1,gram	Kings College London	sequencing by synthesis	16S rRNA	V4	C2	45	years	0	6302	UBERON:feces	37.49399185	UBERON:feces	UBERON:feces	5/23/11	2011-05-23 00:00:00		GAZ:United Kingdom	10/30/65	0	true	10.4516	ENVO:dense settlement biome	ENVO:human-associated habitat	true	630	human	Homo sapiens	6302	9606	6302	51.5	-0.12	true	Cornell	true	false	King's College, London, UK	Stool	female	4	1002861	TwinsUK gut microbiome	DZ	TwinsUK Fecal Sample
2014.Plate8.24	TCCGCAACCTGA	GTGCCAGCMGCCGCGGTAA	33.773	Cornell	UK_Twins	Cornell	fecal samples from TwinsUK MiSeq runs	TwinsUK Miseq	Nick	MiSeq	This analysis was done as in Caporaso et al 2011 Genome research. The PCR primers F515 and R806 were developed against the V4 region of the 16S rRNA, both bacteria and archaea, which we determined would yield optimal community clustering with reads of this length The reverse PCR primer is barcoded with a 12-base error-correcting Golay code to facilitate multiplexing of up to 1,500 samples per lane, and both PCR primers contain sequencer adapter regions.	GT	FWD:GTGCCAGCMGCCGCGGTAA; REV:GGACTACHVGGGTWTCTAAT	Plate8	Illumina	V4	Cornell	2/4/13	TwinsUKPlate8	0.1,gram	Kings College London	sequencing by synthesis	16S rRNA	V4	C1	41	years	0	7261	UBERON:feces	26.87342072	UBERON:feces	UBERON:feces	5/24/11	2011-05-24 18:30:00	18:30:00	GAZ:United Kingdom	8/8/69	0	true	10.4516	ENVO:dense settlement biome	ENVO:human-associated habitat	true	726	human	Homo sapiens	7261	9606	7261	51.5	-0.12	true	Cornell	true	false	King's College, London, UK	Stool	female	4	1002866	TwinsUK gut microbiome	DZ	TwinsUK Fecal Sample
2014.Plate8.21	TCTCGATAAGCG	GTGCCAGCMGCCGCGGTAA	26.521	Cornell	UK_Twins	Cornell	fecal samples from TwinsUK MiSeq runs	TwinsUK Miseq	Nick	MiSeq	This analysis was done as in Caporaso et al 2011 Genome research. The PCR primers F515 and R806 were developed against the V4 region of the 16S rRNA, both bacteria and archaea, which we determined would yield optimal community clustering with reads of this length The reverse PCR primer is barcoded with a 12-base error-correcting Golay code to facilitate multiplexing of up to 1,500 samples per lane, and both PCR primers contain sequencer adapter regions.	GT	FWD:GTGCCAGCMGCCGCGGTAA; REV:GGACTACHVGGGTWTCTAAT	Plate8	Illumina	V4	Cornell	2/4/13	TwinsUKPlate8	0.1,gram	Kings College London	sequencing by synthesis	16S rRNA	V4	B10	60	years	0	4972	UBERON:feces	24.68320084	UBERON:feces	UBERON:feces	6/15/11	2011-06-15 09:00:00	9:00:00	GAZ:United Kingdom	10/26/50	0	true	10.4516	ENVO:dense settlement biome	ENVO:human-associated habitat	true	497	human	Homo sapiens	4972	9606	4972	51.5	-0.12	true	Cornell	true	false	King's College, London, UK	Stool	female	4	1002859	TwinsUK gut microbiome	DZ	TwinsUK Fecal Sample
2014.Plate8.20	CACGAGCTACTC	GTGCCAGCMGCCGCGGTAA	35.757	Cornell	UK_Twins	Cornell	fecal samples from TwinsUK MiSeq runs	TwinsUK Miseq	Nick	MiSeq	This analysis was done as in Caporaso et al 2011 Genome research. The PCR primers F515 and R806 were developed against the V4 region of the 16S rRNA, both bacteria and archaea, which we determined would yield optimal community clustering with reads of this length The reverse PCR primer is barcoded with a 12-base error-correcting Golay code to facilitate multiplexing of up to 1,500 samples per lane, and both PCR primers contain sequencer adapter regions.	GT	FWD:GTGCCAGCMGCCGCGGTAA; REV:GGACTACHVGGGTWTCTAAT	Plate8	Illumina	V4	Cornell	2/4/13	TwinsUKPlate8	0.1,gram	Kings College London	sequencing by synthesis	16S rRNA	V4	B9	55	years	0	3891	UBERON:feces	23.11813927	UBERON:feces	UBERON:feces	6/2/11	2011-06-02 00:00:00		GAZ:United Kingdom	2/14/56	0	true	10.4516	ENVO:dense settlement biome	ENVO:human-associated habitat	true	389	human	Homo sapiens	3891	9606	3891	51.5	-0.12	true	Cornell	true	false	King's College, London, UK	Stool	female	4	1002845	TwinsUK gut microbiome	DZ	TwinsUK Fecal Sample
2014.Plate8.2	GTCGGAAATTGT	GTGCCAGCMGCCGCGGTAA	17.452	Cornell	UK_Twins	Cornell	fecal samples from TwinsUK MiSeq runs	TwinsUK Miseq	Nick	MiSeq	This analysis was done as in Caporaso et al 2011 Genome research. The PCR primers F515 and R806 were developed against the V4 region of the 16S rRNA, both bacteria and archaea, which we determined would yield optimal community clustering with reads of this length The reverse PCR primer is barcoded with a 12-base error-correcting Golay code to facilitate multiplexing of up to 1,500 samples per lane, and both PCR primers contain sequencer adapter regions.	GT	FWD:GTGCCAGCMGCCGCGGTAA; REV:GGACTACHVGGGTWTCTAAT	Plate8	Illumina	V4	Cornell	2/4/13	TwinsUKPlate8	0.1,gram	Kings College London	sequencing by synthesis	16S rRNA	V4	A2	75	years	0	8341	UBERON:feces	38.6122818	UBERON:feces	UBERON:feces	5/1/11	2011-05-01 09:00:00	9:00:00	GAZ:United Kingdom	12/5/35	0	true	10.4516	ENVO:dense settlement biome	ENVO:human-associated habitat	true	834	human	Homo sapiens	8341	9606	8341	51.5	-0.12	true	Cornell	true	false	King's College, London, UK	Stool	female	4	1002827	TwinsUK gut microbiome	DZ	TwinsUK Fecal Sample
2014.Plate8.19	CACCTGTAGTAG	GTGCCAGCMGCCGCGGTAA	39.099	Cornell	UK_Twins	Cornell	fecal samples from TwinsUK MiSeq runs	TwinsUK Miseq	Nick	MiSeq	This analysis was done as in Caporaso et al 2011 Genome research. The PCR primers F515 and R806 were developed against the V4 region of the 16S rRNA, both bacteria and archaea, which we determined would yield optimal community clustering with reads of this length The reverse PCR primer is barcoded with a 12-base error-correcting Golay code to facilitate multiplexing of up to 1,500 samples per lane, and both PCR primers contain sequencer adapter regions.	GT	FWD:GTGCCAGCMGCCGCGGTAA; REV:GGACTACHVGGGTWTCTAAT	Plate8	Illumina	V4	Cornell	2/4/13	TwinsUKPlate8	0.1,gram	Kings College London	sequencing by synthesis	16S rRNA	V4	B8	64	years	0	5062	UBERON:feces	35.21332169	UBERON:feces	UBERON:feces	5/28/11	2011-05-28 00:20:00	0:20:00	GAZ:United Kingdom	4/30/47	0	true	10.4516	ENVO:dense settlement biome	ENVO:human-associated habitat	true	506	human	Homo sapiens	5062	9606	5062	51.5	-0.12	true	Cornell	true	false	King's College, London, UK	Stool	female	4	1002848	TwinsUK gut microbiome	DZ	TwinsUK Fecal Sample
2014.Plate8.18	GTAGCACTCATG	GTGCCAGCMGCCGCGGTAA	31.799	Cornell	UK_Twins	Cornell	fecal samples from TwinsUK MiSeq runs	TwinsUK Miseq	Nick	MiSeq	This analysis was done as in Caporaso et al 2011 Genome research. The PCR primers F515 and R806 were developed against the V4 region of the 16S rRNA, both bacteria and archaea, which we determined would yield optimal community clustering with reads of this length The reverse PCR primer is barcoded with a 12-base error-correcting Golay code to facilitate multiplexing of up to 1,500 samples per lane, and both PCR primers contain sequencer adapter regions.	GT	FWD:GTGCCAGCMGCCGCGGTAA; REV:GGACTACHVGGGTWTCTAAT	Plate8	Illumina	V4	Cornell	2/4/13	TwinsUKPlate8	0.1,gram	Kings College London	sequencing by synthesis	16S rRNA	V4	B7	68	years	0	8261	UBERON:feces	27.30334091	UBERON:feces	UBERON:feces	5/4/11	2011-05-04 10:00:00	10:00:00	GAZ:United Kingdom	12/2/42	0	true	10.4516	ENVO:dense settlement biome	ENVO:human-associated habitat	true	826	human	Homo sapiens	8261	9606	8261	51.5	-0.12	true	Cornell	true	false	King's College, London, UK	Stool	female	4	1002842	TwinsUK gut microbiome	MZ	TwinsUK Fecal Sample
2014.Plate8.17	GTCTCCTCCCTT	GTGCCAGCMGCCGCGGTAA	31.745	Cornell	UK_Twins	Cornell	fecal samples from TwinsUK MiSeq runs	TwinsUK Miseq	Nick	MiSeq	This analysis was done as in Caporaso et al 2011 Genome research. The PCR primers F515 and R806 were developed against the V4 region of the 16S rRNA, both bacteria and archaea, which we determined would yield optimal community clustering with reads of this length The reverse PCR primer is barcoded with a 12-base error-correcting Golay code to facilitate multiplexing of up to 1,500 samples per lane, and both PCR primers contain sequencer adapter regions.	GT	FWD:GTGCCAGCMGCCGCGGTAA; REV:GGACTACHVGGGTWTCTAAT	Plate8	Illumina	V4	Cornell	2/4/13	TwinsUKPlate8	0.1,gram	Kings College London	sequencing by synthesis	16S rRNA	V4	B6	55	years	0	4602	UBERON:feces	39.23297119	UBERON:feces	UBERON:feces	5/9/11	2011-05-09 06:15:00	6:15:00	GAZ:United Kingdom	11/6/55	0	true	10.4516	ENVO:dense settlement biome	ENVO:human-associated habitat	true	460	human	Homo sapiens	4602	9606	4602	51.5	-0.12	true	Cornell	true	false	King's College, London, UK	Stool	female	4	1002847	TwinsUK gut microbiome	DZ	TwinsUK Fecal Sample
2014.Plate8.16	ACACCGCACAAT	GTGCCAGCMGCCGCGGTAA	19.85	Cornell	UK_Twins	Cornell	fecal samples from TwinsUK MiSeq runs	TwinsUK Miseq	Nick	MiSeq	This analysis was done as in Caporaso et al 2011 Genome research. The PCR primers F515 and R806 were developed against the V4 region of the 16S rRNA, both bacteria and archaea, which we determined would yield optimal community clustering with reads of this length The reverse PCR primer is barcoded with a 12-base error-correcting Golay code to facilitate multiplexing of up to 1,500 samples per lane, and both PCR primers contain sequencer adapter regions.	GT	FWD:GTGCCAGCMGCCGCGGTAA; REV:GGACTACHVGGGTWTCTAAT	Plate8	Illumina	V4	Cornell	2/4/13	TwinsUKPlate8	0.1,gram	Kings College London	sequencing by synthesis	16S rRNA	V4	B5	58	years	0	7082	UBERON:feces	24.2466507	UBERON:feces	UBERON:feces	5/25/11	2011-05-25 17:45:00	17:45:00	GAZ:United Kingdom	4/13/53	0	true	10.4516	ENVO:dense settlement biome	ENVO:human-associated habitat	true	708	human	Homo sapiens	7082	9606	7082	51.5	-0.12	true	Cornell	true	false	King's College, London, UK	Stool	female	4	1002852	TwinsUK gut microbiome	DZ	TwinsUK Fecal Sample
2014.Plate8.15	ATCGATCCACAG	GTGCCAGCMGCCGCGGTAA	40.044	Cornell	UK_Twins	Cornell	fecal samples from TwinsUK MiSeq runs	TwinsUK Miseq	Nick	MiSeq	This analysis was done as in Caporaso et al 2011 Genome research. The PCR primers F515 and R806 were developed against the V4 region of the 16S rRNA, both bacteria and archaea, which we determined would yield optimal community clustering with reads of this length The reverse PCR primer is barcoded with a 12-base error-correcting Golay code to facilitate multiplexing of up to 1,500 samples per lane, and both PCR primers contain sequencer adapter regions.	GT	FWD:GTGCCAGCMGCCGCGGTAA; REV:GGACTACHVGGGTWTCTAAT	Plate8	Illumina	V4	Cornell	2/4/13	TwinsUKPlate8	0.1,gram	Kings College London	sequencing by synthesis	16S rRNA	V4	B4	47	years	0	3862	UBERON:feces	31.36030006	UBERON:feces	UBERON:feces	5/30/11	2011-05-30 09:00:00	9:00:00	GAZ:United Kingdom	3/28/64	0	true	10.4516	ENVO:dense settlement biome	ENVO:human-associated habitat	true	386	human	Homo sapiens	3862	9606	3862	51.5	-0.12	true	Cornell	true	false	King's College, London, UK	Stool	female	4	1002844	TwinsUK gut microbiome	DZ	TwinsUK Fecal Sample
2014.Plate8.14	GGAAGAAGTAGC	GTGCCAGCMGCCGCGGTAA	38.845	Cornell	UK_Twins	Cornell	fecal samples from TwinsUK MiSeq runs	TwinsUK Miseq	Nick	MiSeq	This analysis was done as in Caporaso et al 2011 Genome research. The PCR primers F515 and R806 were developed against the V4 region of the 16S rRNA, both bacteria and archaea, which we determined would yield optimal community clustering with reads of this length The reverse PCR primer is barcoded with a 12-base error-correcting Golay code to facilitate multiplexing of up to 1,500 samples per lane, and both PCR primers contain sequencer adapter regions.	GT	FWD:GTGCCAGCMGCCGCGGTAA; REV:GGACTACHVGGGTWTCTAAT	Plate8	Illumina	V4	Cornell	2/4/13	TwinsUKPlate8	0.1,gram	Kings College London	sequencing by synthesis	16S rRNA	V4	B3	63	years	0	6121	UBERON:feces	33.99505997	UBERON:feces	UBERON:feces	5/30/11	2011-05-30 11:50:00	11:50:00	GAZ:United Kingdom	1/2/48	0	true	10.4516	ENVO:dense settlement biome	ENVO:human-associated habitat	true	612	human	Homo sapiens	6121	9606	6121	51.5	-0.12	true	Cornell	true	false	King's College, London, UK	Stool	female	4	1002849	TwinsUK gut microbiome	DZ	TwinsUK Fecal Sample
2014.Plate8.11	TGGAGAGGAGAT	GTGCCAGCMGCCGCGGTAA	29.424	Cornell	UK_Twins	Cornell	fecal samples from TwinsUK MiSeq runs	TwinsUK Miseq	Nick	MiSeq	This analysis was done as in Caporaso et al 2011 Genome research. The PCR primers F515 and R806 were developed against the V4 region of the 16S rRNA, both bacteria and archaea, which we determined would yield optimal community clustering with reads of this length The reverse PCR primer is barcoded with a 12-base error-correcting Golay code to facilitate multiplexing of up to 1,500 samples per lane, and both PCR primers contain sequencer adapter regions.	GT	FWD:GTGCCAGCMGCCGCGGTAA; REV:GGACTACHVGGGTWTCTAAT	Plate8	Illumina	V4	Cornell	2/4/13	TwinsUKPlate8	0.1,gram	Kings College London	sequencing by synthesis	16S rRNA	V4	A11	56	years	0	7622	UBERON:feces	23.79191017	UBERON:feces	UBERON:feces	5/31/11	2011-05-31 20:30:00	20:30:00	GAZ:United Kingdom	3/22/55	0	true	10.4516	ENVO:dense settlement biome	ENVO:human-associated habitat	true	762	human	Homo sapiens	7622	9606	7622	51.5	-0.12	true	Cornell	true	false	King's College, London, UK	Stool	female	4	1002855	TwinsUK gut microbiome	DZ	TwinsUK Fecal Sample
2014.Plate8.10	GTAGTGTCAACA	GTGCCAGCMGCCGCGGTAA	34.086	Cornell	UK_Twins	Cornell	fecal samples from TwinsUK MiSeq runs	TwinsUK Miseq	Nick	MiSeq	This analysis was done as in Caporaso et al 2011 Genome research. The PCR primers F515 and R806 were developed against the V4 region of the 16S rRNA, both bacteria and archaea, which we determined would yield optimal community clustering with reads of this length The reverse PCR primer is barcoded with a 12-base error-correcting Golay code to facilitate multiplexing of up to 1,500 samples per lane, and both PCR primers contain sequencer adapter regions.	GT	FWD:GTGCCAGCMGCCGCGGTAA; REV:GGACTACHVGGGTWTCTAAT	Plate8	Illumina	V4	Cornell	2/4/13	TwinsUKPlate8	0.1,gram	Kings College London	sequencing by synthesis	16S rRNA	V4	A10	78	years	0	7321	UBERON:feces	27.77526093	UBERON:feces	UBERON:feces	5/29/11	2011-05-29 07:00:00	7:00:00	GAZ:United Kingdom	2/11/33	0	true	10.4516	ENVO:dense settlement biome	ENVO:human-associated habitat	true	732	human	Homo sapiens	7321	9606	7321	51.5	-0.12	true	Cornell	true	false	King's College, London, UK	Stool	female	4	1002853	TwinsUK gut microbiome	DZ	TwinsUK Fecal Sample
2014.Plate8.1	ACGTAACCACGT	GTGCCAGCMGCCGCGGTAA	27.872	Cornell	UK_Twins	Cornell	fecal samples from TwinsUK MiSeq runs	TwinsUK Miseq	Nick	MiSeq	This analysis was done as in Caporaso et al 2011 Genome research. The PCR primers F515 and R806 were developed against the V4 region of the 16S rRNA, both bacteria and archaea, which we determined would yield optimal community clustering with reads of this length The reverse PCR primer is barcoded with a 12-base error-correcting Golay code to facilitate multiplexing of up to 1,500 samples per lane, and both PCR primers contain sequencer adapter regions.	GT	FWD:GTGCCAGCMGCCGCGGTAA; REV:GGACTACHVGGGTWTCTAAT	Plate8	Illumina	V4	Cornell	2/4/13	TwinsUKPlate8	0.1,gram	Kings College London	sequencing by synthesis	16S rRNA	V4	A1	35	years	0	4081	UBERON:feces		UBERON:feces	UBERON:feces	5/6/11	2011-05-06 00:00:00		GAZ:United Kingdom	8/19/75	0	true	10.4516	ENVO:dense settlement biome	ENVO:human-associated habitat	true	408	human	Homo sapiens	4081	9606	4081	51.5	-0.12	true	Cornell	true	false	King's College, London, UK	Stool	female	4	1002829	TwinsUK gut microbiome	DZ	TwinsUK Fecal Sample
2014.Plate7.93	GTGAGGGCAAGT	GTGCCAGCMGCCGCGGTAA	14.916	Cornell	UK_Twins	Cornell	fecal samples from TwinsUK MiSeq runs	TwinsUK Miseq	Nick	MiSeq	This analysis was done as in Caporaso et al 2011 Genome research. The PCR primers F515 and R806 were developed against the V4 region of the 16S rRNA, both bacteria and archaea, which we determined would yield optimal community clustering with reads of this length The reverse PCR primer is barcoded with a 12-base error-correcting Golay code to facilitate multiplexing of up to 1,500 samples per lane, and both PCR primers contain sequencer adapter regions.	GT	FWD:GTGCCAGCMGCCGCGGTAA; REV:GGACTACHVGGGTWTCTAAT	Plate7	Illumina	V4	Cornell	2/2/13	TwinsUKPlate7	0.1,gram	Kings College London	sequencing by synthesis	16S rRNA	V4	H11	50	years	0	6151	UBERON:feces	31.60321045	UBERON:feces	UBERON:feces	5/5/11	2011-05-05 23:35:00	23:35:00	GAZ:United Kingdom	6/6/60	0	true	10.4516	ENVO:dense settlement biome	ENVO:human-associated habitat	true	615	human	Homo sapiens	6151	9606	6151	51.5	-0.12	true	Cornell	true	false	King's College, London, UK	Stool	female	4	1002837	TwinsUK gut microbiome	DZ	TwinsUK Fecal Sample
2014.Plate7.92	AATCAACTAGGC	GTGCCAGCMGCCGCGGTAA	22.232	Cornell	UK_Twins	Cornell	fecal samples from TwinsUK MiSeq runs	TwinsUK Miseq	Nick	MiSeq	This analysis was done as in Caporaso et al 2011 Genome research. The PCR primers F515 and R806 were developed against the V4 region of the 16S rRNA, both bacteria and archaea, which we determined would yield optimal community clustering with reads of this length The reverse PCR primer is barcoded with a 12-base error-correcting Golay code to facilitate multiplexing of up to 1,500 samples per lane, and both PCR primers contain sequencer adapter regions.	GT	FWD:GTGCCAGCMGCCGCGGTAA; REV:GGACTACHVGGGTWTCTAAT	Plate7	Illumina	V4	Cornell	2/2/13	TwinsUKPlate7	0.1,gram	Kings College London	sequencing by synthesis	16S rRNA	V4	H10	63	years	0	4992	UBERON:feces	27.43117905	UBERON:feces	UBERON:feces	5/3/11	2011-05-03 08:30:00	8:30:00	GAZ:United Kingdom	5/16/47	0	true	10.4516	ENVO:dense settlement biome	ENVO:human-associated habitat	true	499	human	Homo sapiens	4992	9606	4992	51.5	-0.12	true	Cornell	true	false	King's College, London, UK	Stool	female	4	1002833	TwinsUK gut microbiome	DZ	TwinsUK Fecal Sample
2014.Plate7.91	TGTACGGATAAC	GTGCCAGCMGCCGCGGTAA	27.899	Cornell	UK_Twins	Cornell	fecal samples from TwinsUK MiSeq runs	TwinsUK Miseq	Nick	MiSeq	This analysis was done as in Caporaso et al 2011 Genome research. The PCR primers F515 and R806 were developed against the V4 region of the 16S rRNA, both bacteria and archaea, which we determined would yield optimal community clustering with reads of this length The reverse PCR primer is barcoded with a 12-base error-correcting Golay code to facilitate multiplexing of up to 1,500 samples per lane, and both PCR primers contain sequencer adapter regions.	GT	FWD:GTGCCAGCMGCCGCGGTAA; REV:GGACTACHVGGGTWTCTAAT	Plate7	Illumina	V4	Cornell	2/2/13	TwinsUKPlate7	0.1,gram	Kings College London	sequencing by synthesis	16S rRNA	V4	H9	63	years	0	6012	UBERON:feces	26.10655975	UBERON:feces	UBERON:feces	5/1/11	2011-05-01 21:30:00	21:30:00	GAZ:United Kingdom	6/26/47	0	true	10.4516	ENVO:dense settlement biome	ENVO:human-associated habitat	true	601	human	Homo sapiens	6012	9606	6012	51.5	-0.12	true	Cornell	true	false	King's College, London, UK	Stool	female	4	1002836	TwinsUK gut microbiome	DZ	TwinsUK Fecal Sample
2014.Plate7.90	CAATGCCTCACG	GTGCCAGCMGCCGCGGTAA	29.239	Cornell	UK_Twins	Cornell	fecal samples from TwinsUK MiSeq runs	TwinsUK Miseq	Nick	MiSeq	This analysis was done as in Caporaso et al 2011 Genome research. The PCR primers F515 and R806 were developed against the V4 region of the 16S rRNA, both bacteria and archaea, which we determined would yield optimal community clustering with reads of this length The reverse PCR primer is barcoded with a 12-base error-correcting Golay code to facilitate multiplexing of up to 1,500 samples per lane, and both PCR primers contain sequencer adapter regions.	GT	FWD:GTGCCAGCMGCCGCGGTAA; REV:GGACTACHVGGGTWTCTAAT	Plate7	Illumina	V4	Cornell	2/2/13	TwinsUKPlate7	0.1,gram	Kings College London	sequencing by synthesis	16S rRNA	V4	H8	63	years	0	4991	UBERON:feces	24.63784027	UBERON:feces	UBERON:feces	5/4/11	2011-05-04 15:30:00	15:30:00	GAZ:United Kingdom	5/16/47	0	true	10.4516	ENVO:dense settlement biome	ENVO:human-associated habitat	true	499	human	Homo sapiens	4991	9606	4991	51.5	-0.12	true	Cornell	true	false	King's College, London, UK	Stool	female	4	1002832	TwinsUK gut microbiome	DZ	TwinsUK Fecal Sample
2014.Plate7.89	TTACGTGGCGAT	GTGCCAGCMGCCGCGGTAA	26.147	Cornell	UK_Twins	Cornell	fecal samples from TwinsUK MiSeq runs	TwinsUK Miseq	Nick	MiSeq	This analysis was done as in Caporaso et al 2011 Genome research. The PCR primers F515 and R806 were developed against the V4 region of the 16S rRNA, both bacteria and archaea, which we determined would yield optimal community clustering with reads of this length The reverse PCR primer is barcoded with a 12-base error-correcting Golay code to facilitate multiplexing of up to 1,500 samples per lane, and both PCR primers contain sequencer adapter regions.	GT	FWD:GTGCCAGCMGCCGCGGTAA; REV:GGACTACHVGGGTWTCTAAT	Plate7	Illumina	V4	Cornell	2/2/13	TwinsUKPlate7	0.1,gram	Kings College London	sequencing by synthesis	16S rRNA	V4	H7	48	years	0	8001	UBERON:feces	27.00444984	UBERON:feces	UBERON:feces	5/5/11	2011-05-05 06:20:00	6:20:00	GAZ:United Kingdom	10/9/62	0	true	10.4516	ENVO:dense settlement biome	ENVO:human-associated habitat	true	800	human	Homo sapiens	8001	9606	8001	51.5	-0.12	true	Cornell	true	false	King's College, London, UK	Stool	female	4	1002840	TwinsUK gut microbiome	MZ	TwinsUK Fecal Sample
2014.Plate7.88	TGAGTTCGGTCC	GTGCCAGCMGCCGCGGTAA	37.276	Cornell	UK_Twins	Cornell	fecal samples from TwinsUK MiSeq runs	TwinsUK Miseq	Nick	MiSeq	This analysis was done as in Caporaso et al 2011 Genome research. The PCR primers F515 and R806 were developed against the V4 region of the 16S rRNA, both bacteria and archaea, which we determined would yield optimal community clustering with reads of this length The reverse PCR primer is barcoded with a 12-base error-correcting Golay code to facilitate multiplexing of up to 1,500 samples per lane, and both PCR primers contain sequencer adapter regions.	GT	FWD:GTGCCAGCMGCCGCGGTAA; REV:GGACTACHVGGGTWTCTAAT	Plate7	Illumina	V4	Cornell	2/2/13	TwinsUKPlate7	0.1,gram	Kings College London	sequencing by synthesis	16S rRNA	V4	H6	63	years	0	6011	UBERON:feces	33.87120819	UBERON:feces	UBERON:feces	5/1/11	2011-05-01 19:05:00	19:05:00	GAZ:United Kingdom	6/26/47	0	true	10.4516	ENVO:dense settlement biome	ENVO:human-associated habitat	true	601	human	Homo sapiens	6011	9606	6011	51.5	-0.12	true	Cornell	true	false	King's College, London, UK	Stool	female	4	1002835	TwinsUK gut microbiome	DZ	TwinsUK Fecal Sample
2014.Plate7.87	GTCTGTTGAGTG	GTGCCAGCMGCCGCGGTAA	33.669	Cornell	UK_Twins	Cornell	fecal samples from TwinsUK MiSeq runs	TwinsUK Miseq	Nick	MiSeq	This analysis was done as in Caporaso et al 2011 Genome research. The PCR primers F515 and R806 were developed against the V4 region of the 16S rRNA, both bacteria and archaea, which we determined would yield optimal community clustering with reads of this length The reverse PCR primer is barcoded with a 12-base error-correcting Golay code to facilitate multiplexing of up to 1,500 samples per lane, and both PCR primers contain sequencer adapter regions.	GT	FWD:GTGCCAGCMGCCGCGGTAA; REV:GGACTACHVGGGTWTCTAAT	Plate7	Illumina	V4	Cornell	2/2/13	TwinsUKPlate7	0.1,gram	Kings College London	sequencing by synthesis	16S rRNA	V4	H5	63	years	0	5791	UBERON:feces	37.84576035	UBERON:feces	UBERON:feces	5/10/11	2011-05-10 07:25:00	7:25:00	GAZ:United Kingdom	1/30/48	0	true	10.4516	ENVO:dense settlement biome	ENVO:human-associated habitat	true	579	human	Homo sapiens	5791	9606	5791	51.5	-0.12	true	Cornell	true	false	King's College, London, UK	Stool	female	4	1002814	TwinsUK gut microbiome	DZ	TwinsUK Fecal Sample
2014.Plate7.86	AACATGCATGCC	GTGCCAGCMGCCGCGGTAA	29.857	Cornell	UK_Twins	Cornell	fecal samples from TwinsUK MiSeq runs	TwinsUK Miseq	Nick	MiSeq	This analysis was done as in Caporaso et al 2011 Genome research. The PCR primers F515 and R806 were developed against the V4 region of the 16S rRNA, both bacteria and archaea, which we determined would yield optimal community clustering with reads of this length The reverse PCR primer is barcoded with a 12-base error-correcting Golay code to facilitate multiplexing of up to 1,500 samples per lane, and both PCR primers contain sequencer adapter regions.	GT	FWD:GTGCCAGCMGCCGCGGTAA; REV:GGACTACHVGGGTWTCTAAT	Plate7	Illumina	V4	Cornell	2/2/13	TwinsUKPlate7	0.1,gram	Kings College London	sequencing by synthesis	16S rRNA	V4	H4	55	years	0	5952	UBERON:feces	25.45268059	UBERON:feces	UBERON:feces	5/10/11	2011-05-10 11:45:00	11:45:00	GAZ:United Kingdom	4/12/56	0	true	10.4516	ENVO:dense settlement biome	ENVO:human-associated habitat	true	595	human	Homo sapiens	5952	9606	5952	51.5	-0.12	true	Cornell	true	false	King's College, London, UK	Stool	female	4	1002817	TwinsUK gut microbiome	DZ	TwinsUK Fecal Sample
2014.Plate7.84	GAGTCTTGGTAA	GTGCCAGCMGCCGCGGTAA	39.027	Cornell	UK_Twins	Cornell	fecal samples from TwinsUK MiSeq runs	TwinsUK Miseq	Nick	MiSeq	This analysis was done as in Caporaso et al 2011 Genome research. The PCR primers F515 and R806 were developed against the V4 region of the 16S rRNA, both bacteria and archaea, which we determined would yield optimal community clustering with reads of this length The reverse PCR primer is barcoded with a 12-base error-correcting Golay code to facilitate multiplexing of up to 1,500 samples per lane, and both PCR primers contain sequencer adapter regions.	GT	FWD:GTGCCAGCMGCCGCGGTAA; REV:GGACTACHVGGGTWTCTAAT	Plate7	Illumina	V4	Cornell	2/2/13	TwinsUKPlate7	0.1,gram	Kings College London	sequencing by synthesis	16S rRNA	V4	H2	64	years	0	6142	UBERON:feces	24.8691597	UBERON:feces	UBERON:feces	5/6/11	2011-05-06 10:15:00	10:15:00	GAZ:United Kingdom	10/17/46	0	true	10.4516	ENVO:dense settlement biome	ENVO:human-associated habitat	true	614	human	Homo sapiens	6142	9606	6142	51.5	-0.12	true	Cornell	true	false	King's College, London, UK	Stool	female	4	1002819	TwinsUK gut microbiome	DZ	TwinsUK Fecal Sample
2014.Plate7.83	GTGACGTTAGTC	GTGCCAGCMGCCGCGGTAA	18.725	Cornell	UK_Twins	Cornell	fecal samples from TwinsUK MiSeq runs	TwinsUK Miseq	Nick	MiSeq	This analysis was done as in Caporaso et al 2011 Genome research. The PCR primers F515 and R806 were developed against the V4 region of the 16S rRNA, both bacteria and archaea, which we determined would yield optimal community clustering with reads of this length The reverse PCR primer is barcoded with a 12-base error-correcting Golay code to facilitate multiplexing of up to 1,500 samples per lane, and both PCR primers contain sequencer adapter regions.	GT	FWD:GTGCCAGCMGCCGCGGTAA; REV:GGACTACHVGGGTWTCTAAT	Plate7	Illumina	V4	Cornell	2/2/13	TwinsUKPlate7	0.1,gram	Kings College London	sequencing by synthesis	16S rRNA	V4	H1	68	years	0	6211	UBERON:feces	24.67552948	UBERON:feces	UBERON:feces	5/2/11	2011-05-02 07:50:00	7:50:00	GAZ:United Kingdom	7/29/42	0	true	10.4516	ENVO:dense settlement biome	ENVO:human-associated habitat	true	621	human	Homo sapiens	6211	9606	6211	51.5	-0.12	true	Cornell	true	false	King's College, London, UK	Stool	female	4	1002820	TwinsUK gut microbiome	DZ	TwinsUK Fecal Sample
2014.Plate7.82	GACTTATGCCCG	GTGCCAGCMGCCGCGGTAA	26.663	Cornell	UK_Twins	Cornell	fecal samples from TwinsUK MiSeq runs	TwinsUK Miseq	Nick	MiSeq	This analysis was done as in Caporaso et al 2011 Genome research. The PCR primers F515 and R806 were developed against the V4 region of the 16S rRNA, both bacteria and archaea, which we determined would yield optimal community clustering with reads of this length The reverse PCR primer is barcoded with a 12-base error-correcting Golay code to facilitate multiplexing of up to 1,500 samples per lane, and both PCR primers contain sequencer adapter regions.	GT	FWD:GTGCCAGCMGCCGCGGTAA; REV:GGACTACHVGGGTWTCTAAT	Plate7	Illumina	V4	Cornell	2/2/13	TwinsUKPlate7	0.1,gram	Kings College London	sequencing by synthesis	16S rRNA	V4	G12	32	years	0	4542	UBERON:feces	29.29055023	UBERON:feces	UBERON:feces	5/13/11	2011-05-13 08:45:00	8:45:00	GAZ:United Kingdom	11/4/78	0	true	10.4516	ENVO:dense settlement biome	ENVO:human-associated habitat	true	454	human	Homo sapiens	4542	9606	4542	51.5	-0.12	true	Cornell	true	false	King's College, London, UK	Stool	female	4	1002813	TwinsUK gut microbiome	DZ	TwinsUK Fecal Sample
2014.Plate7.80	CGTCGTCTAAGA	GTGCCAGCMGCCGCGGTAA	19.553	Cornell	UK_Twins	Cornell	fecal samples from TwinsUK MiSeq runs	TwinsUK Miseq	Nick	MiSeq	This analysis was done as in Caporaso et al 2011 Genome research. The PCR primers F515 and R806 were developed against the V4 region of the 16S rRNA, both bacteria and archaea, which we determined would yield optimal community clustering with reads of this length The reverse PCR primer is barcoded with a 12-base error-correcting Golay code to facilitate multiplexing of up to 1,500 samples per lane, and both PCR primers contain sequencer adapter regions.	GT	FWD:GTGCCAGCMGCCGCGGTAA; REV:GGACTACHVGGGTWTCTAAT	Plate7	Illumina	V4	Cornell	2/2/13	TwinsUKPlate7	0.1,gram	Kings College London	sequencing by synthesis	16S rRNA	V4	G10	63	years	0	4171	UBERON:feces	31.86841965	UBERON:feces	UBERON:feces	4/28/11	2011-04-28 08:35:00	8:35:00	GAZ:United Kingdom	3/3/48	0	true	10.4516	ENVO:dense settlement biome	ENVO:human-associated habitat	true	417	human	Homo sapiens	4171	9606	4171	51.5	-0.12	true	Cornell	true	false	King's College, London, UK	Stool	female	4	1002811	TwinsUK gut microbiome	MZ	TwinsUK Fecal Sample
2014.Plate7.8	TTCCACACGTGG	GTGCCAGCMGCCGCGGTAA	31.712	Cornell	UK_Twins	Cornell	fecal samples from TwinsUK MiSeq runs	TwinsUK Miseq	Nick	MiSeq	This analysis was done as in Caporaso et al 2011 Genome research. The PCR primers F515 and R806 were developed against the V4 region of the 16S rRNA, both bacteria and archaea, which we determined would yield optimal community clustering with reads of this length The reverse PCR primer is barcoded with a 12-base error-correcting Golay code to facilitate multiplexing of up to 1,500 samples per lane, and both PCR primers contain sequencer adapter regions.	GT	FWD:GTGCCAGCMGCCGCGGTAA; REV:GGACTACHVGGGTWTCTAAT	Plate7	Illumina	V4	Cornell	2/2/13	TwinsUKPlate7	0.1,gram	Kings College London	sequencing by synthesis	16S rRNA	V4	A8	53	years	0	4351	UBERON:feces	28.65813065	UBERON:feces	UBERON:feces	4/8/11	2011-04-08 07:15:00	7:15:00	GAZ:United Kingdom	11/27/57	0	true	10.4516	ENVO:dense settlement biome	ENVO:human-associated habitat	true	435	human	Homo sapiens	4351	9606	4351	51.5	-0.12	true	Cornell	true	false	King's College, London, UK	Stool	female	3	1002708	TwinsUK gut microbiome	MZ	TwinsUK Fecal Sample
2014.Plate7.79	GGTCGTGTCTTG	GTGCCAGCMGCCGCGGTAA	43.87	Cornell	UK_Twins	Cornell	fecal samples from TwinsUK MiSeq runs	TwinsUK Miseq	Nick	MiSeq	This analysis was done as in Caporaso et al 2011 Genome research. The PCR primers F515 and R806 were developed against the V4 region of the 16S rRNA, both bacteria and archaea, which we determined would yield optimal community clustering with reads of this length The reverse PCR primer is barcoded with a 12-base error-correcting Golay code to facilitate multiplexing of up to 1,500 samples per lane, and both PCR primers contain sequencer adapter regions.	GT	FWD:GTGCCAGCMGCCGCGGTAA; REV:GGACTACHVGGGTWTCTAAT	Plate7	Illumina	V4	Cornell	2/2/13	TwinsUKPlate7	0.1,gram	Kings College London	sequencing by synthesis	16S rRNA	V4	G9	61	years	0	6892	UBERON:feces	21.91155052	UBERON:feces	UBERON:feces	5/12/11	2011-05-12 11:00:00	11:00:00	GAZ:United Kingdom	8/29/49	0	true	10.4516	ENVO:dense settlement biome	ENVO:human-associated habitat	true	689	human	Homo sapiens	6892	9606	6892	51.5	-0.12	true	Cornell	true	false	King's College, London, UK	Stool	female	4	1002823	TwinsUK gut microbiome	DZ	TwinsUK Fecal Sample
2014.Plate7.78	GAAACGGAAACG	GTGCCAGCMGCCGCGGTAA	40.161	Cornell	UK_Twins	Cornell	fecal samples from TwinsUK MiSeq runs	TwinsUK Miseq	Nick	MiSeq	This analysis was done as in Caporaso et al 2011 Genome research. The PCR primers F515 and R806 were developed against the V4 region of the 16S rRNA, both bacteria and archaea, which we determined would yield optimal community clustering with reads of this length The reverse PCR primer is barcoded with a 12-base error-correcting Golay code to facilitate multiplexing of up to 1,500 samples per lane, and both PCR primers contain sequencer adapter regions.	GT	FWD:GTGCCAGCMGCCGCGGTAA; REV:GGACTACHVGGGTWTCTAAT	Plate7	Illumina	V4	Cornell	2/2/13	TwinsUKPlate7	0.1,gram	Kings College London	sequencing by synthesis	16S rRNA	V4	G8	55	years	0	5951	UBERON:feces	26.54669952	UBERON:feces	UBERON:feces	5/9/11	2011-05-09 10:00:00	10:00:00	GAZ:United Kingdom	4/12/56	0	true	10.4516	ENVO:dense settlement biome	ENVO:human-associated habitat	true	595	human	Homo sapiens	5951	9606	5951	51.5	-0.12	true	Cornell	true	false	King's College, London, UK	Stool	female	4	1002816	TwinsUK gut microbiome	DZ	TwinsUK Fecal Sample
2014.Plate7.77	CACGTTTATTCC	GTGCCAGCMGCCGCGGTAA	27.796	Cornell	UK_Twins	Cornell	fecal samples from TwinsUK MiSeq runs	TwinsUK Miseq	Nick	MiSeq	This analysis was done as in Caporaso et al 2011 Genome research. The PCR primers F515 and R806 were developed against the V4 region of the 16S rRNA, both bacteria and archaea, which we determined would yield optimal community clustering with reads of this length The reverse PCR primer is barcoded with a 12-base error-correcting Golay code to facilitate multiplexing of up to 1,500 samples per lane, and both PCR primers contain sequencer adapter regions.	GT	FWD:GTGCCAGCMGCCGCGGTAA; REV:GGACTACHVGGGTWTCTAAT	Plate7	Illumina	V4	Cornell	2/2/13	TwinsUKPlate7	0.1,gram	Kings College London	sequencing by synthesis	16S rRNA	V4	G7	39	years	0	7052	UBERON:feces	22.18279076	UBERON:feces	UBERON:feces	5/3/11	2011-05-03 07:40:00	7:40:00	GAZ:United Kingdom	8/17/71	0	true	10.4516	ENVO:dense settlement biome	ENVO:human-associated habitat	true	705	human	Homo sapiens	7052	9606	7052	51.5	-0.12	true	Cornell	true	false	King's College, London, UK	Stool	female	4	1002825	TwinsUK gut microbiome	DZ	TwinsUK Fecal Sample
2014.Plate7.76	TCGGTCCATAGC	GTGCCAGCMGCCGCGGTAA	38.718	Cornell	UK_Twins	Cornell	fecal samples from TwinsUK MiSeq runs	TwinsUK Miseq	Nick	MiSeq	This analysis was done as in Caporaso et al 2011 Genome research. The PCR primers F515 and R806 were developed against the V4 region of the 16S rRNA, both bacteria and archaea, which we determined would yield optimal community clustering with reads of this length The reverse PCR primer is barcoded with a 12-base error-correcting Golay code to facilitate multiplexing of up to 1,500 samples per lane, and both PCR primers contain sequencer adapter regions.	GT	FWD:GTGCCAGCMGCCGCGGTAA; REV:GGACTACHVGGGTWTCTAAT	Plate7	Illumina	V4	Cornell	2/2/13	TwinsUKPlate7	0.1,gram	Kings College London	sequencing by synthesis	16S rRNA	V4	G6	73	years	0	5762	UBERON:feces	27.43799019	UBERON:feces	UBERON:feces	5/8/11	2011-05-08 15:50:00	15:50:00	GAZ:United Kingdom	12/14/37	0	true	10.4516	ENVO:dense settlement biome	ENVO:human-associated habitat	true	576	human	Homo sapiens	5762	9606	5762	51.5	-0.12	true	Cornell	true	false	King's College, London, UK	Stool	female	4	1002795	TwinsUK gut microbiome	DZ	TwinsUK Fecal Sample
2014.Plate7.75	CTTAGCTACTCT	GTGCCAGCMGCCGCGGTAA	31.712	Cornell	UK_Twins	Cornell	fecal samples from TwinsUK MiSeq runs	TwinsUK Miseq	Nick	MiSeq	This analysis was done as in Caporaso et al 2011 Genome research. The PCR primers F515 and R806 were developed against the V4 region of the 16S rRNA, both bacteria and archaea, which we determined would yield optimal community clustering with reads of this length The reverse PCR primer is barcoded with a 12-base error-correcting Golay code to facilitate multiplexing of up to 1,500 samples per lane, and both PCR primers contain sequencer adapter regions.	GT	FWD:GTGCCAGCMGCCGCGGTAA; REV:GGACTACHVGGGTWTCTAAT	Plate7	Illumina	V4	Cornell	2/2/13	TwinsUKPlate7	0.1,gram	Kings College London	sequencing by synthesis	16S rRNA	V4	G5	64	years	0	7291	UBERON:feces	29.78280067	UBERON:feces	UBERON:feces	5/13/11	2011-05-13 09:30:00	9:30:00	GAZ:United Kingdom	5/14/46	0	true	10.4516	ENVO:dense settlement biome	ENVO:human-associated habitat	true	729	human	Homo sapiens	7291	9606	7291	51.5	-0.12	true	Cornell	true	false	King's College, London, UK	Stool	female	4	1002808	TwinsUK gut microbiome	DZ	TwinsUK Fecal Sample
2014.Plate7.74	AGTGATGTGACT	GTGCCAGCMGCCGCGGTAA	35.009	Cornell	UK_Twins	Cornell	fecal samples from TwinsUK MiSeq runs	TwinsUK Miseq	Nick	MiSeq	This analysis was done as in Caporaso et al 2011 Genome research. The PCR primers F515 and R806 were developed against the V4 region of the 16S rRNA, both bacteria and archaea, which we determined would yield optimal community clustering with reads of this length The reverse PCR primer is barcoded with a 12-base error-correcting Golay code to facilitate multiplexing of up to 1,500 samples per lane, and both PCR primers contain sequencer adapter regions.	GT	FWD:GTGCCAGCMGCCGCGGTAA; REV:GGACTACHVGGGTWTCTAAT	Plate7	Illumina	V4	Cornell	2/2/13	TwinsUKPlate7	0.1,gram	Kings College London	sequencing by synthesis	16S rRNA	V4	G4	52	years	0	6292	UBERON:feces	21.47763062	UBERON:feces	UBERON:feces	5/12/11	2011-05-12 09:30:00	9:30:00	GAZ:United Kingdom	5/7/59	0	true	10.4516	ENVO:dense settlement biome	ENVO:human-associated habitat	true	629	human	Homo sapiens	6292	9606	6292	51.5	-0.12	true	Cornell	true	false	King's College, London, UK	Stool	female	4	1002797	TwinsUK gut microbiome	DZ	TwinsUK Fecal Sample
2014.Plate7.73	TCAGACCAACTG	GTGCCAGCMGCCGCGGTAA	40.779	Cornell	UK_Twins	Cornell	fecal samples from TwinsUK MiSeq runs	TwinsUK Miseq	Nick	MiSeq	This analysis was done as in Caporaso et al 2011 Genome research. The PCR primers F515 and R806 were developed against the V4 region of the 16S rRNA, both bacteria and archaea, which we determined would yield optimal community clustering with reads of this length The reverse PCR primer is barcoded with a 12-base error-correcting Golay code to facilitate multiplexing of up to 1,500 samples per lane, and both PCR primers contain sequencer adapter regions.	GT	FWD:GTGCCAGCMGCCGCGGTAA; REV:GGACTACHVGGGTWTCTAAT	Plate7	Illumina	V4	Cornell	2/2/13	TwinsUKPlate7	0.1,gram	Kings College London	sequencing by synthesis	16S rRNA	V4	G3	64	years	0	7292	UBERON:feces	23.49357033	UBERON:feces	UBERON:feces	5/10/11	2011-05-10 16:30:00	16:30:00	GAZ:United Kingdom	5/14/46	0	true	10.4516	ENVO:dense settlement biome	ENVO:human-associated habitat	true	729	human	Homo sapiens	7292	9606	7292	51.5	-0.12	true	Cornell	true	false	King's College, London, UK	Stool	female	4	1002809	TwinsUK gut microbiome	DZ	TwinsUK Fecal Sample
2014.Plate7.72	GACAGAGGTGCA	GTGCCAGCMGCCGCGGTAA	27.59	Cornell	UK_Twins	Cornell	fecal samples from TwinsUK MiSeq runs	TwinsUK Miseq	Nick	MiSeq	This analysis was done as in Caporaso et al 2011 Genome research. The PCR primers F515 and R806 were developed against the V4 region of the 16S rRNA, both bacteria and archaea, which we determined would yield optimal community clustering with reads of this length The reverse PCR primer is barcoded with a 12-base error-correcting Golay code to facilitate multiplexing of up to 1,500 samples per lane, and both PCR primers contain sequencer adapter regions.	GT	FWD:GTGCCAGCMGCCGCGGTAA; REV:GGACTACHVGGGTWTCTAAT	Plate7	Illumina	V4	Cornell	2/2/13	TwinsUKPlate7	0.1,gram	Kings College London	sequencing by synthesis	16S rRNA	V4	G2	61	years	0	6891	UBERON:feces		UBERON:feces	UBERON:feces	5/11/11	2011-05-11 08:00:00	8:00:00	GAZ:United Kingdom	8/29/49	0	true	10.4516	ENVO:dense settlement biome	ENVO:human-associated habitat	true	689	human	Homo sapiens	6891	9606	6891	51.5	-0.12	true	Cornell	true	false	King's College, London, UK	Stool	female	4	1002805	TwinsUK gut microbiome	DZ	TwinsUK Fecal Sample
2014.Plate7.71	CTGGTGCTGAAT	GTGCCAGCMGCCGCGGTAA	32.588	Cornell	UK_Twins	Cornell	fecal samples from TwinsUK MiSeq runs	TwinsUK Miseq	Nick	MiSeq	This analysis was done as in Caporaso et al 2011 Genome research. The PCR primers F515 and R806 were developed against the V4 region of the 16S rRNA, both bacteria and archaea, which we determined would yield optimal community clustering with reads of this length The reverse PCR primer is barcoded with a 12-base error-correcting Golay code to facilitate multiplexing of up to 1,500 samples per lane, and both PCR primers contain sequencer adapter regions.	GT	FWD:GTGCCAGCMGCCGCGGTAA; REV:GGACTACHVGGGTWTCTAAT	Plate7	Illumina	V4	Cornell	2/2/13	TwinsUKPlate7	0.1,gram	Kings College London	sequencing by synthesis	16S rRNA	V4	G1	56	years	0	6441	UBERON:feces	21.83535004	UBERON:feces	UBERON:feces	5/8/11	2011-05-08 11:45:00	11:45:00	GAZ:United Kingdom	8/20/54	0	true	10.4516	ENVO:dense settlement biome	ENVO:human-associated habitat	true	644	human	Homo sapiens	6441	9606	6441	51.5	-0.12	true	Cornell	true	false	King's College, London, UK	Stool	female	4	1002798	TwinsUK gut microbiome	DZ	TwinsUK Fecal Sample
2014.Plate7.70	TGTCAGCTGTCG	GTGCCAGCMGCCGCGGTAA	35.936	Cornell	UK_Twins	Cornell	fecal samples from TwinsUK MiSeq runs	TwinsUK Miseq	Nick	MiSeq	This analysis was done as in Caporaso et al 2011 Genome research. The PCR primers F515 and R806 were developed against the V4 region of the 16S rRNA, both bacteria and archaea, which we determined would yield optimal community clustering with reads of this length The reverse PCR primer is barcoded with a 12-base error-correcting Golay code to facilitate multiplexing of up to 1,500 samples per lane, and both PCR primers contain sequencer adapter regions.	GT	FWD:GTGCCAGCMGCCGCGGTAA; REV:GGACTACHVGGGTWTCTAAT	Plate7	Illumina	V4	Cornell	2/2/13	TwinsUKPlate7	0.1,gram	Kings College London	sequencing by synthesis	16S rRNA	V4	F12	63	years	0	6541	UBERON:feces	24.30462074	UBERON:feces	UBERON:feces	5/9/11	2011-05-09 00:00:00		GAZ:United Kingdom	2/6/48	0	true	10.4516	ENVO:dense settlement biome	ENVO:human-associated habitat	true	654	human	Homo sapiens	6541	9606	6541	51.5	-0.12	true	Cornell	true	false	King's College, London, UK	Stool	female	4	1002802	TwinsUK gut microbiome	DZ	TwinsUK Fecal Sample
2014.Plate7.7	GTTGGTTGGCAT	GTGCCAGCMGCCGCGGTAA	34.597	Cornell	UK_Twins	Cornell	fecal samples from TwinsUK MiSeq runs	TwinsUK Miseq	Nick	MiSeq	This analysis was done as in Caporaso et al 2011 Genome research. The PCR primers F515 and R806 were developed against the V4 region of the 16S rRNA, both bacteria and archaea, which we determined would yield optimal community clustering with reads of this length The reverse PCR primer is barcoded with a 12-base error-correcting Golay code to facilitate multiplexing of up to 1,500 samples per lane, and both PCR primers contain sequencer adapter regions.	GT	FWD:GTGCCAGCMGCCGCGGTAA; REV:GGACTACHVGGGTWTCTAAT	Plate7	Illumina	V4	Cornell	2/2/13	TwinsUKPlate7	0.1,gram	Kings College London	sequencing by synthesis	16S rRNA	V4	A7	71	years	0	5691	UBERON:feces	30.61691093	UBERON:feces	UBERON:feces	4/8/11	2011-04-08 08:00:00	8:00:00	GAZ:United Kingdom	8/6/39	0	true	10.4516	ENVO:dense settlement biome	ENVO:human-associated habitat	true	569	human	Homo sapiens	5691	9606	5691	51.5	-0.12	true	Cornell	true	false	King's College, London, UK	Stool	female	3	1002698	TwinsUK gut microbiome	MZ	TwinsUK Fecal Sample
2014.Plate7.69	GGAACGACGTGA	GTGCCAGCMGCCGCGGTAA	24.396	Cornell	UK_Twins	Cornell	fecal samples from TwinsUK MiSeq runs	TwinsUK Miseq	Nick	MiSeq	This analysis was done as in Caporaso et al 2011 Genome research. The PCR primers F515 and R806 were developed against the V4 region of the 16S rRNA, both bacteria and archaea, which we determined would yield optimal community clustering with reads of this length The reverse PCR primer is barcoded with a 12-base error-correcting Golay code to facilitate multiplexing of up to 1,500 samples per lane, and both PCR primers contain sequencer adapter regions.	GT	FWD:GTGCCAGCMGCCGCGGTAA; REV:GGACTACHVGGGTWTCTAAT	Plate7	Illumina	V4	Cornell	2/2/13	TwinsUKPlate7	0.1,gram	Kings College London	sequencing by synthesis	16S rRNA	V4	F11	75	years	0	6462	UBERON:feces	24.9594593	UBERON:feces	UBERON:feces	5/7/11	2011-05-07 09:00:00	9:00:00	GAZ:United Kingdom	7/3/35	0	true	10.4516	ENVO:dense settlement biome	ENVO:human-associated habitat	true	646	human	Homo sapiens	6462	9606	6462	51.5	-0.12	true	Cornell	true	false	King's College, London, UK	Stool	female	4	1002801	TwinsUK gut microbiome	DZ	TwinsUK Fecal Sample
2014.Plate7.67	CAACTAGACTCG	GTGCCAGCMGCCGCGGTAA	15.431	Cornell	UK_Twins	Cornell	fecal samples from TwinsUK MiSeq runs	TwinsUK Miseq	Nick	MiSeq	This analysis was done as in Caporaso et al 2011 Genome research. The PCR primers F515 and R806 were developed against the V4 region of the 16S rRNA, both bacteria and archaea, which we determined would yield optimal community clustering with reads of this length The reverse PCR primer is barcoded with a 12-base error-correcting Golay code to facilitate multiplexing of up to 1,500 samples per lane, and both PCR primers contain sequencer adapter regions.	GT	FWD:GTGCCAGCMGCCGCGGTAA; REV:GGACTACHVGGGTWTCTAAT	Plate7	Illumina	V4	Cornell	2/2/13	TwinsUKPlate7	0.1,gram	Kings College London	sequencing by synthesis	16S rRNA	V4	F9	58	years	0	7132	UBERON:feces	21.50651932	UBERON:feces	UBERON:feces	4/29/11	2011-04-29 07:20:00	7:20:00	GAZ:United Kingdom	7/30/52	0	true	10.4516	ENVO:dense settlement biome	ENVO:human-associated habitat	true	713	human	Homo sapiens	7132	9606	7132	51.5	-0.12	true	Cornell	true	false	King's College, London, UK	Stool	female	4	1002807	TwinsUK gut microbiome	DZ	TwinsUK Fecal Sample
2014.Plate7.66	GTGCTTGTGTAG	GTGCCAGCMGCCGCGGTAA	48.301	Cornell	UK_Twins	Cornell	fecal samples from TwinsUK MiSeq runs	TwinsUK Miseq	Nick	MiSeq	This analysis was done as in Caporaso et al 2011 Genome research. The PCR primers F515 and R806 were developed against the V4 region of the 16S rRNA, both bacteria and archaea, which we determined would yield optimal community clustering with reads of this length The reverse PCR primer is barcoded with a 12-base error-correcting Golay code to facilitate multiplexing of up to 1,500 samples per lane, and both PCR primers contain sequencer adapter regions.	GT	FWD:GTGCCAGCMGCCGCGGTAA; REV:GGACTACHVGGGTWTCTAAT	Plate7	Illumina	V4	Cornell	2/2/13	TwinsUKPlate7	0.1,gram	Kings College London	sequencing by synthesis	16S rRNA	V4	F8	56	years	0	3912	UBERON:feces	19.30981064	UBERON:feces	UBERON:feces	5/11/11	2011-05-11 08:30:00	8:30:00	GAZ:United Kingdom	9/20/54	0	true	10.4516	ENVO:dense settlement biome	ENVO:human-associated habitat	true	391	human	Homo sapiens	3912	9606	3912	51.5	-0.12	true	Cornell	true	false	King's College, London, UK	Stool	female	4	1002794	TwinsUK gut microbiome	DZ	TwinsUK Fecal Sample
2014.Plate7.65	AACCTCGGATAA	GTGCCAGCMGCCGCGGTAA	25.941	Cornell	UK_Twins	Cornell	fecal samples from TwinsUK MiSeq runs	TwinsUK Miseq	Nick	MiSeq	This analysis was done as in Caporaso et al 2011 Genome research. The PCR primers F515 and R806 were developed against the V4 region of the 16S rRNA, both bacteria and archaea, which we determined would yield optimal community clustering with reads of this length The reverse PCR primer is barcoded with a 12-base error-correcting Golay code to facilitate multiplexing of up to 1,500 samples per lane, and both PCR primers contain sequencer adapter regions.	GT	FWD:GTGCCAGCMGCCGCGGTAA; REV:GGACTACHVGGGTWTCTAAT	Plate7	Illumina	V4	Cornell	2/2/13	TwinsUKPlate7	0.1,gram	Kings College London	sequencing by synthesis	16S rRNA	V4	F7	45	years	0	6752	UBERON:feces	30.34560966	UBERON:feces	UBERON:feces	5/15/11	2011-05-15 08:50:00	8:50:00	GAZ:United Kingdom	6/19/65	0	true	10.4516	ENVO:dense settlement biome	ENVO:human-associated habitat	true	675	human	Homo sapiens	6752	9606	6752	51.5	-0.12	true	Cornell	true	false	King's College, London, UK	Stool	female	4	1002804	TwinsUK gut microbiome	DZ	TwinsUK Fecal Sample
2014.Plate7.64	TGCCGCCGTAAT	GTGCCAGCMGCCGCGGTAA	36.76	Cornell	UK_Twins	Cornell	fecal samples from TwinsUK MiSeq runs	TwinsUK Miseq	Nick	MiSeq	This analysis was done as in Caporaso et al 2011 Genome research. The PCR primers F515 and R806 were developed against the V4 region of the 16S rRNA, both bacteria and archaea, which we determined would yield optimal community clustering with reads of this length The reverse PCR primer is barcoded with a 12-base error-correcting Golay code to facilitate multiplexing of up to 1,500 samples per lane, and both PCR primers contain sequencer adapter regions.	GT	FWD:GTGCCAGCMGCCGCGGTAA; REV:GGACTACHVGGGTWTCTAAT	Plate7	Illumina	V4	Cornell	2/2/13	TwinsUKPlate7	0.1,gram	Kings College London	sequencing by synthesis	16S rRNA	V4	F6	52	years	0	6291	UBERON:feces	28.04450035	UBERON:feces	UBERON:feces	5/9/11	2011-05-09 06:30:00	6:30:00	GAZ:United Kingdom	5/7/59	0	true	10.4516	ENVO:dense settlement biome	ENVO:human-associated habitat	true	629	human	Homo sapiens	6291	9606	6291	51.5	-0.12	true	Cornell	true	false	King's College, London, UK	Stool	female	4	1002796	TwinsUK gut microbiome	DZ	TwinsUK Fecal Sample
2014.Plate7.63	AAGTGAAGCGAG	GTGCCAGCMGCCGCGGTAA	29.857	Cornell	UK_Twins	Cornell	fecal samples from TwinsUK MiSeq runs	TwinsUK Miseq	Nick	MiSeq	This analysis was done as in Caporaso et al 2011 Genome research. The PCR primers F515 and R806 were developed against the V4 region of the 16S rRNA, both bacteria and archaea, which we determined would yield optimal community clustering with reads of this length The reverse PCR primer is barcoded with a 12-base error-correcting Golay code to facilitate multiplexing of up to 1,500 samples per lane, and both PCR primers contain sequencer adapter regions.	GT	FWD:GTGCCAGCMGCCGCGGTAA; REV:GGACTACHVGGGTWTCTAAT	Plate7	Illumina	V4	Cornell	2/2/13	TwinsUKPlate7	0.1,gram	Kings College London	sequencing by synthesis	16S rRNA	V4	F5	77	years	0	8472	UBERON:feces	25.34623909	UBERON:feces	UBERON:feces	3/19/11	2011-03-19 11:00:00	11:00:00	GAZ:United Kingdom	4/26/33	0	true	10.4516	ENVO:dense settlement biome	ENVO:human-associated habitat	true	847	human	Homo sapiens	8472	9606	8472	51.5	-0.12	true	Cornell	true	false	King's College, London, UK	Stool	female	3	1002784	TwinsUK gut microbiome	MZ	TwinsUK Fecal Sample
2014.Plate7.61	TTCCCTTCTCCG	GTGCCAGCMGCCGCGGTAA	30.166	Cornell	UK_Twins	Cornell	fecal samples from TwinsUK MiSeq runs	TwinsUK Miseq	Nick	MiSeq	This analysis was done as in Caporaso et al 2011 Genome research. The PCR primers F515 and R806 were developed against the V4 region of the 16S rRNA, both bacteria and archaea, which we determined would yield optimal community clustering with reads of this length The reverse PCR primer is barcoded with a 12-base error-correcting Golay code to facilitate multiplexing of up to 1,500 samples per lane, and both PCR primers contain sequencer adapter regions.	GT	FWD:GTGCCAGCMGCCGCGGTAA; REV:GGACTACHVGGGTWTCTAAT	Plate7	Illumina	V4	Cornell	2/2/13	TwinsUKPlate7	0.1,gram	Kings College London	sequencing by synthesis	16S rRNA	V4	F3	83	years	0	8382	UBERON:feces	26.66550064	UBERON:feces	UBERON:feces	3/20/11	2011-03-20 10:40:00	10:40:00	GAZ:United Kingdom	10/13/27	0	true	10.4516	ENVO:dense settlement biome	ENVO:human-associated habitat	true	838	human	Homo sapiens	8382	9606	8382	51.5	-0.12	true	Cornell	true	false	King's College, London, UK	Stool	female	3	1002785	TwinsUK gut microbiome	MZ	TwinsUK Fecal Sample
2014.Plate7.60	GTGGCCTACTAC	GTGCCAGCMGCCGCGGTAA	25.735	Cornell	UK_Twins	Cornell	fecal samples from TwinsUK MiSeq runs	TwinsUK Miseq	Nick	MiSeq	This analysis was done as in Caporaso et al 2011 Genome research. The PCR primers F515 and R806 were developed against the V4 region of the 16S rRNA, both bacteria and archaea, which we determined would yield optimal community clustering with reads of this length The reverse PCR primer is barcoded with a 12-base error-correcting Golay code to facilitate multiplexing of up to 1,500 samples per lane, and both PCR primers contain sequencer adapter regions.	GT	FWD:GTGCCAGCMGCCGCGGTAA; REV:GGACTACHVGGGTWTCTAAT	Plate7	Illumina	V4	Cornell	2/2/13	TwinsUKPlate7	0.1,gram	Kings College London	sequencing by synthesis	16S rRNA	V4	F2	77	years	0	4181	UBERON:feces	26.52548027	UBERON:feces	UBERON:feces	3/22/11	2011-03-22 22:15:00	22:15:00	GAZ:United Kingdom	6/8/33	0	true	10.4516	ENVO:dense settlement biome	ENVO:human-associated habitat	true	418	human	Homo sapiens	4181	9606	4181	51.5	-0.12	true	Cornell	true	false	King's College, London, UK	Stool	female	3	1002786	TwinsUK gut microbiome	MZ	TwinsUK Fecal Sample
2014.Plate7.6	ACTCGGCCAACT	GTGCCAGCMGCCGCGGTAA	26.663	Cornell	UK_Twins	Cornell	fecal samples from TwinsUK MiSeq runs	TwinsUK Miseq	Nick	MiSeq	This analysis was done as in Caporaso et al 2011 Genome research. The PCR primers F515 and R806 were developed against the V4 region of the 16S rRNA, both bacteria and archaea, which we determined would yield optimal community clustering with reads of this length The reverse PCR primer is barcoded with a 12-base error-correcting Golay code to facilitate multiplexing of up to 1,500 samples per lane, and both PCR primers contain sequencer adapter regions.	GT	FWD:GTGCCAGCMGCCGCGGTAA; REV:GGACTACHVGGGTWTCTAAT	Plate7	Illumina	V4	Cornell	2/2/13	TwinsUKPlate7	0.1,gram	Kings College London	sequencing by synthesis	16S rRNA	V4	A6	71	years	0	5692	UBERON:feces	29.10423088	UBERON:feces	UBERON:feces	4/9/11	2011-04-09 06:00:00	6:00:00	GAZ:United Kingdom	8/6/39	0	true	10.4516	ENVO:dense settlement biome	ENVO:human-associated habitat	true	569	human	Homo sapiens	5692	9606	5692	51.5	-0.12	true	Cornell	true	false	King's College, London, UK	Stool	female	3	1002699	TwinsUK gut microbiome	MZ	TwinsUK Fecal Sample
2014.Plate7.58	GCCTCGTACTGA	GTGCCAGCMGCCGCGGTAA	35.318	Cornell	UK_Twins	Cornell	fecal samples from TwinsUK MiSeq runs	TwinsUK Miseq	Nick	MiSeq	This analysis was done as in Caporaso et al 2011 Genome research. The PCR primers F515 and R806 were developed against the V4 region of the 16S rRNA, both bacteria and archaea, which we determined would yield optimal community clustering with reads of this length The reverse PCR primer is barcoded with a 12-base error-correcting Golay code to facilitate multiplexing of up to 1,500 samples per lane, and both PCR primers contain sequencer adapter regions.	GT	FWD:GTGCCAGCMGCCGCGGTAA; REV:GGACTACHVGGGTWTCTAAT	Plate7	Illumina	V4	Cornell	2/2/13	TwinsUKPlate7	0.1,gram	Kings College London	sequencing by synthesis	16S rRNA	V4	E12	76	years	0	5821	UBERON:feces	32.01411057	UBERON:feces	UBERON:feces	3/21/11	2011-03-21 07:30:00	7:30:00	GAZ:United Kingdom	11/21/34	0	true	10.4516	ENVO:dense settlement biome	ENVO:human-associated habitat	true	582	human	Homo sapiens	5821	9606	5821	51.5	-0.12	true	Cornell	true	false	King's College, London, UK	Stool	female	3	1002790	TwinsUK gut microbiome	DZ	TwinsUK Fecal Sample
2014.Plate7.57	CGCATACGACCT	GTGCCAGCMGCCGCGGTAA	22.438	Cornell	UK_Twins	Cornell	fecal samples from TwinsUK MiSeq runs	TwinsUK Miseq	Nick	MiSeq	This analysis was done as in Caporaso et al 2011 Genome research. The PCR primers F515 and R806 were developed against the V4 region of the 16S rRNA, both bacteria and archaea, which we determined would yield optimal community clustering with reads of this length The reverse PCR primer is barcoded with a 12-base error-correcting Golay code to facilitate multiplexing of up to 1,500 samples per lane, and both PCR primers contain sequencer adapter regions.	GT	FWD:GTGCCAGCMGCCGCGGTAA; REV:GGACTACHVGGGTWTCTAAT	Plate7	Illumina	V4	Cornell	2/2/13	TwinsUKPlate7	0.1,gram	Kings College London	sequencing by synthesis	16S rRNA	V4	E11	59	years	0	4372	UBERON:feces	28.7551899	UBERON:feces	UBERON:feces	3/16/11	2011-03-16 15:20:00	15:20:00	GAZ:United Kingdom	4/10/51	0	true	10.4516	ENVO:dense settlement biome	ENVO:human-associated habitat	true	437	human	Homo sapiens	4372	9606	4372	51.5	-0.12	true	Cornell	true	false	King's College, London, UK	Stool	female	3	1002789	TwinsUK gut microbiome	MZ	TwinsUK Fecal Sample
2014.Plate7.55	CTCCAGGTCATG	GTGCCAGCMGCCGCGGTAA	21.923	Cornell	UK_Twins	Cornell	fecal samples from TwinsUK MiSeq runs	TwinsUK Miseq	Nick	MiSeq	This analysis was done as in Caporaso et al 2011 Genome research. The PCR primers F515 and R806 were developed against the V4 region of the 16S rRNA, both bacteria and archaea, which we determined would yield optimal community clustering with reads of this length The reverse PCR primer is barcoded with a 12-base error-correcting Golay code to facilitate multiplexing of up to 1,500 samples per lane, and both PCR primers contain sequencer adapter regions.	GT	FWD:GTGCCAGCMGCCGCGGTAA; REV:GGACTACHVGGGTWTCTAAT	Plate7	Illumina	V4	Cornell	2/2/13	TwinsUKPlate7	0.1,gram	Kings College London	sequencing by synthesis	16S rRNA	V4	E9	64	years	0	6061	UBERON:feces		UBERON:feces	UBERON:feces	3/17/11	2011-03-17 07:45:00	7:45:00	GAZ:United Kingdom	6/29/46	0	true	10.4516	ENVO:dense settlement biome	ENVO:human-associated habitat	true	606	human	Homo sapiens	6061	9606	6061	51.5	-0.12	true	Cornell	true	false	King's College, London, UK	Stool	female	3	1002791	TwinsUK gut microbiome	MZ	TwinsUK Fecal Sample
2014.Plate7.54	TTCACCTGTATC	GTGCCAGCMGCCGCGGTAA	27.075	Cornell	UK_Twins	Cornell	fecal samples from TwinsUK MiSeq runs	TwinsUK Miseq	Nick	MiSeq	This analysis was done as in Caporaso et al 2011 Genome research. The PCR primers F515 and R806 were developed against the V4 region of the 16S rRNA, both bacteria and archaea, which we determined would yield optimal community clustering with reads of this length The reverse PCR primer is barcoded with a 12-base error-correcting Golay code to facilitate multiplexing of up to 1,500 samples per lane, and both PCR primers contain sequencer adapter regions.	GT	FWD:GTGCCAGCMGCCGCGGTAA; REV:GGACTACHVGGGTWTCTAAT	Plate7	Illumina	V4	Cornell	2/2/13	TwinsUKPlate7	0.1,gram	Kings College London	sequencing by synthesis	16S rRNA	V4	E8	73	years	0	5532	UBERON:feces	24.69947052	UBERON:feces	UBERON:feces	3/15/11	2011-03-15 18:30:00	18:30:00	GAZ:United Kingdom	3/14/38	0	true	10.4516	ENVO:dense settlement biome	ENVO:human-associated habitat	true	553	human	Homo sapiens	5532	9606	5532	51.5	-0.12	true	Cornell	true	false	King's College, London, UK	Stool	female	3	1002772	TwinsUK gut microbiome	MZ	TwinsUK Fecal Sample
2014.Plate7.53	CCTCGGGTACTA	GTGCCAGCMGCCGCGGTAA	16.565	Cornell	UK_Twins	Cornell	fecal samples from TwinsUK MiSeq runs	TwinsUK Miseq	Nick	MiSeq	This analysis was done as in Caporaso et al 2011 Genome research. The PCR primers F515 and R806 were developed against the V4 region of the 16S rRNA, both bacteria and archaea, which we determined would yield optimal community clustering with reads of this length The reverse PCR primer is barcoded with a 12-base error-correcting Golay code to facilitate multiplexing of up to 1,500 samples per lane, and both PCR primers contain sequencer adapter regions.	GT	FWD:GTGCCAGCMGCCGCGGTAA; REV:GGACTACHVGGGTWTCTAAT	Plate7	Illumina	V4	Cornell	2/2/13	TwinsUKPlate7	0.1,gram	Kings College London	sequencing by synthesis	16S rRNA	V4	E7	62	years	0	7282	UBERON:feces	30.42351913	UBERON:feces	UBERON:feces	3/15/11	2011-03-15 21:30:00	21:30:00	GAZ:United Kingdom	3/1/49	0	true	10.4516	ENVO:dense settlement biome	ENVO:human-associated habitat	true	728	human	Homo sapiens	7282	9606	7282	51.5	-0.12	true	Cornell	true	false	King's College, London, UK	Stool	female	3	1002781	TwinsUK gut microbiome	MZ	TwinsUK Fecal Sample
2014.Plate7.52	TAAACGCGACTC	GTGCCAGCMGCCGCGGTAA	33.978	Cornell	UK_Twins	Cornell	fecal samples from TwinsUK MiSeq runs	TwinsUK Miseq	Nick	MiSeq	This analysis was done as in Caporaso et al 2011 Genome research. The PCR primers F515 and R806 were developed against the V4 region of the 16S rRNA, both bacteria and archaea, which we determined would yield optimal community clustering with reads of this length The reverse PCR primer is barcoded with a 12-base error-correcting Golay code to facilitate multiplexing of up to 1,500 samples per lane, and both PCR primers contain sequencer adapter regions.	GT	FWD:GTGCCAGCMGCCGCGGTAA; REV:GGACTACHVGGGTWTCTAAT	Plate7	Illumina	V4	Cornell	2/2/13	TwinsUKPlate7	0.1,gram	Kings College London	sequencing by synthesis	16S rRNA	V4	E6	73	years	0	5531	UBERON:feces	28.53342056	UBERON:feces	UBERON:feces	3/14/11	2011-03-14 10:00:00	10:00:00	GAZ:United Kingdom	3/14/38	0	true	10.4516	ENVO:dense settlement biome	ENVO:human-associated habitat	true	553	human	Homo sapiens	5531	9606	5531	51.5	-0.12	true	Cornell	true	false	King's College, London, UK	Stool	female	3	1002771	TwinsUK gut microbiome	MZ	TwinsUK Fecal Sample
2014.Plate7.51	ATTCAGATGGCA	GTGCCAGCMGCCGCGGTAA	37.379	Cornell	UK_Twins	Cornell	fecal samples from TwinsUK MiSeq runs	TwinsUK Miseq	Nick	MiSeq	This analysis was done as in Caporaso et al 2011 Genome research. The PCR primers F515 and R806 were developed against the V4 region of the 16S rRNA, both bacteria and archaea, which we determined would yield optimal community clustering with reads of this length The reverse PCR primer is barcoded with a 12-base error-correcting Golay code to facilitate multiplexing of up to 1,500 samples per lane, and both PCR primers contain sequencer adapter regions.	GT	FWD:GTGCCAGCMGCCGCGGTAA; REV:GGACTACHVGGGTWTCTAAT	Plate7	Illumina	V4	Cornell	2/2/13	TwinsUKPlate7	0.1,gram	Kings College London	sequencing by synthesis	16S rRNA	V4	E5	76	years	0	5822	UBERON:feces	22.9487896	UBERON:feces	UBERON:feces	3/22/11	2011-03-22 00:00:00		GAZ:United Kingdom	11/21/34	0	true	10.4516	ENVO:dense settlement biome	ENVO:human-associated habitat	true	582	human	Homo sapiens	5822	9606	5822	51.5	-0.12	true	Cornell	true	false	King's College, London, UK	Stool	female	3	1002774	TwinsUK gut microbiome	DZ	TwinsUK Fecal Sample
2014.Plate7.50	ATTATACGGCGC	GTGCCAGCMGCCGCGGTAA	46.343	Cornell	UK_Twins	Cornell	fecal samples from TwinsUK MiSeq runs	TwinsUK Miseq	Nick	MiSeq	This analysis was done as in Caporaso et al 2011 Genome research. The PCR primers F515 and R806 were developed against the V4 region of the 16S rRNA, both bacteria and archaea, which we determined would yield optimal community clustering with reads of this length The reverse PCR primer is barcoded with a 12-base error-correcting Golay code to facilitate multiplexing of up to 1,500 samples per lane, and both PCR primers contain sequencer adapter regions.	GT	FWD:GTGCCAGCMGCCGCGGTAA; REV:GGACTACHVGGGTWTCTAAT	Plate7	Illumina	V4	Cornell	2/2/13	TwinsUKPlate7	0.1,gram	Kings College London	sequencing by synthesis	16S rRNA	V4	E4	70	years	0	7032	UBERON:feces	25.91415977	UBERON:feces	UBERON:feces	3/16/11	2011-03-16 10:00:00	10:00:00	GAZ:United Kingdom	4/30/40	0	true	10.4516	ENVO:dense settlement biome	ENVO:human-associated habitat	true	703	human	Homo sapiens	7032	9606	7032	51.5	-0.12	true	Cornell	true	false	King's College, London, UK	Stool	female	3	1002779	TwinsUK gut microbiome	MZ	TwinsUK Fecal Sample
2014.Plate7.5	TGTCCGTGGATC	GTGCCAGCMGCCGCGGTAA	31.505	Cornell	UK_Twins	Cornell	fecal samples from TwinsUK MiSeq runs	TwinsUK Miseq	Nick	MiSeq	This analysis was done as in Caporaso et al 2011 Genome research. The PCR primers F515 and R806 were developed against the V4 region of the 16S rRNA, both bacteria and archaea, which we determined would yield optimal community clustering with reads of this length The reverse PCR primer is barcoded with a 12-base error-correcting Golay code to facilitate multiplexing of up to 1,500 samples per lane, and both PCR primers contain sequencer adapter regions.	GT	FWD:GTGCCAGCMGCCGCGGTAA; REV:GGACTACHVGGGTWTCTAAT	Plate7	Illumina	V4	Cornell	2/2/13	TwinsUKPlate7	0.1,gram	Kings College London	sequencing by synthesis	16S rRNA	V4	A5	71	years	0	8422	UBERON:feces	27.76859093	UBERON:feces	UBERON:feces	4/18/11	2011-04-18 15:25:00	15:25:00	GAZ:United Kingdom	7/27/39	0	true	10.4516	ENVO:dense settlement biome	ENVO:human-associated habitat	true	842	human	Homo sapiens	8422	9606	8422	51.5	-0.12	true	Cornell	true	false	King's College, London, UK	Stool	female	3	1002687	TwinsUK gut microbiome	DZ	TwinsUK Fecal Sample
2014.Plate7.45	ATAAAGAGGAGG	GTGCCAGCMGCCGCGGTAA	11.928	Cornell	UK_Twins	Cornell	fecal samples from TwinsUK MiSeq runs	TwinsUK Miseq	Nick	MiSeq	This analysis was done as in Caporaso et al 2011 Genome research. The PCR primers F515 and R806 were developed against the V4 region of the 16S rRNA, both bacteria and archaea, which we determined would yield optimal community clustering with reads of this length The reverse PCR primer is barcoded with a 12-base error-correcting Golay code to facilitate multiplexing of up to 1,500 samples per lane, and both PCR primers contain sequencer adapter regions.	GT	FWD:GTGCCAGCMGCCGCGGTAA; REV:GGACTACHVGGGTWTCTAAT	Plate7	Illumina	V4	Cornell	2/2/13	TwinsUKPlate7	0.1,gram	Kings College London	sequencing by synthesis	16S rRNA	V4	D11	37	years	0	8481	UBERON:feces		UBERON:feces	UBERON:feces	3/21/11	2011-03-21 09:25:00	9:25:00	GAZ:United Kingdom	1/26/74	0	true	10.4516	ENVO:dense settlement biome	ENVO:human-associated habitat	true	848	human	Homo sapiens	8481	9606	8481	51.5	-0.12	true	Cornell	true	false	King's College, London, UK	Stool	female	3	1002768	TwinsUK gut microbiome	DZ	TwinsUK Fecal Sample
2014.Plate7.42	TCCTCACTATCA	GTGCCAGCMGCCGCGGTAA	28.723	Cornell	UK_Twins	Cornell	fecal samples from TwinsUK MiSeq runs	TwinsUK Miseq	Nick	MiSeq	This analysis was done as in Caporaso et al 2011 Genome research. The PCR primers F515 and R806 were developed against the V4 region of the 16S rRNA, both bacteria and archaea, which we determined would yield optimal community clustering with reads of this length The reverse PCR primer is barcoded with a 12-base error-correcting Golay code to facilitate multiplexing of up to 1,500 samples per lane, and both PCR primers contain sequencer adapter regions.	GT	FWD:GTGCCAGCMGCCGCGGTAA; REV:GGACTACHVGGGTWTCTAAT	Plate7	Illumina	V4	Cornell	2/2/13	TwinsUKPlate7	0.1,gram	Kings College London	sequencing by synthesis	16S rRNA	V4	D8	58	years	0	6692	UBERON:feces	23.40623093	UBERON:feces	UBERON:feces	3/4/11	2011-03-04 00:00:00		GAZ:United Kingdom	9/30/52	0	true	10.4516	ENVO:dense settlement biome	ENVO:human-associated habitat	true	669	human	Homo sapiens	6692	9606	6692	51.5	-0.12	true	Cornell	true	false	King's College, London, UK	Stool	female	3	1002764	TwinsUK gut microbiome	DZ	TwinsUK Fecal Sample
2014.Plate7.41	TCCTAGGTCCGA	GTGCCAGCMGCCGCGGTAA	24.19	Cornell	UK_Twins	Cornell	fecal samples from TwinsUK MiSeq runs	TwinsUK Miseq	Nick	MiSeq	This analysis was done as in Caporaso et al 2011 Genome research. The PCR primers F515 and R806 were developed against the V4 region of the 16S rRNA, both bacteria and archaea, which we determined would yield optimal community clustering with reads of this length The reverse PCR primer is barcoded with a 12-base error-correcting Golay code to facilitate multiplexing of up to 1,500 samples per lane, and both PCR primers contain sequencer adapter regions.	GT	FWD:GTGCCAGCMGCCGCGGTAA; REV:GGACTACHVGGGTWTCTAAT	Plate7	Illumina	V4	Cornell	2/2/13	TwinsUKPlate7	0.1,gram	Kings College London	sequencing by synthesis	16S rRNA	V4	D7	64	years	0	5501	UBERON:feces	40.76715088	UBERON:feces	UBERON:feces	2/28/11	2011-02-28 09:00:00	9:00:00	GAZ:United Kingdom	11/24/46	0	true	10.4516	ENVO:dense settlement biome	ENVO:human-associated habitat	true	550	human	Homo sapiens	5501	9606	5501	51.5	-0.12	true	Cornell	true	false	King's College, London, UK	Stool	female	3	1002758	TwinsUK gut microbiome	MZ	TwinsUK Fecal Sample
2014.Plate7.4	CATCTGGGCAAT	GTGCCAGCMGCCGCGGTAA	32.845	Cornell	UK_Twins	Cornell	fecal samples from TwinsUK MiSeq runs	TwinsUK Miseq	Nick	MiSeq	This analysis was done as in Caporaso et al 2011 Genome research. The PCR primers F515 and R806 were developed against the V4 region of the 16S rRNA, both bacteria and archaea, which we determined would yield optimal community clustering with reads of this length The reverse PCR primer is barcoded with a 12-base error-correcting Golay code to facilitate multiplexing of up to 1,500 samples per lane, and both PCR primers contain sequencer adapter regions.	GT	FWD:GTGCCAGCMGCCGCGGTAA; REV:GGACTACHVGGGTWTCTAAT	Plate7	Illumina	V4	Cornell	2/2/13	TwinsUKPlate7	0.1,gram	Kings College London	sequencing by synthesis	16S rRNA	V4	A4	65	years	0	7802	UBERON:feces	24.88746071	UBERON:feces	UBERON:feces	4/6/11	2011-04-06 10:30:00	10:30:00	GAZ:United Kingdom	1/27/46	0	true	10.4516	ENVO:dense settlement biome	ENVO:human-associated habitat	true	780	human	Homo sapiens	7802	9606	7802	51.5	-0.12	true	Cornell	true	false	King's College, London, UK	Stool	female	3	1002702	TwinsUK gut microbiome	MZ	TwinsUK Fecal Sample
2014.Plate7.39	GACCGTCAATAC	GTGCCAGCMGCCGCGGTAA	36.657	Cornell	UK_Twins	Cornell	fecal samples from TwinsUK MiSeq runs	TwinsUK Miseq	Nick	MiSeq	This analysis was done as in Caporaso et al 2011 Genome research. The PCR primers F515 and R806 were developed against the V4 region of the 16S rRNA, both bacteria and archaea, which we determined would yield optimal community clustering with reads of this length The reverse PCR primer is barcoded with a 12-base error-correcting Golay code to facilitate multiplexing of up to 1,500 samples per lane, and both PCR primers contain sequencer adapter regions.	GT	FWD:GTGCCAGCMGCCGCGGTAA; REV:GGACTACHVGGGTWTCTAAT	Plate7	Illumina	V4	Cornell	2/2/13	TwinsUKPlate7	0.1,gram	Kings College London	sequencing by synthesis	16S rRNA	V4	D5	70	years	0	8152	UBERON:feces	23.53614044	UBERON:feces	UBERON:feces	3/3/11	2011-03-03 14:00:00	14:00:00	GAZ:United Kingdom	6/9/40	0	true	10.4516	ENVO:dense settlement biome	ENVO:human-associated habitat	true	815	human	Homo sapiens	8152	9606	8152	51.5	-0.12	true	Cornell	true	false	King's College, London, UK	Stool	female	3	1002752	TwinsUK gut microbiome	MZ	TwinsUK Fecal Sample
2014.Plate7.38	GGAAATCCCATC	GTGCCAGCMGCCGCGGTAA	20.996	Cornell	UK_Twins	Cornell	fecal samples from TwinsUK MiSeq runs	TwinsUK Miseq	Nick	MiSeq	This analysis was done as in Caporaso et al 2011 Genome research. The PCR primers F515 and R806 were developed against the V4 region of the 16S rRNA, both bacteria and archaea, which we determined would yield optimal community clustering with reads of this length The reverse PCR primer is barcoded with a 12-base error-correcting Golay code to facilitate multiplexing of up to 1,500 samples per lane, and both PCR primers contain sequencer adapter regions.	GT	FWD:GTGCCAGCMGCCGCGGTAA; REV:GGACTACHVGGGTWTCTAAT	Plate7	Illumina	V4	Cornell	2/2/13	TwinsUKPlate7	0.1,gram	Kings College London	sequencing by synthesis	16S rRNA	V4	D4	70	years	0	8151	UBERON:feces	28.58680916	UBERON:feces	UBERON:feces	2/28/11	2011-02-28 15:30:00	15:30:00	GAZ:United Kingdom	6/9/40	0	true	10.4516	ENVO:dense settlement biome	ENVO:human-associated habitat	true	815	human	Homo sapiens	8151	9606	8151	51.5	-0.12	true	Cornell	true	false	King's College, London, UK	Stool	female	3	1002751	TwinsUK gut microbiome	MZ	TwinsUK Fecal Sample
2014.Plate7.36	GATCTAATCGAG	GTGCCAGCMGCCGCGGTAA	28.414	Cornell	UK_Twins	Cornell	fecal samples from TwinsUK MiSeq runs	TwinsUK Miseq	Nick	MiSeq	This analysis was done as in Caporaso et al 2011 Genome research. The PCR primers F515 and R806 were developed against the V4 region of the 16S rRNA, both bacteria and archaea, which we determined would yield optimal community clustering with reads of this length The reverse PCR primer is barcoded with a 12-base error-correcting Golay code to facilitate multiplexing of up to 1,500 samples per lane, and both PCR primers contain sequencer adapter regions.	GT	FWD:GTGCCAGCMGCCGCGGTAA; REV:GGACTACHVGGGTWTCTAAT	Plate7	Illumina	V4	Cornell	2/2/13	TwinsUKPlate7	0.1,gram	Kings College London	sequencing by synthesis	16S rRNA	V4	D2	58	years	0	6691	UBERON:feces	20.09724998	UBERON:feces	UBERON:feces	3/3/11	2011-03-03 05:30:00	5:30:00	GAZ:United Kingdom	9/30/52	0	true	10.4516	ENVO:dense settlement biome	ENVO:human-associated habitat	true	669	human	Homo sapiens	6691	9606	6691	51.5	-0.12	true	Cornell	true	false	King's College, London, UK	Stool	female	3	1002763	TwinsUK gut microbiome	DZ	TwinsUK Fecal Sample
2014.Plate7.35	GCATGCATCCCA	GTGCCAGCMGCCGCGGTAA	9.418	Cornell	UK_Twins	Cornell	fecal samples from TwinsUK MiSeq runs	TwinsUK Miseq	Nick	MiSeq	This analysis was done as in Caporaso et al 2011 Genome research. The PCR primers F515 and R806 were developed against the V4 region of the 16S rRNA, both bacteria and archaea, which we determined would yield optimal community clustering with reads of this length The reverse PCR primer is barcoded with a 12-base error-correcting Golay code to facilitate multiplexing of up to 1,500 samples per lane, and both PCR primers contain sequencer adapter regions.	GT	FWD:GTGCCAGCMGCCGCGGTAA; REV:GGACTACHVGGGTWTCTAAT	Plate7	Illumina	V4	Cornell	2/2/13	TwinsUKPlate7	0.1,gram	Kings College London	sequencing by synthesis	16S rRNA	V4	D1	67	years	0	5721	UBERON:feces	29.11541939	UBERON:feces	UBERON:feces	2/27/11	2011-02-27 11:36:00	11:36:00	GAZ:United Kingdom	1/26/44	0	true	10.4516	ENVO:dense settlement biome	ENVO:human-associated habitat	true	572	human	Homo sapiens	5721	9606	5721	51.5	-0.12	true	Cornell	true	false	King's College, London, UK	Stool	female	3	1002760	TwinsUK gut microbiome	DZ	TwinsUK Fecal Sample
2014.Plate7.34	ACTCATCTTCCA	GTGCCAGCMGCCGCGGTAA	25.426	Cornell	UK_Twins	Cornell	fecal samples from TwinsUK MiSeq runs	TwinsUK Miseq	Nick	MiSeq	This analysis was done as in Caporaso et al 2011 Genome research. The PCR primers F515 and R806 were developed against the V4 region of the 16S rRNA, both bacteria and archaea, which we determined would yield optimal community clustering with reads of this length The reverse PCR primer is barcoded with a 12-base error-correcting Golay code to facilitate multiplexing of up to 1,500 samples per lane, and both PCR primers contain sequencer adapter regions.	GT	FWD:GTGCCAGCMGCCGCGGTAA; REV:GGACTACHVGGGTWTCTAAT	Plate7	Illumina	V4	Cornell	2/2/13	TwinsUKPlate7	0.1,gram	Kings College London	sequencing by synthesis	16S rRNA	V4	C11	75	years	0	6812	UBERON:feces	25.08918953	UBERON:feces	UBERON:feces	3/8/11	2011-03-08 15:15:00	15:15:00	GAZ:United Kingdom	1/27/36	0	true	10.4516	ENVO:dense settlement biome	ENVO:human-associated habitat	true	681	human	Homo sapiens	6812	9606	6812	51.5	-0.12	true	Cornell	true	false	King's College, London, UK	Stool	female	3	1002726	TwinsUK gut microbiome	MZ	TwinsUK Fecal Sample
2014.Plate7.33	AAGATCGTACTG	GTGCCAGCMGCCGCGGTAA	29.342	Cornell	UK_Twins	Cornell	fecal samples from TwinsUK MiSeq runs	TwinsUK Miseq	Nick	MiSeq	This analysis was done as in Caporaso et al 2011 Genome research. The PCR primers F515 and R806 were developed against the V4 region of the 16S rRNA, both bacteria and archaea, which we determined would yield optimal community clustering with reads of this length The reverse PCR primer is barcoded with a 12-base error-correcting Golay code to facilitate multiplexing of up to 1,500 samples per lane, and both PCR primers contain sequencer adapter regions.	GT	FWD:GTGCCAGCMGCCGCGGTAA; REV:GGACTACHVGGGTWTCTAAT	Plate7	Illumina	V4	Cornell	2/2/13	TwinsUKPlate7	0.1,gram	Kings College London	sequencing by synthesis	16S rRNA	V4	C10	72	years	0	6972	UBERON:feces	23.11076927	UBERON:feces	UBERON:feces	3/14/11	2011-03-14 21:00:00	21:00:00	GAZ:United Kingdom	1/4/39	0	true	10.4516	ENVO:dense settlement biome	ENVO:human-associated habitat	true	697	human	Homo sapiens	6972	9606	6972	51.5	-0.12	true	Cornell	true	false	King's College, London, UK	Stool	female	3	1002729	TwinsUK gut microbiome	MZ	TwinsUK Fecal Sample
2014.Plate7.31	ATCGGGCTTAAC	GTGCCAGCMGCCGCGGTAA	34.7	Cornell	UK_Twins	Cornell	fecal samples from TwinsUK MiSeq runs	TwinsUK Miseq	Nick	MiSeq	This analysis was done as in Caporaso et al 2011 Genome research. The PCR primers F515 and R806 were developed against the V4 region of the 16S rRNA, both bacteria and archaea, which we determined would yield optimal community clustering with reads of this length The reverse PCR primer is barcoded with a 12-base error-correcting Golay code to facilitate multiplexing of up to 1,500 samples per lane, and both PCR primers contain sequencer adapter regions.	GT	FWD:GTGCCAGCMGCCGCGGTAA; REV:GGACTACHVGGGTWTCTAAT	Plate7	Illumina	V4	Cornell	2/2/13	TwinsUKPlate7	0.1,gram	Kings College London	sequencing by synthesis	16S rRNA	V4	C8	77	years	0	7952	UBERON:feces	20.01634026	UBERON:feces	UBERON:feces	3/10/11	2011-03-10 17:00:00	17:00:00	GAZ:United Kingdom	1/6/34	0	true	10.4516	ENVO:dense settlement biome	ENVO:human-associated habitat	true	795	human	Homo sapiens	7952	9606	7952	51.5	-0.12	true	Cornell	true	false	King's College, London, UK	Stool	female	3	1002734	TwinsUK gut microbiome	DZ	TwinsUK Fecal Sample
2014.Plate7.30	GAAACTCCTAGA	GTGCCAGCMGCCGCGGTAA	29.651	Cornell	UK_Twins	Cornell	fecal samples from TwinsUK MiSeq runs	TwinsUK Miseq	Nick	MiSeq	This analysis was done as in Caporaso et al 2011 Genome research. The PCR primers F515 and R806 were developed against the V4 region of the 16S rRNA, both bacteria and archaea, which we determined would yield optimal community clustering with reads of this length The reverse PCR primer is barcoded with a 12-base error-correcting Golay code to facilitate multiplexing of up to 1,500 samples per lane, and both PCR primers contain sequencer adapter regions.	GT	FWD:GTGCCAGCMGCCGCGGTAA; REV:GGACTACHVGGGTWTCTAAT	Plate7	Illumina	V4	Cornell	2/2/13	TwinsUKPlate7	0.1,gram	Kings College London	sequencing by synthesis	16S rRNA	V4	C7	60	years	0	4761	UBERON:feces	16.15645981	UBERON:feces	UBERON:feces	3/7/11	2011-03-07 07:00:00	7:00:00	GAZ:United Kingdom	2/10/51	0	true	10.4516	ENVO:dense settlement biome	ENVO:human-associated habitat	true	476	human	Homo sapiens	4761	9606	4761	51.5	-0.12	true	Cornell	true	false	King's College, London, UK	Stool	female	3	1002724	TwinsUK gut microbiome	MZ	TwinsUK Fecal Sample
2014.Plate7.3	TCTAACGAGTGC	GTGCCAGCMGCCGCGGTAA	41.5	Cornell	UK_Twins	Cornell	fecal samples from TwinsUK MiSeq runs	TwinsUK Miseq	Nick	MiSeq	This analysis was done as in Caporaso et al 2011 Genome research. The PCR primers F515 and R806 were developed against the V4 region of the 16S rRNA, both bacteria and archaea, which we determined would yield optimal community clustering with reads of this length The reverse PCR primer is barcoded with a 12-base error-correcting Golay code to facilitate multiplexing of up to 1,500 samples per lane, and both PCR primers contain sequencer adapter regions.	GT	FWD:GTGCCAGCMGCCGCGGTAA; REV:GGACTACHVGGGTWTCTAAT	Plate7	Illumina	V4	Cornell	2/2/13	TwinsUKPlate7	0.1,gram	Kings College London	sequencing by synthesis	16S rRNA	V4	A3	70	years	0	8441	UBERON:feces	21.08139992	UBERON:feces	UBERON:feces	4/12/11	2011-04-12 07:25:00	7:25:00	GAZ:United Kingdom	3/9/41	0	true	10.4516	ENVO:dense settlement biome	ENVO:human-associated habitat	true	844	human	Homo sapiens	8441	9606	8441	51.5	-0.12	true	Cornell	true	false	King's College, London, UK	Stool	female	3	1002688	TwinsUK gut microbiome	DZ	TwinsUK Fecal Sample
2014.Plate7.29	GCGTAGAGAGAC	GTGCCAGCMGCCGCGGTAA	32.124	Cornell	UK_Twins	Cornell	fecal samples from TwinsUK MiSeq runs	TwinsUK Miseq	Nick	MiSeq	This analysis was done as in Caporaso et al 2011 Genome research. The PCR primers F515 and R806 were developed against the V4 region of the 16S rRNA, both bacteria and archaea, which we determined would yield optimal community clustering with reads of this length The reverse PCR primer is barcoded with a 12-base error-correcting Golay code to facilitate multiplexing of up to 1,500 samples per lane, and both PCR primers contain sequencer adapter regions.	GT	FWD:GTGCCAGCMGCCGCGGTAA; REV:GGACTACHVGGGTWTCTAAT	Plate7	Illumina	V4	Cornell	2/2/13	TwinsUKPlate7	0.1,gram	Kings College London	sequencing by synthesis	16S rRNA	V4	C6	68	years	0	4201	UBERON:feces	23.1500206	UBERON:feces	UBERON:feces	3/9/11	2011-03-09 08:30:00	8:30:00	GAZ:United Kingdom	9/5/42	0	true	10.4516	ENVO:dense settlement biome	ENVO:human-associated habitat	true	420	human	Homo sapiens	4201	9606	4201	51.5	-0.12	true	Cornell	true	false	King's College, London, UK	Stool	female	3	1002722	TwinsUK gut microbiome	MZ	TwinsUK Fecal Sample
2014.Plate7.28	TCCAGGGCTATA	GTGCCAGCMGCCGCGGTAA	36.348	Cornell	UK_Twins	Cornell	fecal samples from TwinsUK MiSeq runs	TwinsUK Miseq	Nick	MiSeq	This analysis was done as in Caporaso et al 2011 Genome research. The PCR primers F515 and R806 were developed against the V4 region of the 16S rRNA, both bacteria and archaea, which we determined would yield optimal community clustering with reads of this length The reverse PCR primer is barcoded with a 12-base error-correcting Golay code to facilitate multiplexing of up to 1,500 samples per lane, and both PCR primers contain sequencer adapter regions.	GT	FWD:GTGCCAGCMGCCGCGGTAA; REV:GGACTACHVGGGTWTCTAAT	Plate7	Illumina	V4	Cornell	2/2/13	TwinsUKPlate7	0.1,gram	Kings College London	sequencing by synthesis	16S rRNA	V4	C5	65	years	0	6922	UBERON:feces	24.0564003	UBERON:feces	UBERON:feces	3/9/11	2011-03-09 08:20:00	8:20:00	GAZ:United Kingdom	3/27/45	0	true	10.4516	ENVO:dense settlement biome	ENVO:human-associated habitat	true	692	human	Homo sapiens	6922	9606	6922	51.5	-0.12	true	Cornell	true	false	King's College, London, UK	Stool	female	3	1002728	TwinsUK gut microbiome	MZ	TwinsUK Fecal Sample
2014.Plate7.27	TTGGACGTCCAC	GTGCCAGCMGCCGCGGTAA	34.288	Cornell	UK_Twins	Cornell	fecal samples from TwinsUK MiSeq runs	TwinsUK Miseq	Nick	MiSeq	This analysis was done as in Caporaso et al 2011 Genome research. The PCR primers F515 and R806 were developed against the V4 region of the 16S rRNA, both bacteria and archaea, which we determined would yield optimal community clustering with reads of this length The reverse PCR primer is barcoded with a 12-base error-correcting Golay code to facilitate multiplexing of up to 1,500 samples per lane, and both PCR primers contain sequencer adapter regions.	GT	FWD:GTGCCAGCMGCCGCGGTAA; REV:GGACTACHVGGGTWTCTAAT	Plate7	Illumina	V4	Cornell	2/2/13	TwinsUKPlate7	0.1,gram	Kings College London	sequencing by synthesis	16S rRNA	V4	C4	41	years	0	7121	UBERON:feces	23.91581917	UBERON:feces	UBERON:feces	2/6/11	2011-02-06 07:50:00	7:50:00	GAZ:United Kingdom	8/16/69	0	true	10.4516	ENVO:dense settlement biome	ENVO:human-associated habitat	true	712	human	Homo sapiens	7121	9606	7121	51.5	-0.12	true	Cornell	true	false	King's College, London, UK	Stool	female	3	1002731	TwinsUK gut microbiome	DZ	TwinsUK Fecal Sample
2014.Plate7.25	TCACTTGGTGCG	GTGCCAGCMGCCGCGGTAA	24.911	Cornell	UK_Twins	Cornell	fecal samples from TwinsUK MiSeq runs	TwinsUK Miseq	Nick	MiSeq	This analysis was done as in Caporaso et al 2011 Genome research. The PCR primers F515 and R806 were developed against the V4 region of the 16S rRNA, both bacteria and archaea, which we determined would yield optimal community clustering with reads of this length The reverse PCR primer is barcoded with a 12-base error-correcting Golay code to facilitate multiplexing of up to 1,500 samples per lane, and both PCR primers contain sequencer adapter regions.	GT	FWD:GTGCCAGCMGCCGCGGTAA; REV:GGACTACHVGGGTWTCTAAT	Plate7	Illumina	V4	Cornell	2/2/13	TwinsUKPlate7	0.1,gram	Kings College London	sequencing by synthesis	16S rRNA	V4	C2	65	years	0	4071	UBERON:feces	31.37791061	UBERON:feces	UBERON:feces	3/12/11	2011-03-12 07:45:00	7:45:00	GAZ:United Kingdom	4/14/45	0	true	10.4516	ENVO:dense settlement biome	ENVO:human-associated habitat	true	407	human	Homo sapiens	4071	9606	4071	51.5	-0.12	true	Cornell	true	false	King's College, London, UK	Stool	female	3	1002720	TwinsUK gut microbiome	MZ	TwinsUK Fecal Sample
2014.Plate7.24	TCCGCAACCTGA	GTGCCAGCMGCCGCGGTAA	27.353	Cornell	UK_Twins	Cornell	fecal samples from TwinsUK MiSeq runs	TwinsUK Miseq	Nick	MiSeq	This analysis was done as in Caporaso et al 2011 Genome research. The PCR primers F515 and R806 were developed against the V4 region of the 16S rRNA, both bacteria and archaea, which we determined would yield optimal community clustering with reads of this length The reverse PCR primer is barcoded with a 12-base error-correcting Golay code to facilitate multiplexing of up to 1,500 samples per lane, and both PCR primers contain sequencer adapter regions.	GT	FWD:GTGCCAGCMGCCGCGGTAA; REV:GGACTACHVGGGTWTCTAAT	Plate7	Illumina	V4	Cornell	2/2/13	TwinsUKPlate7	0.1,gram	Kings College London	sequencing by synthesis	16S rRNA	V4	C1	53	years	0	4161	UBERON:feces	38.06937027	UBERON:feces	UBERON:feces	3/8/11	2011-03-08 09:30:00	9:30:00	GAZ:United Kingdom	12/26/57	0	true	10.4516	ENVO:dense settlement biome	ENVO:human-associated habitat	true	416	human	Homo sapiens	4161	9606	4161	51.5	-0.12	true	Cornell	true	false	King's College, London, UK	Stool	female	3	1002721	TwinsUK gut microbiome	MZ	TwinsUK Fecal Sample
2014.Plate7.23	AGACAAGCTTCC	GTGCCAGCMGCCGCGGTAA	11.31	Cornell	UK_Twins	Cornell	fecal samples from TwinsUK MiSeq runs	TwinsUK Miseq	Nick	MiSeq	This analysis was done as in Caporaso et al 2011 Genome research. The PCR primers F515 and R806 were developed against the V4 region of the 16S rRNA, both bacteria and archaea, which we determined would yield optimal community clustering with reads of this length The reverse PCR primer is barcoded with a 12-base error-correcting Golay code to facilitate multiplexing of up to 1,500 samples per lane, and both PCR primers contain sequencer adapter regions.	GT	FWD:GTGCCAGCMGCCGCGGTAA; REV:GGACTACHVGGGTWTCTAAT	Plate7	Illumina	V4	Cornell	2/2/13	TwinsUKPlate7	0.1,gram	Kings College London	sequencing by synthesis	16S rRNA	V4	B12	72	years	0	3952	UBERON:feces	35.41405869	UBERON:feces	UBERON:feces	3/9/11	2011-03-09 00:00:00		GAZ:United Kingdom	8/24/38	0	true	10.4516	ENVO:dense settlement biome	ENVO:human-associated habitat	true	395	human	Homo sapiens	3952	9606	3952	51.5	-0.12	true	Cornell	true	false	King's College, London, UK	Stool	female	3	1002719	TwinsUK gut microbiome	DZ	TwinsUK Fecal Sample
2014.Plate7.21	TCTCGATAAGCG	GTGCCAGCMGCCGCGGTAA	22.541	Cornell	UK_Twins	Cornell	fecal samples from TwinsUK MiSeq runs	TwinsUK Miseq	Nick	MiSeq	This analysis was done as in Caporaso et al 2011 Genome research. The PCR primers F515 and R806 were developed against the V4 region of the 16S rRNA, both bacteria and archaea, which we determined would yield optimal community clustering with reads of this length The reverse PCR primer is barcoded with a 12-base error-correcting Golay code to facilitate multiplexing of up to 1,500 samples per lane, and both PCR primers contain sequencer adapter regions.	GT	FWD:GTGCCAGCMGCCGCGGTAA; REV:GGACTACHVGGGTWTCTAAT	Plate7	Illumina	V4	Cornell	2/2/13	TwinsUKPlate7	0.1,gram	Kings College London	sequencing by synthesis	16S rRNA	V4	B10	73	years	0	5831	UBERON:feces	33.66836929	UBERON:feces	UBERON:feces	4/13/11	2011-04-13 07:40:00	7:40:00	GAZ:United Kingdom	6/21/37	0	true	10.4516	ENVO:dense settlement biome	ENVO:human-associated habitat	true	583	human	Homo sapiens	5831	9606	5831	51.5	-0.12	true	Cornell	true	false	King's College, London, UK	Stool	female	3	1002712	TwinsUK gut microbiome	DZ	TwinsUK Fecal Sample
2014.Plate7.20	CACGAGCTACTC	GTGCCAGCMGCCGCGGTAA	29.96	Cornell	UK_Twins	Cornell	fecal samples from TwinsUK MiSeq runs	TwinsUK Miseq	Nick	MiSeq	This analysis was done as in Caporaso et al 2011 Genome research. The PCR primers F515 and R806 were developed against the V4 region of the 16S rRNA, both bacteria and archaea, which we determined would yield optimal community clustering with reads of this length The reverse PCR primer is barcoded with a 12-base error-correcting Golay code to facilitate multiplexing of up to 1,500 samples per lane, and both PCR primers contain sequencer adapter regions.	GT	FWD:GTGCCAGCMGCCGCGGTAA; REV:GGACTACHVGGGTWTCTAAT	Plate7	Illumina	V4	Cornell	2/2/13	TwinsUKPlate7	0.1,gram	Kings College London	sequencing by synthesis	16S rRNA	V4	B9	67	years	0	5932	UBERON:feces	30.1072197	UBERON:feces	UBERON:feces	4/12/11	2011-04-12 21:00:00	21:00:00	GAZ:United Kingdom	2/21/44	0	true	10.4516	ENVO:dense settlement biome	ENVO:human-associated habitat	true	593	human	Homo sapiens	5932	9606	5932	51.5	-0.12	true	Cornell	true	false	King's College, London, UK	Stool	female	3	1002715	TwinsUK gut microbiome	DZ	TwinsUK Fecal Sample
2014.Plate7.2	GTCGGAAATTGT	GTGCCAGCMGCCGCGGTAA	32.845	Cornell	UK_Twins	Cornell	fecal samples from TwinsUK MiSeq runs	TwinsUK Miseq	Nick	MiSeq	This analysis was done as in Caporaso et al 2011 Genome research. The PCR primers F515 and R806 were developed against the V4 region of the 16S rRNA, both bacteria and archaea, which we determined would yield optimal community clustering with reads of this length The reverse PCR primer is barcoded with a 12-base error-correcting Golay code to facilitate multiplexing of up to 1,500 samples per lane, and both PCR primers contain sequencer adapter regions.	GT	FWD:GTGCCAGCMGCCGCGGTAA; REV:GGACTACHVGGGTWTCTAAT	Plate7	Illumina	V4	Cornell	2/2/13	TwinsUKPlate7	0.1,gram	Kings College London	sequencing by synthesis	16S rRNA	V4	A2	67	years	0	4862	UBERON:feces	30.58200073	UBERON:feces	UBERON:feces	4/11/11	2011-04-11 11:20:00	11:20:00	GAZ:United Kingdom	10/8/43	0	true	10.4516	ENVO:dense settlement biome	ENVO:human-associated habitat	true	486	human	Homo sapiens	4862	9606	4862	51.5	-0.12	true	Cornell	true	false	King's College, London, UK	Stool	female	3	1002694	TwinsUK gut microbiome	MZ	TwinsUK Fecal Sample
2014.Plate7.19	CACCTGTAGTAG	GTGCCAGCMGCCGCGGTAA	23.365	Cornell	UK_Twins	Cornell	fecal samples from TwinsUK MiSeq runs	TwinsUK Miseq	Nick	MiSeq	This analysis was done as in Caporaso et al 2011 Genome research. The PCR primers F515 and R806 were developed against the V4 region of the 16S rRNA, both bacteria and archaea, which we determined would yield optimal community clustering with reads of this length The reverse PCR primer is barcoded with a 12-base error-correcting Golay code to facilitate multiplexing of up to 1,500 samples per lane, and both PCR primers contain sequencer adapter regions.	GT	FWD:GTGCCAGCMGCCGCGGTAA; REV:GGACTACHVGGGTWTCTAAT	Plate7	Illumina	V4	Cornell	2/2/13	TwinsUKPlate7	0.1,gram	Kings College London	sequencing by synthesis	16S rRNA	V4	B8	63	years	0	8202	UBERON:feces	29.19371033	UBERON:feces	UBERON:feces	4/13/11	2011-04-13 08:20:00	8:20:00	GAZ:United Kingdom	11/5/47	0	true	10.4516	ENVO:dense settlement biome	ENVO:human-associated habitat	true	820	human	Homo sapiens	8202	9606	8202	51.5	-0.12	true	Cornell	true	false	King's College, London, UK	Stool	female	3	1002705	TwinsUK gut microbiome	MZ	TwinsUK Fecal Sample
2014.Plate7.18	GTAGCACTCATG	GTGCCAGCMGCCGCGGTAA	35.318	Cornell	UK_Twins	Cornell	fecal samples from TwinsUK MiSeq runs	TwinsUK Miseq	Nick	MiSeq	This analysis was done as in Caporaso et al 2011 Genome research. The PCR primers F515 and R806 were developed against the V4 region of the 16S rRNA, both bacteria and archaea, which we determined would yield optimal community clustering with reads of this length The reverse PCR primer is barcoded with a 12-base error-correcting Golay code to facilitate multiplexing of up to 1,500 samples per lane, and both PCR primers contain sequencer adapter regions.	GT	FWD:GTGCCAGCMGCCGCGGTAA; REV:GGACTACHVGGGTWTCTAAT	Plate7	Illumina	V4	Cornell	2/2/13	TwinsUKPlate7	0.1,gram	Kings College London	sequencing by synthesis	16S rRNA	V4	B7	73	years	0	5832	UBERON:feces	30.13187027	UBERON:feces	UBERON:feces	4/13/11	2011-04-13 00:00:00		GAZ:United Kingdom	6/21/37	0	true	10.4516	ENVO:dense settlement biome	ENVO:human-associated habitat	true	583	human	Homo sapiens	5832	9606	5832	51.5	-0.12	true	Cornell	true	false	King's College, London, UK	Stool	female	3	1002713	TwinsUK gut microbiome	DZ	TwinsUK Fecal Sample
2014.Plate7.17	GTCTCCTCCCTT	GTGCCAGCMGCCGCGGTAA	21.099	Cornell	UK_Twins	Cornell	fecal samples from TwinsUK MiSeq runs	TwinsUK Miseq	Nick	MiSeq	This analysis was done as in Caporaso et al 2011 Genome research. The PCR primers F515 and R806 were developed against the V4 region of the 16S rRNA, both bacteria and archaea, which we determined would yield optimal community clustering with reads of this length The reverse PCR primer is barcoded with a 12-base error-correcting Golay code to facilitate multiplexing of up to 1,500 samples per lane, and both PCR primers contain sequencer adapter regions.	GT	FWD:GTGCCAGCMGCCGCGGTAA; REV:GGACTACHVGGGTWTCTAAT	Plate7	Illumina	V4	Cornell	2/2/13	TwinsUKPlate7	0.1,gram	Kings College London	sequencing by synthesis	16S rRNA	V4	B6	70	years	0	8442	UBERON:feces	19.17370033	UBERON:feces	UBERON:feces	4/12/11	2011-04-12 09:00:00	9:00:00	GAZ:United Kingdom	3/10/41	0	true	10.4516	ENVO:dense settlement biome	ENVO:human-associated habitat	true	844	human	Homo sapiens	8442	9606	8442	51.5	-0.12	true	Cornell	true	false	King's College, London, UK	Stool	female	3	1002703	TwinsUK gut microbiome	DZ	TwinsUK Fecal Sample
2014.Plate7.15	ATCGATCCACAG	GTGCCAGCMGCCGCGGTAA	39.13	Cornell	UK_Twins	Cornell	fecal samples from TwinsUK MiSeq runs	TwinsUK Miseq	Nick	MiSeq	This analysis was done as in Caporaso et al 2011 Genome research. The PCR primers F515 and R806 were developed against the V4 region of the 16S rRNA, both bacteria and archaea, which we determined would yield optimal community clustering with reads of this length The reverse PCR primer is barcoded with a 12-base error-correcting Golay code to facilitate multiplexing of up to 1,500 samples per lane, and both PCR primers contain sequencer adapter regions.	GT	FWD:GTGCCAGCMGCCGCGGTAA; REV:GGACTACHVGGGTWTCTAAT	Plate7	Illumina	V4	Cornell	2/2/13	TwinsUKPlate7	0.1,gram	Kings College London	sequencing by synthesis	16S rRNA	V4	B4	60	years	0	5412	UBERON:feces	29.83539009	UBERON:feces	UBERON:feces	4/14/11	2011-04-14 07:30:00	7:30:00	GAZ:United Kingdom	1/8/51	0	true	10.4516	ENVO:dense settlement biome	ENVO:human-associated habitat	true	541	human	Homo sapiens	5412	9606	5412	51.5	-0.12	true	Cornell	true	false	King's College, London, UK	Stool	female	3	1002711	TwinsUK gut microbiome	DZ	TwinsUK Fecal Sample
2014.Plate7.14	GGAAGAAGTAGC	GTGCCAGCMGCCGCGGTAA	37.07	Cornell	UK_Twins	Cornell	fecal samples from TwinsUK MiSeq runs	TwinsUK Miseq	Nick	MiSeq	This analysis was done as in Caporaso et al 2011 Genome research. The PCR primers F515 and R806 were developed against the V4 region of the 16S rRNA, both bacteria and archaea, which we determined would yield optimal community clustering with reads of this length The reverse PCR primer is barcoded with a 12-base error-correcting Golay code to facilitate multiplexing of up to 1,500 samples per lane, and both PCR primers contain sequencer adapter regions.	GT	FWD:GTGCCAGCMGCCGCGGTAA; REV:GGACTACHVGGGTWTCTAAT	Plate7	Illumina	V4	Cornell	2/2/13	TwinsUKPlate7	0.1,gram	Kings College London	sequencing by synthesis	16S rRNA	V4	B3	63	years	0	8201	UBERON:feces	21.09650993	UBERON:feces	UBERON:feces	4/13/11	2011-04-13 12:25:00	12:25:00	GAZ:United Kingdom	11/5/47	0	true	10.4516	ENVO:dense settlement biome	ENVO:human-associated habitat	true	820	human	Homo sapiens	8201	9606	8201	51.5	-0.12	true	Cornell	true	false	King's College, London, UK	Stool	female	3	1002704	TwinsUK gut microbiome	MZ	TwinsUK Fecal Sample
2014.Plate7.13	GACTCAACCAGT	GTGCCAGCMGCCGCGGTAA	24.602	Cornell	UK_Twins	Cornell	fecal samples from TwinsUK MiSeq runs	TwinsUK Miseq	Nick	MiSeq	This analysis was done as in Caporaso et al 2011 Genome research. The PCR primers F515 and R806 were developed against the V4 region of the 16S rRNA, both bacteria and archaea, which we determined would yield optimal community clustering with reads of this length The reverse PCR primer is barcoded with a 12-base error-correcting Golay code to facilitate multiplexing of up to 1,500 samples per lane, and both PCR primers contain sequencer adapter regions.	GT	FWD:GTGCCAGCMGCCGCGGTAA; REV:GGACTACHVGGGTWTCTAAT	Plate7	Illumina	V4	Cornell	2/2/13	TwinsUKPlate7	0.1,gram	Kings College London	sequencing by synthesis	16S rRNA	V4	B2	53	years	0	6362	UBERON:feces	23.86495018	UBERON:feces	UBERON:feces	4/14/11	2011-04-14 07:40:00	7:40:00	GAZ:United Kingdom	8/14/57	0	true	10.4516	ENVO:dense settlement biome	ENVO:human-associated habitat	true	636	human	Homo sapiens	6362	9606	6362	51.5	-0.12	true	Cornell	true	false	King's College, London, UK	Stool	female	3	1002717	TwinsUK gut microbiome	DZ	TwinsUK Fecal Sample
2014.Plate7.12	AATACAGACCTG	GTGCCAGCMGCCGCGGTAA	32.201	Cornell	UK_Twins	Cornell	fecal samples from TwinsUK MiSeq runs	TwinsUK Miseq	Nick	MiSeq	This analysis was done as in Caporaso et al 2011 Genome research. The PCR primers F515 and R806 were developed against the V4 region of the 16S rRNA, both bacteria and archaea, which we determined would yield optimal community clustering with reads of this length The reverse PCR primer is barcoded with a 12-base error-correcting Golay code to facilitate multiplexing of up to 1,500 samples per lane, and both PCR primers contain sequencer adapter regions.	GT	FWD:GTGCCAGCMGCCGCGGTAA; REV:GGACTACHVGGGTWTCTAAT	Plate7	Illumina	V4	Cornell	2/2/13	TwinsUKPlate7	0.1,gram	Kings College London	sequencing by synthesis	16S rRNA	V4	B1	65	years	0	7801	UBERON:feces	27.76709938	UBERON:feces	UBERON:feces	4/6/11	2011-04-06 22:30:00	22:30:00	GAZ:United Kingdom	1/27/46	0	true	10.4516	ENVO:dense settlement biome	ENVO:human-associated habitat	true	780	human	Homo sapiens	7801	9606	7801	51.5	-0.12	true	Cornell	true	false	King's College, London, UK	Stool	female	3	1002718	TwinsUK gut microbiome	MZ	TwinsUK Fecal Sample
2014.Plate7.11	TGGAGAGGAGAT	GTGCCAGCMGCCGCGGTAA	29.239	Cornell	UK_Twins	Cornell	fecal samples from TwinsUK MiSeq runs	TwinsUK Miseq	Nick	MiSeq	This analysis was done as in Caporaso et al 2011 Genome research. The PCR primers F515 and R806 were developed against the V4 region of the 16S rRNA, both bacteria and archaea, which we determined would yield optimal community clustering with reads of this length The reverse PCR primer is barcoded with a 12-base error-correcting Golay code to facilitate multiplexing of up to 1,500 samples per lane, and both PCR primers contain sequencer adapter regions.	GT	FWD:GTGCCAGCMGCCGCGGTAA; REV:GGACTACHVGGGTWTCTAAT	Plate7	Illumina	V4	Cornell	2/2/13	TwinsUKPlate7	0.1,gram	Kings College London	sequencing by synthesis	16S rRNA	V4	A11	53	years	0	6361	UBERON:feces	23.85306931	UBERON:feces	UBERON:feces	4/9/11	2011-04-09 20:30:00	20:30:00	GAZ:United Kingdom	8/14/57	0	true	10.4516	ENVO:dense settlement biome	ENVO:human-associated habitat	true	636	human	Homo sapiens	6361	9606	6361	51.5	-0.12	true	Cornell	true	false	King's College, London, UK	Stool	female	3	1002716	TwinsUK gut microbiome	DZ	TwinsUK Fecal Sample
2014.Plate7.10	GTAGTGTCAACA	GTGCCAGCMGCCGCGGTAA	15.431	Cornell	UK_Twins	Cornell	fecal samples from TwinsUK MiSeq runs	TwinsUK Miseq	Nick	MiSeq	This analysis was done as in Caporaso et al 2011 Genome research. The PCR primers F515 and R806 were developed against the V4 region of the 16S rRNA, both bacteria and archaea, which we determined would yield optimal community clustering with reads of this length The reverse PCR primer is barcoded with a 12-base error-correcting Golay code to facilitate multiplexing of up to 1,500 samples per lane, and both PCR primers contain sequencer adapter regions.	GT	FWD:GTGCCAGCMGCCGCGGTAA; REV:GGACTACHVGGGTWTCTAAT	Plate7	Illumina	V4	Cornell	2/2/13	TwinsUKPlate7	0.1,gram	Kings College London	sequencing by synthesis	16S rRNA	V4	A10	57	years	0	4271	UBERON:feces	23.59023094	UBERON:feces	UBERON:feces	4/6/11	2011-04-06 10:15:00	10:15:00	GAZ:United Kingdom	8/4/53	0	true	10.4516	ENVO:dense settlement biome	ENVO:human-associated habitat	true	427	human	Homo sapiens	4271	9606	4271	51.5	-0.12	true	Cornell	true	false	King's College, London, UK	Stool	female	3	1002706	TwinsUK gut microbiome	DZ	TwinsUK Fecal Sample
2014.Plate7.1	ACGTAACCACGT	GTGCCAGCMGCCGCGGTAA	33.655	Cornell	UK_Twins	Cornell	fecal samples from TwinsUK MiSeq runs	TwinsUK Miseq	Nick	MiSeq	This analysis was done as in Caporaso et al 2011 Genome research. The PCR primers F515 and R806 were developed against the V4 region of the 16S rRNA, both bacteria and archaea, which we determined would yield optimal community clustering with reads of this length The reverse PCR primer is barcoded with a 12-base error-correcting Golay code to facilitate multiplexing of up to 1,500 samples per lane, and both PCR primers contain sequencer adapter regions.	GT	FWD:GTGCCAGCMGCCGCGGTAA; REV:GGACTACHVGGGTWTCTAAT	Plate7	Illumina	V4	Cornell	2/2/13	TwinsUKPlate7	0.1,gram	Kings College London	sequencing by synthesis	16S rRNA	V4	A1	59	years	0	5001	UBERON:feces	21.96511078	UBERON:feces	UBERON:feces	4/19/11	2011-04-19 09:00:00	9:00:00	GAZ:United Kingdom	3/30/52	0	true	10.4516	ENVO:dense settlement biome	ENVO:human-associated habitat	true	500	human	Homo sapiens	5001	9606	5001	51.5	-0.12	true	Cornell	true	false	King's College, London, UK	Stool	female	3	1002695	TwinsUK gut microbiome	DZ	TwinsUK Fecal Sample
2014.Plate6.93	GTGAGGGCAAGT	GTGCCAGCMGCCGCGGTAA	18.996	Cornell	UK_Twins	Cornell	fecal samples from TwinsUK MiSeq runs	TwinsUK Miseq	Nick	MiSeq	This analysis was done as in Caporaso et al 2011 Genome research. The PCR primers F515 and R806 were developed against the V4 region of the 16S rRNA, both bacteria and archaea, which we determined would yield optimal community clustering with reads of this length The reverse PCR primer is barcoded with a 12-base error-correcting Golay code to facilitate multiplexing of up to 1,500 samples per lane, and both PCR primers contain sequencer adapter regions.	GT	FWD:GTGCCAGCMGCCGCGGTAA; REV:GGACTACHVGGGTWTCTAAT	Plate6	Illumina	V4	Cornell	1/31/13	TwinsUKPlate6	0.1,gram	Kings College London	sequencing by synthesis	16S rRNA	V4	H11	44	years	0	7302	UBERON:feces	23.0945797	UBERON:feces	UBERON:feces	4/13/11	2011-04-13 07:30:00	7:30:00	GAZ:United Kingdom	12/6/66	0	true	10.4516	ENVO:dense settlement biome	ENVO:human-associated habitat	true	730	human	Homo sapiens	7302	9606	7302	51.5	-0.12	true	Cornell	true	false	King's College, London, UK	Stool	female	3	1002701	TwinsUK gut microbiome	MZ	TwinsUK Fecal Sample
2014.Plate6.92	AATCAACTAGGC	GTGCCAGCMGCCGCGGTAA	16.001	Cornell	UK_Twins	Cornell	fecal samples from TwinsUK MiSeq runs	TwinsUK Miseq	Nick	MiSeq	This analysis was done as in Caporaso et al 2011 Genome research. The PCR primers F515 and R806 were developed against the V4 region of the 16S rRNA, both bacteria and archaea, which we determined would yield optimal community clustering with reads of this length The reverse PCR primer is barcoded with a 12-base error-correcting Golay code to facilitate multiplexing of up to 1,500 samples per lane, and both PCR primers contain sequencer adapter regions.	GT	FWD:GTGCCAGCMGCCGCGGTAA; REV:GGACTACHVGGGTWTCTAAT	Plate6	Illumina	V4	Cornell	1/31/13	TwinsUKPlate6	0.1,gram	Kings College London	sequencing by synthesis	16S rRNA	V4	H10	44	years	0	7301	UBERON:feces	23.23061943	UBERON:feces	UBERON:feces	4/12/11	2011-04-12 08:30:00	8:30:00	GAZ:United Kingdom	12/6/66	0	true	10.4516	ENVO:dense settlement biome	ENVO:human-associated habitat	true	730	human	Homo sapiens	7301	9606	7301	51.5	-0.12	true	Cornell	true	false	King's College, London, UK	Stool	female	3	1002700	TwinsUK gut microbiome	MZ	TwinsUK Fecal Sample
2014.Plate6.90	CAATGCCTCACG	GTGCCAGCMGCCGCGGTAA	27.875	Cornell	UK_Twins	Cornell	fecal samples from TwinsUK MiSeq runs	TwinsUK Miseq	Nick	MiSeq	This analysis was done as in Caporaso et al 2011 Genome research. The PCR primers F515 and R806 were developed against the V4 region of the 16S rRNA, both bacteria and archaea, which we determined would yield optimal community clustering with reads of this length The reverse PCR primer is barcoded with a 12-base error-correcting Golay code to facilitate multiplexing of up to 1,500 samples per lane, and both PCR primers contain sequencer adapter regions.	GT	FWD:GTGCCAGCMGCCGCGGTAA; REV:GGACTACHVGGGTWTCTAAT	Plate6	Illumina	V4	Cornell	1/31/13	TwinsUKPlate6	0.1,gram	Kings College London	sequencing by synthesis	16S rRNA	V4	H8	58	years	0	5601	UBERON:feces	25.05480957	UBERON:feces	UBERON:feces	4/15/11	2011-04-15 00:00:00		GAZ:United Kingdom	10/29/52	0	true	10.4516	ENVO:dense settlement biome	ENVO:human-associated habitat	true	560	human	Homo sapiens	5601	9606	5601	51.5	-0.12	true	Cornell	true	false	King's College, London, UK	Stool	female	3	1002697	TwinsUK gut microbiome	DZ	TwinsUK Fecal Sample
2014.Plate6.9	AACCCAGATGAT	GTGCCAGCMGCCGCGGTAA	33.348	Cornell	UK_Twins	Cornell	fecal samples from TwinsUK MiSeq runs	TwinsUK Miseq	Nick	MiSeq	This analysis was done as in Caporaso et al 2011 Genome research. The PCR primers F515 and R806 were developed against the V4 region of the 16S rRNA, both bacteria and archaea, which we determined would yield optimal community clustering with reads of this length The reverse PCR primer is barcoded with a 12-base error-correcting Golay code to facilitate multiplexing of up to 1,500 samples per lane, and both PCR primers contain sequencer adapter regions.	GT	FWD:GTGCCAGCMGCCGCGGTAA; REV:GGACTACHVGGGTWTCTAAT	Plate6	Illumina	V4	Cornell	1/31/13	TwinsUKPlate6	0.1,gram	Kings College London	sequencing by synthesis	16S rRNA	V4	A9	63	years	0	8242	UBERON:feces	24.77319908	UBERON:feces	UBERON:feces	1/18/11	2011-01-18 07:40:00	7:40:00	GAZ:United Kingdom	6/21/47	0	true	10.4516	ENVO:dense settlement biome	ENVO:human-associated habitat	true	824	human	Homo sapiens	8242	9606	8242	51.5	-0.12	true	Cornell	true	false	King's College, London, UK	Stool	female	2	1002473	TwinsUK gut microbiome	DZ	TwinsUK Fecal Sample
2014.Plate6.89	TTACGTGGCGAT	GTGCCAGCMGCCGCGGTAA	39.646	Cornell	UK_Twins	Cornell	fecal samples from TwinsUK MiSeq runs	TwinsUK Miseq	Nick	MiSeq	This analysis was done as in Caporaso et al 2011 Genome research. The PCR primers F515 and R806 were developed against the V4 region of the 16S rRNA, both bacteria and archaea, which we determined would yield optimal community clustering with reads of this length The reverse PCR primer is barcoded with a 12-base error-correcting Golay code to facilitate multiplexing of up to 1,500 samples per lane, and both PCR primers contain sequencer adapter regions.	GT	FWD:GTGCCAGCMGCCGCGGTAA; REV:GGACTACHVGGGTWTCTAAT	Plate6	Illumina	V4	Cornell	1/31/13	TwinsUKPlate6	0.1,gram	Kings College London	sequencing by synthesis	16S rRNA	V4	H7	41	years	0	4471	UBERON:feces	25.61000061	UBERON:feces	UBERON:feces	4/20/11	2011-04-20 10:45:00	10:45:00	GAZ:United Kingdom	4/3/70	0	true	10.4516	ENVO:dense settlement biome	ENVO:human-associated habitat	true	447	human	Homo sapiens	4471	9606	4471	51.5	-0.12	true	Cornell	true	false	King's College, London, UK	Stool	female	3	1002690	TwinsUK gut microbiome	DZ	TwinsUK Fecal Sample
2014.Plate6.88	TGAGTTCGGTCC	GTGCCAGCMGCCGCGGTAA	27.256	Cornell	UK_Twins	Cornell	fecal samples from TwinsUK MiSeq runs	TwinsUK Miseq	Nick	MiSeq	This analysis was done as in Caporaso et al 2011 Genome research. The PCR primers F515 and R806 were developed against the V4 region of the 16S rRNA, both bacteria and archaea, which we determined would yield optimal community clustering with reads of this length The reverse PCR primer is barcoded with a 12-base error-correcting Golay code to facilitate multiplexing of up to 1,500 samples per lane, and both PCR primers contain sequencer adapter regions.	GT	FWD:GTGCCAGCMGCCGCGGTAA; REV:GGACTACHVGGGTWTCTAAT	Plate6	Illumina	V4	Cornell	1/31/13	TwinsUKPlate6	0.1,gram	Kings College London	sequencing by synthesis	16S rRNA	V4	H6	43	years	0	8302	UBERON:feces	25.84026909	UBERON:feces	UBERON:feces	4/18/11	2011-04-18 07:45:00	7:45:00	GAZ:United Kingdom	8/8/67	0	true	10.4516	ENVO:dense settlement biome	ENVO:human-associated habitat	true	830	human	Homo sapiens	8302	9606	8302	51.5	-0.12	true	Cornell	true	false	King's College, London, UK	Stool	female	3	1002689	TwinsUK gut microbiome	DZ	TwinsUK Fecal Sample
2014.Plate6.87	GTCTGTTGAGTG	GTGCCAGCMGCCGCGGTAA	31.695	Cornell	UK_Twins	Cornell	fecal samples from TwinsUK MiSeq runs	TwinsUK Miseq	Nick	MiSeq	This analysis was done as in Caporaso et al 2011 Genome research. The PCR primers F515 and R806 were developed against the V4 region of the 16S rRNA, both bacteria and archaea, which we determined would yield optimal community clustering with reads of this length The reverse PCR primer is barcoded with a 12-base error-correcting Golay code to facilitate multiplexing of up to 1,500 samples per lane, and both PCR primers contain sequencer adapter regions.	GT	FWD:GTGCCAGCMGCCGCGGTAA; REV:GGACTACHVGGGTWTCTAAT	Plate6	Illumina	V4	Cornell	1/31/13	TwinsUKPlate6	0.1,gram	Kings College London	sequencing by synthesis	16S rRNA	V4	H5	67	years	0	4861	UBERON:feces	27.01634026	UBERON:feces	UBERON:feces	4/12/11	2011-04-12 09:05:00	9:05:00	GAZ:United Kingdom	10/8/43	0	true	10.4516	ENVO:dense settlement biome	ENVO:human-associated habitat	true	486	human	Homo sapiens	4861	9606	4861	51.5	-0.12	true	Cornell	true	false	King's College, London, UK	Stool	female	3	1002693	TwinsUK gut microbiome	MZ	TwinsUK Fecal Sample
2014.Plate6.81	CAAGCGTTGTCC	GTGCCAGCMGCCGCGGTAA	35.619	Cornell	UK_Twins	Cornell	fecal samples from TwinsUK MiSeq runs	TwinsUK Miseq	Nick	MiSeq	This analysis was done as in Caporaso et al 2011 Genome research. The PCR primers F515 and R806 were developed against the V4 region of the 16S rRNA, both bacteria and archaea, which we determined would yield optimal community clustering with reads of this length The reverse PCR primer is barcoded with a 12-base error-correcting Golay code to facilitate multiplexing of up to 1,500 samples per lane, and both PCR primers contain sequencer adapter regions.	GT	FWD:GTGCCAGCMGCCGCGGTAA; REV:GGACTACHVGGGTWTCTAAT	Plate6	Illumina	V4	Cornell	1/31/13	TwinsUKPlate6	0.1,gram	Kings College London	sequencing by synthesis	16S rRNA	V4	G11	60	years	0	5802	UBERON:feces	20.58883095	UBERON:feces	UBERON:feces	3/29/11	2011-03-29 07:50:00	7:50:00	GAZ:United Kingdom	3/18/51	0	true	10.4516	ENVO:dense settlement biome	ENVO:human-associated habitat	true	580	human	Homo sapiens	5802	9606	5802	51.5	-0.12	true	Cornell	true	false	King's College, London, UK	Stool	female	3	1002665	TwinsUK gut microbiome	DZ	TwinsUK Fecal Sample
2014.Plate6.80	CGTCGTCTAAGA	GTGCCAGCMGCCGCGGTAA	33.244	Cornell	UK_Twins	Cornell	fecal samples from TwinsUK MiSeq runs	TwinsUK Miseq	Nick	MiSeq	This analysis was done as in Caporaso et al 2011 Genome research. The PCR primers F515 and R806 were developed against the V4 region of the 16S rRNA, both bacteria and archaea, which we determined would yield optimal community clustering with reads of this length The reverse PCR primer is barcoded with a 12-base error-correcting Golay code to facilitate multiplexing of up to 1,500 samples per lane, and both PCR primers contain sequencer adapter regions.	GT	FWD:GTGCCAGCMGCCGCGGTAA; REV:GGACTACHVGGGTWTCTAAT	Plate6	Illumina	V4	Cornell	1/31/13	TwinsUKPlate6	0.1,gram	Kings College London	sequencing by synthesis	16S rRNA	V4	G10	68	years	0	8062	UBERON:feces	26.57202911	UBERON:feces	UBERON:feces	4/4/11	2011-04-04 17:00:00	17:00:00	GAZ:United Kingdom	2/27/43	0	true	10.4516	ENVO:dense settlement biome	ENVO:human-associated habitat	true	806	human	Homo sapiens	8062	9606	8062	51.5	-0.12	true	Cornell	true	false	King's College, London, UK	Stool	female	3	1002670	TwinsUK gut microbiome	MZ	TwinsUK Fecal Sample
2014.Plate6.8	TTCCACACGTGG	GTGCCAGCMGCCGCGGTAA	34.793	Cornell	UK_Twins	Cornell	fecal samples from TwinsUK MiSeq runs	TwinsUK Miseq	Nick	MiSeq	This analysis was done as in Caporaso et al 2011 Genome research. The PCR primers F515 and R806 were developed against the V4 region of the 16S rRNA, both bacteria and archaea, which we determined would yield optimal community clustering with reads of this length The reverse PCR primer is barcoded with a 12-base error-correcting Golay code to facilitate multiplexing of up to 1,500 samples per lane, and both PCR primers contain sequencer adapter regions.	GT	FWD:GTGCCAGCMGCCGCGGTAA; REV:GGACTACHVGGGTWTCTAAT	Plate6	Illumina	V4	Cornell	1/31/13	TwinsUKPlate6	0.1,gram	Kings College London	sequencing by synthesis	16S rRNA	V4	A8	47	years	0	4462	UBERON:feces	24.4059906	UBERON:feces	UBERON:feces	2/6/11	2011-02-06 19:35:00	19:35:00	GAZ:United Kingdom	6/18/63	0	true	10.4516	ENVO:dense settlement biome	ENVO:human-associated habitat	true	446	human	Homo sapiens	4462	9606	4462	51.5	-0.12	true	Cornell	true	false	King's College, London, UK	Stool	female	2	1002548	TwinsUK gut microbiome	DZ	TwinsUK Fecal Sample
2014.Plate6.79	GGTCGTGTCTTG	GTGCCAGCMGCCGCGGTAA	42.95	Cornell	UK_Twins	Cornell	fecal samples from TwinsUK MiSeq runs	TwinsUK Miseq	Nick	MiSeq	This analysis was done as in Caporaso et al 2011 Genome research. The PCR primers F515 and R806 were developed against the V4 region of the 16S rRNA, both bacteria and archaea, which we determined would yield optimal community clustering with reads of this length The reverse PCR primer is barcoded with a 12-base error-correcting Golay code to facilitate multiplexing of up to 1,500 samples per lane, and both PCR primers contain sequencer adapter regions.	GT	FWD:GTGCCAGCMGCCGCGGTAA; REV:GGACTACHVGGGTWTCTAAT	Plate6	Illumina	V4	Cornell	1/31/13	TwinsUKPlate6	0.1,gram	Kings College London	sequencing by synthesis	16S rRNA	V4	G9	47	years	0	3972	UBERON:feces	34.17274094	UBERON:feces	UBERON:feces	3/28/11	2011-03-28 23:25:00	23:25:00	GAZ:United Kingdom	2/7/64	0	true	10.4516	ENVO:dense settlement biome	ENVO:human-associated habitat	true	397	human	Homo sapiens	3972	9606	3972	51.5	-0.12	true	Cornell	true	false	King's College, London, UK	Stool	female	3	1002659	TwinsUK gut microbiome	MZ	TwinsUK Fecal Sample
2014.Plate6.78	GAAACGGAAACG	GTGCCAGCMGCCGCGGTAA	12.8	Cornell	UK_Twins	Cornell	fecal samples from TwinsUK MiSeq runs	TwinsUK Miseq	Nick	MiSeq	This analysis was done as in Caporaso et al 2011 Genome research. The PCR primers F515 and R806 were developed against the V4 region of the 16S rRNA, both bacteria and archaea, which we determined would yield optimal community clustering with reads of this length The reverse PCR primer is barcoded with a 12-base error-correcting Golay code to facilitate multiplexing of up to 1,500 samples per lane, and both PCR primers contain sequencer adapter regions.	GT	FWD:GTGCCAGCMGCCGCGGTAA; REV:GGACTACHVGGGTWTCTAAT	Plate6	Illumina	V4	Cornell	1/31/13	TwinsUKPlate6	0.1,gram	Kings College London	sequencing by synthesis	16S rRNA	V4	G8	54	years	0	4612	UBERON:feces	23.02146912	UBERON:feces	UBERON:feces	4/2/11	2011-04-02 08:30:00	8:30:00	GAZ:United Kingdom	2/20/57	0	true	10.4516	ENVO:dense settlement biome	ENVO:human-associated habitat	true	461	human	Homo sapiens	4612	9606	4612	51.5	-0.12	true	Cornell	true	false	King's College, London, UK	Stool	female	3	1002662	TwinsUK gut microbiome	DZ	TwinsUK Fecal Sample
2014.Plate6.77	CACGTTTATTCC	GTGCCAGCMGCCGCGGTAA	32.315	Cornell	UK_Twins	Cornell	fecal samples from TwinsUK MiSeq runs	TwinsUK Miseq	Nick	MiSeq	This analysis was done as in Caporaso et al 2011 Genome research. The PCR primers F515 and R806 were developed against the V4 region of the 16S rRNA, both bacteria and archaea, which we determined would yield optimal community clustering with reads of this length The reverse PCR primer is barcoded with a 12-base error-correcting Golay code to facilitate multiplexing of up to 1,500 samples per lane, and both PCR primers contain sequencer adapter regions.	GT	FWD:GTGCCAGCMGCCGCGGTAA; REV:GGACTACHVGGGTWTCTAAT	Plate6	Illumina	V4	Cornell	1/31/13	TwinsUKPlate6	0.1,gram	Kings College London	sequencing by synthesis	16S rRNA	V4	G7	62	years	0	6241	UBERON:feces	29.00725937	UBERON:feces	UBERON:feces	3/30/11	2011-03-30 21:50:00	21:50:00	GAZ:United Kingdom	3/11/49	0	true	10.4516	ENVO:dense settlement biome	ENVO:human-associated habitat	true	624	human	Homo sapiens	6241	9606	6241	51.5	-0.12	true	Cornell	true	false	King's College, London, UK	Stool	female	3	1002666	TwinsUK gut microbiome	DZ	TwinsUK Fecal Sample
2014.Plate6.76	TCGGTCCATAGC	GTGCCAGCMGCCGCGGTAA	45.428	Cornell	UK_Twins	Cornell	fecal samples from TwinsUK MiSeq runs	TwinsUK Miseq	Nick	MiSeq	This analysis was done as in Caporaso et al 2011 Genome research. The PCR primers F515 and R806 were developed against the V4 region of the 16S rRNA, both bacteria and archaea, which we determined would yield optimal community clustering with reads of this length The reverse PCR primer is barcoded with a 12-base error-correcting Golay code to facilitate multiplexing of up to 1,500 samples per lane, and both PCR primers contain sequencer adapter regions.	GT	FWD:GTGCCAGCMGCCGCGGTAA; REV:GGACTACHVGGGTWTCTAAT	Plate6	Illumina	V4	Cornell	1/31/13	TwinsUKPlate6	0.1,gram	Kings College London	sequencing by synthesis	16S rRNA	V4	G6	77	years	0	8411	UBERON:feces	26.64867973	UBERON:feces	UBERON:feces	4/4/11	2011-04-04 06:40:00	6:40:00	GAZ:United Kingdom	10/5/33	0	true	10.4516	ENVO:dense settlement biome	ENVO:human-associated habitat	true	841	human	Homo sapiens	8411	9606	8411	51.5	-0.12	true	Cornell	true	false	King's College, London, UK	Stool	female	3	1002655	TwinsUK gut microbiome	MZ	TwinsUK Fecal Sample
2014.Plate6.75	CTTAGCTACTCT	GTGCCAGCMGCCGCGGTAA	33.864	Cornell	UK_Twins	Cornell	fecal samples from TwinsUK MiSeq runs	TwinsUK Miseq	Nick	MiSeq	This analysis was done as in Caporaso et al 2011 Genome research. The PCR primers F515 and R806 were developed against the V4 region of the 16S rRNA, both bacteria and archaea, which we determined would yield optimal community clustering with reads of this length The reverse PCR primer is barcoded with a 12-base error-correcting Golay code to facilitate multiplexing of up to 1,500 samples per lane, and both PCR primers contain sequencer adapter regions.	GT	FWD:GTGCCAGCMGCCGCGGTAA; REV:GGACTACHVGGGTWTCTAAT	Plate6	Illumina	V4	Cornell	1/31/13	TwinsUKPlate6	0.1,gram	Kings College London	sequencing by synthesis	16S rRNA	V4	G5	77	years	0	8412	UBERON:feces	26.84093094	UBERON:feces	UBERON:feces	4/3/11	2011-04-03 07:15:00	7:15:00	GAZ:United Kingdom	10/5/33	0	true	10.4516	ENVO:dense settlement biome	ENVO:human-associated habitat	true	841	human	Homo sapiens	8412	9606	8412	51.5	-0.12	true	Cornell	true	false	King's College, London, UK	Stool	female	3	1002656	TwinsUK gut microbiome	MZ	TwinsUK Fecal Sample
2014.Plate6.74	AGTGATGTGACT	GTGCCAGCMGCCGCGGTAA	52.759	Cornell	UK_Twins	Cornell	fecal samples from TwinsUK MiSeq runs	TwinsUK Miseq	Nick	MiSeq	This analysis was done as in Caporaso et al 2011 Genome research. The PCR primers F515 and R806 were developed against the V4 region of the 16S rRNA, both bacteria and archaea, which we determined would yield optimal community clustering with reads of this length The reverse PCR primer is barcoded with a 12-base error-correcting Golay code to facilitate multiplexing of up to 1,500 samples per lane, and both PCR primers contain sequencer adapter regions.	GT	FWD:GTGCCAGCMGCCGCGGTAA; REV:GGACTACHVGGGTWTCTAAT	Plate6	Illumina	V4	Cornell	1/31/13	TwinsUKPlate6	0.1,gram	Kings College London	sequencing by synthesis	16S rRNA	V4	G4	56	years	0	6512	UBERON:feces	24.00956917	UBERON:feces	UBERON:feces	3/25/11	2011-03-25 06:30:00	6:30:00	GAZ:United Kingdom	8/30/54	0	true	10.4516	ENVO:dense settlement biome	ENVO:human-associated habitat	true	651	human	Homo sapiens	6512	9606	6512	51.5	-0.12	true	Cornell	true	false	King's College, London, UK	Stool	female	3	1002651	TwinsUK gut microbiome	DZ	TwinsUK Fecal Sample
2014.Plate6.73	TCAGACCAACTG	GTGCCAGCMGCCGCGGTAA	45.015	Cornell	UK_Twins	Cornell	fecal samples from TwinsUK MiSeq runs	TwinsUK Miseq	Nick	MiSeq	This analysis was done as in Caporaso et al 2011 Genome research. The PCR primers F515 and R806 were developed against the V4 region of the 16S rRNA, both bacteria and archaea, which we determined would yield optimal community clustering with reads of this length The reverse PCR primer is barcoded with a 12-base error-correcting Golay code to facilitate multiplexing of up to 1,500 samples per lane, and both PCR primers contain sequencer adapter regions.	GT	FWD:GTGCCAGCMGCCGCGGTAA; REV:GGACTACHVGGGTWTCTAAT	Plate6	Illumina	V4	Cornell	1/31/13	TwinsUKPlate6	0.1,gram	Kings College London	sequencing by synthesis	16S rRNA	V4	G3	54	years	0	4131	UBERON:feces	25.83226013	UBERON:feces	UBERON:feces	3/24/11	2011-03-24 07:10:00	7:10:00	GAZ:United Kingdom	11/21/56	0	true	10.4516	ENVO:dense settlement biome	ENVO:human-associated habitat	true	413	human	Homo sapiens	4131	9606	4131	51.5	-0.12	true	Cornell	true	false	King's College, London, UK	Stool	female	3	1002640	TwinsUK gut microbiome	MZ	TwinsUK Fecal Sample
2014.Plate6.72	GACAGAGGTGCA	GTGCCAGCMGCCGCGGTAA	35.516	Cornell	UK_Twins	Cornell	fecal samples from TwinsUK MiSeq runs	TwinsUK Miseq	Nick	MiSeq	This analysis was done as in Caporaso et al 2011 Genome research. The PCR primers F515 and R806 were developed against the V4 region of the 16S rRNA, both bacteria and archaea, which we determined would yield optimal community clustering with reads of this length The reverse PCR primer is barcoded with a 12-base error-correcting Golay code to facilitate multiplexing of up to 1,500 samples per lane, and both PCR primers contain sequencer adapter regions.	GT	FWD:GTGCCAGCMGCCGCGGTAA; REV:GGACTACHVGGGTWTCTAAT	Plate6	Illumina	V4	Cornell	1/31/13	TwinsUKPlate6	0.1,gram	Kings College London	sequencing by synthesis	16S rRNA	V4	G2	64	years	0	6702	UBERON:feces	31.32991982	UBERON:feces	UBERON:feces	3/28/11	2011-03-28 15:40:00	15:40:00	GAZ:United Kingdom	10/24/46	0	true	10.4516	ENVO:dense settlement biome	ENVO:human-associated habitat	true	670	human	Homo sapiens	6702	9606	6702	51.5	-0.12	true	Cornell	true	false	King's College, London, UK	Stool	female	3	1002653	TwinsUK gut microbiome	DZ	TwinsUK Fecal Sample
2014.Plate6.71	CTGGTGCTGAAT	GTGCCAGCMGCCGCGGTAA	48.003	Cornell	UK_Twins	Cornell	fecal samples from TwinsUK MiSeq runs	TwinsUK Miseq	Nick	MiSeq	This analysis was done as in Caporaso et al 2011 Genome research. The PCR primers F515 and R806 were developed against the V4 region of the 16S rRNA, both bacteria and archaea, which we determined would yield optimal community clustering with reads of this length The reverse PCR primer is barcoded with a 12-base error-correcting Golay code to facilitate multiplexing of up to 1,500 samples per lane, and both PCR primers contain sequencer adapter regions.	GT	FWD:GTGCCAGCMGCCGCGGTAA; REV:GGACTACHVGGGTWTCTAAT	Plate6	Illumina	V4	Cornell	1/31/13	TwinsUKPlate6	0.1,gram	Kings College London	sequencing by synthesis	16S rRNA	V4	G1	72	years	0	6051	UBERON:feces	23.40801048	UBERON:feces	UBERON:feces	3/26/11	2011-03-26 08:30:00	8:30:00	GAZ:United Kingdom	5/12/38	0	true	10.4516	ENVO:dense settlement biome	ENVO:human-associated habitat	true	605	human	Homo sapiens	6051	9606	6051	51.5	-0.12	true	Cornell	true	false	King's College, London, UK	Stool	female	3	1002648	TwinsUK gut microbiome	MZ	TwinsUK Fecal Sample
2014.Plate6.70	TGTCAGCTGTCG	GTGCCAGCMGCCGCGGTAA	32.935	Cornell	UK_Twins	Cornell	fecal samples from TwinsUK MiSeq runs	TwinsUK Miseq	Nick	MiSeq	This analysis was done as in Caporaso et al 2011 Genome research. The PCR primers F515 and R806 were developed against the V4 region of the 16S rRNA, both bacteria and archaea, which we determined would yield optimal community clustering with reads of this length The reverse PCR primer is barcoded with a 12-base error-correcting Golay code to facilitate multiplexing of up to 1,500 samples per lane, and both PCR primers contain sequencer adapter regions.	GT	FWD:GTGCCAGCMGCCGCGGTAA; REV:GGACTACHVGGGTWTCTAAT	Plate6	Illumina	V4	Cornell	1/31/13	TwinsUKPlate6	0.1,gram	Kings College London	sequencing by synthesis	16S rRNA	V4	F12	47	years	0	3971	UBERON:feces	32.42539978	UBERON:feces	UBERON:feces	3/27/11	2011-03-27 00:00:00	0:00:00	GAZ:United Kingdom	2/7/64	0	true	10.4516	ENVO:dense settlement biome	ENVO:human-associated habitat	true	397	human	Homo sapiens	3971	9606	3971	51.5	-0.12	true	Cornell	true	false	King's College, London, UK	Stool	female	3	1002639	TwinsUK gut microbiome	MZ	TwinsUK Fecal Sample
2014.Plate6.7	GTTGGTTGGCAT	GTGCCAGCMGCCGCGGTAA	46.357	Cornell	UK_Twins	Cornell	fecal samples from TwinsUK MiSeq runs	TwinsUK Miseq	Nick	MiSeq	This analysis was done as in Caporaso et al 2011 Genome research. The PCR primers F515 and R806 were developed against the V4 region of the 16S rRNA, both bacteria and archaea, which we determined would yield optimal community clustering with reads of this length The reverse PCR primer is barcoded with a 12-base error-correcting Golay code to facilitate multiplexing of up to 1,500 samples per lane, and both PCR primers contain sequencer adapter regions.	GT	FWD:GTGCCAGCMGCCGCGGTAA; REV:GGACTACHVGGGTWTCTAAT	Plate6	Illumina	V4	Cornell	1/31/13	TwinsUKPlate6	0.1,gram	Kings College London	sequencing by synthesis	16S rRNA	V4	A7	67	years	0	6071	UBERON:feces	20.71479034	UBERON:feces	UBERON:feces	2/4/11	2011-02-04 08:15:00	8:15:00	GAZ:United Kingdom	11/5/43	0	true	10.4516	ENVO:dense settlement biome	ENVO:human-associated habitat	true	607	human	Homo sapiens	6071	9606	6071	51.5	-0.12	true	Cornell	true	false	King's College, London, UK	Stool	female	2	1002555	TwinsUK gut microbiome	DZ	TwinsUK Fecal Sample
2014.Plate6.69	GGAACGACGTGA	GTGCCAGCMGCCGCGGTAA	29.011	Cornell	UK_Twins	Cornell	fecal samples from TwinsUK MiSeq runs	TwinsUK Miseq	Nick	MiSeq	This analysis was done as in Caporaso et al 2011 Genome research. The PCR primers F515 and R806 were developed against the V4 region of the 16S rRNA, both bacteria and archaea, which we determined would yield optimal community clustering with reads of this length The reverse PCR primer is barcoded with a 12-base error-correcting Golay code to facilitate multiplexing of up to 1,500 samples per lane, and both PCR primers contain sequencer adapter regions.	GT	FWD:GTGCCAGCMGCCGCGGTAA; REV:GGACTACHVGGGTWTCTAAT	Plate6	Illumina	V4	Cornell	1/31/13	TwinsUKPlate6	0.1,gram	Kings College London	sequencing by synthesis	16S rRNA	V4	F11	56	years	0	7992	UBERON:feces	26.13018036	UBERON:feces	UBERON:feces	3/27/11	2011-03-27 10:00:00	10:00:00	GAZ:United Kingdom	10/7/54	0	true	10.4516	ENVO:dense settlement biome	ENVO:human-associated habitat	true	799	human	Homo sapiens	7992	9606	7992	51.5	-0.12	true	Cornell	true	false	King's College, London, UK	Stool	female	3	1002654	TwinsUK gut microbiome	MZ	TwinsUK Fecal Sample
2014.Plate6.68	AGTGCCCTTGGT	GTGCCAGCMGCCGCGGTAA	10.942	Cornell	UK_Twins	Cornell	fecal samples from TwinsUK MiSeq runs	TwinsUK Miseq	Nick	MiSeq	This analysis was done as in Caporaso et al 2011 Genome research. The PCR primers F515 and R806 were developed against the V4 region of the 16S rRNA, both bacteria and archaea, which we determined would yield optimal community clustering with reads of this length The reverse PCR primer is barcoded with a 12-base error-correcting Golay code to facilitate multiplexing of up to 1,500 samples per lane, and both PCR primers contain sequencer adapter regions.	GT	FWD:GTGCCAGCMGCCGCGGTAA; REV:GGACTACHVGGGTWTCTAAT	Plate6	Illumina	V4	Cornell	1/31/13	TwinsUKPlate6	0.1,gram	Kings College London	sequencing by synthesis	16S rRNA	V4	F10	64	years	0	6701	UBERON:feces	29.60360909	UBERON:feces	UBERON:feces	3/28/11	2011-03-28 07:00:00	7:00:00	GAZ:United Kingdom	10/24/46	0	true	10.4516	ENVO:dense settlement biome	ENVO:human-associated habitat	true	670	human	Homo sapiens	6701	9606	6701	51.5	-0.12	true	Cornell	true	false	King's College, London, UK	Stool	female	3	1002652	TwinsUK gut microbiome	DZ	TwinsUK Fecal Sample
2014.Plate6.67	CAACTAGACTCG	GTGCCAGCMGCCGCGGTAA	8.774	Cornell	UK_Twins	Cornell	fecal samples from TwinsUK MiSeq runs	TwinsUK Miseq	Nick	MiSeq	This analysis was done as in Caporaso et al 2011 Genome research. The PCR primers F515 and R806 were developed against the V4 region of the 16S rRNA, both bacteria and archaea, which we determined would yield optimal community clustering with reads of this length The reverse PCR primer is barcoded with a 12-base error-correcting Golay code to facilitate multiplexing of up to 1,500 samples per lane, and both PCR primers contain sequencer adapter regions.	GT	FWD:GTGCCAGCMGCCGCGGTAA; REV:GGACTACHVGGGTWTCTAAT	Plate6	Illumina	V4	Cornell	1/31/13	TwinsUKPlate6	0.1,gram	Kings College London	sequencing by synthesis	16S rRNA	V4	F9	71	years	0	5592	UBERON:feces	25.25202942	UBERON:feces	UBERON:feces	3/28/11	2011-03-28 21:45:00	21:45:00	GAZ:United Kingdom	8/4/39	0	true	10.4516	ENVO:dense settlement biome	ENVO:human-associated habitat	true	559	human	Homo sapiens	5592	9606	5592	51.5	-0.12	true	Cornell	true	false	King's College, London, UK	Stool	female	3	1002647	TwinsUK gut microbiome	DZ	TwinsUK Fecal Sample
2014.Plate6.66	GTGCTTGTGTAG	GTGCCAGCMGCCGCGGTAA	36.239	Cornell	UK_Twins	Cornell	fecal samples from TwinsUK MiSeq runs	TwinsUK Miseq	Nick	MiSeq	This analysis was done as in Caporaso et al 2011 Genome research. The PCR primers F515 and R806 were developed against the V4 region of the 16S rRNA, both bacteria and archaea, which we determined would yield optimal community clustering with reads of this length The reverse PCR primer is barcoded with a 12-base error-correcting Golay code to facilitate multiplexing of up to 1,500 samples per lane, and both PCR primers contain sequencer adapter regions.	GT	FWD:GTGCCAGCMGCCGCGGTAA; REV:GGACTACHVGGGTWTCTAAT	Plate6	Illumina	V4	Cornell	1/31/13	TwinsUKPlate6	0.1,gram	Kings College London	sequencing by synthesis	16S rRNA	V4	F8	53	years	0	4352	UBERON:feces	28.81814957	UBERON:feces	UBERON:feces	3/26/11	2011-03-26 07:00:00	7:00:00	GAZ:United Kingdom	11/27/57	0	true	10.4516	ENVO:dense settlement biome	ENVO:human-associated habitat	true	435	human	Homo sapiens	4352	9606	4352	51.5	-0.12	true	Cornell	true	false	King's College, London, UK	Stool	female	3	1002641	TwinsUK gut microbiome	MZ	TwinsUK Fecal Sample
2014.Plate6.65	AACCTCGGATAA	GTGCCAGCMGCCGCGGTAA	35.516	Cornell	UK_Twins	Cornell	fecal samples from TwinsUK MiSeq runs	TwinsUK Miseq	Nick	MiSeq	This analysis was done as in Caporaso et al 2011 Genome research. The PCR primers F515 and R806 were developed against the V4 region of the 16S rRNA, both bacteria and archaea, which we determined would yield optimal community clustering with reads of this length The reverse PCR primer is barcoded with a 12-base error-correcting Golay code to facilitate multiplexing of up to 1,500 samples per lane, and both PCR primers contain sequencer adapter regions.	GT	FWD:GTGCCAGCMGCCGCGGTAA; REV:GGACTACHVGGGTWTCTAAT	Plate6	Illumina	V4	Cornell	1/31/13	TwinsUKPlate6	0.1,gram	Kings College London	sequencing by synthesis	16S rRNA	V4	F7	73	years	0	4511	UBERON:feces	20.2562294	UBERON:feces	UBERON:feces	3/24/11	2011-03-24 08:40:00	8:40:00	GAZ:United Kingdom	6/26/37	0	true	10.4516	ENVO:dense settlement biome	ENVO:human-associated habitat	true	451	human	Homo sapiens	4511	9606	4511	51.5	-0.12	true	Cornell	true	false	King's College, London, UK	Stool	female	3	1002642	TwinsUK gut microbiome	DZ	TwinsUK Fecal Sample
2014.Plate6.64	TGCCGCCGTAAT	GTGCCAGCMGCCGCGGTAA	36.239	Cornell	UK_Twins	Cornell	fecal samples from TwinsUK MiSeq runs	TwinsUK Miseq	Nick	MiSeq	This analysis was done as in Caporaso et al 2011 Genome research. The PCR primers F515 and R806 were developed against the V4 region of the 16S rRNA, both bacteria and archaea, which we determined would yield optimal community clustering with reads of this length The reverse PCR primer is barcoded with a 12-base error-correcting Golay code to facilitate multiplexing of up to 1,500 samples per lane, and both PCR primers contain sequencer adapter regions.	GT	FWD:GTGCCAGCMGCCGCGGTAA; REV:GGACTACHVGGGTWTCTAAT	Plate6	Illumina	V4	Cornell	1/31/13	TwinsUKPlate6	0.1,gram	Kings College London	sequencing by synthesis	16S rRNA	V4	F6	66	years	0	4592	UBERON:feces	21.20215988	UBERON:feces	UBERON:feces	3/27/11	2011-03-27 16:30:00	16:30:00	GAZ:United Kingdom	2/17/45	0	true	10.4516	ENVO:dense settlement biome	ENVO:human-associated habitat	true	459	human	Homo sapiens	4592	9606	4592	51.5	-0.12	true	Cornell	true	false	King's College, London, UK	Stool	female	3	1002645	TwinsUK gut microbiome	DZ	TwinsUK Fecal Sample
2014.Plate6.62	CATTTGACGACG	GTGCCAGCMGCCGCGGTAA	21.061	Cornell	UK_Twins	Cornell	fecal samples from TwinsUK MiSeq runs	TwinsUK Miseq	Nick	MiSeq	This analysis was done as in Caporaso et al 2011 Genome research. The PCR primers F515 and R806 were developed against the V4 region of the 16S rRNA, both bacteria and archaea, which we determined would yield optimal community clustering with reads of this length The reverse PCR primer is barcoded with a 12-base error-correcting Golay code to facilitate multiplexing of up to 1,500 samples per lane, and both PCR primers contain sequencer adapter regions.	GT	FWD:GTGCCAGCMGCCGCGGTAA; REV:GGACTACHVGGGTWTCTAAT	Plate6	Illumina	V4	Cornell	1/31/13	TwinsUKPlate6	0.1,gram	Kings College London	sequencing by synthesis	16S rRNA	V4	F4	56	years	0	6511	UBERON:feces	27.24559021	UBERON:feces	UBERON:feces	3/24/11	2011-03-24 18:30:00	18:30:00	GAZ:United Kingdom	8/30/54	0	true	10.4516	ENVO:dense settlement biome	ENVO:human-associated habitat	true	651	human	Homo sapiens	6511	9606	6511	51.5	-0.12	true	Cornell	true	false	King's College, London, UK	Stool	female	3	1002650	TwinsUK gut microbiome	DZ	TwinsUK Fecal Sample
2014.Plate6.61	TTCCCTTCTCCG	GTGCCAGCMGCCGCGGTAA	38.097	Cornell	UK_Twins	Cornell	fecal samples from TwinsUK MiSeq runs	TwinsUK Miseq	Nick	MiSeq	This analysis was done as in Caporaso et al 2011 Genome research. The PCR primers F515 and R806 were developed against the V4 region of the 16S rRNA, both bacteria and archaea, which we determined would yield optimal community clustering with reads of this length The reverse PCR primer is barcoded with a 12-base error-correcting Golay code to facilitate multiplexing of up to 1,500 samples per lane, and both PCR primers contain sequencer adapter regions.	GT	FWD:GTGCCAGCMGCCGCGGTAA; REV:GGACTACHVGGGTWTCTAAT	Plate6	Illumina	V4	Cornell	1/31/13	TwinsUKPlate6	0.1,gram	Kings College London	sequencing by synthesis	16S rRNA	V4	F3	73	years	0	4512	UBERON:feces	23.18777084	UBERON:feces	UBERON:feces	3/25/11	2011-03-25 19:30:00	19:30:00	GAZ:United Kingdom	6/26/37	0	true	10.4516	ENVO:dense settlement biome	ENVO:human-associated habitat	true	451	human	Homo sapiens	4512	9606	4512	51.5	-0.12	true	Cornell	true	false	King's College, London, UK	Stool	female	3	1002643	TwinsUK gut microbiome	DZ	TwinsUK Fecal Sample
2014.Plate6.60	GTGGCCTACTAC	GTGCCAGCMGCCGCGGTAA	34.277	Cornell	UK_Twins	Cornell	fecal samples from TwinsUK MiSeq runs	TwinsUK Miseq	Nick	MiSeq	This analysis was done as in Caporaso et al 2011 Genome research. The PCR primers F515 and R806 were developed against the V4 region of the 16S rRNA, both bacteria and archaea, which we determined would yield optimal community clustering with reads of this length The reverse PCR primer is barcoded with a 12-base error-correcting Golay code to facilitate multiplexing of up to 1,500 samples per lane, and both PCR primers contain sequencer adapter regions.	GT	FWD:GTGCCAGCMGCCGCGGTAA; REV:GGACTACHVGGGTWTCTAAT	Plate6	Illumina	V4	Cornell	1/31/13	TwinsUKPlate6	0.1,gram	Kings College London	sequencing by synthesis	16S rRNA	V4	F2	59	years	0	3852	UBERON:feces	29.44113922	UBERON:feces	UBERON:feces	4/1/11	2011-04-01 08:45:00	8:45:00	GAZ:United Kingdom	4/7/51	0	true	10.4516	ENVO:dense settlement biome	ENVO:human-associated habitat	true	385	human	Homo sapiens	3852	9606	3852	51.5	-0.12	true	Cornell	true	false	King's College, London, UK	Stool	female	3	1002624	TwinsUK gut microbiome	MZ	TwinsUK Fecal Sample
2014.Plate6.6	ACTCGGCCAACT	GTGCCAGCMGCCGCGGTAA	31.179	Cornell	UK_Twins	Cornell	fecal samples from TwinsUK MiSeq runs	TwinsUK Miseq	Nick	MiSeq	This analysis was done as in Caporaso et al 2011 Genome research. The PCR primers F515 and R806 were developed against the V4 region of the 16S rRNA, both bacteria and archaea, which we determined would yield optimal community clustering with reads of this length The reverse PCR primer is barcoded with a 12-base error-correcting Golay code to facilitate multiplexing of up to 1,500 samples per lane, and both PCR primers contain sequencer adapter regions.	GT	FWD:GTGCCAGCMGCCGCGGTAA; REV:GGACTACHVGGGTWTCTAAT	Plate6	Illumina	V4	Cornell	1/31/13	TwinsUKPlate6	0.1,gram	Kings College London	sequencing by synthesis	16S rRNA	V4	A6	63	years	0	8102	UBERON:feces	33.39736938	UBERON:feces	UBERON:feces	1/8/11	2011-01-08 09:00:00	9:00:00	GAZ:United Kingdom	8/27/47	0	true	10.4516	ENVO:dense settlement biome	ENVO:human-associated habitat	true	810	human	Homo sapiens	8102	9606	8102	51.5	-0.12	true	Cornell	true	false	King's College, London, UK	Stool	female	2	1002485	TwinsUK gut microbiome	DZ	TwinsUK Fecal Sample
2014.Plate6.58	GCCTCGTACTGA	GTGCCAGCMGCCGCGGTAA	31.799	Cornell	UK_Twins	Cornell	fecal samples from TwinsUK MiSeq runs	TwinsUK Miseq	Nick	MiSeq	This analysis was done as in Caporaso et al 2011 Genome research. The PCR primers F515 and R806 were developed against the V4 region of the 16S rRNA, both bacteria and archaea, which we determined would yield optimal community clustering with reads of this length The reverse PCR primer is barcoded with a 12-base error-correcting Golay code to facilitate multiplexing of up to 1,500 samples per lane, and both PCR primers contain sequencer adapter regions.	GT	FWD:GTGCCAGCMGCCGCGGTAA; REV:GGACTACHVGGGTWTCTAAT	Plate6	Illumina	V4	Cornell	1/31/13	TwinsUKPlate6	0.1,gram	Kings College London	sequencing by synthesis	16S rRNA	V4	E12	67	years	0	6781	UBERON:feces	25.79986954	UBERON:feces	UBERON:feces	3/23/11	2011-03-23 06:10:00	6:10:00	GAZ:United Kingdom	5/2/43	0	true	10.4516	ENVO:dense settlement biome	ENVO:human-associated habitat	true	678	human	Homo sapiens	6781	9606	6781	51.5	-0.12	true	Cornell	true	false	King's College, London, UK	Stool	female	3	1002634	TwinsUK gut microbiome	DZ	TwinsUK Fecal Sample
2014.Plate6.57	CGCATACGACCT	GTGCCAGCMGCCGCGGTAA	35.826	Cornell	UK_Twins	Cornell	fecal samples from TwinsUK MiSeq runs	TwinsUK Miseq	Nick	MiSeq	This analysis was done as in Caporaso et al 2011 Genome research. The PCR primers F515 and R806 were developed against the V4 region of the 16S rRNA, both bacteria and archaea, which we determined would yield optimal community clustering with reads of this length The reverse PCR primer is barcoded with a 12-base error-correcting Golay code to facilitate multiplexing of up to 1,500 samples per lane, and both PCR primers contain sequencer adapter regions.	GT	FWD:GTGCCAGCMGCCGCGGTAA; REV:GGACTACHVGGGTWTCTAAT	Plate6	Illumina	V4	Cornell	1/31/13	TwinsUKPlate6	0.1,gram	Kings College London	sequencing by synthesis	16S rRNA	V4	E11	55	years	0	4921	UBERON:feces	22.07530022	UBERON:feces	UBERON:feces	4/7/11	2011-04-07 06:45:00	6:45:00	GAZ:United Kingdom	12/20/55	0	true	10.4516	ENVO:dense settlement biome	ENVO:human-associated habitat	true	492	human	Homo sapiens	4921	9606	4921	51.5	-0.12	true	Cornell	true	false	King's College, London, UK	Stool	female	3	1002631	TwinsUK gut microbiome	MZ	TwinsUK Fecal Sample
2014.Plate6.56	CAGGATTCGTAC	GTGCCAGCMGCCGCGGTAA	17.653	Cornell	UK_Twins	Cornell	fecal samples from TwinsUK MiSeq runs	TwinsUK Miseq	Nick	MiSeq	This analysis was done as in Caporaso et al 2011 Genome research. The PCR primers F515 and R806 were developed against the V4 region of the 16S rRNA, both bacteria and archaea, which we determined would yield optimal community clustering with reads of this length The reverse PCR primer is barcoded with a 12-base error-correcting Golay code to facilitate multiplexing of up to 1,500 samples per lane, and both PCR primers contain sequencer adapter regions.	GT	FWD:GTGCCAGCMGCCGCGGTAA; REV:GGACTACHVGGGTWTCTAAT	Plate6	Illumina	V4	Cornell	1/31/13	TwinsUKPlate6	0.1,gram	Kings College London	sequencing by synthesis	16S rRNA	V4	E10	64	years	0	7242	UBERON:feces	25.82221985	UBERON:feces	UBERON:feces	3/22/11	2011-03-22 08:00:00	8:00:00	GAZ:United Kingdom	3/11/47	0	true	10.4516	ENVO:dense settlement biome	ENVO:human-associated habitat	true	724	human	Homo sapiens	7242	9606	7242	51.5	-0.12	true	Cornell	true	false	King's College, London, UK	Stool	female	3	1002637	TwinsUK gut microbiome	MZ	TwinsUK Fecal Sample
2014.Plate6.55	CTCCAGGTCATG	GTGCCAGCMGCCGCGGTAA	34.793	Cornell	UK_Twins	Cornell	fecal samples from TwinsUK MiSeq runs	TwinsUK Miseq	Nick	MiSeq	This analysis was done as in Caporaso et al 2011 Genome research. The PCR primers F515 and R806 were developed against the V4 region of the 16S rRNA, both bacteria and archaea, which we determined would yield optimal community clustering with reads of this length The reverse PCR primer is barcoded with a 12-base error-correcting Golay code to facilitate multiplexing of up to 1,500 samples per lane, and both PCR primers contain sequencer adapter regions.	GT	FWD:GTGCCAGCMGCCGCGGTAA; REV:GGACTACHVGGGTWTCTAAT	Plate6	Illumina	V4	Cornell	1/31/13	TwinsUKPlate6	0.1,gram	Kings College London	sequencing by synthesis	16S rRNA	V4	E9	72	years	0	4621	UBERON:feces	25.01589012	UBERON:feces	UBERON:feces	3/29/11	2011-03-29 09:00:00	9:00:00	GAZ:United Kingdom	1/13/39	0	true	10.4516	ENVO:dense settlement biome	ENVO:human-associated habitat	true	462	human	Homo sapiens	4621	9606	4621	51.5	-0.12	true	Cornell	true	false	King's College, London, UK	Stool	female	3	1002630	TwinsUK gut microbiome	DZ	TwinsUK Fecal Sample
2014.Plate6.54	TTCACCTGTATC	GTGCCAGCMGCCGCGGTAA	29.94	Cornell	UK_Twins	Cornell	fecal samples from TwinsUK MiSeq runs	TwinsUK Miseq	Nick	MiSeq	This analysis was done as in Caporaso et al 2011 Genome research. The PCR primers F515 and R806 were developed against the V4 region of the 16S rRNA, both bacteria and archaea, which we determined would yield optimal community clustering with reads of this length The reverse PCR primer is barcoded with a 12-base error-correcting Golay code to facilitate multiplexing of up to 1,500 samples per lane, and both PCR primers contain sequencer adapter regions.	GT	FWD:GTGCCAGCMGCCGCGGTAA; REV:GGACTACHVGGGTWTCTAAT	Plate6	Illumina	V4	Cornell	1/31/13	TwinsUKPlate6	0.1,gram	Kings College London	sequencing by synthesis	16S rRNA	V4	E8	54	years	0	4611	UBERON:feces	28.83029938	UBERON:feces	UBERON:feces	4/3/11	2011-04-03 07:30:00	7:30:00	GAZ:United Kingdom	2/20/57	0	true	10.4516	ENVO:dense settlement biome	ENVO:human-associated habitat	true	461	human	Homo sapiens	4611	9606	4611	51.5	-0.12	true	Cornell	true	false	King's College, London, UK	Stool	female	3	1002629	TwinsUK gut microbiome	DZ	TwinsUK Fecal Sample
2014.Plate6.53	CCTCGGGTACTA	GTGCCAGCMGCCGCGGTAA	21.474	Cornell	UK_Twins	Cornell	fecal samples from TwinsUK MiSeq runs	TwinsUK Miseq	Nick	MiSeq	This analysis was done as in Caporaso et al 2011 Genome research. The PCR primers F515 and R806 were developed against the V4 region of the 16S rRNA, both bacteria and archaea, which we determined would yield optimal community clustering with reads of this length The reverse PCR primer is barcoded with a 12-base error-correcting Golay code to facilitate multiplexing of up to 1,500 samples per lane, and both PCR primers contain sequencer adapter regions.	GT	FWD:GTGCCAGCMGCCGCGGTAA; REV:GGACTACHVGGGTWTCTAAT	Plate6	Illumina	V4	Cornell	1/31/13	TwinsUKPlate6	0.1,gram	Kings College London	sequencing by synthesis	16S rRNA	V4	E7	55	years	0	4922	UBERON:feces	24.39023972	UBERON:feces	UBERON:feces	4/6/11	2011-04-06 07:05:00	7:05:00	GAZ:United Kingdom	12/20/55	0	true	10.4516	ENVO:dense settlement biome	ENVO:human-associated habitat	true	492	human	Homo sapiens	4922	9606	4922	51.5	-0.12	true	Cornell	true	false	King's College, London, UK	Stool	female	3	1002632	TwinsUK gut microbiome	MZ	TwinsUK Fecal Sample
2014.Plate6.52	TAAACGCGACTC	GTGCCAGCMGCCGCGGTAA	27.875	Cornell	UK_Twins	Cornell	fecal samples from TwinsUK MiSeq runs	TwinsUK Miseq	Nick	MiSeq	This analysis was done as in Caporaso et al 2011 Genome research. The PCR primers F515 and R806 were developed against the V4 region of the 16S rRNA, both bacteria and archaea, which we determined would yield optimal community clustering with reads of this length The reverse PCR primer is barcoded with a 12-base error-correcting Golay code to facilitate multiplexing of up to 1,500 samples per lane, and both PCR primers contain sequencer adapter regions.	GT	FWD:GTGCCAGCMGCCGCGGTAA; REV:GGACTACHVGGGTWTCTAAT	Plate6	Illumina	V4	Cornell	1/31/13	TwinsUKPlate6	0.1,gram	Kings College London	sequencing by synthesis	16S rRNA	V4	E6	68	years	0	8061	UBERON:feces	25.0065403	UBERON:feces	UBERON:feces	4/3/11	2011-04-03 14:45:00	14:45:00	GAZ:United Kingdom	2/27/43	0	true	10.4516	ENVO:dense settlement biome	ENVO:human-associated habitat	true	806	human	Homo sapiens	8061	9606	8061	51.5	-0.12	true	Cornell	true	false	King's College, London, UK	Stool	female	3	1002638	TwinsUK gut microbiome	MZ	TwinsUK Fecal Sample
2014.Plate6.51	ATTCAGATGGCA	GTGCCAGCMGCCGCGGTAA	22.919	Cornell	UK_Twins	Cornell	fecal samples from TwinsUK MiSeq runs	TwinsUK Miseq	Nick	MiSeq	This analysis was done as in Caporaso et al 2011 Genome research. The PCR primers F515 and R806 were developed against the V4 region of the 16S rRNA, both bacteria and archaea, which we determined would yield optimal community clustering with reads of this length The reverse PCR primer is barcoded with a 12-base error-correcting Golay code to facilitate multiplexing of up to 1,500 samples per lane, and both PCR primers contain sequencer adapter regions.	GT	FWD:GTGCCAGCMGCCGCGGTAA; REV:GGACTACHVGGGTWTCTAAT	Plate6	Illumina	V4	Cornell	1/31/13	TwinsUKPlate6	0.1,gram	Kings College London	sequencing by synthesis	16S rRNA	V4	E5	54	years	0	4132	UBERON:feces	22.43034935	UBERON:feces	UBERON:feces	3/24/11	2011-03-24 16:10:00	16:10:00	GAZ:United Kingdom	11/21/56	0	true	10.4516	ENVO:dense settlement biome	ENVO:human-associated habitat	true	413	human	Homo sapiens	4132	9606	4132	51.5	-0.12	true	Cornell	true	false	King's College, London, UK	Stool	female	3	1002625	TwinsUK gut microbiome	MZ	TwinsUK Fecal Sample
2014.Plate6.50	ATTATACGGCGC	GTGCCAGCMGCCGCGGTAA	41.917	Cornell	UK_Twins	Cornell	fecal samples from TwinsUK MiSeq runs	TwinsUK Miseq	Nick	MiSeq	This analysis was done as in Caporaso et al 2011 Genome research. The PCR primers F515 and R806 were developed against the V4 region of the 16S rRNA, both bacteria and archaea, which we determined would yield optimal community clustering with reads of this length The reverse PCR primer is barcoded with a 12-base error-correcting Golay code to facilitate multiplexing of up to 1,500 samples per lane, and both PCR primers contain sequencer adapter regions.	GT	FWD:GTGCCAGCMGCCGCGGTAA; REV:GGACTACHVGGGTWTCTAAT	Plate6	Illumina	V4	Cornell	1/31/13	TwinsUKPlate6	0.1,gram	Kings College London	sequencing by synthesis	16S rRNA	V4	E4	59	years	0	3851	UBERON:feces		UBERON:feces	UBERON:feces	4/1/11	2011-04-01 08:00:00	8:00:00	GAZ:United Kingdom	4/7/51	0	true	10.4516	ENVO:dense settlement biome	ENVO:human-associated habitat	true	385	human	Homo sapiens	3851	9606	3851	51.5	-0.12	true	Cornell	true	false	King's College, London, UK	Stool	female	3	1002623	TwinsUK gut microbiome	MZ	TwinsUK Fecal Sample
2014.Plate6.5	TGTCCGTGGATC	GTGCCAGCMGCCGCGGTAA	32.728	Cornell	UK_Twins	Cornell	fecal samples from TwinsUK MiSeq runs	TwinsUK Miseq	Nick	MiSeq	This analysis was done as in Caporaso et al 2011 Genome research. The PCR primers F515 and R806 were developed against the V4 region of the 16S rRNA, both bacteria and archaea, which we determined would yield optimal community clustering with reads of this length The reverse PCR primer is barcoded with a 12-base error-correcting Golay code to facilitate multiplexing of up to 1,500 samples per lane, and both PCR primers contain sequencer adapter regions.	GT	FWD:GTGCCAGCMGCCGCGGTAA; REV:GGACTACHVGGGTWTCTAAT	Plate6	Illumina	V4	Cornell	1/31/13	TwinsUKPlate6	0.1,gram	Kings College London	sequencing by synthesis	16S rRNA	V4	A5	62	years	0	8112	UBERON:feces	32.63708115	UBERON:feces	UBERON:feces	1/18/11	2011-01-18 17:30:00	17:30:00	GAZ:United Kingdom	9/12/48	0	true	10.4516	ENVO:dense settlement biome	ENVO:human-associated habitat	true	811	human	Homo sapiens	8112	9606	8112	51.5	-0.12	true	Cornell	true	false	King's College, London, UK	Stool	female	2	1002486	TwinsUK gut microbiome	DZ	TwinsUK Fecal Sample
2014.Plate6.49	ACACAGTCCTGA	GTGCCAGCMGCCGCGGTAA	7.844	Cornell	UK_Twins	Cornell	fecal samples from TwinsUK MiSeq runs	TwinsUK Miseq	Nick	MiSeq	This analysis was done as in Caporaso et al 2011 Genome research. The PCR primers F515 and R806 were developed against the V4 region of the 16S rRNA, both bacteria and archaea, which we determined would yield optimal community clustering with reads of this length The reverse PCR primer is barcoded with a 12-base error-correcting Golay code to facilitate multiplexing of up to 1,500 samples per lane, and both PCR primers contain sequencer adapter regions.	GT	FWD:GTGCCAGCMGCCGCGGTAA; REV:GGACTACHVGGGTWTCTAAT	Plate6	Illumina	V4	Cornell	1/31/13	TwinsUKPlate6	0.1,gram	Kings College London	sequencing by synthesis	16S rRNA	V4	E3	79	years	0	5751	UBERON:feces	30.03577042	UBERON:feces	UBERON:feces	3/15/11	2011-03-15 07:30:00	7:30:00	GAZ:United Kingdom	7/15/31	0	true	10.4516	ENVO:dense settlement biome	ENVO:human-associated habitat	true	575	human	Homo sapiens	5751	9606	5751	51.5	-0.12	true	Cornell	true	false	King's College, London, UK	Stool	female	3	1002741	TwinsUK gut microbiome	MZ	TwinsUK Fecal Sample
2014.Plate6.48	GCTTCCAGACAA	GTGCCAGCMGCCGCGGTAA	27.978	Cornell	UK_Twins	Cornell	fecal samples from TwinsUK MiSeq runs	TwinsUK Miseq	Nick	MiSeq	This analysis was done as in Caporaso et al 2011 Genome research. The PCR primers F515 and R806 were developed against the V4 region of the 16S rRNA, both bacteria and archaea, which we determined would yield optimal community clustering with reads of this length The reverse PCR primer is barcoded with a 12-base error-correcting Golay code to facilitate multiplexing of up to 1,500 samples per lane, and both PCR primers contain sequencer adapter regions.	GT	FWD:GTGCCAGCMGCCGCGGTAA; REV:GGACTACHVGGGTWTCTAAT	Plate6	Illumina	V4	Cornell	1/31/13	TwinsUKPlate6	0.1,gram	Kings College London	sequencing by synthesis	16S rRNA	V4	E2	65	years	0	4072	UBERON:feces	27.2824192	UBERON:feces	UBERON:feces	3/13/11	2011-03-13 07:40:00	7:40:00	GAZ:United Kingdom	4/14/45	0	true	10.4516	ENVO:dense settlement biome	ENVO:human-associated habitat	true	407	human	Homo sapiens	4072	9606	4072	51.5	-0.12	true	Cornell	true	false	King's College, London, UK	Stool	female	3	1002735	TwinsUK gut microbiome	MZ	TwinsUK Fecal Sample
2014.Plate6.47	ATCCCAGCATGC	GTGCCAGCMGCCGCGGTAA	29.292	Cornell	UK_Twins	Cornell	fecal samples from TwinsUK MiSeq runs	TwinsUK Miseq	Nick	MiSeq	This analysis was done as in Caporaso et al 2011 Genome research. The PCR primers F515 and R806 were developed against the V4 region of the 16S rRNA, both bacteria and archaea, which we determined would yield optimal community clustering with reads of this length The reverse PCR primer is barcoded with a 12-base error-correcting Golay code to facilitate multiplexing of up to 1,500 samples per lane, and both PCR primers contain sequencer adapter regions.	GT	FWD:GTGCCAGCMGCCGCGGTAA; REV:GGACTACHVGGGTWTCTAAT	Plate6	Illumina	V4	Cornell	1/31/13	TwinsUKPlate6	0.1,gram	Kings College London	sequencing by synthesis	16S rRNA	V4	E1	41	years	0	7122	UBERON:feces	23.19296074	UBERON:feces	UBERON:feces	3/7/11	2011-03-07 07:15:00	7:15:00	GAZ:United Kingdom	8/16/69	0	true	10.4516	ENVO:dense settlement biome	ENVO:human-associated habitat	true	712	human	Homo sapiens	7122	9606	7122	51.5	-0.12	true	Cornell	true	false	King's College, London, UK	Stool	female	3	1002748	TwinsUK gut microbiome	DZ	TwinsUK Fecal Sample
2014.Plate6.44	GCCCAAGTTCAC	GTGCCAGCMGCCGCGGTAA	29.734	Cornell	UK_Twins	Cornell	fecal samples from TwinsUK MiSeq runs	TwinsUK Miseq	Nick	MiSeq	This analysis was done as in Caporaso et al 2011 Genome research. The PCR primers F515 and R806 were developed against the V4 region of the 16S rRNA, both bacteria and archaea, which we determined would yield optimal community clustering with reads of this length The reverse PCR primer is barcoded with a 12-base error-correcting Golay code to facilitate multiplexing of up to 1,500 samples per lane, and both PCR primers contain sequencer adapter regions.	GT	FWD:GTGCCAGCMGCCGCGGTAA; REV:GGACTACHVGGGTWTCTAAT	Plate6	Illumina	V4	Cornell	1/31/13	TwinsUKPlate6	0.1,gram	Kings College London	sequencing by synthesis	16S rRNA	V4	D10	70	years	0	5852	UBERON:feces	28.9815197	UBERON:feces	UBERON:feces	3/8/11	2011-03-08 18:05:00	18:05:00	GAZ:United Kingdom	2/1/41	0	true	10.4516	ENVO:dense settlement biome	ENVO:human-associated habitat	true	585	human	Homo sapiens	5852	9606	5852	51.5	-0.12	true	Cornell	true	false	King's College, London, UK	Stool	female	3	1002744	TwinsUK gut microbiome	DZ	TwinsUK Fecal Sample
2014.Plate6.43	GCCTGCAGTACT	GTGCCAGCMGCCGCGGTAA	29.94	Cornell	UK_Twins	Cornell	fecal samples from TwinsUK MiSeq runs	TwinsUK Miseq	Nick	MiSeq	This analysis was done as in Caporaso et al 2011 Genome research. The PCR primers F515 and R806 were developed against the V4 region of the 16S rRNA, both bacteria and archaea, which we determined would yield optimal community clustering with reads of this length The reverse PCR primer is barcoded with a 12-base error-correcting Golay code to facilitate multiplexing of up to 1,500 samples per lane, and both PCR primers contain sequencer adapter regions.	GT	FWD:GTGCCAGCMGCCGCGGTAA; REV:GGACTACHVGGGTWTCTAAT	Plate6	Illumina	V4	Cornell	1/31/13	TwinsUKPlate6	0.1,gram	Kings College London	sequencing by synthesis	16S rRNA	V4	D9	70	years	0	7391	UBERON:feces	26.36560059	UBERON:feces	UBERON:feces	3/3/11	2011-03-03 09:00:00	9:00:00	GAZ:United Kingdom	10/15/40	0	true	10.4516	ENVO:dense settlement biome	ENVO:human-associated habitat	true	739	human	Homo sapiens	7391	9606	7391	51.5	-0.12	true	Cornell	true	false	King's College, London, UK	Stool	female	3	1002749	TwinsUK gut microbiome	MZ	TwinsUK Fecal Sample
2014.Plate6.42	TCCTCACTATCA	GTGCCAGCMGCCGCGGTAA	25.81	Cornell	UK_Twins	Cornell	fecal samples from TwinsUK MiSeq runs	TwinsUK Miseq	Nick	MiSeq	This analysis was done as in Caporaso et al 2011 Genome research. The PCR primers F515 and R806 were developed against the V4 region of the 16S rRNA, both bacteria and archaea, which we determined would yield optimal community clustering with reads of this length The reverse PCR primer is barcoded with a 12-base error-correcting Golay code to facilitate multiplexing of up to 1,500 samples per lane, and both PCR primers contain sequencer adapter regions.	GT	FWD:GTGCCAGCMGCCGCGGTAA; REV:GGACTACHVGGGTWTCTAAT	Plate6	Illumina	V4	Cornell	1/31/13	TwinsUKPlate6	0.1,gram	Kings College London	sequencing by synthesis	16S rRNA	V4	D8	58	years	0	5011	UBERON:feces	29.12896919	UBERON:feces	UBERON:feces	3/2/11	2011-03-02 16:00:00	16:00:00	GAZ:United Kingdom	2/1/53	0	true	10.4516	ENVO:dense settlement biome	ENVO:human-associated habitat	true	501	human	Homo sapiens	5011	9606	5011	51.5	-0.12	true	Cornell	true	false	King's College, London, UK	Stool	female	3	1002739	TwinsUK gut microbiome	MZ	TwinsUK Fecal Sample
2014.Plate6.41	TCCTAGGTCCGA	GTGCCAGCMGCCGCGGTAA	29.527	Cornell	UK_Twins	Cornell	fecal samples from TwinsUK MiSeq runs	TwinsUK Miseq	Nick	MiSeq	This analysis was done as in Caporaso et al 2011 Genome research. The PCR primers F515 and R806 were developed against the V4 region of the 16S rRNA, both bacteria and archaea, which we determined would yield optimal community clustering with reads of this length The reverse PCR primer is barcoded with a 12-base error-correcting Golay code to facilitate multiplexing of up to 1,500 samples per lane, and both PCR primers contain sequencer adapter regions.	GT	FWD:GTGCCAGCMGCCGCGGTAA; REV:GGACTACHVGGGTWTCTAAT	Plate6	Illumina	V4	Cornell	1/31/13	TwinsUKPlate6	0.1,gram	Kings College London	sequencing by synthesis	16S rRNA	V4	D7	58	years	0	5141	UBERON:feces	22.57504082	UBERON:feces	UBERON:feces	3/14/11	2011-03-14 07:15:00	7:15:00	GAZ:United Kingdom	8/25/52	0	true	10.4516	ENVO:dense settlement biome	ENVO:human-associated habitat	true	514	human	Homo sapiens	5141	9606	5141	51.5	-0.12	true	Cornell	true	false	King's College, London, UK	Stool	female	3	1002740	TwinsUK gut microbiome	DZ	TwinsUK Fecal Sample
2014.Plate6.40	TTGGAACGGCTT	GTGCCAGCMGCCGCGGTAA	25.5	Cornell	UK_Twins	Cornell	fecal samples from TwinsUK MiSeq runs	TwinsUK Miseq	Nick	MiSeq	This analysis was done as in Caporaso et al 2011 Genome research. The PCR primers F515 and R806 were developed against the V4 region of the 16S rRNA, both bacteria and archaea, which we determined would yield optimal community clustering with reads of this length The reverse PCR primer is barcoded with a 12-base error-correcting Golay code to facilitate multiplexing of up to 1,500 samples per lane, and both PCR primers contain sequencer adapter regions.	GT	FWD:GTGCCAGCMGCCGCGGTAA; REV:GGACTACHVGGGTWTCTAAT	Plate6	Illumina	V4	Cornell	1/31/13	TwinsUKPlate6	0.1,gram	Kings College London	sequencing by synthesis	16S rRNA	V4	D6	72	years	0	6971	UBERON:feces	25.36101913	UBERON:feces	UBERON:feces	3/13/11	2011-03-13 20:15:00	20:15:00	GAZ:United Kingdom	1/4/39	0	true	10.4516	ENVO:dense settlement biome	ENVO:human-associated habitat	true	697	human	Homo sapiens	6971	9606	6971	51.5	-0.12	true	Cornell	true	false	King's College, London, UK	Stool	female	3	1002746	TwinsUK gut microbiome	MZ	TwinsUK Fecal Sample
2014.Plate6.4	CATCTGGGCAAT	GTGCCAGCMGCCGCGGTAA	20.028	Cornell	UK_Twins	Cornell	fecal samples from TwinsUK MiSeq runs	TwinsUK Miseq	Nick	MiSeq	This analysis was done as in Caporaso et al 2011 Genome research. The PCR primers F515 and R806 were developed against the V4 region of the 16S rRNA, both bacteria and archaea, which we determined would yield optimal community clustering with reads of this length The reverse PCR primer is barcoded with a 12-base error-correcting Golay code to facilitate multiplexing of up to 1,500 samples per lane, and both PCR primers contain sequencer adapter regions.	GT	FWD:GTGCCAGCMGCCGCGGTAA; REV:GGACTACHVGGGTWTCTAAT	Plate6	Illumina	V4	Cornell	1/31/13	TwinsUKPlate6	0.1,gram	Kings College London	sequencing by synthesis	16S rRNA	V4	A4	59	years	0	7892	UBERON:feces	25.67811012	UBERON:feces	UBERON:feces	1/7/11	2011-01-07 15:10:00	15:10:00	GAZ:United Kingdom	6/7/51	0	true	10.4516	ENVO:dense settlement biome	ENVO:human-associated habitat	true	789	human	Homo sapiens	7892	9606	7892	51.5	-0.12	true	Cornell	true	false	King's College, London, UK	Stool	female	2	1002484	TwinsUK gut microbiome	DZ	TwinsUK Fecal Sample
2014.Plate6.39	GACCGTCAATAC	GTGCCAGCMGCCGCGGTAA	24.984	Cornell	UK_Twins	Cornell	fecal samples from TwinsUK MiSeq runs	TwinsUK Miseq	Nick	MiSeq	This analysis was done as in Caporaso et al 2011 Genome research. The PCR primers F515 and R806 were developed against the V4 region of the 16S rRNA, both bacteria and archaea, which we determined would yield optimal community clustering with reads of this length The reverse PCR primer is barcoded with a 12-base error-correcting Golay code to facilitate multiplexing of up to 1,500 samples per lane, and both PCR primers contain sequencer adapter regions.	GT	FWD:GTGCCAGCMGCCGCGGTAA; REV:GGACTACHVGGGTWTCTAAT	Plate6	Illumina	V4	Cornell	1/31/13	TwinsUKPlate6	0.1,gram	Kings College London	sequencing by synthesis	16S rRNA	V4	D5	70	years	0	5851	UBERON:feces	24.67931938	UBERON:feces	UBERON:feces	3/9/11	2011-03-09 07:00:00	7:00:00	GAZ:United Kingdom	2/1/41	0	true	10.4516	ENVO:dense settlement biome	ENVO:human-associated habitat	true	585	human	Homo sapiens	5851	9606	5851	51.5	-0.12	true	Cornell	true	false	King's College, London, UK	Stool	female	3	1002743	TwinsUK gut microbiome	DZ	TwinsUK Fecal Sample
2014.Plate6.38	GGAAATCCCATC	GTGCCAGCMGCCGCGGTAA	21.783	Cornell	UK_Twins	Cornell	fecal samples from TwinsUK MiSeq runs	TwinsUK Miseq	Nick	MiSeq	This analysis was done as in Caporaso et al 2011 Genome research. The PCR primers F515 and R806 were developed against the V4 region of the 16S rRNA, both bacteria and archaea, which we determined would yield optimal community clustering with reads of this length The reverse PCR primer is barcoded with a 12-base error-correcting Golay code to facilitate multiplexing of up to 1,500 samples per lane, and both PCR primers contain sequencer adapter regions.	GT	FWD:GTGCCAGCMGCCGCGGTAA; REV:GGACTACHVGGGTWTCTAAT	Plate6	Illumina	V4	Cornell	1/31/13	TwinsUKPlate6	0.1,gram	Kings College London	sequencing by synthesis	16S rRNA	V4	D4	39	years	0	8292	UBERON:feces	28.99710083	UBERON:feces	UBERON:feces	4/15/11	2011-04-15 07:20:00	7:20:00	GAZ:United Kingdom	7/7/71	0	true	10.4516	ENVO:dense settlement biome	ENVO:human-associated habitat	true	829	human	Homo sapiens	8292	9606	8292	51.5	-0.12	true	Cornell	true	false	King's College, London, UK	Stool	female	3	1002675	TwinsUK gut microbiome	DZ	TwinsUK Fecal Sample
2014.Plate6.36	GATCTAATCGAG	GTGCCAGCMGCCGCGGTAA	29.217	Cornell	UK_Twins	Cornell	fecal samples from TwinsUK MiSeq runs	TwinsUK Miseq	Nick	MiSeq	This analysis was done as in Caporaso et al 2011 Genome research. The PCR primers F515 and R806 were developed against the V4 region of the 16S rRNA, both bacteria and archaea, which we determined would yield optimal community clustering with reads of this length The reverse PCR primer is barcoded with a 12-base error-correcting Golay code to facilitate multiplexing of up to 1,500 samples per lane, and both PCR primers contain sequencer adapter regions.	GT	FWD:GTGCCAGCMGCCGCGGTAA; REV:GGACTACHVGGGTWTCTAAT	Plate6	Illumina	V4	Cornell	1/31/13	TwinsUKPlate6	0.1,gram	Kings College London	sequencing by synthesis	16S rRNA	V4	D2	46	years	0	4102	UBERON:feces	20.56331062	UBERON:feces	UBERON:feces	4/21/11	2011-04-21 07:30:00	7:30:00	GAZ:United Kingdom	9/5/64	0	true	10.4516	ENVO:dense settlement biome	ENVO:human-associated habitat	true	410	human	Homo sapiens	4102	9606	4102	51.5	-0.12	true	Cornell	true	false	King's College, London, UK	Stool	female	3	1002678	TwinsUK gut microbiome	MZ	TwinsUK Fecal Sample
2014.Plate6.35	GCATGCATCCCA	GTGCCAGCMGCCGCGGTAA	56.631	Cornell	UK_Twins	Cornell	fecal samples from TwinsUK MiSeq runs	TwinsUK Miseq	Nick	MiSeq	This analysis was done as in Caporaso et al 2011 Genome research. The PCR primers F515 and R806 were developed against the V4 region of the 16S rRNA, both bacteria and archaea, which we determined would yield optimal community clustering with reads of this length The reverse PCR primer is barcoded with a 12-base error-correcting Golay code to facilitate multiplexing of up to 1,500 samples per lane, and both PCR primers contain sequencer adapter regions.	GT	FWD:GTGCCAGCMGCCGCGGTAA; REV:GGACTACHVGGGTWTCTAAT	Plate6	Illumina	V4	Cornell	1/31/13	TwinsUKPlate6	0.1,gram	Kings College London	sequencing by synthesis	16S rRNA	V4	D1	46	years	0	4101	UBERON:feces	22.16609001	UBERON:feces	UBERON:feces	4/21/11	2011-04-21 00:00:00		GAZ:United Kingdom	9/5/64	0	true	10.4516	ENVO:dense settlement biome	ENVO:human-associated habitat	true	410	human	Homo sapiens	4101	9606	4101	51.5	-0.12	true	Cornell	true	false	King's College, London, UK	Stool	female	3	1002677	TwinsUK gut microbiome	MZ	TwinsUK Fecal Sample
2014.Plate6.33	AAGATCGTACTG	GTGCCAGCMGCCGCGGTAA	34.174	Cornell	UK_Twins	Cornell	fecal samples from TwinsUK MiSeq runs	TwinsUK Miseq	Nick	MiSeq	This analysis was done as in Caporaso et al 2011 Genome research. The PCR primers F515 and R806 were developed against the V4 region of the 16S rRNA, both bacteria and archaea, which we determined would yield optimal community clustering with reads of this length The reverse PCR primer is barcoded with a 12-base error-correcting Golay code to facilitate multiplexing of up to 1,500 samples per lane, and both PCR primers contain sequencer adapter regions.	GT	FWD:GTGCCAGCMGCCGCGGTAA; REV:GGACTACHVGGGTWTCTAAT	Plate6	Illumina	V4	Cornell	1/31/13	TwinsUKPlate6	0.1,gram	Kings College London	sequencing by synthesis	16S rRNA	V4	C10	59	years	0	5101	UBERON:feces	26.05862999	UBERON:feces	UBERON:feces	4/19/11	2011-04-19 11:00:00	11:00:00	GAZ:United Kingdom	7/29/51	0	true	10.4516	ENVO:dense settlement biome	ENVO:human-associated habitat	true	510	human	Homo sapiens	5101	9606	5101	51.5	-0.12	true	Cornell	true	false	King's College, London, UK	Stool	female	3	1002680	TwinsUK gut microbiome	DZ	TwinsUK Fecal Sample
2014.Plate6.32	TACGCCCATCAG	GTGCCAGCMGCCGCGGTAA	37.065	Cornell	UK_Twins	Cornell	fecal samples from TwinsUK MiSeq runs	TwinsUK Miseq	Nick	MiSeq	This analysis was done as in Caporaso et al 2011 Genome research. The PCR primers F515 and R806 were developed against the V4 region of the 16S rRNA, both bacteria and archaea, which we determined would yield optimal community clustering with reads of this length The reverse PCR primer is barcoded with a 12-base error-correcting Golay code to facilitate multiplexing of up to 1,500 samples per lane, and both PCR primers contain sequencer adapter regions.	GT	FWD:GTGCCAGCMGCCGCGGTAA; REV:GGACTACHVGGGTWTCTAAT	Plate6	Illumina	V4	Cornell	1/31/13	TwinsUKPlate6	0.1,gram	Kings College London	sequencing by synthesis	16S rRNA	V4	C9	59	years	0	5102	UBERON:feces	28.65199089	UBERON:feces	UBERON:feces	4/19/11	2011-04-19 07:30:00	7:30:00	GAZ:United Kingdom	7/29/51	0	true	10.4516	ENVO:dense settlement biome	ENVO:human-associated habitat	true	510	human	Homo sapiens	5102	9606	5102	51.5	-0.12	true	Cornell	true	false	King's College, London, UK	Stool	female	3	1002681	TwinsUK gut microbiome	DZ	TwinsUK Fecal Sample
2014.Plate6.31	ATCGGGCTTAAC	GTGCCAGCMGCCGCGGTAA	42.33	Cornell	UK_Twins	Cornell	fecal samples from TwinsUK MiSeq runs	TwinsUK Miseq	Nick	MiSeq	This analysis was done as in Caporaso et al 2011 Genome research. The PCR primers F515 and R806 were developed against the V4 region of the 16S rRNA, both bacteria and archaea, which we determined would yield optimal community clustering with reads of this length The reverse PCR primer is barcoded with a 12-base error-correcting Golay code to facilitate multiplexing of up to 1,500 samples per lane, and both PCR primers contain sequencer adapter regions.	GT	FWD:GTGCCAGCMGCCGCGGTAA; REV:GGACTACHVGGGTWTCTAAT	Plate6	Illumina	V4	Cornell	1/31/13	TwinsUKPlate6	0.1,gram	Kings College London	sequencing by synthesis	16S rRNA	V4	C8	71	years	0	7022	UBERON:feces	25.47533989	UBERON:feces	UBERON:feces	3/31/11	2011-03-31 09:40:00	9:40:00	GAZ:United Kingdom	12/12/39	0	true	10.4516	ENVO:dense settlement biome	ENVO:human-associated habitat	true	702	human	Homo sapiens	7022	9606	7022	51.5	-0.12	true	Cornell	true	false	King's College, London, UK	Stool	female	3	1002685	TwinsUK gut microbiome	MZ	TwinsUK Fecal Sample
2014.Plate6.30	GAAACTCCTAGA	GTGCCAGCMGCCGCGGTAA	30.56	Cornell	UK_Twins	Cornell	fecal samples from TwinsUK MiSeq runs	TwinsUK Miseq	Nick	MiSeq	This analysis was done as in Caporaso et al 2011 Genome research. The PCR primers F515 and R806 were developed against the V4 region of the 16S rRNA, both bacteria and archaea, which we determined would yield optimal community clustering with reads of this length The reverse PCR primer is barcoded with a 12-base error-correcting Golay code to facilitate multiplexing of up to 1,500 samples per lane, and both PCR primers contain sequencer adapter regions.	GT	FWD:GTGCCAGCMGCCGCGGTAA; REV:GGACTACHVGGGTWTCTAAT	Plate6	Illumina	V4	Cornell	1/31/13	TwinsUKPlate6	0.1,gram	Kings College London	sequencing by synthesis	16S rRNA	V4	C7	58	years	0	5602	UBERON:feces	36.16321945	UBERON:feces	UBERON:feces	4/15/11	2011-04-15 09:05:00	9:05:00	GAZ:United Kingdom	10/29/52	0	true	10.4516	ENVO:dense settlement biome	ENVO:human-associated habitat	true	560	human	Homo sapiens	5602	9606	5602	51.5	-0.12	true	Cornell	true	false	King's College, London, UK	Stool	female	3	1002682	TwinsUK gut microbiome	DZ	TwinsUK Fecal Sample
2014.Plate6.3	TCTAACGAGTGC	GTGCCAGCMGCCGCGGTAA	33.554	Cornell	UK_Twins	Cornell	fecal samples from TwinsUK MiSeq runs	TwinsUK Miseq	Nick	MiSeq	This analysis was done as in Caporaso et al 2011 Genome research. The PCR primers F515 and R806 were developed against the V4 region of the 16S rRNA, both bacteria and archaea, which we determined would yield optimal community clustering with reads of this length The reverse PCR primer is barcoded with a 12-base error-correcting Golay code to facilitate multiplexing of up to 1,500 samples per lane, and both PCR primers contain sequencer adapter regions.	GT	FWD:GTGCCAGCMGCCGCGGTAA; REV:GGACTACHVGGGTWTCTAAT	Plate6	Illumina	V4	Cornell	1/31/13	TwinsUKPlate6	0.1,gram	Kings College London	sequencing by synthesis	16S rRNA	V4	A3	72	years	0	7011	UBERON:feces	28.36537933	UBERON:feces	UBERON:feces	1/17/11	2011-01-17 16:30:00	16:30:00	GAZ:United Kingdom	3/26/38	0	true	10.4516	ENVO:dense settlement biome	ENVO:human-associated habitat	true	701	human	Homo sapiens	7011	9606	7011	51.5	-0.12	true	Cornell	true	false	King's College, London, UK	Stool	female	2	1002480	TwinsUK gut microbiome	MZ	TwinsUK Fecal Sample
2014.Plate6.29	GCGTAGAGAGAC	GTGCCAGCMGCCGCGGTAA	27.565	Cornell	UK_Twins	Cornell	fecal samples from TwinsUK MiSeq runs	TwinsUK Miseq	Nick	MiSeq	This analysis was done as in Caporaso et al 2011 Genome research. The PCR primers F515 and R806 were developed against the V4 region of the 16S rRNA, both bacteria and archaea, which we determined would yield optimal community clustering with reads of this length The reverse PCR primer is barcoded with a 12-base error-correcting Golay code to facilitate multiplexing of up to 1,500 samples per lane, and both PCR primers contain sequencer adapter regions.	GT	FWD:GTGCCAGCMGCCGCGGTAA; REV:GGACTACHVGGGTWTCTAAT	Plate6	Illumina	V4	Cornell	1/31/13	TwinsUKPlate6	0.1,gram	Kings College London	sequencing by synthesis	16S rRNA	V4	C6	77	years	0	8492	UBERON:feces	23.38120079	UBERON:feces	UBERON:feces	4/19/11	2011-04-19 22:45:00	22:45:00	GAZ:United Kingdom	8/2/33	0	true	10.4516	ENVO:dense settlement biome	ENVO:human-associated habitat	true	849	human	Homo sapiens	8492	9606	8492	51.5	-0.12	true	Cornell	true	false	King's College, London, UK	Stool	female	3	1002673	TwinsUK gut microbiome	MZ	TwinsUK Fecal Sample
2014.Plate6.28	TCCAGGGCTATA	GTGCCAGCMGCCGCGGTAA	11.974	Cornell	UK_Twins	Cornell	fecal samples from TwinsUK MiSeq runs	TwinsUK Miseq	Nick	MiSeq	This analysis was done as in Caporaso et al 2011 Genome research. The PCR primers F515 and R806 were developed against the V4 region of the 16S rRNA, both bacteria and archaea, which we determined would yield optimal community clustering with reads of this length The reverse PCR primer is barcoded with a 12-base error-correcting Golay code to facilitate multiplexing of up to 1,500 samples per lane, and both PCR primers contain sequencer adapter regions.	GT	FWD:GTGCCAGCMGCCGCGGTAA; REV:GGACTACHVGGGTWTCTAAT	Plate6	Illumina	V4	Cornell	1/31/13	TwinsUKPlate6	0.1,gram	Kings College London	sequencing by synthesis	16S rRNA	V4	C5	61	years	0	4252	UBERON:feces	21.42683029	UBERON:feces	UBERON:feces	3/30/11	2011-03-30 07:30:00	7:30:00	GAZ:United Kingdom	2/13/50	0	true	10.4516	ENVO:dense settlement biome	ENVO:human-associated habitat	true	425	human	Homo sapiens	4252	9606	4252	51.5	-0.12	true	Cornell	true	false	King's College, London, UK	Stool	female	3	1002679	TwinsUK gut microbiome	MZ	TwinsUK Fecal Sample
2014.Plate6.27	TTGGACGTCCAC	GTGCCAGCMGCCGCGGTAA	30.043	Cornell	UK_Twins	Cornell	fecal samples from TwinsUK MiSeq runs	TwinsUK Miseq	Nick	MiSeq	This analysis was done as in Caporaso et al 2011 Genome research. The PCR primers F515 and R806 were developed against the V4 region of the 16S rRNA, both bacteria and archaea, which we determined would yield optimal community clustering with reads of this length The reverse PCR primer is barcoded with a 12-base error-correcting Golay code to facilitate multiplexing of up to 1,500 samples per lane, and both PCR primers contain sequencer adapter regions.	GT	FWD:GTGCCAGCMGCCGCGGTAA; REV:GGACTACHVGGGTWTCTAAT	Plate6	Illumina	V4	Cornell	1/31/13	TwinsUKPlate6	0.1,gram	Kings College London	sequencing by synthesis	16S rRNA	V4	C4	43	years	0	8301	UBERON:feces	34.83662033	UBERON:feces	UBERON:feces	4/17/11	2011-04-17 21:40:00	21:40:00	GAZ:United Kingdom	8/8/67	0	true	10.4516	ENVO:dense settlement biome	ENVO:human-associated habitat	true	830	human	Homo sapiens	8301	9606	8301	51.5	-0.12	true	Cornell	true	false	King's College, London, UK	Stool	female	3	1002676	TwinsUK gut microbiome	DZ	TwinsUK Fecal Sample
2014.Plate6.25	TCACTTGGTGCG	GTGCCAGCMGCCGCGGTAA	35.413	Cornell	UK_Twins	Cornell	fecal samples from TwinsUK MiSeq runs	TwinsUK Miseq	Nick	MiSeq	This analysis was done as in Caporaso et al 2011 Genome research. The PCR primers F515 and R806 were developed against the V4 region of the 16S rRNA, both bacteria and archaea, which we determined would yield optimal community clustering with reads of this length The reverse PCR primer is barcoded with a 12-base error-correcting Golay code to facilitate multiplexing of up to 1,500 samples per lane, and both PCR primers contain sequencer adapter regions.	GT	FWD:GTGCCAGCMGCCGCGGTAA; REV:GGACTACHVGGGTWTCTAAT	Plate6	Illumina	V4	Cornell	1/31/13	TwinsUKPlate6	0.1,gram	Kings College London	sequencing by synthesis	16S rRNA	V4	C2	71	years	0	8421	UBERON:feces	28.78906059	UBERON:feces	UBERON:feces	4/18/11	2011-04-18 15:40:00	15:40:00	GAZ:United Kingdom	7/27/39	0	true	10.4516	ENVO:dense settlement biome	ENVO:human-associated habitat	true	842	human	Homo sapiens	8421	9606	8421	51.5	-0.12	true	Cornell	true	false	King's College, London, UK	Stool	female	3	1002671	TwinsUK gut microbiome	DZ	TwinsUK Fecal Sample
2014.Plate6.24	TCCGCAACCTGA	GTGCCAGCMGCCGCGGTAA	54.692	Cornell	UK_Twins	Cornell	fecal samples from TwinsUK MiSeq runs	TwinsUK Miseq	Nick	MiSeq	This analysis was done as in Caporaso et al 2011 Genome research. The PCR primers F515 and R806 were developed against the V4 region of the 16S rRNA, both bacteria and archaea, which we determined would yield optimal community clustering with reads of this length The reverse PCR primer is barcoded with a 12-base error-correcting Golay code to facilitate multiplexing of up to 1,500 samples per lane, and both PCR primers contain sequencer adapter regions.	GT	FWD:GTGCCAGCMGCCGCGGTAA; REV:GGACTACHVGGGTWTCTAAT	Plate6	Illumina	V4	Cornell	1/31/13	TwinsUKPlate6	0.1,gram	Kings College London	sequencing by synthesis	16S rRNA	V4	C1	70	years	0	7741	UBERON:feces	34.1608696	UBERON:feces	UBERON:feces	1/16/11	2011-01-16 07:50:00	7:50:00	GAZ:United Kingdom	2/27/40	0	true	10.4516	ENVO:dense settlement biome	ENVO:human-associated habitat	true	774	human	Homo sapiens	7741	9606	7741	51.5	-0.12	true	Cornell	true	false	King's College, London, UK	Stool	female	2	1002482	TwinsUK gut microbiome	DZ	TwinsUK Fecal Sample
2014.Plate6.23	AGACAAGCTTCC	GTGCCAGCMGCCGCGGTAA	38.097	Cornell	UK_Twins	Cornell	fecal samples from TwinsUK MiSeq runs	TwinsUK Miseq	Nick	MiSeq	This analysis was done as in Caporaso et al 2011 Genome research. The PCR primers F515 and R806 were developed against the V4 region of the 16S rRNA, both bacteria and archaea, which we determined would yield optimal community clustering with reads of this length The reverse PCR primer is barcoded with a 12-base error-correcting Golay code to facilitate multiplexing of up to 1,500 samples per lane, and both PCR primers contain sequencer adapter regions.	GT	FWD:GTGCCAGCMGCCGCGGTAA; REV:GGACTACHVGGGTWTCTAAT	Plate6	Illumina	V4	Cornell	1/31/13	TwinsUKPlate6	0.1,gram	Kings College London	sequencing by synthesis	16S rRNA	V4	B12	54	years	0	7101	UBERON:feces	24.23196983	UBERON:feces	UBERON:feces	2/11/11	2011-02-11 05:53:00	5:53:00	GAZ:United Kingdom	3/14/56	0	true	10.4516	ENVO:dense settlement biome	ENVO:human-associated habitat	true	710	human	Homo sapiens	7101	9606	7101	51.5	-0.12	true	Cornell	true	false	King's College, London, UK	Stool	female	2	1002558	TwinsUK gut microbiome	DZ	TwinsUK Fecal Sample
2014.Plate6.22	TAGACACCGTGT	GTGCCAGCMGCCGCGGTAA	14.04	Cornell	UK_Twins	Cornell	fecal samples from TwinsUK MiSeq runs	TwinsUK Miseq	Nick	MiSeq	This analysis was done as in Caporaso et al 2011 Genome research. The PCR primers F515 and R806 were developed against the V4 region of the 16S rRNA, both bacteria and archaea, which we determined would yield optimal community clustering with reads of this length The reverse PCR primer is barcoded with a 12-base error-correcting Golay code to facilitate multiplexing of up to 1,500 samples per lane, and both PCR primers contain sequencer adapter regions.	GT	FWD:GTGCCAGCMGCCGCGGTAA; REV:GGACTACHVGGGTWTCTAAT	Plate6	Illumina	V4	Cornell	1/31/13	TwinsUKPlate6	0.1,gram	Kings College London	sequencing by synthesis	16S rRNA	V4	B11	67	years	0	5971	UBERON:feces	21.55837059	UBERON:feces	UBERON:feces	1/18/11	2011-01-18 07:15:00	7:15:00	GAZ:United Kingdom	5/4/43	0	true	10.4516	ENVO:dense settlement biome	ENVO:human-associated habitat	true	597	human	Homo sapiens	5971	9606	5971	51.5	-0.12	true	Cornell	true	false	King's College, London, UK	Stool	female	2	1002478	TwinsUK gut microbiome	DZ	TwinsUK Fecal Sample
2014.Plate6.21	TCTCGATAAGCG	GTGCCAGCMGCCGCGGTAA	39.233	Cornell	UK_Twins	Cornell	fecal samples from TwinsUK MiSeq runs	TwinsUK Miseq	Nick	MiSeq	This analysis was done as in Caporaso et al 2011 Genome research. The PCR primers F515 and R806 were developed against the V4 region of the 16S rRNA, both bacteria and archaea, which we determined would yield optimal community clustering with reads of this length The reverse PCR primer is barcoded with a 12-base error-correcting Golay code to facilitate multiplexing of up to 1,500 samples per lane, and both PCR primers contain sequencer adapter regions.	GT	FWD:GTGCCAGCMGCCGCGGTAA; REV:GGACTACHVGGGTWTCTAAT	Plate6	Illumina	V4	Cornell	1/31/13	TwinsUKPlate6	0.1,gram	Kings College London	sequencing by synthesis	16S rRNA	V4	B10	64	years	0	7961	UBERON:feces	23.72100067	UBERON:feces	UBERON:feces	2/8/11	2011-02-08 07:30:00	7:30:00	GAZ:United Kingdom	9/19/46	0	true	10.4516	ENVO:dense settlement biome	ENVO:human-associated habitat	true	796	human	Homo sapiens	7961	9606	7961	51.5	-0.12	true	Cornell	true	false	King's College, London, UK	Stool	female	2	1002561	TwinsUK gut microbiome	DZ	TwinsUK Fecal Sample
2014.Plate6.20	CACGAGCTACTC	GTGCCAGCMGCCGCGGTAA	29.011	Cornell	UK_Twins	Cornell	fecal samples from TwinsUK MiSeq runs	TwinsUK Miseq	Nick	MiSeq	This analysis was done as in Caporaso et al 2011 Genome research. The PCR primers F515 and R806 were developed against the V4 region of the 16S rRNA, both bacteria and archaea, which we determined would yield optimal community clustering with reads of this length The reverse PCR primer is barcoded with a 12-base error-correcting Golay code to facilitate multiplexing of up to 1,500 samples per lane, and both PCR primers contain sequencer adapter regions.	GT	FWD:GTGCCAGCMGCCGCGGTAA; REV:GGACTACHVGGGTWTCTAAT	Plate6	Illumina	V4	Cornell	1/31/13	TwinsUKPlate6	0.1,gram	Kings College London	sequencing by synthesis	16S rRNA	V4	B9	47	years	0	4461	UBERON:feces	20.49490929	UBERON:feces	UBERON:feces	2/6/11	2011-02-06 23:30:00	23:30:00	GAZ:United Kingdom	6/19/63	0	true	10.4516	ENVO:dense settlement biome	ENVO:human-associated habitat	true	446	human	Homo sapiens	4461	9606	4461	51.5	-0.12	true	Cornell	true	false	King's College, London, UK	Stool	female	2	1002547	TwinsUK gut microbiome	DZ	TwinsUK Fecal Sample
2014.Plate6.2	GTCGGAAATTGT	GTGCCAGCMGCCGCGGTAA	46.873	Cornell	UK_Twins	Cornell	fecal samples from TwinsUK MiSeq runs	TwinsUK Miseq	Nick	MiSeq	This analysis was done as in Caporaso et al 2011 Genome research. The PCR primers F515 and R806 were developed against the V4 region of the 16S rRNA, both bacteria and archaea, which we determined would yield optimal community clustering with reads of this length The reverse PCR primer is barcoded with a 12-base error-correcting Golay code to facilitate multiplexing of up to 1,500 samples per lane, and both PCR primers contain sequencer adapter regions.	GT	FWD:GTGCCAGCMGCCGCGGTAA; REV:GGACTACHVGGGTWTCTAAT	Plate6	Illumina	V4	Cornell	1/31/13	TwinsUKPlate6	0.1,gram	Kings College London	sequencing by synthesis	16S rRNA	V4	A2	54	years	0	5172	UBERON:feces	24.92583084	UBERON:feces	UBERON:feces	1/6/11	2011-01-06 23:20:00	23:20:00	GAZ:United Kingdom	12/29/56	0	true	10.4516	ENVO:dense settlement biome	ENVO:human-associated habitat	true	517	human	Homo sapiens	5172	9606	5172	51.5	-0.12	true	Cornell	true	false	King's College, London, UK	Stool	female	2	1002474	TwinsUK gut microbiome	DZ	TwinsUK Fecal Sample
2014.Plate6.19	CACCTGTAGTAG	GTGCCAGCMGCCGCGGTAA	31.592	Cornell	UK_Twins	Cornell	fecal samples from TwinsUK MiSeq runs	TwinsUK Miseq	Nick	MiSeq	This analysis was done as in Caporaso et al 2011 Genome research. The PCR primers F515 and R806 were developed against the V4 region of the 16S rRNA, both bacteria and archaea, which we determined would yield optimal community clustering with reads of this length The reverse PCR primer is barcoded with a 12-base error-correcting Golay code to facilitate multiplexing of up to 1,500 samples per lane, and both PCR primers contain sequencer adapter regions.	GT	FWD:GTGCCAGCMGCCGCGGTAA; REV:GGACTACHVGGGTWTCTAAT	Plate6	Illumina	V4	Cornell	1/31/13	TwinsUKPlate6	0.1,gram	Kings College London	sequencing by synthesis	16S rRNA	V4	B8	57	years	0	6182	UBERON:feces	36.78218842	UBERON:feces	UBERON:feces	1/16/11	2011-01-16 07:40:00	7:40:00	GAZ:United Kingdom	11/6/53	0	true	10.4516	ENVO:dense settlement biome	ENVO:human-associated habitat	true	618	human	Homo sapiens	6182	9606	6182	51.5	-0.12	true	Cornell	true	false	King's College, London, UK	Stool	female	2	1002479	TwinsUK gut microbiome	DZ	TwinsUK Fecal Sample
2014.Plate6.18	GTAGCACTCATG	GTGCCAGCMGCCGCGGTAA	38.304	Cornell	UK_Twins	Cornell	fecal samples from TwinsUK MiSeq runs	TwinsUK Miseq	Nick	MiSeq	This analysis was done as in Caporaso et al 2011 Genome research. The PCR primers F515 and R806 were developed against the V4 region of the 16S rRNA, both bacteria and archaea, which we determined would yield optimal community clustering with reads of this length The reverse PCR primer is barcoded with a 12-base error-correcting Golay code to facilitate multiplexing of up to 1,500 samples per lane, and both PCR primers contain sequencer adapter regions.	GT	FWD:GTGCCAGCMGCCGCGGTAA; REV:GGACTACHVGGGTWTCTAAT	Plate6	Illumina	V4	Cornell	1/31/13	TwinsUKPlate6	0.1,gram	Kings College London	sequencing by synthesis	16S rRNA	V4	B7	64	years	0	7151	UBERON:feces	23.57786942	UBERON:feces	UBERON:feces	2/7/11	2011-02-07 10:00:00	10:00:00	GAZ:United Kingdom	7/10/46	0	true	10.4516	ENVO:dense settlement biome	ENVO:human-associated habitat	true	715	human	Homo sapiens	7151	9606	7151	51.5	-0.12	true	Cornell	true	false	King's College, London, UK	Stool	female	2	1002559	TwinsUK gut microbiome	DZ	TwinsUK Fecal Sample
2014.Plate6.17	GTCTCCTCCCTT	GTGCCAGCMGCCGCGGTAA	33.967	Cornell	UK_Twins	Cornell	fecal samples from TwinsUK MiSeq runs	TwinsUK Miseq	Nick	MiSeq	This analysis was done as in Caporaso et al 2011 Genome research. The PCR primers F515 and R806 were developed against the V4 region of the 16S rRNA, both bacteria and archaea, which we determined would yield optimal community clustering with reads of this length The reverse PCR primer is barcoded with a 12-base error-correcting Golay code to facilitate multiplexing of up to 1,500 samples per lane, and both PCR primers contain sequencer adapter regions.	GT	FWD:GTGCCAGCMGCCGCGGTAA; REV:GGACTACHVGGGTWTCTAAT	Plate6	Illumina	V4	Cornell	1/31/13	TwinsUKPlate6	0.1,gram	Kings College London	sequencing by synthesis	16S rRNA	V4	B6	47	years	0	4651	UBERON:feces	19.66385078	UBERON:feces	UBERON:feces	2/10/11	2011-02-10 18:15:00	18:15:00	GAZ:United Kingdom	5/26/63	0	true	10.4516	ENVO:dense settlement biome	ENVO:human-associated habitat	true	465	human	Homo sapiens	4651	9606	4651	51.5	-0.12	true	Cornell	true	false	King's College, London, UK	Stool	female	2	1002550	TwinsUK gut microbiome	MZ	TwinsUK Fecal Sample
2014.Plate6.16	ACACCGCACAAT	GTGCCAGCMGCCGCGGTAA	30.147	Cornell	UK_Twins	Cornell	fecal samples from TwinsUK MiSeq runs	TwinsUK Miseq	Nick	MiSeq	This analysis was done as in Caporaso et al 2011 Genome research. The PCR primers F515 and R806 were developed against the V4 region of the 16S rRNA, both bacteria and archaea, which we determined would yield optimal community clustering with reads of this length The reverse PCR primer is barcoded with a 12-base error-correcting Golay code to facilitate multiplexing of up to 1,500 samples per lane, and both PCR primers contain sequencer adapter regions.	GT	FWD:GTGCCAGCMGCCGCGGTAA; REV:GGACTACHVGGGTWTCTAAT	Plate6	Illumina	V4	Cornell	1/31/13	TwinsUKPlate6	0.1,gram	Kings College London	sequencing by synthesis	16S rRNA	V4	B5	70	years	0	7742	UBERON:feces	30.99407959	UBERON:feces	UBERON:feces	1/18/11	2011-01-18 08:35:00	8:35:00	GAZ:United Kingdom	2/27/40	0	true	10.4516	ENVO:dense settlement biome	ENVO:human-associated habitat	true	774	human	Homo sapiens	7742	9606	7742	51.5	-0.12	true	Cornell	true	false	King's College, London, UK	Stool	female	2	1002483	TwinsUK gut microbiome	DZ	TwinsUK Fecal Sample
2014.Plate6.15	ATCGATCCACAG	GTGCCAGCMGCCGCGGTAA	46.667	Cornell	UK_Twins	Cornell	fecal samples from TwinsUK MiSeq runs	TwinsUK Miseq	Nick	MiSeq	This analysis was done as in Caporaso et al 2011 Genome research. The PCR primers F515 and R806 were developed against the V4 region of the 16S rRNA, both bacteria and archaea, which we determined would yield optimal community clustering with reads of this length The reverse PCR primer is barcoded with a 12-base error-correcting Golay code to facilitate multiplexing of up to 1,500 samples per lane, and both PCR primers contain sequencer adapter regions.	GT	FWD:GTGCCAGCMGCCGCGGTAA; REV:GGACTACHVGGGTWTCTAAT	Plate6	Illumina	V4	Cornell	1/31/13	TwinsUKPlate6	0.1,gram	Kings College London	sequencing by synthesis	16S rRNA	V4	B4	64	years	0	7962	UBERON:feces	22.53123093	UBERON:feces	UBERON:feces	2/8/11	2011-02-08 09:10:00	9:10:00	GAZ:United Kingdom	9/19/46	0	true	10.4516	ENVO:dense settlement biome	ENVO:human-associated habitat	true	796	human	Homo sapiens	7962	9606	7962	51.5	-0.12	true	Cornell	true	false	King's College, London, UK	Stool	female	2	1002562	TwinsUK gut microbiome	DZ	TwinsUK Fecal Sample
2014.Plate6.14	GGAAGAAGTAGC	GTGCCAGCMGCCGCGGTAA	27.875	Cornell	UK_Twins	Cornell	fecal samples from TwinsUK MiSeq runs	TwinsUK Miseq	Nick	MiSeq	This analysis was done as in Caporaso et al 2011 Genome research. The PCR primers F515 and R806 were developed against the V4 region of the 16S rRNA, both bacteria and archaea, which we determined would yield optimal community clustering with reads of this length The reverse PCR primer is barcoded with a 12-base error-correcting Golay code to facilitate multiplexing of up to 1,500 samples per lane, and both PCR primers contain sequencer adapter regions.	GT	FWD:GTGCCAGCMGCCGCGGTAA; REV:GGACTACHVGGGTWTCTAAT	Plate6	Illumina	V4	Cornell	1/31/13	TwinsUKPlate6	0.1,gram	Kings College London	sequencing by synthesis	16S rRNA	V4	B3	61	years	0	4632	UBERON:feces	28.71369934	UBERON:feces	UBERON:feces	2/13/11	2011-02-13 12:45:00	12:45:00	GAZ:United Kingdom	5/20/49	0	true	10.4516	ENVO:dense settlement biome	ENVO:human-associated habitat	true	463	human	Homo sapiens	4632	9606	4632	51.5	-0.12	true	Cornell	true	false	King's College, London, UK	Stool	female	2	1002549	TwinsUK gut microbiome	DZ	TwinsUK Fecal Sample
2014.Plate6.13	GACTCAACCAGT	GTGCCAGCMGCCGCGGTAA	15.898	Cornell	UK_Twins	Cornell	fecal samples from TwinsUK MiSeq runs	TwinsUK Miseq	Nick	MiSeq	This analysis was done as in Caporaso et al 2011 Genome research. The PCR primers F515 and R806 were developed against the V4 region of the 16S rRNA, both bacteria and archaea, which we determined would yield optimal community clustering with reads of this length The reverse PCR primer is barcoded with a 12-base error-correcting Golay code to facilitate multiplexing of up to 1,500 samples per lane, and both PCR primers contain sequencer adapter regions.	GT	FWD:GTGCCAGCMGCCGCGGTAA; REV:GGACTACHVGGGTWTCTAAT	Plate6	Illumina	V4	Cornell	1/31/13	TwinsUKPlate6	0.1,gram	Kings College London	sequencing by synthesis	16S rRNA	V4	B2	67	years	0	8212	UBERON:feces	25.49752998	UBERON:feces	UBERON:feces	1/13/11	2011-01-13 14:45:00	14:45:00	GAZ:United Kingdom	8/29/43	0	true	10.4516	ENVO:dense settlement biome	ENVO:human-associated habitat	true	821	human	Homo sapiens	8212	9606	8212	51.5	-0.12	true	Cornell	true	false	King's College, London, UK	Stool	female	2	1002472	TwinsUK gut microbiome	DZ	TwinsUK Fecal Sample
2014.Plate6.11	TGGAGAGGAGAT	GTGCCAGCMGCCGCGGTAA	36.961	Cornell	UK_Twins	Cornell	fecal samples from TwinsUK MiSeq runs	TwinsUK Miseq	Nick	MiSeq	This analysis was done as in Caporaso et al 2011 Genome research. The PCR primers F515 and R806 were developed against the V4 region of the 16S rRNA, both bacteria and archaea, which we determined would yield optimal community clustering with reads of this length The reverse PCR primer is barcoded with a 12-base error-correcting Golay code to facilitate multiplexing of up to 1,500 samples per lane, and both PCR primers contain sequencer adapter regions.	GT	FWD:GTGCCAGCMGCCGCGGTAA; REV:GGACTACHVGGGTWTCTAAT	Plate6	Illumina	V4	Cornell	1/31/13	TwinsUKPlate6	0.1,gram	Kings College London	sequencing by synthesis	16S rRNA	V4	A11	64	years	0	5891	UBERON:feces	25.89237022	UBERON:feces	UBERON:feces	2/8/11	2011-02-08 19:15:00	19:15:00	GAZ:United Kingdom	8/16/46	0	true	10.4516	ENVO:dense settlement biome	ENVO:human-associated habitat	true	589	human	Homo sapiens	5891	9606	5891	51.5	-0.12	true	Cornell	true	false	King's College, London, UK	Stool	female	2	1002553	TwinsUK gut microbiome	DZ	TwinsUK Fecal Sample
2014.Plate6.10	GTAGTGTCAACA	GTGCCAGCMGCCGCGGTAA	39.543	Cornell	UK_Twins	Cornell	fecal samples from TwinsUK MiSeq runs	TwinsUK Miseq	Nick	MiSeq	This analysis was done as in Caporaso et al 2011 Genome research. The PCR primers F515 and R806 were developed against the V4 region of the 16S rRNA, both bacteria and archaea, which we determined would yield optimal community clustering with reads of this length The reverse PCR primer is barcoded with a 12-base error-correcting Golay code to facilitate multiplexing of up to 1,500 samples per lane, and both PCR primers contain sequencer adapter regions.	GT	FWD:GTGCCAGCMGCCGCGGTAA; REV:GGACTACHVGGGTWTCTAAT	Plate6	Illumina	V4	Cornell	1/31/13	TwinsUKPlate6	0.1,gram	Kings College London	sequencing by synthesis	16S rRNA	V4	A10	61	years	0	7251	UBERON:feces	20.29243088	UBERON:feces	UBERON:feces	1/12/11	2011-01-12 08:55:00	8:55:00	GAZ:United Kingdom	7/20/49	0	true	10.4516	ENVO:dense settlement biome	ENVO:human-associated habitat	true	725	human	Homo sapiens	7251	9606	7251	51.5	-0.12	true	Cornell	true	false	King's College, London, UK	Stool	female	2	1002481	TwinsUK gut microbiome	MZ	TwinsUK Fecal Sample
2014.Plate6.1	ACGTAACCACGT	GTGCCAGCMGCCGCGGTAA	34.721	Cornell	UK_Twins	Cornell	fecal samples from TwinsUK MiSeq runs	TwinsUK Miseq	Nick	MiSeq	This analysis was done as in Caporaso et al 2011 Genome research. The PCR primers F515 and R806 were developed against the V4 region of the 16S rRNA, both bacteria and archaea, which we determined would yield optimal community clustering with reads of this length The reverse PCR primer is barcoded with a 12-base error-correcting Golay code to facilitate multiplexing of up to 1,500 samples per lane, and both PCR primers contain sequencer adapter regions.	GT	FWD:GTGCCAGCMGCCGCGGTAA; REV:GGACTACHVGGGTWTCTAAT	Plate6	Illumina	V4	Cornell	1/31/13	TwinsUKPlate6	0.1,gram	Kings College London	sequencing by synthesis	16S rRNA	V4	A1	46	years	0	7341	UBERON:feces	31.66786003	UBERON:feces	UBERON:feces	2/23/11	2011-02-23 00:00:00		GAZ:United Kingdom	1/14/65	0	true	10.4516	ENVO:dense settlement biome	ENVO:human-associated habitat	true	734	human	Homo sapiens	7341	9606	7341	51.5	-0.12	true	Cornell	true	false	King's College, London, UK	Stool	female	2	1002621	TwinsUK gut microbiome	MZ	TwinsUK Fecal Sample
2014.Plate5.94	CGTGGGCTCATT	GTGCCAGCMGCCGCGGTAA	26.799	Cornell	UK_Twins	Cornell	fecal samples from TwinsUK MiSeq runs	TwinsUK Miseq	Nick	MiSeq	This analysis was done as in Caporaso et al 2011 Genome research. The PCR primers F515 and R806 were developed against the V4 region of the 16S rRNA, both bacteria and archaea, which we determined would yield optimal community clustering with reads of this length The reverse PCR primer is barcoded with a 12-base error-correcting Golay code to facilitate multiplexing of up to 1,500 samples per lane, and both PCR primers contain sequencer adapter regions.	GT	FWD:GTGCCAGCMGCCGCGGTAA; REV:GGACTACHVGGGTWTCTAAT	Plate5	Illumina	V4	Cornell	1/25/13	TwinsUKPlate5	0.1,gram	Kings College London	sequencing by synthesis	16S rRNA	V4	H12	70	years	0	5611	UBERON:feces	23.87111092	UBERON:feces	UBERON:feces	2/24/11	2011-02-24 08:30:00	8:30:00	GAZ:United Kingdom	5/21/40	0	true	10.4516	ENVO:dense settlement biome	ENVO:human-associated habitat	true	561	human	Homo sapiens	5611	9606	5611	51.5	-0.12	true	Cornell	true	false	King's College, London, UK	Stool	female	2	1002617	TwinsUK gut microbiome	DZ	TwinsUK Fecal Sample
2014.Plate5.93	GTGAGGGCAAGT	GTGCCAGCMGCCGCGGTAA	31.702	Cornell	UK_Twins	Cornell	fecal samples from TwinsUK MiSeq runs	TwinsUK Miseq	Nick	MiSeq	This analysis was done as in Caporaso et al 2011 Genome research. The PCR primers F515 and R806 were developed against the V4 region of the 16S rRNA, both bacteria and archaea, which we determined would yield optimal community clustering with reads of this length The reverse PCR primer is barcoded with a 12-base error-correcting Golay code to facilitate multiplexing of up to 1,500 samples per lane, and both PCR primers contain sequencer adapter regions.	GT	FWD:GTGCCAGCMGCCGCGGTAA; REV:GGACTACHVGGGTWTCTAAT	Plate5	Illumina	V4	Cornell	1/25/13	TwinsUKPlate5	0.1,gram	Kings College London	sequencing by synthesis	16S rRNA	V4	H11	46	years	0	7342	UBERON:feces	27.94021988	UBERON:feces	UBERON:feces	2/22/11	2011-02-22 08:15:00	8:15:00	GAZ:United Kingdom	1/14/65	0	true	10.4516	ENVO:dense settlement biome	ENVO:human-associated habitat	true	734	human	Homo sapiens	7342	9606	7342	51.5	-0.12	true	Cornell	true	false	King's College, London, UK	Stool	female	2	1002622	TwinsUK gut microbiome	MZ	TwinsUK Fecal Sample
2014.Plate5.92	AATCAACTAGGC	GTGCCAGCMGCCGCGGTAA	31.293	Cornell	UK_Twins	Cornell	fecal samples from TwinsUK MiSeq runs	TwinsUK Miseq	Nick	MiSeq	This analysis was done as in Caporaso et al 2011 Genome research. The PCR primers F515 and R806 were developed against the V4 region of the 16S rRNA, both bacteria and archaea, which we determined would yield optimal community clustering with reads of this length The reverse PCR primer is barcoded with a 12-base error-correcting Golay code to facilitate multiplexing of up to 1,500 samples per lane, and both PCR primers contain sequencer adapter regions.	GT	FWD:GTGCCAGCMGCCGCGGTAA; REV:GGACTACHVGGGTWTCTAAT	Plate5	Illumina	V4	Cornell	1/25/13	TwinsUKPlate5	0.1,gram	Kings College London	sequencing by synthesis	16S rRNA	V4	H10	68	years	0	8502	UBERON:feces	29.76086044	UBERON:feces	UBERON:feces	2/21/11	2011-02-21 17:45:00	17:45:00	GAZ:United Kingdom	7/5/42	0	true	10.4516	ENVO:dense settlement biome	ENVO:human-associated habitat	true	850	human	Homo sapiens	8502	9606	8502	51.5	-0.12	true	Cornell	true	false	King's College, London, UK	Stool	female	2	1002611	TwinsUK gut microbiome	MZ	TwinsUK Fecal Sample
2014.Plate5.91	TGTACGGATAAC	GTGCCAGCMGCCGCGGTAA	38.239	Cornell	UK_Twins	Cornell	fecal samples from TwinsUK MiSeq runs	TwinsUK Miseq	Nick	MiSeq	This analysis was done as in Caporaso et al 2011 Genome research. The PCR primers F515 and R806 were developed against the V4 region of the 16S rRNA, both bacteria and archaea, which we determined would yield optimal community clustering with reads of this length The reverse PCR primer is barcoded with a 12-base error-correcting Golay code to facilitate multiplexing of up to 1,500 samples per lane, and both PCR primers contain sequencer adapter regions.	GT	FWD:GTGCCAGCMGCCGCGGTAA; REV:GGACTACHVGGGTWTCTAAT	Plate5	Illumina	V4	Cornell	1/25/13	TwinsUKPlate5	0.1,gram	Kings College London	sequencing by synthesis	16S rRNA	V4	H9	68	years	0	8501	UBERON:feces	32.98204041	UBERON:feces	UBERON:feces	2/23/11	2011-02-23 13:00:00	13:00:00	GAZ:United Kingdom	7/5/42	0	true	10.4516	ENVO:dense settlement biome	ENVO:human-associated habitat	true	850	human	Homo sapiens	8501	9606	8501	51.5	-0.12	true	Cornell	true	false	King's College, London, UK	Stool	female	2	1002610	TwinsUK gut microbiome	MZ	TwinsUK Fecal Sample
2014.Plate5.90	CAATGCCTCACG	GTGCCAGCMGCCGCGGTAA	43.448	Cornell	UK_Twins	Cornell	fecal samples from TwinsUK MiSeq runs	TwinsUK Miseq	Nick	MiSeq	This analysis was done as in Caporaso et al 2011 Genome research. The PCR primers F515 and R806 were developed against the V4 region of the 16S rRNA, both bacteria and archaea, which we determined would yield optimal community clustering with reads of this length The reverse PCR primer is barcoded with a 12-base error-correcting Golay code to facilitate multiplexing of up to 1,500 samples per lane, and both PCR primers contain sequencer adapter regions.	GT	FWD:GTGCCAGCMGCCGCGGTAA; REV:GGACTACHVGGGTWTCTAAT	Plate5	Illumina	V4	Cornell	1/25/13	TwinsUKPlate5	0.1,gram	Kings College London	sequencing by synthesis	16S rRNA	V4	H8	73	years	0	5742	UBERON:feces	21.65114021	UBERON:feces	UBERON:feces	2/25/11	2011-02-25 08:45:00	8:45:00	GAZ:United Kingdom	9/14/37	0	true	10.4516	ENVO:dense settlement biome	ENVO:human-associated habitat	true	574	human	Homo sapiens	5742	9606	5742	51.5	-0.12	true	Cornell	true	false	King's College, London, UK	Stool	female	2	1002619	TwinsUK gut microbiome	MZ	TwinsUK Fecal Sample
2014.Plate5.9	AACCCAGATGAT	GTGCCAGCMGCCGCGGTAA	26.799	Cornell	UK_Twins	Cornell	fecal samples from TwinsUK MiSeq runs	TwinsUK Miseq	Nick	MiSeq	This analysis was done as in Caporaso et al 2011 Genome research. The PCR primers F515 and R806 were developed against the V4 region of the 16S rRNA, both bacteria and archaea, which we determined would yield optimal community clustering with reads of this length The reverse PCR primer is barcoded with a 12-base error-correcting Golay code to facilitate multiplexing of up to 1,500 samples per lane, and both PCR primers contain sequencer adapter regions.	GT	FWD:GTGCCAGCMGCCGCGGTAA; REV:GGACTACHVGGGTWTCTAAT	Plate5	Illumina	V4	Cornell	1/25/13	TwinsUKPlate5	0.1,gram	Kings College London	sequencing by synthesis	16S rRNA	V4	A9	57	years	0	7211	UBERON:feces	21.60832977	UBERON:feces	UBERON:feces	12/15/10	2010-12-15 17:50:00	17:50:00	GAZ:United Kingdom	7/6/53	0	true	10.4516	ENVO:dense settlement biome	ENVO:human-associated habitat	true	721	human	Homo sapiens	7211	9606	7211	51.5	-0.12	true	Cornell	true	false	King's College, London, UK	Stool	female	2	1002420	TwinsUK gut microbiome	MZ	TwinsUK Fecal Sample
2014.Plate5.89	TTACGTGGCGAT	GTGCCAGCMGCCGCGGTAA	29.455	Cornell	UK_Twins	Cornell	fecal samples from TwinsUK MiSeq runs	TwinsUK Miseq	Nick	MiSeq	This analysis was done as in Caporaso et al 2011 Genome research. The PCR primers F515 and R806 were developed against the V4 region of the 16S rRNA, both bacteria and archaea, which we determined would yield optimal community clustering with reads of this length The reverse PCR primer is barcoded with a 12-base error-correcting Golay code to facilitate multiplexing of up to 1,500 samples per lane, and both PCR primers contain sequencer adapter regions.	GT	FWD:GTGCCAGCMGCCGCGGTAA; REV:GGACTACHVGGGTWTCTAAT	Plate5	Illumina	V4	Cornell	1/25/13	TwinsUKPlate5	0.1,gram	Kings College London	sequencing by synthesis	16S rRNA	V4	H7	66	years	0	6802	UBERON:feces	41.27766037	UBERON:feces	UBERON:feces	2/13/11	2011-02-13 22:05:00	22:05:00	GAZ:United Kingdom	3/29/44	0	true	10.4516	ENVO:dense settlement biome	ENVO:human-associated habitat	true	680	human	Homo sapiens	6802	9606	6802	51.5	-0.12	true	Cornell	true	false	King's College, London, UK	Stool	female	2	1002570	TwinsUK gut microbiome	DZ	TwinsUK Fecal Sample
2014.Plate5.88	TGAGTTCGGTCC	GTGCCAGCMGCCGCGGTAA	40.588	Cornell	UK_Twins	Cornell	fecal samples from TwinsUK MiSeq runs	TwinsUK Miseq	Nick	MiSeq	This analysis was done as in Caporaso et al 2011 Genome research. The PCR primers F515 and R806 were developed against the V4 region of the 16S rRNA, both bacteria and archaea, which we determined would yield optimal community clustering with reads of this length The reverse PCR primer is barcoded with a 12-base error-correcting Golay code to facilitate multiplexing of up to 1,500 samples per lane, and both PCR primers contain sequencer adapter regions.	GT	FWD:GTGCCAGCMGCCGCGGTAA; REV:GGACTACHVGGGTWTCTAAT	Plate5	Illumina	V4	Cornell	1/25/13	TwinsUKPlate5	0.1,gram	Kings College London	sequencing by synthesis	16S rRNA	V4	H6	74	years	0	8051	UBERON:feces	29.67102051	UBERON:feces	UBERON:feces	2/15/11	2011-02-15 11:05:00	11:05:00	GAZ:United Kingdom	7/29/36	0	true	10.4516	ENVO:dense settlement biome	ENVO:human-associated habitat	true	805	human	Homo sapiens	8051	9606	8051	51.5	-0.12	true	Cornell	true	false	King's College, London, UK	Stool	female	2	1002577	TwinsUK gut microbiome	MZ	TwinsUK Fecal Sample
2014.Plate5.87	GTCTGTTGAGTG	GTGCCAGCMGCCGCGGTAA	39.464	Cornell	UK_Twins	Cornell	fecal samples from TwinsUK MiSeq runs	TwinsUK Miseq	Nick	MiSeq	This analysis was done as in Caporaso et al 2011 Genome research. The PCR primers F515 and R806 were developed against the V4 region of the 16S rRNA, both bacteria and archaea, which we determined would yield optimal community clustering with reads of this length The reverse PCR primer is barcoded with a 12-base error-correcting Golay code to facilitate multiplexing of up to 1,500 samples per lane, and both PCR primers contain sequencer adapter regions.	GT	FWD:GTGCCAGCMGCCGCGGTAA; REV:GGACTACHVGGGTWTCTAAT	Plate5	Illumina	V4	Cornell	1/25/13	TwinsUKPlate5	0.1,gram	Kings College London	sequencing by synthesis	16S rRNA	V4	H5	66	years	0	6801	UBERON:feces	31.9664402	UBERON:feces	UBERON:feces	2/14/11	2011-02-14 23:15:00	23:15:00	GAZ:United Kingdom	3/29/44	0	true	10.4516	ENVO:dense settlement biome	ENVO:human-associated habitat	true	680	human	Homo sapiens	6801	9606	6801	51.5	-0.12	true	Cornell	true	false	King's College, London, UK	Stool	female	2	1002569	TwinsUK gut microbiome	DZ	TwinsUK Fecal Sample
2014.Plate5.86	AACATGCATGCC	GTGCCAGCMGCCGCGGTAA	47.737	Cornell	UK_Twins	Cornell	fecal samples from TwinsUK MiSeq runs	TwinsUK Miseq	Nick	MiSeq	This analysis was done as in Caporaso et al 2011 Genome research. The PCR primers F515 and R806 were developed against the V4 region of the 16S rRNA, both bacteria and archaea, which we determined would yield optimal community clustering with reads of this length The reverse PCR primer is barcoded with a 12-base error-correcting Golay code to facilitate multiplexing of up to 1,500 samples per lane, and both PCR primers contain sequencer adapter regions.	GT	FWD:GTGCCAGCMGCCGCGGTAA; REV:GGACTACHVGGGTWTCTAAT	Plate5	Illumina	V4	Cornell	1/25/13	TwinsUKPlate5	0.1,gram	Kings College London	sequencing by synthesis	16S rRNA	V4	H4	73	years	0	4912	UBERON:feces	25.46154976	UBERON:feces	UBERON:feces	2/15/11	2011-02-15 08:45:00	8:45:00	GAZ:United Kingdom	6/6/37	0	true	10.4516	ENVO:dense settlement biome	ENVO:human-associated habitat	true	491	human	Homo sapiens	4912	9606	4912	51.5	-0.12	true	Cornell	true	false	King's College, London, UK	Stool	female	2	1002568	TwinsUK gut microbiome	DZ	TwinsUK Fecal Sample
2014.Plate5.84	GAGTCTTGGTAA	GTGCCAGCMGCCGCGGTAA	18.833	Cornell	UK_Twins	Cornell	fecal samples from TwinsUK MiSeq runs	TwinsUK Miseq	Nick	MiSeq	This analysis was done as in Caporaso et al 2011 Genome research. The PCR primers F515 and R806 were developed against the V4 region of the 16S rRNA, both bacteria and archaea, which we determined would yield optimal community clustering with reads of this length The reverse PCR primer is barcoded with a 12-base error-correcting Golay code to facilitate multiplexing of up to 1,500 samples per lane, and both PCR primers contain sequencer adapter regions.	GT	FWD:GTGCCAGCMGCCGCGGTAA; REV:GGACTACHVGGGTWTCTAAT	Plate5	Illumina	V4	Cornell	1/25/13	TwinsUKPlate5	0.1,gram	Kings College London	sequencing by synthesis	16S rRNA	V4	H2	67	years	0	6852	UBERON:feces	23.55468941	UBERON:feces	UBERON:feces	2/8/11	2011-02-08 11:30:00	11:30:00	GAZ:United Kingdom	10/15/43	0	true	10.4516	ENVO:dense settlement biome	ENVO:human-associated habitat	true	685	human	Homo sapiens	6852	9606	6852	51.5	-0.12	true	Cornell	true	false	King's College, London, UK	Stool	female	2	1002572	TwinsUK gut microbiome	MZ	TwinsUK Fecal Sample
2014.Plate5.83	GTGACGTTAGTC	GTGCCAGCMGCCGCGGTAA	40.053	Cornell	UK_Twins	Cornell	fecal samples from TwinsUK MiSeq runs	TwinsUK Miseq	Nick	MiSeq	This analysis was done as in Caporaso et al 2011 Genome research. The PCR primers F515 and R806 were developed against the V4 region of the 16S rRNA, both bacteria and archaea, which we determined would yield optimal community clustering with reads of this length The reverse PCR primer is barcoded with a 12-base error-correcting Golay code to facilitate multiplexing of up to 1,500 samples per lane, and both PCR primers contain sequencer adapter regions.	GT	FWD:GTGCCAGCMGCCGCGGTAA; REV:GGACTACHVGGGTWTCTAAT	Plate5	Illumina	V4	Cornell	1/25/13	TwinsUKPlate5	0.1,gram	Kings College London	sequencing by synthesis	16S rRNA	V4	H1	65	years	0	8142	UBERON:feces	26.38413048	UBERON:feces	UBERON:feces	2/10/11	2011-02-10 08:15:00	8:15:00	GAZ:United Kingdom	5/11/45	0	true	10.4516	ENVO:dense settlement biome	ENVO:human-associated habitat	true	814	human	Homo sapiens	8142	9606	8142	51.5	-0.12	true	Cornell	true	false	King's College, London, UK	Stool	female	2	1002564	TwinsUK gut microbiome	MZ	TwinsUK Fecal Sample
2014.Plate5.82	GACTTATGCCCG	GTGCCAGCMGCCGCGGTAA	9.845	Cornell	UK_Twins	Cornell	fecal samples from TwinsUK MiSeq runs	TwinsUK Miseq	Nick	MiSeq	This analysis was done as in Caporaso et al 2011 Genome research. The PCR primers F515 and R806 were developed against the V4 region of the 16S rRNA, both bacteria and archaea, which we determined would yield optimal community clustering with reads of this length The reverse PCR primer is barcoded with a 12-base error-correcting Golay code to facilitate multiplexing of up to 1,500 samples per lane, and both PCR primers contain sequencer adapter regions.	GT	FWD:GTGCCAGCMGCCGCGGTAA; REV:GGACTACHVGGGTWTCTAAT	Plate5	Illumina	V4	Cornell	1/25/13	TwinsUKPlate5	0.1,gram	Kings College London	sequencing by synthesis	16S rRNA	V4	G12	67	years	0	6851	UBERON:feces	24.57265091	UBERON:feces	UBERON:feces	2/8/11	2011-02-08 09:20:00	9:20:00	GAZ:United Kingdom	10/15/43	0	true	10.4516	ENVO:dense settlement biome	ENVO:human-associated habitat	true	685	human	Homo sapiens	6851	9606	6851	51.5	-0.12	true	Cornell	true	false	King's College, London, UK	Stool	female	2	1002571	TwinsUK gut microbiome	MZ	TwinsUK Fecal Sample
2014.Plate5.81	CAAGCGTTGTCC	GTGCCAGCMGCCGCGGTAA	30.783	Cornell	UK_Twins	Cornell	fecal samples from TwinsUK MiSeq runs	TwinsUK Miseq	Nick	MiSeq	This analysis was done as in Caporaso et al 2011 Genome research. The PCR primers F515 and R806 were developed against the V4 region of the 16S rRNA, both bacteria and archaea, which we determined would yield optimal community clustering with reads of this length The reverse PCR primer is barcoded with a 12-base error-correcting Golay code to facilitate multiplexing of up to 1,500 samples per lane, and both PCR primers contain sequencer adapter regions.	GT	FWD:GTGCCAGCMGCCGCGGTAA; REV:GGACTACHVGGGTWTCTAAT	Plate5	Illumina	V4	Cornell	1/25/13	TwinsUKPlate5	0.1,gram	Kings College London	sequencing by synthesis	16S rRNA	V4	G11	72	years	0	6911	UBERON:feces	25.35692978	UBERON:feces	UBERON:feces	2/8/11	2011-02-08 08:30:00	8:30:00	GAZ:United Kingdom	2/1/39	0	true	10.4516	ENVO:dense settlement biome	ENVO:human-associated habitat	true	691	human	Homo sapiens	6911	9606	6911	51.5	-0.12	true	Cornell	true	false	King's College, London, UK	Stool	female	2	1002573	TwinsUK gut microbiome	MZ	TwinsUK Fecal Sample
2014.Plate5.80	CGTCGTCTAAGA	GTGCCAGCMGCCGCGGTAA	30.885	Cornell	UK_Twins	Cornell	fecal samples from TwinsUK MiSeq runs	TwinsUK Miseq	Nick	MiSeq	This analysis was done as in Caporaso et al 2011 Genome research. The PCR primers F515 and R806 were developed against the V4 region of the 16S rRNA, both bacteria and archaea, which we determined would yield optimal community clustering with reads of this length The reverse PCR primer is barcoded with a 12-base error-correcting Golay code to facilitate multiplexing of up to 1,500 samples per lane, and both PCR primers contain sequencer adapter regions.	GT	FWD:GTGCCAGCMGCCGCGGTAA; REV:GGACTACHVGGGTWTCTAAT	Plate5	Illumina	V4	Cornell	1/25/13	TwinsUKPlate5	0.1,gram	Kings College London	sequencing by synthesis	16S rRNA	V4	G10	65	years	0	8141	UBERON:feces	27.04371071	UBERON:feces	UBERON:feces	2/10/11	2011-02-10 07:30:00	7:30:00	GAZ:United Kingdom	5/11/45	0	true	10.4516	ENVO:dense settlement biome	ENVO:human-associated habitat	true	814	human	Homo sapiens	8141	9606	8141	51.5	-0.12	true	Cornell	true	false	King's College, London, UK	Stool	female	2	1002563	TwinsUK gut microbiome	MZ	TwinsUK Fecal Sample
2014.Plate5.8	TTCCACACGTGG	GTGCCAGCMGCCGCGGTAA	42.631	Cornell	UK_Twins	Cornell	fecal samples from TwinsUK MiSeq runs	TwinsUK Miseq	Nick	MiSeq	This analysis was done as in Caporaso et al 2011 Genome research. The PCR primers F515 and R806 were developed against the V4 region of the 16S rRNA, both bacteria and archaea, which we determined would yield optimal community clustering with reads of this length The reverse PCR primer is barcoded with a 12-base error-correcting Golay code to facilitate multiplexing of up to 1,500 samples per lane, and both PCR primers contain sequencer adapter regions.	GT	FWD:GTGCCAGCMGCCGCGGTAA; REV:GGACTACHVGGGTWTCTAAT	Plate5	Illumina	V4	Cornell	1/25/13	TwinsUKPlate5	0.1,gram	Kings College London	sequencing by synthesis	16S rRNA	V4	A8	57	years	0	7212	UBERON:feces	20.43734932	UBERON:feces	UBERON:feces	12/15/10	2010-12-15 21:00:00	21:00:00	GAZ:United Kingdom	7/6/53	0	true	10.4516	ENVO:dense settlement biome	ENVO:human-associated habitat	true	721	human	Homo sapiens	7212	9606	7212	51.5	-0.12	true	Cornell	true	false	King's College, London, UK	Stool	female	2	1002421	TwinsUK gut microbiome	MZ	TwinsUK Fecal Sample
2014.Plate5.79	GGTCGTGTCTTG	GTGCCAGCMGCCGCGGTAA	47.329	Cornell	UK_Twins	Cornell	fecal samples from TwinsUK MiSeq runs	TwinsUK Miseq	Nick	MiSeq	This analysis was done as in Caporaso et al 2011 Genome research. The PCR primers F515 and R806 were developed against the V4 region of the 16S rRNA, both bacteria and archaea, which we determined would yield optimal community clustering with reads of this length The reverse PCR primer is barcoded with a 12-base error-correcting Golay code to facilitate multiplexing of up to 1,500 samples per lane, and both PCR primers contain sequencer adapter regions.	GT	FWD:GTGCCAGCMGCCGCGGTAA; REV:GGACTACHVGGGTWTCTAAT	Plate5	Illumina	V4	Cornell	1/25/13	TwinsUKPlate5	0.1,gram	Kings College London	sequencing by synthesis	16S rRNA	V4	G9	51	years	0	5082	UBERON:feces	24.97546005	UBERON:feces	UBERON:feces	1/26/11	2011-01-26 07:25:00	7:25:00	GAZ:United Kingdom	1/13/60	0	true	10.4516	ENVO:dense settlement biome	ENVO:human-associated habitat	true	508	human	Homo sapiens	5082	9606	5082	51.5	-0.12	true	Cornell	true	false	King's College, London, UK	Stool	female	2	1002505	TwinsUK gut microbiome	DZ	TwinsUK Fecal Sample
2014.Plate5.78	GAAACGGAAACG	GTGCCAGCMGCCGCGGTAA	43.55	Cornell	UK_Twins	Cornell	fecal samples from TwinsUK MiSeq runs	TwinsUK Miseq	Nick	MiSeq	This analysis was done as in Caporaso et al 2011 Genome research. The PCR primers F515 and R806 were developed against the V4 region of the 16S rRNA, both bacteria and archaea, which we determined would yield optimal community clustering with reads of this length The reverse PCR primer is barcoded with a 12-base error-correcting Golay code to facilitate multiplexing of up to 1,500 samples per lane, and both PCR primers contain sequencer adapter regions.	GT	FWD:GTGCCAGCMGCCGCGGTAA; REV:GGACTACHVGGGTWTCTAAT	Plate5	Illumina	V4	Cornell	1/25/13	TwinsUKPlate5	0.1,gram	Kings College London	sequencing by synthesis	16S rRNA	V4	G8	56	years	0	5391	UBERON:feces	21.87166977	UBERON:feces	UBERON:feces	1/26/11	2011-01-26 09:30:00	9:30:00	GAZ:United Kingdom	5/23/54	0	true	10.4516	ENVO:dense settlement biome	ENVO:human-associated habitat	true	539	human	Homo sapiens	5391	9606	5391	51.5	-0.12	true	Cornell	true	false	King's College, London, UK	Stool	female	2	1002509	TwinsUK gut microbiome	DZ	TwinsUK Fecal Sample
2014.Plate5.77	CACGTTTATTCC	GTGCCAGCMGCCGCGGTAA	40.588	Cornell	UK_Twins	Cornell	fecal samples from TwinsUK MiSeq runs	TwinsUK Miseq	Nick	MiSeq	This analysis was done as in Caporaso et al 2011 Genome research. The PCR primers F515 and R806 were developed against the V4 region of the 16S rRNA, both bacteria and archaea, which we determined would yield optimal community clustering with reads of this length The reverse PCR primer is barcoded with a 12-base error-correcting Golay code to facilitate multiplexing of up to 1,500 samples per lane, and both PCR primers contain sequencer adapter regions.	GT	FWD:GTGCCAGCMGCCGCGGTAA; REV:GGACTACHVGGGTWTCTAAT	Plate5	Illumina	V4	Cornell	1/25/13	TwinsUKPlate5	0.1,gram	Kings College London	sequencing by synthesis	16S rRNA	V4	G7	73	years	0	7931	UBERON:feces	24.1588192	UBERON:feces	UBERON:feces	1/27/11	2011-01-27 11:20:00	11:20:00	GAZ:United Kingdom	4/25/37	0	true	10.4516	ENVO:dense settlement biome	ENVO:human-associated habitat	true	793	human	Homo sapiens	7931	9606	7931	51.5	-0.12	true	Cornell	true	false	King's College, London, UK	Stool	female	2	1002518	TwinsUK gut microbiome	DZ	TwinsUK Fecal Sample
2014.Plate5.76	TCGGTCCATAGC	GTGCCAGCMGCCGCGGTAA	36.707	Cornell	UK_Twins	Cornell	fecal samples from TwinsUK MiSeq runs	TwinsUK Miseq	Nick	MiSeq	This analysis was done as in Caporaso et al 2011 Genome research. The PCR primers F515 and R806 were developed against the V4 region of the 16S rRNA, both bacteria and archaea, which we determined would yield optimal community clustering with reads of this length The reverse PCR primer is barcoded with a 12-base error-correcting Golay code to facilitate multiplexing of up to 1,500 samples per lane, and both PCR primers contain sequencer adapter regions.	GT	FWD:GTGCCAGCMGCCGCGGTAA; REV:GGACTACHVGGGTWTCTAAT	Plate5	Illumina	V4	Cornell	1/25/13	TwinsUKPlate5	0.1,gram	Kings College London	sequencing by synthesis	16S rRNA	V4	G6	68	years	0	4852	UBERON:feces	28.42975044	UBERON:feces	UBERON:feces	1/25/11	2011-01-25 10:00:00	10:00:00	GAZ:United Kingdom	11/10/42	0	true	10.4516	ENVO:dense settlement biome	ENVO:human-associated habitat	true	485	human	Homo sapiens	4852	9606	4852	51.5	-0.12	true	Cornell	true	false	King's College, London, UK	Stool	female	2	1002503	TwinsUK gut microbiome	DZ	TwinsUK Fecal Sample
2014.Plate5.75	CTTAGCTACTCT	GTGCCAGCMGCCGCGGTAA	30.987	Cornell	UK_Twins	Cornell	fecal samples from TwinsUK MiSeq runs	TwinsUK Miseq	Nick	MiSeq	This analysis was done as in Caporaso et al 2011 Genome research. The PCR primers F515 and R806 were developed against the V4 region of the 16S rRNA, both bacteria and archaea, which we determined would yield optimal community clustering with reads of this length The reverse PCR primer is barcoded with a 12-base error-correcting Golay code to facilitate multiplexing of up to 1,500 samples per lane, and both PCR primers contain sequencer adapter regions.	GT	FWD:GTGCCAGCMGCCGCGGTAA; REV:GGACTACHVGGGTWTCTAAT	Plate5	Illumina	V4	Cornell	1/25/13	TwinsUKPlate5	0.1,gram	Kings College London	sequencing by synthesis	16S rRNA	V4	G5	64	years	0	6382	UBERON:feces	35.9550705	UBERON:feces	UBERON:feces	1/24/11	2011-01-24 09:30:00	9:30:00	GAZ:United Kingdom	1/15/47	0	true	10.4516	ENVO:dense settlement biome	ENVO:human-associated habitat	true	638	human	Homo sapiens	6382	9606	6382	51.5	-0.12	true	Cornell	true	false	King's College, London, UK	Stool	female	2	1002516	TwinsUK gut microbiome	DZ	TwinsUK Fecal Sample
2014.Plate5.74	AGTGATGTGACT	GTGCCAGCMGCCGCGGTAA	37.319	Cornell	UK_Twins	Cornell	fecal samples from TwinsUK MiSeq runs	TwinsUK Miseq	Nick	MiSeq	This analysis was done as in Caporaso et al 2011 Genome research. The PCR primers F515 and R806 were developed against the V4 region of the 16S rRNA, both bacteria and archaea, which we determined would yield optimal community clustering with reads of this length The reverse PCR primer is barcoded with a 12-base error-correcting Golay code to facilitate multiplexing of up to 1,500 samples per lane, and both PCR primers contain sequencer adapter regions.	GT	FWD:GTGCCAGCMGCCGCGGTAA; REV:GGACTACHVGGGTWTCTAAT	Plate5	Illumina	V4	Cornell	1/25/13	TwinsUKPlate5	0.1,gram	Kings College London	sequencing by synthesis	16S rRNA	V4	G4	51	years	0	5081	UBERON:feces	29.71644974	UBERON:feces	UBERON:feces	1/25/11	2011-01-25 06:20:00	6:20:00	GAZ:United Kingdom	1/13/60	0	true	10.4516	ENVO:dense settlement biome	ENVO:human-associated habitat	true	508	human	Homo sapiens	5081	9606	5081	51.5	-0.12	true	Cornell	true	false	King's College, London, UK	Stool	female	2	1002504	TwinsUK gut microbiome	DZ	TwinsUK Fecal Sample
2014.Plate5.72	GACAGAGGTGCA	GTGCCAGCMGCCGCGGTAA	19.854	Cornell	UK_Twins	Cornell	fecal samples from TwinsUK MiSeq runs	TwinsUK Miseq	Nick	MiSeq	This analysis was done as in Caporaso et al 2011 Genome research. The PCR primers F515 and R806 were developed against the V4 region of the 16S rRNA, both bacteria and archaea, which we determined would yield optimal community clustering with reads of this length The reverse PCR primer is barcoded with a 12-base error-correcting Golay code to facilitate multiplexing of up to 1,500 samples per lane, and both PCR primers contain sequencer adapter regions.	GT	FWD:GTGCCAGCMGCCGCGGTAA; REV:GGACTACHVGGGTWTCTAAT	Plate5	Illumina	V4	Cornell	1/25/13	TwinsUKPlate5	0.1,gram	Kings College London	sequencing by synthesis	16S rRNA	V4	G2	65	years	0	5921	UBERON:feces	26.46256065	UBERON:feces	UBERON:feces	1/19/11	2011-01-19 08:50:00	8:50:00	GAZ:United Kingdom	9/6/45	0	true	10.4516	ENVO:dense settlement biome	ENVO:human-associated habitat	true	592	human	Homo sapiens	5921	9606	5921	51.5	-0.12	true	Cornell	true	false	King's College, London, UK	Stool	female	2	1002513	TwinsUK gut microbiome	DZ	TwinsUK Fecal Sample
2014.Plate5.71	CTGGTGCTGAAT	GTGCCAGCMGCCGCGGTAA	39.665	Cornell	UK_Twins	Cornell	fecal samples from TwinsUK MiSeq runs	TwinsUK Miseq	Nick	MiSeq	This analysis was done as in Caporaso et al 2011 Genome research. The PCR primers F515 and R806 were developed against the V4 region of the 16S rRNA, both bacteria and archaea, which we determined would yield optimal community clustering with reads of this length The reverse PCR primer is barcoded with a 12-base error-correcting Golay code to facilitate multiplexing of up to 1,500 samples per lane, and both PCR primers contain sequencer adapter regions.	GT	FWD:GTGCCAGCMGCCGCGGTAA; REV:GGACTACHVGGGTWTCTAAT	Plate5	Illumina	V4	Cornell	1/25/13	TwinsUKPlate5	0.1,gram	Kings College London	sequencing by synthesis	16S rRNA	V4	G1	65	years	0	5922	UBERON:feces	31.09260941	UBERON:feces	UBERON:feces	1/20/11	2011-01-20 06:00:00	6:00:00	GAZ:United Kingdom	9/6/45	0	true	10.4516	ENVO:dense settlement biome	ENVO:human-associated habitat	true	592	human	Homo sapiens	5922	9606	5922	51.5	-0.12	true	Cornell	true	false	King's College, London, UK	Stool	female	2	1002514	TwinsUK gut microbiome	DZ	TwinsUK Fecal Sample
2014.Plate5.70	TGTCAGCTGTCG	GTGCCAGCMGCCGCGGTAA	25.982	Cornell	UK_Twins	Cornell	fecal samples from TwinsUK MiSeq runs	TwinsUK Miseq	Nick	MiSeq	This analysis was done as in Caporaso et al 2011 Genome research. The PCR primers F515 and R806 were developed against the V4 region of the 16S rRNA, both bacteria and archaea, which we determined would yield optimal community clustering with reads of this length The reverse PCR primer is barcoded with a 12-base error-correcting Golay code to facilitate multiplexing of up to 1,500 samples per lane, and both PCR primers contain sequencer adapter regions.	GT	FWD:GTGCCAGCMGCCGCGGTAA; REV:GGACTACHVGGGTWTCTAAT	Plate5	Illumina	V4	Cornell	1/25/13	TwinsUKPlate5	0.1,gram	Kings College London	sequencing by synthesis	16S rRNA	V4	F12	66	years	0	5671	UBERON:feces	22.04788971	UBERON:feces	UBERON:feces	1/24/11	2011-01-24 07:50:00	7:50:00	GAZ:United Kingdom	10/7/44	0	true	10.4516	ENVO:dense settlement biome	ENVO:human-associated habitat	true	567	human	Homo sapiens	5671	9606	5671	51.5	-0.12	true	Cornell	true	false	King's College, London, UK	Stool	female	2	1002510	TwinsUK gut microbiome	DZ	TwinsUK Fecal Sample
2014.Plate5.7	GTTGGTTGGCAT	GTGCCAGCMGCCGCGGTAA	35.277	Cornell	UK_Twins	Cornell	fecal samples from TwinsUK MiSeq runs	TwinsUK Miseq	Nick	MiSeq	This analysis was done as in Caporaso et al 2011 Genome research. The PCR primers F515 and R806 were developed against the V4 region of the 16S rRNA, both bacteria and archaea, which we determined would yield optimal community clustering with reads of this length The reverse PCR primer is barcoded with a 12-base error-correcting Golay code to facilitate multiplexing of up to 1,500 samples per lane, and both PCR primers contain sequencer adapter regions.	GT	FWD:GTGCCAGCMGCCGCGGTAA; REV:GGACTACHVGGGTWTCTAAT	Plate5	Illumina	V4	Cornell	1/25/13	TwinsUKPlate5	0.1,gram	Kings College London	sequencing by synthesis	16S rRNA	V4	A7	63	years	0	4952	UBERON:feces	26.81078911	UBERON:feces	UBERON:feces	1/5/11	2011-01-05 06:30:00	6:30:00	GAZ:United Kingdom	10/11/47	0	true	10.4516	ENVO:dense settlement biome	ENVO:human-associated habitat	true	495	human	Homo sapiens	4952	9606	4952	51.5	-0.12	true	Cornell	true	false	King's College, London, UK	Stool	female	2	1002413	TwinsUK gut microbiome	DZ	TwinsUK Fecal Sample
2014.Plate5.69	GGAACGACGTGA	GTGCCAGCMGCCGCGGTAA	29.966	Cornell	UK_Twins	Cornell	fecal samples from TwinsUK MiSeq runs	TwinsUK Miseq	Nick	MiSeq	This analysis was done as in Caporaso et al 2011 Genome research. The PCR primers F515 and R806 were developed against the V4 region of the 16S rRNA, both bacteria and archaea, which we determined would yield optimal community clustering with reads of this length The reverse PCR primer is barcoded with a 12-base error-correcting Golay code to facilitate multiplexing of up to 1,500 samples per lane, and both PCR primers contain sequencer adapter regions.	GT	FWD:GTGCCAGCMGCCGCGGTAA; REV:GGACTACHVGGGTWTCTAAT	Plate5	Illumina	V4	Cornell	1/25/13	TwinsUKPlate5	0.1,gram	Kings College London	sequencing by synthesis	16S rRNA	V4	F11	66	years	0	5192	UBERON:feces	25.37957954	UBERON:feces	UBERON:feces	1/23/11	2011-01-23 14:40:00	14:40:00	GAZ:United Kingdom	1/26/44	0	true	10.4516	ENVO:dense settlement biome	ENVO:human-associated habitat	true	519	human	Homo sapiens	5192	9606	5192	51.5	-0.12	true	Cornell	true	false	King's College, London, UK	Stool	female	2	1002507	TwinsUK gut microbiome	DZ	TwinsUK Fecal Sample
2014.Plate5.68	AGTGCCCTTGGT	GTGCCAGCMGCCGCGGTAA	25.267	Cornell	UK_Twins	Cornell	fecal samples from TwinsUK MiSeq runs	TwinsUK Miseq	Nick	MiSeq	This analysis was done as in Caporaso et al 2011 Genome research. The PCR primers F515 and R806 were developed against the V4 region of the 16S rRNA, both bacteria and archaea, which we determined would yield optimal community clustering with reads of this length The reverse PCR primer is barcoded with a 12-base error-correcting Golay code to facilitate multiplexing of up to 1,500 samples per lane, and both PCR primers contain sequencer adapter regions.	GT	FWD:GTGCCAGCMGCCGCGGTAA; REV:GGACTACHVGGGTWTCTAAT	Plate5	Illumina	V4	Cornell	1/25/13	TwinsUKPlate5	0.1,gram	Kings College London	sequencing by synthesis	16S rRNA	V4	F10	72	years	0	7351	UBERON:feces	24.87359047	UBERON:feces	UBERON:feces	1/27/11	2011-01-27 08:30:00	8:30:00	GAZ:United Kingdom	7/18/38	0	true	10.4516	ENVO:dense settlement biome	ENVO:human-associated habitat	true	735	human	Homo sapiens	7351	9606	7351	51.5	-0.12	true	Cornell	true	false	King's College, London, UK	Stool	female	2	1002517	TwinsUK gut microbiome	DZ	TwinsUK Fecal Sample
2014.Plate5.67	CAACTAGACTCG	GTGCCAGCMGCCGCGGTAA	42.324	Cornell	UK_Twins	Cornell	fecal samples from TwinsUK MiSeq runs	TwinsUK Miseq	Nick	MiSeq	This analysis was done as in Caporaso et al 2011 Genome research. The PCR primers F515 and R806 were developed against the V4 region of the 16S rRNA, both bacteria and archaea, which we determined would yield optimal community clustering with reads of this length The reverse PCR primer is barcoded with a 12-base error-correcting Golay code to facilitate multiplexing of up to 1,500 samples per lane, and both PCR primers contain sequencer adapter regions.	GT	FWD:GTGCCAGCMGCCGCGGTAA; REV:GGACTACHVGGGTWTCTAAT	Plate5	Illumina	V4	Cornell	1/25/13	TwinsUKPlate5	0.1,gram	Kings College London	sequencing by synthesis	16S rRNA	V4	F9	59	years	0	7571	UBERON:feces	24.18367958	UBERON:feces	UBERON:feces	1/24/11	2011-01-24 09:00:00	9:00:00	GAZ:United Kingdom	10/25/51	0	true	10.4516	ENVO:dense settlement biome	ENVO:human-associated habitat	true	757	human	Homo sapiens	7571	9606	7571	51.5	-0.12	true	Cornell	true	false	King's College, London, UK	Stool	female	2	1002499	TwinsUK gut microbiome	MZ	TwinsUK Fecal Sample
2014.Plate5.66	GTGCTTGTGTAG	GTGCCAGCMGCCGCGGTAA	43.754	Cornell	UK_Twins	Cornell	fecal samples from TwinsUK MiSeq runs	TwinsUK Miseq	Nick	MiSeq	This analysis was done as in Caporaso et al 2011 Genome research. The PCR primers F515 and R806 were developed against the V4 region of the 16S rRNA, both bacteria and archaea, which we determined would yield optimal community clustering with reads of this length The reverse PCR primer is barcoded with a 12-base error-correcting Golay code to facilitate multiplexing of up to 1,500 samples per lane, and both PCR primers contain sequencer adapter regions.	GT	FWD:GTGCCAGCMGCCGCGGTAA; REV:GGACTACHVGGGTWTCTAAT	Plate5	Illumina	V4	Cornell	1/25/13	TwinsUKPlate5	0.1,gram	Kings College London	sequencing by synthesis	16S rRNA	V4	F8	64	years	0	6422	UBERON:feces	22.83728027	UBERON:feces	UBERON:feces	1/23/11	2011-01-23 14:20:00	14:20:00	GAZ:United Kingdom	3/8/46	0	true	10.4516	ENVO:dense settlement biome	ENVO:human-associated habitat	true	642	human	Homo sapiens	6422	9606	6422	51.5	-0.12	true	Cornell	true	false	King's College, London, UK	Stool	female	2	1002497	TwinsUK gut microbiome	DZ	TwinsUK Fecal Sample
2014.Plate5.65	AACCTCGGATAA	GTGCCAGCMGCCGCGGTAA	30.272	Cornell	UK_Twins	Cornell	fecal samples from TwinsUK MiSeq runs	TwinsUK Miseq	Nick	MiSeq	This analysis was done as in Caporaso et al 2011 Genome research. The PCR primers F515 and R806 were developed against the V4 region of the 16S rRNA, both bacteria and archaea, which we determined would yield optimal community clustering with reads of this length The reverse PCR primer is barcoded with a 12-base error-correcting Golay code to facilitate multiplexing of up to 1,500 samples per lane, and both PCR primers contain sequencer adapter regions.	GT	FWD:GTGCCAGCMGCCGCGGTAA; REV:GGACTACHVGGGTWTCTAAT	Plate5	Illumina	V4	Cornell	1/25/13	TwinsUKPlate5	0.1,gram	Kings College London	sequencing by synthesis	16S rRNA	V4	F7	61	years	0	4712	UBERON:feces	20.03268051	UBERON:feces	UBERON:feces	1/21/11	2011-01-21 00:00:00		GAZ:United Kingdom	10/7/49	0	true	10.4516	ENVO:dense settlement biome	ENVO:human-associated habitat	true	471	human	Homo sapiens	4712	9606	4712	51.5	-0.12	true	Cornell	true	false	King's College, London, UK	Stool	female	2	1002491	TwinsUK gut microbiome	DZ	TwinsUK Fecal Sample
2014.Plate5.64	TGCCGCCGTAAT	GTGCCAGCMGCCGCGGTAA	28.842	Cornell	UK_Twins	Cornell	fecal samples from TwinsUK MiSeq runs	TwinsUK Miseq	Nick	MiSeq	This analysis was done as in Caporaso et al 2011 Genome research. The PCR primers F515 and R806 were developed against the V4 region of the 16S rRNA, both bacteria and archaea, which we determined would yield optimal community clustering with reads of this length The reverse PCR primer is barcoded with a 12-base error-correcting Golay code to facilitate multiplexing of up to 1,500 samples per lane, and both PCR primers contain sequencer adapter regions.	GT	FWD:GTGCCAGCMGCCGCGGTAA; REV:GGACTACHVGGGTWTCTAAT	Plate5	Illumina	V4	Cornell	1/25/13	TwinsUKPlate5	0.1,gram	Kings College London	sequencing by synthesis	16S rRNA	V4	F6	62	years	0	8111	UBERON:feces	27.66210938	UBERON:feces	UBERON:feces	1/21/11	2011-01-21 12:00:00	12:00:00	GAZ:United Kingdom	9/12/48	0	true	10.4516	ENVO:dense settlement biome	ENVO:human-associated habitat	true	811	human	Homo sapiens	8111	9606	8111	51.5	-0.12	true	Cornell	true	false	King's College, London, UK	Stool	female	2	1002502	TwinsUK gut microbiome	DZ	TwinsUK Fecal Sample
2014.Plate5.63	AAGTGAAGCGAG	GTGCCAGCMGCCGCGGTAA	33.54	Cornell	UK_Twins	Cornell	fecal samples from TwinsUK MiSeq runs	TwinsUK Miseq	Nick	MiSeq	This analysis was done as in Caporaso et al 2011 Genome research. The PCR primers F515 and R806 were developed against the V4 region of the 16S rRNA, both bacteria and archaea, which we determined would yield optimal community clustering with reads of this length The reverse PCR primer is barcoded with a 12-base error-correcting Golay code to facilitate multiplexing of up to 1,500 samples per lane, and both PCR primers contain sequencer adapter regions.	GT	FWD:GTGCCAGCMGCCGCGGTAA; REV:GGACTACHVGGGTWTCTAAT	Plate5	Illumina	V4	Cornell	1/25/13	TwinsUKPlate5	0.1,gram	Kings College London	sequencing by synthesis	16S rRNA	V4	F5	63	years	0	8101	UBERON:feces	38.6674614	UBERON:feces	UBERON:feces	1/19/11	2011-01-19 15:30:00	15:30:00	GAZ:United Kingdom	8/27/47	0	true	10.4516	ENVO:dense settlement biome	ENVO:human-associated habitat	true	810	human	Homo sapiens	8101	9606	8101	51.5	-0.12	true	Cornell	true	false	King's College, London, UK	Stool	female	2	1002501	TwinsUK gut microbiome	DZ	TwinsUK Fecal Sample
2014.Plate5.62	CATTTGACGACG	GTGCCAGCMGCCGCGGTAA	37.932	Cornell	UK_Twins	Cornell	fecal samples from TwinsUK MiSeq runs	TwinsUK Miseq	Nick	MiSeq	This analysis was done as in Caporaso et al 2011 Genome research. The PCR primers F515 and R806 were developed against the V4 region of the 16S rRNA, both bacteria and archaea, which we determined would yield optimal community clustering with reads of this length The reverse PCR primer is barcoded with a 12-base error-correcting Golay code to facilitate multiplexing of up to 1,500 samples per lane, and both PCR primers contain sequencer adapter regions.	GT	FWD:GTGCCAGCMGCCGCGGTAA; REV:GGACTACHVGGGTWTCTAAT	Plate5	Illumina	V4	Cornell	1/25/13	TwinsUKPlate5	0.1,gram	Kings College London	sequencing by synthesis	16S rRNA	V4	F4	61	years	0	4711	UBERON:feces	22.51561928	UBERON:feces	UBERON:feces	1/21/11	2011-01-21 06:30:00	6:30:00	GAZ:United Kingdom	10/7/49	0	true	10.4516	ENVO:dense settlement biome	ENVO:human-associated habitat	true	471	human	Homo sapiens	4711	9606	4711	51.5	-0.12	true	Cornell	true	false	King's College, London, UK	Stool	female	2	1002490	TwinsUK gut microbiome	DZ	TwinsUK Fecal Sample
2014.Plate5.61	TTCCCTTCTCCG	GTGCCAGCMGCCGCGGTAA	21.488	Cornell	UK_Twins	Cornell	fecal samples from TwinsUK MiSeq runs	TwinsUK Miseq	Nick	MiSeq	This analysis was done as in Caporaso et al 2011 Genome research. The PCR primers F515 and R806 were developed against the V4 region of the 16S rRNA, both bacteria and archaea, which we determined would yield optimal community clustering with reads of this length The reverse PCR primer is barcoded with a 12-base error-correcting Golay code to facilitate multiplexing of up to 1,500 samples per lane, and both PCR primers contain sequencer adapter regions.	GT	FWD:GTGCCAGCMGCCGCGGTAA; REV:GGACTACHVGGGTWTCTAAT	Plate5	Illumina	V4	Cornell	1/25/13	TwinsUKPlate5	0.1,gram	Kings College London	sequencing by synthesis	16S rRNA	V4	F3	59	years	0	7572	UBERON:feces	24.02210999	UBERON:feces	UBERON:feces	1/23/11	2011-01-23 12:00:00	12:00:00	GAZ:United Kingdom	10/25/51	0	true	10.4516	ENVO:dense settlement biome	ENVO:human-associated habitat	true	757	human	Homo sapiens	7572	9606	7572	51.5	-0.12	true	Cornell	true	false	King's College, London, UK	Stool	female	2	1002500	TwinsUK gut microbiome	MZ	TwinsUK Fecal Sample
2014.Plate5.59	ACCAACAGATTG	GTGCCAGCMGCCGCGGTAA	43.446	Cornell	UK_Twins	Cornell	fecal samples from TwinsUK MiSeq runs	TwinsUK Miseq	Nick	MiSeq	This analysis was done as in Caporaso et al 2011 Genome research. The PCR primers F515 and R806 were developed against the V4 region of the 16S rRNA, both bacteria and archaea, which we determined would yield optimal community clustering with reads of this length The reverse PCR primer is barcoded with a 12-base error-correcting Golay code to facilitate multiplexing of up to 1,500 samples per lane, and both PCR primers contain sequencer adapter regions.	GT	FWD:GTGCCAGCMGCCGCGGTAA; REV:GGACTACHVGGGTWTCTAAT	Plate5	Illumina	V4	Cornell	1/25/13	TwinsUKPlate5	0.1,gram	Kings College London	sequencing by synthesis	16S rRNA	V4	F1	55	years	0	8361	UBERON:feces	24.93728065	UBERON:feces	UBERON:feces	1/21/11	2011-01-21 08:30:00	8:30:00	GAZ:United Kingdom	12/14/55	0	true	10.4516	ENVO:dense settlement biome	ENVO:human-associated habitat	true	836	human	Homo sapiens	8361	9606	8361	51.5	-0.12	true	Cornell	true	false	King's College, London, UK	Stool	female	2	1002487	TwinsUK gut microbiome	DZ	TwinsUK Fecal Sample
2014.Plate5.58	GCCTCGTACTGA	GTGCCAGCMGCCGCGGTAA	25.778	Cornell	UK_Twins	Cornell	fecal samples from TwinsUK MiSeq runs	TwinsUK Miseq	Nick	MiSeq	This analysis was done as in Caporaso et al 2011 Genome research. The PCR primers F515 and R806 were developed against the V4 region of the 16S rRNA, both bacteria and archaea, which we determined would yield optimal community clustering with reads of this length The reverse PCR primer is barcoded with a 12-base error-correcting Golay code to facilitate multiplexing of up to 1,500 samples per lane, and both PCR primers contain sequencer adapter regions.	GT	FWD:GTGCCAGCMGCCGCGGTAA; REV:GGACTACHVGGGTWTCTAAT	Plate5	Illumina	V4	Cornell	1/25/13	TwinsUKPlate5	0.1,gram	Kings College London	sequencing by synthesis	16S rRNA	V4	E12	74	years	0	5381	UBERON:feces	23.71184921	UBERON:feces	UBERON:feces	1/27/11	2011-01-27 14:00:00	14:00:00	GAZ:United Kingdom	9/16/36	0	true	10.4516	ENVO:dense settlement biome	ENVO:human-associated habitat	true	538	human	Homo sapiens	5381	9606	5381	51.5	-0.12	true	Cornell	true	false	King's College, London, UK	Stool	female	2	1002522	TwinsUK gut microbiome	MZ	TwinsUK Fecal Sample
2014.Plate5.57	CGCATACGACCT	GTGCCAGCMGCCGCGGTAA	33.234	Cornell	UK_Twins	Cornell	fecal samples from TwinsUK MiSeq runs	TwinsUK Miseq	Nick	MiSeq	This analysis was done as in Caporaso et al 2011 Genome research. The PCR primers F515 and R806 were developed against the V4 region of the 16S rRNA, both bacteria and archaea, which we determined would yield optimal community clustering with reads of this length The reverse PCR primer is barcoded with a 12-base error-correcting Golay code to facilitate multiplexing of up to 1,500 samples per lane, and both PCR primers contain sequencer adapter regions.	GT	FWD:GTGCCAGCMGCCGCGGTAA; REV:GGACTACHVGGGTWTCTAAT	Plate5	Illumina	V4	Cornell	1/25/13	TwinsUKPlate5	0.1,gram	Kings College London	sequencing by synthesis	16S rRNA	V4	E11	61	years	0	7632	UBERON:feces	26.13933945	UBERON:feces	UBERON:feces	1/27/11	2011-01-27 09:00:00	9:00:00	GAZ:United Kingdom	3/18/49	0	true	10.4516	ENVO:dense settlement biome	ENVO:human-associated habitat	true	763	human	Homo sapiens	7632	9606	7632	51.5	-0.12	true	Cornell	true	false	King's College, London, UK	Stool	female	2	1002530	TwinsUK gut microbiome	DZ	TwinsUK Fecal Sample
2014.Plate5.56	CAGGATTCGTAC	GTGCCAGCMGCCGCGGTAA	28.332	Cornell	UK_Twins	Cornell	fecal samples from TwinsUK MiSeq runs	TwinsUK Miseq	Nick	MiSeq	This analysis was done as in Caporaso et al 2011 Genome research. The PCR primers F515 and R806 were developed against the V4 region of the 16S rRNA, both bacteria and archaea, which we determined would yield optimal community clustering with reads of this length The reverse PCR primer is barcoded with a 12-base error-correcting Golay code to facilitate multiplexing of up to 1,500 samples per lane, and both PCR primers contain sequencer adapter regions.	GT	FWD:GTGCCAGCMGCCGCGGTAA; REV:GGACTACHVGGGTWTCTAAT	Plate5	Illumina	V4	Cornell	1/25/13	TwinsUKPlate5	0.1,gram	Kings College London	sequencing by synthesis	16S rRNA	V4	E10	68	years	0	5782	UBERON:feces	20.4839592	UBERON:feces	UBERON:feces	1/26/11	2011-01-26 08:15:00	8:15:00	GAZ:United Kingdom	3/5/42	0	true	10.4516	ENVO:dense settlement biome	ENVO:human-associated habitat	true	578	human	Homo sapiens	5782	9606	5782	51.5	-0.12	true	Cornell	true	false	King's College, London, UK	Stool	female	2	1002525	TwinsUK gut microbiome	DZ	TwinsUK Fecal Sample
2014.Plate5.55	CTCCAGGTCATG	GTGCCAGCMGCCGCGGTAA	31.702	Cornell	UK_Twins	Cornell	fecal samples from TwinsUK MiSeq runs	TwinsUK Miseq	Nick	MiSeq	This analysis was done as in Caporaso et al 2011 Genome research. The PCR primers F515 and R806 were developed against the V4 region of the 16S rRNA, both bacteria and archaea, which we determined would yield optimal community clustering with reads of this length The reverse PCR primer is barcoded with a 12-base error-correcting Golay code to facilitate multiplexing of up to 1,500 samples per lane, and both PCR primers contain sequencer adapter regions.	GT	FWD:GTGCCAGCMGCCGCGGTAA; REV:GGACTACHVGGGTWTCTAAT	Plate5	Illumina	V4	Cornell	1/25/13	TwinsUKPlate5	0.1,gram	Kings College London	sequencing by synthesis	16S rRNA	V4	E9	63	years	0	5371	UBERON:feces	24.25588989	UBERON:feces	UBERON:feces	1/28/11	2011-01-28 09:00:00	9:00:00	GAZ:United Kingdom	2/4/47	0	true	10.4516	ENVO:dense settlement biome	ENVO:human-associated habitat	true	537	human	Homo sapiens	5371	9606	5371	51.5	-0.12	true	Cornell	true	false	King's College, London, UK	Stool	female	2	1002520	TwinsUK gut microbiome	DZ	TwinsUK Fecal Sample
2014.Plate5.54	TTCACCTGTATC	GTGCCAGCMGCCGCGGTAA	36.911	Cornell	UK_Twins	Cornell	fecal samples from TwinsUK MiSeq runs	TwinsUK Miseq	Nick	MiSeq	This analysis was done as in Caporaso et al 2011 Genome research. The PCR primers F515 and R806 were developed against the V4 region of the 16S rRNA, both bacteria and archaea, which we determined would yield optimal community clustering with reads of this length The reverse PCR primer is barcoded with a 12-base error-correcting Golay code to facilitate multiplexing of up to 1,500 samples per lane, and both PCR primers contain sequencer adapter regions.	GT	FWD:GTGCCAGCMGCCGCGGTAA; REV:GGACTACHVGGGTWTCTAAT	Plate5	Illumina	V4	Cornell	1/25/13	TwinsUKPlate5	0.1,gram	Kings College London	sequencing by synthesis	16S rRNA	V4	E8	61	years	0	7631	UBERON:feces	23.0720005	UBERON:feces	UBERON:feces	1/26/11	2011-01-26 09:15:00	9:15:00	GAZ:United Kingdom	3/18/49	0	true	10.4516	ENVO:dense settlement biome	ENVO:human-associated habitat	true	763	human	Homo sapiens	7631	9606	7631	51.5	-0.12	true	Cornell	true	false	King's College, London, UK	Stool	female	2	1002529	TwinsUK gut microbiome	DZ	TwinsUK Fecal Sample
2014.Plate5.53	CCTCGGGTACTA	GTGCCAGCMGCCGCGGTAA	29.046	Cornell	UK_Twins	Cornell	fecal samples from TwinsUK MiSeq runs	TwinsUK Miseq	Nick	MiSeq	This analysis was done as in Caporaso et al 2011 Genome research. The PCR primers F515 and R806 were developed against the V4 region of the 16S rRNA, both bacteria and archaea, which we determined would yield optimal community clustering with reads of this length The reverse PCR primer is barcoded with a 12-base error-correcting Golay code to facilitate multiplexing of up to 1,500 samples per lane, and both PCR primers contain sequencer adapter regions.	GT	FWD:GTGCCAGCMGCCGCGGTAA; REV:GGACTACHVGGGTWTCTAAT	Plate5	Illumina	V4	Cornell	1/25/13	TwinsUKPlate5	0.1,gram	Kings College London	sequencing by synthesis	16S rRNA	V4	E7	63	years	0	5372	UBERON:feces	23.34786034	UBERON:feces	UBERON:feces	1/26/11	2011-01-26 09:30:00	9:30:00	GAZ:United Kingdom	2/4/47	0	true	10.4516	ENVO:dense settlement biome	ENVO:human-associated habitat	true	537	human	Homo sapiens	5372	9606	5372	51.5	-0.12	true	Cornell	true	false	King's College, London, UK	Stool	female	2	1002521	TwinsUK gut microbiome	DZ	TwinsUK Fecal Sample
2014.Plate5.52	TAAACGCGACTC	GTGCCAGCMGCCGCGGTAA	35.072	Cornell	UK_Twins	Cornell	fecal samples from TwinsUK MiSeq runs	TwinsUK Miseq	Nick	MiSeq	This analysis was done as in Caporaso et al 2011 Genome research. The PCR primers F515 and R806 were developed against the V4 region of the 16S rRNA, both bacteria and archaea, which we determined would yield optimal community clustering with reads of this length The reverse PCR primer is barcoded with a 12-base error-correcting Golay code to facilitate multiplexing of up to 1,500 samples per lane, and both PCR primers contain sequencer adapter regions.	GT	FWD:GTGCCAGCMGCCGCGGTAA; REV:GGACTACHVGGGTWTCTAAT	Plate5	Illumina	V4	Cornell	1/25/13	TwinsUKPlate5	0.1,gram	Kings College London	sequencing by synthesis	16S rRNA	V4	E6	66	years	0	5191	UBERON:feces	23.75082016	UBERON:feces	UBERON:feces	1/23/11	2011-01-23 09:00:00	9:00:00	GAZ:United Kingdom	1/26/44	0	true	10.4516	ENVO:dense settlement biome	ENVO:human-associated habitat	true	519	human	Homo sapiens	5191	9606	5191	51.5	-0.12	true	Cornell	true	false	King's College, London, UK	Stool	female	2	1002519	TwinsUK gut microbiome	DZ	TwinsUK Fecal Sample
2014.Plate5.51	ATTCAGATGGCA	GTGCCAGCMGCCGCGGTAA	30.987	Cornell	UK_Twins	Cornell	fecal samples from TwinsUK MiSeq runs	TwinsUK Miseq	Nick	MiSeq	This analysis was done as in Caporaso et al 2011 Genome research. The PCR primers F515 and R806 were developed against the V4 region of the 16S rRNA, both bacteria and archaea, which we determined would yield optimal community clustering with reads of this length The reverse PCR primer is barcoded with a 12-base error-correcting Golay code to facilitate multiplexing of up to 1,500 samples per lane, and both PCR primers contain sequencer adapter regions.	GT	FWD:GTGCCAGCMGCCGCGGTAA; REV:GGACTACHVGGGTWTCTAAT	Plate5	Illumina	V4	Cornell	1/25/13	TwinsUKPlate5	0.1,gram	Kings College London	sequencing by synthesis	16S rRNA	V4	E5	68	years	0	5781	UBERON:feces	19.13438988	UBERON:feces	UBERON:feces	1/26/11	2011-01-26 00:00:00		GAZ:United Kingdom	3/5/42	0	true	10.4516	ENVO:dense settlement biome	ENVO:human-associated habitat	true	578	human	Homo sapiens	5781	9606	5781	51.5	-0.12	true	Cornell	true	false	King's College, London, UK	Stool	female	2	1002524	TwinsUK gut microbiome	DZ	TwinsUK Fecal Sample
2014.Plate5.50	ATTATACGGCGC	GTGCCAGCMGCCGCGGTAA	45.797	Cornell	UK_Twins	Cornell	fecal samples from TwinsUK MiSeq runs	TwinsUK Miseq	Nick	MiSeq	This analysis was done as in Caporaso et al 2011 Genome research. The PCR primers F515 and R806 were developed against the V4 region of the 16S rRNA, both bacteria and archaea, which we determined would yield optimal community clustering with reads of this length The reverse PCR primer is barcoded with a 12-base error-correcting Golay code to facilitate multiplexing of up to 1,500 samples per lane, and both PCR primers contain sequencer adapter regions.	GT	FWD:GTGCCAGCMGCCGCGGTAA; REV:GGACTACHVGGGTWTCTAAT	Plate5	Illumina	V4	Cornell	1/25/13	TwinsUKPlate5	0.1,gram	Kings College London	sequencing by synthesis	16S rRNA	V4	E4	73	years	0	7932	UBERON:feces	29.70701981	UBERON:feces	UBERON:feces	1/26/11	2011-01-26 11:00:00	11:00:00	GAZ:United Kingdom	4/25/37	0	true	10.4516	ENVO:dense settlement biome	ENVO:human-associated habitat	true	793	human	Homo sapiens	7932	9606	7932	51.5	-0.12	true	Cornell	true	false	King's College, London, UK	Stool	female	2	1002531	TwinsUK gut microbiome	DZ	TwinsUK Fecal Sample
2014.Plate5.49	ACACAGTCCTGA	GTGCCAGCMGCCGCGGTAA	27.31	Cornell	UK_Twins	Cornell	fecal samples from TwinsUK MiSeq runs	TwinsUK Miseq	Nick	MiSeq	This analysis was done as in Caporaso et al 2011 Genome research. The PCR primers F515 and R806 were developed against the V4 region of the 16S rRNA, both bacteria and archaea, which we determined would yield optimal community clustering with reads of this length The reverse PCR primer is barcoded with a 12-base error-correcting Golay code to facilitate multiplexing of up to 1,500 samples per lane, and both PCR primers contain sequencer adapter regions.	GT	FWD:GTGCCAGCMGCCGCGGTAA; REV:GGACTACHVGGGTWTCTAAT	Plate5	Illumina	V4	Cornell	1/25/13	TwinsUKPlate5	0.1,gram	Kings College London	sequencing by synthesis	16S rRNA	V4	E3	80	years	0	5152	UBERON:feces	26.47813034	UBERON:feces	UBERON:feces	2/7/11	2011-02-07 00:00:00		GAZ:United Kingdom	10/11/30	0	true	10.4516	ENVO:dense settlement biome	ENVO:human-associated habitat	true	515	human	Homo sapiens	5152	9606	5152	51.5	-0.12	true	Cornell	true	false	King's College, London, UK	Stool	female	2	1002552	TwinsUK gut microbiome	DZ	TwinsUK Fecal Sample
2014.Plate5.48	GCTTCCAGACAA	GTGCCAGCMGCCGCGGTAA	32.315	Cornell	UK_Twins	Cornell	fecal samples from TwinsUK MiSeq runs	TwinsUK Miseq	Nick	MiSeq	This analysis was done as in Caporaso et al 2011 Genome research. The PCR primers F515 and R806 were developed against the V4 region of the 16S rRNA, both bacteria and archaea, which we determined would yield optimal community clustering with reads of this length The reverse PCR primer is barcoded with a 12-base error-correcting Golay code to facilitate multiplexing of up to 1,500 samples per lane, and both PCR primers contain sequencer adapter regions.	GT	FWD:GTGCCAGCMGCCGCGGTAA; REV:GGACTACHVGGGTWTCTAAT	Plate5	Illumina	V4	Cornell	1/25/13	TwinsUKPlate5	0.1,gram	Kings College London	sequencing by synthesis	16S rRNA	V4	E2	68	years	0	6871	UBERON:feces	24.07346916	UBERON:feces	UBERON:feces	2/1/11	2011-02-01 08:00:00	8:00:00	GAZ:United Kingdom	11/26/42	0	true	10.4516	ENVO:dense settlement biome	ENVO:human-associated habitat	true	687	human	Homo sapiens	6871	9606	6871	51.5	-0.12	true	Cornell	true	false	King's College, London, UK	Stool	female	2	1002539	TwinsUK gut microbiome	DZ	TwinsUK Fecal Sample
2014.Plate5.47	ATCCCAGCATGC	GTGCCAGCMGCCGCGGTAA	35.884	Cornell	UK_Twins	Cornell	fecal samples from TwinsUK MiSeq runs	TwinsUK Miseq	Nick	MiSeq	This analysis was done as in Caporaso et al 2011 Genome research. The PCR primers F515 and R806 were developed against the V4 region of the 16S rRNA, both bacteria and archaea, which we determined would yield optimal community clustering with reads of this length The reverse PCR primer is barcoded with a 12-base error-correcting Golay code to facilitate multiplexing of up to 1,500 samples per lane, and both PCR primers contain sequencer adapter regions.	GT	FWD:GTGCCAGCMGCCGCGGTAA; REV:GGACTACHVGGGTWTCTAAT	Plate5	Illumina	V4	Cornell	1/25/13	TwinsUKPlate5	0.1,gram	Kings College London	sequencing by synthesis	16S rRNA	V4	E1	67	years	0	7181	UBERON:feces	19.9148407	UBERON:feces	UBERON:feces	2/4/11	2011-02-04 00:00:00		GAZ:United Kingdom	4/17/43	0	true	10.4516	ENVO:dense settlement biome	ENVO:human-associated habitat	true	718	human	Homo sapiens	7181	9606	7181	51.5	-0.12	true	Cornell	true	false	King's College, London, UK	Stool	female	2	1002541	TwinsUK gut microbiome	DZ	TwinsUK Fecal Sample
2014.Plate5.45	ATAAAGAGGAGG	GTGCCAGCMGCCGCGGTAA	24.552	Cornell	UK_Twins	Cornell	fecal samples from TwinsUK MiSeq runs	TwinsUK Miseq	Nick	MiSeq	This analysis was done as in Caporaso et al 2011 Genome research. The PCR primers F515 and R806 were developed against the V4 region of the 16S rRNA, both bacteria and archaea, which we determined would yield optimal community clustering with reads of this length The reverse PCR primer is barcoded with a 12-base error-correcting Golay code to facilitate multiplexing of up to 1,500 samples per lane, and both PCR primers contain sequencer adapter regions.	GT	FWD:GTGCCAGCMGCCGCGGTAA; REV:GGACTACHVGGGTWTCTAAT	Plate5	Illumina	V4	Cornell	1/25/13	TwinsUKPlate5	0.1,gram	Kings College London	sequencing by synthesis	16S rRNA	V4	D11	64	years	0	4881	UBERON:feces	26.52779961	UBERON:feces	UBERON:feces	1/31/11	2011-01-31 06:45:00	6:45:00	GAZ:United Kingdom	8/10/46	0	true	10.4516	ENVO:dense settlement biome	ENVO:human-associated habitat	true	488	human	Homo sapiens	4881	9606	4881	51.5	-0.12	true	Cornell	true	false	King's College, London, UK	Stool	female	2	1002535	TwinsUK gut microbiome	DZ	TwinsUK Fecal Sample
2014.Plate5.44	GCCCAAGTTCAC	GTGCCAGCMGCCGCGGTAA	18.118	Cornell	UK_Twins	Cornell	fecal samples from TwinsUK MiSeq runs	TwinsUK Miseq	Nick	MiSeq	This analysis was done as in Caporaso et al 2011 Genome research. The PCR primers F515 and R806 were developed against the V4 region of the 16S rRNA, both bacteria and archaea, which we determined would yield optimal community clustering with reads of this length The reverse PCR primer is barcoded with a 12-base error-correcting Golay code to facilitate multiplexing of up to 1,500 samples per lane, and both PCR primers contain sequencer adapter regions.	GT	FWD:GTGCCAGCMGCCGCGGTAA; REV:GGACTACHVGGGTWTCTAAT	Plate5	Illumina	V4	Cornell	1/25/13	TwinsUKPlate5	0.1,gram	Kings College London	sequencing by synthesis	16S rRNA	V4	D10	55	years	0	8362	UBERON:feces	26.8804493	UBERON:feces	UBERON:feces	1/21/11	2011-01-21 00:00:00		GAZ:United Kingdom	12/14/55	0	true	10.4516	ENVO:dense settlement biome	ENVO:human-associated habitat	true	836	human	Homo sapiens	8362	9606	8362	51.5	-0.12	true	Cornell	true	false	King's College, London, UK	Stool	female	2	1002532	TwinsUK gut microbiome	DZ	TwinsUK Fecal Sample
2014.Plate5.43	GCCTGCAGTACT	GTGCCAGCMGCCGCGGTAA	31.498	Cornell	UK_Twins	Cornell	fecal samples from TwinsUK MiSeq runs	TwinsUK Miseq	Nick	MiSeq	This analysis was done as in Caporaso et al 2011 Genome research. The PCR primers F515 and R806 were developed against the V4 region of the 16S rRNA, both bacteria and archaea, which we determined would yield optimal community clustering with reads of this length The reverse PCR primer is barcoded with a 12-base error-correcting Golay code to facilitate multiplexing of up to 1,500 samples per lane, and both PCR primers contain sequencer adapter regions.	GT	FWD:GTGCCAGCMGCCGCGGTAA; REV:GGACTACHVGGGTWTCTAAT	Plate5	Illumina	V4	Cornell	1/25/13	TwinsUKPlate5	0.1,gram	Kings College London	sequencing by synthesis	16S rRNA	V4	D9	50	years	0	7862	UBERON:feces	27.64530945	UBERON:feces	UBERON:feces	1/30/11	2011-01-30 09:49:00	9:49:00	GAZ:United Kingdom	5/13/60	0	true	10.4516	ENVO:dense settlement biome	ENVO:human-associated habitat	true	786	human	Homo sapiens	7862	9606	7862	51.5	-0.12	true	Cornell	true	false	King's College, London, UK	Stool	female	2	1002546	TwinsUK gut microbiome	MZ	TwinsUK Fecal Sample
2014.Plate5.42	TCCTCACTATCA	GTGCCAGCMGCCGCGGTAA	32.213	Cornell	UK_Twins	Cornell	fecal samples from TwinsUK MiSeq runs	TwinsUK Miseq	Nick	MiSeq	This analysis was done as in Caporaso et al 2011 Genome research. The PCR primers F515 and R806 were developed against the V4 region of the 16S rRNA, both bacteria and archaea, which we determined would yield optimal community clustering with reads of this length The reverse PCR primer is barcoded with a 12-base error-correcting Golay code to facilitate multiplexing of up to 1,500 samples per lane, and both PCR primers contain sequencer adapter regions.	GT	FWD:GTGCCAGCMGCCGCGGTAA; REV:GGACTACHVGGGTWTCTAAT	Plate5	Illumina	V4	Cornell	1/25/13	TwinsUKPlate5	0.1,gram	Kings College London	sequencing by synthesis	16S rRNA	V4	D8	50	years	0	7861	UBERON:feces	26.20079041	UBERON:feces	UBERON:feces	1/29/11	2011-01-29 14:15:00	14:15:00	GAZ:United Kingdom	5/13/60	0	true	10.4516	ENVO:dense settlement biome	ENVO:human-associated habitat	true	786	human	Homo sapiens	7861	9606	7861	51.5	-0.12	true	Cornell	true	false	King's College, London, UK	Stool	female	2	1002545	TwinsUK gut microbiome	MZ	TwinsUK Fecal Sample
2014.Plate5.40	TTGGAACGGCTT	GTGCCAGCMGCCGCGGTAA	37.728	Cornell	UK_Twins	Cornell	fecal samples from TwinsUK MiSeq runs	TwinsUK Miseq	Nick	MiSeq	This analysis was done as in Caporaso et al 2011 Genome research. The PCR primers F515 and R806 were developed against the V4 region of the 16S rRNA, both bacteria and archaea, which we determined would yield optimal community clustering with reads of this length The reverse PCR primer is barcoded with a 12-base error-correcting Golay code to facilitate multiplexing of up to 1,500 samples per lane, and both PCR primers contain sequencer adapter regions.	GT	FWD:GTGCCAGCMGCCGCGGTAA; REV:GGACTACHVGGGTWTCTAAT	Plate5	Illumina	V4	Cornell	1/25/13	TwinsUKPlate5	0.1,gram	Kings College London	sequencing by synthesis	16S rRNA	V4	D6	58	years	0	7591	UBERON:feces	29.70564079	UBERON:feces	UBERON:feces	2/1/11	2011-02-01 21:15:00	21:15:00	GAZ:United Kingdom	3/13/52	0	true	10.4516	ENVO:dense settlement biome	ENVO:human-associated habitat	true	759	human	Homo sapiens	7591	9606	7591	51.5	-0.12	true	Cornell	true	false	King's College, London, UK	Stool	female	2	1002543	TwinsUK gut microbiome	MZ	TwinsUK Fecal Sample
2014.Plate5.4	CATCTGGGCAAT	GTGCCAGCMGCCGCGGTAA	30.578	Cornell	UK_Twins	Cornell	fecal samples from TwinsUK MiSeq runs	TwinsUK Miseq	Nick	MiSeq	This analysis was done as in Caporaso et al 2011 Genome research. The PCR primers F515 and R806 were developed against the V4 region of the 16S rRNA, both bacteria and archaea, which we determined would yield optimal community clustering with reads of this length The reverse PCR primer is barcoded with a 12-base error-correcting Golay code to facilitate multiplexing of up to 1,500 samples per lane, and both PCR primers contain sequencer adapter regions.	GT	FWD:GTGCCAGCMGCCGCGGTAA; REV:GGACTACHVGGGTWTCTAAT	Plate5	Illumina	V4	Cornell	1/25/13	TwinsUKPlate5	0.1,gram	Kings College London	sequencing by synthesis	16S rRNA	V4	A4	69	years	0	6131	UBERON:feces	21.32959938	UBERON:feces	UBERON:feces	1/2/11	2011-01-02 15:00:00	15:00:00	GAZ:United Kingdom	11/7/41	0	true	10.4516	ENVO:dense settlement biome	ENVO:human-associated habitat	true	613	human	Homo sapiens	6131	9606	6131	51.5	-0.12	true	Cornell	true	false	King's College, London, UK	Stool	female	2	1002417	TwinsUK gut microbiome	DZ	TwinsUK Fecal Sample
2014.Plate5.39	GACCGTCAATAC	GTGCCAGCMGCCGCGGTAA	31.906	Cornell	UK_Twins	Cornell	fecal samples from TwinsUK MiSeq runs	TwinsUK Miseq	Nick	MiSeq	This analysis was done as in Caporaso et al 2011 Genome research. The PCR primers F515 and R806 were developed against the V4 region of the 16S rRNA, both bacteria and archaea, which we determined would yield optimal community clustering with reads of this length The reverse PCR primer is barcoded with a 12-base error-correcting Golay code to facilitate multiplexing of up to 1,500 samples per lane, and both PCR primers contain sequencer adapter regions.	GT	FWD:GTGCCAGCMGCCGCGGTAA; REV:GGACTACHVGGGTWTCTAAT	Plate5	Illumina	V4	Cornell	1/25/13	TwinsUKPlate5	0.1,gram	Kings College London	sequencing by synthesis	16S rRNA	V4	D5	44	years	0	4481	UBERON:feces	29.88302994	UBERON:feces	UBERON:feces	2/1/11	2011-02-01 08:30:00	8:30:00	GAZ:United Kingdom	3/29/66	0	true	10.4516	ENVO:dense settlement biome	ENVO:human-associated habitat	true	448	human	Homo sapiens	4481	9606	4481	51.5	-0.12	true	Cornell	true	false	King's College, London, UK	Stool	female	2	1002533	TwinsUK gut microbiome	DZ	TwinsUK Fecal Sample
2014.Plate5.38	GGAAATCCCATC	GTGCCAGCMGCCGCGGTAA	26.493	Cornell	UK_Twins	Cornell	fecal samples from TwinsUK MiSeq runs	TwinsUK Miseq	Nick	MiSeq	This analysis was done as in Caporaso et al 2011 Genome research. The PCR primers F515 and R806 were developed against the V4 region of the 16S rRNA, both bacteria and archaea, which we determined would yield optimal community clustering with reads of this length The reverse PCR primer is barcoded with a 12-base error-correcting Golay code to facilitate multiplexing of up to 1,500 samples per lane, and both PCR primers contain sequencer adapter regions.	GT	FWD:GTGCCAGCMGCCGCGGTAA; REV:GGACTACHVGGGTWTCTAAT	Plate5	Illumina	V4	Cornell	1/25/13	TwinsUKPlate5	0.1,gram	Kings College London	sequencing by synthesis	16S rRNA	V4	D4	60	years	0	8352	UBERON:feces	29.29770088	UBERON:feces	UBERON:feces	2/21/11	2011-02-21 20:00:00	20:00:00	GAZ:United Kingdom	6/22/50	0	true	10.4516	ENVO:dense settlement biome	ENVO:human-associated habitat	true	835	human	Homo sapiens	8352	9606	8352	51.5	-0.12	true	Cornell	true	false	King's College, London, UK	Stool	female	2	1002595	TwinsUK gut microbiome	DZ	TwinsUK Fecal Sample
2014.Plate5.36	GATCTAATCGAG	GTGCCAGCMGCCGCGGTAA	28.842	Cornell	UK_Twins	Cornell	fecal samples from TwinsUK MiSeq runs	TwinsUK Miseq	Nick	MiSeq	This analysis was done as in Caporaso et al 2011 Genome research. The PCR primers F515 and R806 were developed against the V4 region of the 16S rRNA, both bacteria and archaea, which we determined would yield optimal community clustering with reads of this length The reverse PCR primer is barcoded with a 12-base error-correcting Golay code to facilitate multiplexing of up to 1,500 samples per lane, and both PCR primers contain sequencer adapter regions.	GT	FWD:GTGCCAGCMGCCGCGGTAA; REV:GGACTACHVGGGTWTCTAAT	Plate5	Illumina	V4	Cornell	1/25/13	TwinsUKPlate5	0.1,gram	Kings College London	sequencing by synthesis	16S rRNA	V4	D2	63	years	0	5981	UBERON:feces	23.2741909	UBERON:feces	UBERON:feces	2/16/11	2011-02-16 18:50:00	18:50:00	GAZ:United Kingdom	10/6/47	0	true	10.4516	ENVO:dense settlement biome	ENVO:human-associated habitat	true	598	human	Homo sapiens	5981	9606	5981	51.5	-0.12	true	Cornell	true	false	King's College, London, UK	Stool	female	2	1002605	TwinsUK gut microbiome	DZ	TwinsUK Fecal Sample
2014.Plate5.35	GCATGCATCCCA	GTGCCAGCMGCCGCGGTAA	47.421	Cornell	UK_Twins	Cornell	fecal samples from TwinsUK MiSeq runs	TwinsUK Miseq	Nick	MiSeq	This analysis was done as in Caporaso et al 2011 Genome research. The PCR primers F515 and R806 were developed against the V4 region of the 16S rRNA, both bacteria and archaea, which we determined would yield optimal community clustering with reads of this length The reverse PCR primer is barcoded with a 12-base error-correcting Golay code to facilitate multiplexing of up to 1,500 samples per lane, and both PCR primers contain sequencer adapter regions.	GT	FWD:GTGCCAGCMGCCGCGGTAA; REV:GGACTACHVGGGTWTCTAAT	Plate5	Illumina	V4	Cornell	1/25/13	TwinsUKPlate5	0.1,gram	Kings College London	sequencing by synthesis	16S rRNA	V4	D1	60	years	0	8351	UBERON:feces	19.06427956	UBERON:feces	UBERON:feces	2/22/11	2011-02-22 08:40:00	8:40:00	GAZ:United Kingdom	6/22/50	0	true	10.4516	ENVO:dense settlement biome	ENVO:human-associated habitat	true	835	human	Homo sapiens	8351	9606	8351	51.5	-0.12	true	Cornell	true	false	King's College, London, UK	Stool	female	2	1002594	TwinsUK gut microbiome	DZ	TwinsUK Fecal Sample
2014.Plate5.34	ACTCATCTTCCA	GTGCCAGCMGCCGCGGTAA	28.332	Cornell	UK_Twins	Cornell	fecal samples from TwinsUK MiSeq runs	TwinsUK Miseq	Nick	MiSeq	This analysis was done as in Caporaso et al 2011 Genome research. The PCR primers F515 and R806 were developed against the V4 region of the 16S rRNA, both bacteria and archaea, which we determined would yield optimal community clustering with reads of this length The reverse PCR primer is barcoded with a 12-base error-correcting Golay code to facilitate multiplexing of up to 1,500 samples per lane, and both PCR primers contain sequencer adapter regions.	GT	FWD:GTGCCAGCMGCCGCGGTAA; REV:GGACTACHVGGGTWTCTAAT	Plate5	Illumina	V4	Cornell	1/25/13	TwinsUKPlate5	0.1,gram	Kings College London	sequencing by synthesis	16S rRNA	V4	C11	69	years	0	5651	UBERON:feces	30.58510017	UBERON:feces	UBERON:feces	2/22/11	2011-02-22 18:28:00	18:28:00	GAZ:United Kingdom	2/23/41	0	true	10.4516	ENVO:dense settlement biome	ENVO:human-associated habitat	true	565	human	Homo sapiens	5651	9606	5651	51.5	-0.12	true	Cornell	true	false	King's College, London, UK	Stool	female	2	1002601	TwinsUK gut microbiome	MZ	TwinsUK Fecal Sample
2014.Plate5.33	AAGATCGTACTG	GTGCCAGCMGCCGCGGTAA	22.612	Cornell	UK_Twins	Cornell	fecal samples from TwinsUK MiSeq runs	TwinsUK Miseq	Nick	MiSeq	This analysis was done as in Caporaso et al 2011 Genome research. The PCR primers F515 and R806 were developed against the V4 region of the 16S rRNA, both bacteria and archaea, which we determined would yield optimal community clustering with reads of this length The reverse PCR primer is barcoded with a 12-base error-correcting Golay code to facilitate multiplexing of up to 1,500 samples per lane, and both PCR primers contain sequencer adapter regions.	GT	FWD:GTGCCAGCMGCCGCGGTAA; REV:GGACTACHVGGGTWTCTAAT	Plate5	Illumina	V4	Cornell	1/25/13	TwinsUKPlate5	0.1,gram	Kings College London	sequencing by synthesis	16S rRNA	V4	C10	50	years	0	5321	UBERON:feces	25.52281952	UBERON:feces	UBERON:feces	2/21/11	2011-02-21 22:30:00	22:30:00	GAZ:United Kingdom	9/26/60	0	true	10.4516	ENVO:dense settlement biome	ENVO:human-associated habitat	true	532	human	Homo sapiens	5321	9606	5321	51.5	-0.12	true	Cornell	true	false	King's College, London, UK	Stool	female	2	1002599	TwinsUK gut microbiome	DZ	TwinsUK Fecal Sample
2014.Plate5.32	TACGCCCATCAG	GTGCCAGCMGCCGCGGTAA	32.008	Cornell	UK_Twins	Cornell	fecal samples from TwinsUK MiSeq runs	TwinsUK Miseq	Nick	MiSeq	This analysis was done as in Caporaso et al 2011 Genome research. The PCR primers F515 and R806 were developed against the V4 region of the 16S rRNA, both bacteria and archaea, which we determined would yield optimal community clustering with reads of this length The reverse PCR primer is barcoded with a 12-base error-correcting Golay code to facilitate multiplexing of up to 1,500 samples per lane, and both PCR primers contain sequencer adapter regions.	GT	FWD:GTGCCAGCMGCCGCGGTAA; REV:GGACTACHVGGGTWTCTAAT	Plate5	Illumina	V4	Cornell	1/25/13	TwinsUKPlate5	0.1,gram	Kings College London	sequencing by synthesis	16S rRNA	V4	C9	60	years	0	7732	UBERON:feces	26.54678917	UBERON:feces	UBERON:feces	2/21/11	2011-02-21 08:00:00	8:00:00	GAZ:United Kingdom	2/12/51	0	true	10.4516	ENVO:dense settlement biome	ENVO:human-associated habitat	true	773	human	Homo sapiens	7732	9606	7732	51.5	-0.12	true	Cornell	true	false	King's College, London, UK	Stool	female	2	1002609	TwinsUK gut microbiome	DZ	TwinsUK Fecal Sample
2014.Plate5.31	ATCGGGCTTAAC	GTGCCAGCMGCCGCGGTAA	35.072	Cornell	UK_Twins	Cornell	fecal samples from TwinsUK MiSeq runs	TwinsUK Miseq	Nick	MiSeq	This analysis was done as in Caporaso et al 2011 Genome research. The PCR primers F515 and R806 were developed against the V4 region of the 16S rRNA, both bacteria and archaea, which we determined would yield optimal community clustering with reads of this length The reverse PCR primer is barcoded with a 12-base error-correcting Golay code to facilitate multiplexing of up to 1,500 samples per lane, and both PCR primers contain sequencer adapter regions.	GT	FWD:GTGCCAGCMGCCGCGGTAA; REV:GGACTACHVGGGTWTCTAAT	Plate5	Illumina	V4	Cornell	1/25/13	TwinsUKPlate5	0.1,gram	Kings College London	sequencing by synthesis	16S rRNA	V4	C8	73	years	0	5741	UBERON:feces	20.8466301	UBERON:feces	UBERON:feces	2/23/11	2011-02-23 09:40:00	9:40:00	GAZ:United Kingdom	9/14/37	0	true	10.4516	ENVO:dense settlement biome	ENVO:human-associated habitat	true	574	human	Homo sapiens	5741	9606	5741	51.5	-0.12	true	Cornell	true	false	King's College, London, UK	Stool	female	2	1002603	TwinsUK gut microbiome	MZ	TwinsUK Fecal Sample
2014.Plate5.30	GAAACTCCTAGA	GTGCCAGCMGCCGCGGTAA	27.719	Cornell	UK_Twins	Cornell	fecal samples from TwinsUK MiSeq runs	TwinsUK Miseq	Nick	MiSeq	This analysis was done as in Caporaso et al 2011 Genome research. The PCR primers F515 and R806 were developed against the V4 region of the 16S rRNA, both bacteria and archaea, which we determined would yield optimal community clustering with reads of this length The reverse PCR primer is barcoded with a 12-base error-correcting Golay code to facilitate multiplexing of up to 1,500 samples per lane, and both PCR primers contain sequencer adapter regions.	GT	FWD:GTGCCAGCMGCCGCGGTAA; REV:GGACTACHVGGGTWTCTAAT	Plate5	Illumina	V4	Cornell	1/25/13	TwinsUKPlate5	0.1,gram	Kings College London	sequencing by synthesis	16S rRNA	V4	C7	50	years	0	4021	UBERON:feces	23.9437809	UBERON:feces	UBERON:feces	2/24/11	2011-02-24 09:25:00	9:25:00	GAZ:United Kingdom	8/8/60	0	true	10.4516	ENVO:dense settlement biome	ENVO:human-associated habitat	true	402	human	Homo sapiens	4021	9606	4021	51.5	-0.12	true	Cornell	true	false	King's College, London, UK	Stool	female	2	1002596	TwinsUK gut microbiome	DZ	TwinsUK Fecal Sample
2014.Plate5.3	TCTAACGAGTGC	GTGCCAGCMGCCGCGGTAA	29.659	Cornell	UK_Twins	Cornell	fecal samples from TwinsUK MiSeq runs	TwinsUK Miseq	Nick	MiSeq	This analysis was done as in Caporaso et al 2011 Genome research. The PCR primers F515 and R806 were developed against the V4 region of the 16S rRNA, both bacteria and archaea, which we determined would yield optimal community clustering with reads of this length The reverse PCR primer is barcoded with a 12-base error-correcting Golay code to facilitate multiplexing of up to 1,500 samples per lane, and both PCR primers contain sequencer adapter regions.	GT	FWD:GTGCCAGCMGCCGCGGTAA; REV:GGACTACHVGGGTWTCTAAT	Plate5	Illumina	V4	Cornell	1/25/13	TwinsUKPlate5	0.1,gram	Kings College London	sequencing by synthesis	16S rRNA	V4	A3	53	years	0	7911	UBERON:feces	32.56093979	UBERON:feces	UBERON:feces	12/12/10	2010-12-12 11:30:00	11:30:00	GAZ:United Kingdom	5/24/57	0	true	10.4516	ENVO:dense settlement biome	ENVO:human-associated habitat	true	791	human	Homo sapiens	7911	9606	7911	51.5	-0.12	true	Cornell	true	false	King's College, London, UK	Stool	female	2	1002423	TwinsUK gut microbiome	MZ	TwinsUK Fecal Sample
2014.Plate5.29	GCGTAGAGAGAC	GTGCCAGCMGCCGCGGTAA	35.175	Cornell	UK_Twins	Cornell	fecal samples from TwinsUK MiSeq runs	TwinsUK Miseq	Nick	MiSeq	This analysis was done as in Caporaso et al 2011 Genome research. The PCR primers F515 and R806 were developed against the V4 region of the 16S rRNA, both bacteria and archaea, which we determined would yield optimal community clustering with reads of this length The reverse PCR primer is barcoded with a 12-base error-correcting Golay code to facilitate multiplexing of up to 1,500 samples per lane, and both PCR primers contain sequencer adapter regions.	GT	FWD:GTGCCAGCMGCCGCGGTAA; REV:GGACTACHVGGGTWTCTAAT	Plate5	Illumina	V4	Cornell	1/25/13	TwinsUKPlate5	0.1,gram	Kings College London	sequencing by synthesis	16S rRNA	V4	C6	63	years	0	6082	UBERON:feces	21.99167061	UBERON:feces	UBERON:feces	1/8/11	2011-01-08 21:25:00	21:25:00	GAZ:United Kingdom	11/11/47	0	true	10.4516	ENVO:dense settlement biome	ENVO:human-associated habitat	true	608	human	Homo sapiens	6082	9606	6082	51.5	-0.12	true	Cornell	true	false	King's College, London, UK	Stool	female	2	1002449	TwinsUK gut microbiome	DZ	TwinsUK Fecal Sample
2014.Plate5.28	TCCAGGGCTATA	GTGCCAGCMGCCGCGGTAA	41.609	Cornell	UK_Twins	Cornell	fecal samples from TwinsUK MiSeq runs	TwinsUK Miseq	Nick	MiSeq	This analysis was done as in Caporaso et al 2011 Genome research. The PCR primers F515 and R806 were developed against the V4 region of the 16S rRNA, both bacteria and archaea, which we determined would yield optimal community clustering with reads of this length The reverse PCR primer is barcoded with a 12-base error-correcting Golay code to facilitate multiplexing of up to 1,500 samples per lane, and both PCR primers contain sequencer adapter regions.	GT	FWD:GTGCCAGCMGCCGCGGTAA; REV:GGACTACHVGGGTWTCTAAT	Plate5	Illumina	V4	Cornell	1/25/13	TwinsUKPlate5	0.1,gram	Kings College London	sequencing by synthesis	16S rRNA	V4	C5	71	years	0	8081	UBERON:feces	32.03440094	UBERON:feces	UBERON:feces	1/13/11	2011-01-13 07:30:00	7:30:00	GAZ:United Kingdom	5/26/39	0	true	10.4516	ENVO:dense settlement biome	ENVO:human-associated habitat	true	808	human	Homo sapiens	8081	9606	8081	51.5	-0.12	true	Cornell	true	false	King's College, London, UK	Stool	female	2	1002454	TwinsUK gut microbiome	DZ	TwinsUK Fecal Sample
2014.Plate5.27	TTGGACGTCCAC	GTGCCAGCMGCCGCGGTAA	35.379	Cornell	UK_Twins	Cornell	fecal samples from TwinsUK MiSeq runs	TwinsUK Miseq	Nick	MiSeq	This analysis was done as in Caporaso et al 2011 Genome research. The PCR primers F515 and R806 were developed against the V4 region of the 16S rRNA, both bacteria and archaea, which we determined would yield optimal community clustering with reads of this length The reverse PCR primer is barcoded with a 12-base error-correcting Golay code to facilitate multiplexing of up to 1,500 samples per lane, and both PCR primers contain sequencer adapter regions.	GT	FWD:GTGCCAGCMGCCGCGGTAA; REV:GGACTACHVGGGTWTCTAAT	Plate5	Illumina	V4	Cornell	1/25/13	TwinsUKPlate5	0.1,gram	Kings College London	sequencing by synthesis	16S rRNA	V4	C4	72	years	0	8171	UBERON:feces	22.55501938	UBERON:feces	UBERON:feces	1/12/11	2011-01-12 11:30:00	11:30:00	GAZ:United Kingdom	12/27/38	0	true	10.4516	ENVO:dense settlement biome	ENVO:human-associated habitat	true	817	human	Homo sapiens	8171	9606	8171	51.5	-0.12	true	Cornell	true	false	King's College, London, UK	Stool	female	2	1002440	TwinsUK gut microbiome	DZ	TwinsUK Fecal Sample
2014.Plate5.25	TCACTTGGTGCG	GTGCCAGCMGCCGCGGTAA	33.847	Cornell	UK_Twins	Cornell	fecal samples from TwinsUK MiSeq runs	TwinsUK Miseq	Nick	MiSeq	This analysis was done as in Caporaso et al 2011 Genome research. The PCR primers F515 and R806 were developed against the V4 region of the 16S rRNA, both bacteria and archaea, which we determined would yield optimal community clustering with reads of this length The reverse PCR primer is barcoded with a 12-base error-correcting Golay code to facilitate multiplexing of up to 1,500 samples per lane, and both PCR primers contain sequencer adapter regions.	GT	FWD:GTGCCAGCMGCCGCGGTAA; REV:GGACTACHVGGGTWTCTAAT	Plate5	Illumina	V4	Cornell	1/25/13	TwinsUKPlate5	0.1,gram	Kings College London	sequencing by synthesis	16S rRNA	V4	C2	72	years	0	8172	UBERON:feces	19.18997002	UBERON:feces	UBERON:feces	1/12/11	2011-01-12 08:30:00	8:30:00	GAZ:United Kingdom	12/27/38	0	true	10.4516	ENVO:dense settlement biome	ENVO:human-associated habitat	true	817	human	Homo sapiens	8172	9606	8172	51.5	-0.12	true	Cornell	true	false	King's College, London, UK	Stool	female	2	1002441	TwinsUK gut microbiome	DZ	TwinsUK Fecal Sample
2014.Plate5.24	TCCGCAACCTGA	GTGCCAGCMGCCGCGGTAA	24.833	Cornell	UK_Twins	Cornell	fecal samples from TwinsUK MiSeq runs	TwinsUK Miseq	Nick	MiSeq	This analysis was done as in Caporaso et al 2011 Genome research. The PCR primers F515 and R806 were developed against the V4 region of the 16S rRNA, both bacteria and archaea, which we determined would yield optimal community clustering with reads of this length The reverse PCR primer is barcoded with a 12-base error-correcting Golay code to facilitate multiplexing of up to 1,500 samples per lane, and both PCR primers contain sequencer adapter regions.	GT	FWD:GTGCCAGCMGCCGCGGTAA; REV:GGACTACHVGGGTWTCTAAT	Plate5	Illumina	V4	Cornell	1/25/13	TwinsUKPlate5	0.1,gram	Kings College London	sequencing by synthesis	16S rRNA	V4	C1	79	years	0	5472	UBERON:feces	28.41953087	UBERON:feces	UBERON:feces	1/6/11	2011-01-06 08:30:00	8:30:00	GAZ:United Kingdom	7/7/31	0	true	10.4516	ENVO:dense settlement biome	ENVO:human-associated habitat	true	547	human	Homo sapiens	5472	9606	5472	51.5	-0.12	true	Cornell	true	false	King's College, London, UK	Stool	female	2	1002446	TwinsUK gut microbiome	DZ	TwinsUK Fecal Sample
2014.Plate5.23	AGACAAGCTTCC	GTGCCAGCMGCCGCGGTAA	29.659	Cornell	UK_Twins	Cornell	fecal samples from TwinsUK MiSeq runs	TwinsUK Miseq	Nick	MiSeq	This analysis was done as in Caporaso et al 2011 Genome research. The PCR primers F515 and R806 were developed against the V4 region of the 16S rRNA, both bacteria and archaea, which we determined would yield optimal community clustering with reads of this length The reverse PCR primer is barcoded with a 12-base error-correcting Golay code to facilitate multiplexing of up to 1,500 samples per lane, and both PCR primers contain sequencer adapter regions.	GT	FWD:GTGCCAGCMGCCGCGGTAA; REV:GGACTACHVGGGTWTCTAAT	Plate5	Illumina	V4	Cornell	1/25/13	TwinsUKPlate5	0.1,gram	Kings College London	sequencing by synthesis	16S rRNA	V4	B12	41	years	0	6581	UBERON:feces	40.57360077	UBERON:feces	UBERON:feces	1/13/11	2011-01-13 19:55:00	19:55:00	GAZ:United Kingdom	8/3/69	0	true	10.4516	ENVO:dense settlement biome	ENVO:human-associated habitat	true	658	human	Homo sapiens	6581	9606	6581	51.5	-0.12	true	Cornell	true	false	King's College, London, UK	Stool	female	2	1002450	TwinsUK gut microbiome	DZ	TwinsUK Fecal Sample
2014.Plate5.20	CACGAGCTACTC	GTGCCAGCMGCCGCGGTAA	25.574	Cornell	UK_Twins	Cornell	fecal samples from TwinsUK MiSeq runs	TwinsUK Miseq	Nick	MiSeq	This analysis was done as in Caporaso et al 2011 Genome research. The PCR primers F515 and R806 were developed against the V4 region of the 16S rRNA, both bacteria and archaea, which we determined would yield optimal community clustering with reads of this length The reverse PCR primer is barcoded with a 12-base error-correcting Golay code to facilitate multiplexing of up to 1,500 samples per lane, and both PCR primers contain sequencer adapter regions.	GT	FWD:GTGCCAGCMGCCGCGGTAA; REV:GGACTACHVGGGTWTCTAAT	Plate5	Illumina	V4	Cornell	1/25/13	TwinsUKPlate5	0.1,gram	Kings College London	sequencing by synthesis	16S rRNA	V4	B9	60	years	0	5881	UBERON:feces	27.22619057	UBERON:feces	UBERON:feces	1/9/11	2011-01-09 06:45:00	6:45:00	GAZ:United Kingdom	3/30/50	0	true	10.4516	ENVO:dense settlement biome	ENVO:human-associated habitat	true	588	human	Homo sapiens	5881	9606	5881	51.5	-0.12	true	Cornell	true	false	King's College, London, UK	Stool	female	2	1002447	TwinsUK gut microbiome	DZ	TwinsUK Fecal Sample
2014.Plate5.2	GTCGGAAATTGT	GTGCCAGCMGCCGCGGTAA	26.595	Cornell	UK_Twins	Cornell	fecal samples from TwinsUK MiSeq runs	TwinsUK Miseq	Nick	MiSeq	This analysis was done as in Caporaso et al 2011 Genome research. The PCR primers F515 and R806 were developed against the V4 region of the 16S rRNA, both bacteria and archaea, which we determined would yield optimal community clustering with reads of this length The reverse PCR primer is barcoded with a 12-base error-correcting Golay code to facilitate multiplexing of up to 1,500 samples per lane, and both PCR primers contain sequencer adapter regions.	GT	FWD:GTGCCAGCMGCCGCGGTAA; REV:GGACTACHVGGGTWTCTAAT	Plate5	Illumina	V4	Cornell	1/25/13	TwinsUKPlate5	0.1,gram	Kings College London	sequencing by synthesis	16S rRNA	V4	A2	69	years	0	6132	UBERON:feces	20.29693985	UBERON:feces	UBERON:feces	1/4/11	2011-01-04 04:30:00	4:30:00	GAZ:United Kingdom	11/7/41	0	true	10.4516	ENVO:dense settlement biome	ENVO:human-associated habitat	true	613	human	Homo sapiens	6132	9606	6132	51.5	-0.12	true	Cornell	true	false	King's College, London, UK	Stool	female	2	1002418	TwinsUK gut microbiome	DZ	TwinsUK Fecal Sample
2014.Plate5.19	CACCTGTAGTAG	GTGCCAGCMGCCGCGGTAA	30.374	Cornell	UK_Twins	Cornell	fecal samples from TwinsUK MiSeq runs	TwinsUK Miseq	Nick	MiSeq	This analysis was done as in Caporaso et al 2011 Genome research. The PCR primers F515 and R806 were developed against the V4 region of the 16S rRNA, both bacteria and archaea, which we determined would yield optimal community clustering with reads of this length The reverse PCR primer is barcoded with a 12-base error-correcting Golay code to facilitate multiplexing of up to 1,500 samples per lane, and both PCR primers contain sequencer adapter regions.	GT	FWD:GTGCCAGCMGCCGCGGTAA; REV:GGACTACHVGGGTWTCTAAT	Plate5	Illumina	V4	Cornell	1/25/13	TwinsUKPlate5	0.1,gram	Kings College London	sequencing by synthesis	16S rRNA	V4	B8	62	years	0	7972	UBERON:feces	21.13801956	UBERON:feces	UBERON:feces	1/6/11	2011-01-06 08:40:00	8:40:00	GAZ:United Kingdom	3/5/48	0	true	10.4516	ENVO:dense settlement biome	ENVO:human-associated habitat	true	797	human	Homo sapiens	7972	9606	7972	51.5	-0.12	true	Cornell	true	false	King's College, London, UK	Stool	female	2	1002453	TwinsUK gut microbiome	MZ	TwinsUK Fecal Sample
2014.Plate5.18	GTAGCACTCATG	GTGCCAGCMGCCGCGGTAA	28.229	Cornell	UK_Twins	Cornell	fecal samples from TwinsUK MiSeq runs	TwinsUK Miseq	Nick	MiSeq	This analysis was done as in Caporaso et al 2011 Genome research. The PCR primers F515 and R806 were developed against the V4 region of the 16S rRNA, both bacteria and archaea, which we determined would yield optimal community clustering with reads of this length The reverse PCR primer is barcoded with a 12-base error-correcting Golay code to facilitate multiplexing of up to 1,500 samples per lane, and both PCR primers contain sequencer adapter regions.	GT	FWD:GTGCCAGCMGCCGCGGTAA; REV:GGACTACHVGGGTWTCTAAT	Plate5	Illumina	V4	Cornell	1/25/13	TwinsUKPlate5	0.1,gram	Kings College London	sequencing by synthesis	16S rRNA	V4	B7	60	years	0	5882	UBERON:feces	26.08625031	UBERON:feces	UBERON:feces	1/9/11	2011-01-09 09:30:00	9:30:00	GAZ:United Kingdom	3/30/50	0	true	10.4516	ENVO:dense settlement biome	ENVO:human-associated habitat	true	588	human	Homo sapiens	5882	9606	5882	51.5	-0.12	true	Cornell	true	false	King's College, London, UK	Stool	female	2	1002448	TwinsUK gut microbiome	DZ	TwinsUK Fecal Sample
2014.Plate5.17	GTCTCCTCCCTT	GTGCCAGCMGCCGCGGTAA	32.417	Cornell	UK_Twins	Cornell	fecal samples from TwinsUK MiSeq runs	TwinsUK Miseq	Nick	MiSeq	This analysis was done as in Caporaso et al 2011 Genome research. The PCR primers F515 and R806 were developed against the V4 region of the 16S rRNA, both bacteria and archaea, which we determined would yield optimal community clustering with reads of this length The reverse PCR primer is barcoded with a 12-base error-correcting Golay code to facilitate multiplexing of up to 1,500 samples per lane, and both PCR primers contain sequencer adapter regions.	GT	FWD:GTGCCAGCMGCCGCGGTAA; REV:GGACTACHVGGGTWTCTAAT	Plate5	Illumina	V4	Cornell	1/25/13	TwinsUKPlate5	0.1,gram	Kings College London	sequencing by synthesis	16S rRNA	V4	B6	61	years	0	8012	UBERON:feces	33.78905869	UBERON:feces	UBERON:feces	2/1/11	2011-02-01 11:05:00	11:05:00	GAZ:United Kingdom	12/3/49	0	true	10.4516	ENVO:dense settlement biome	ENVO:human-associated habitat	true	801	human	Homo sapiens	8012	9606	8012	51.5	-0.12	true	Cornell	true	false	King's College, London, UK	Stool	female	2	1002593	TwinsUK gut microbiome	MZ	TwinsUK Fecal Sample
2014.Plate5.16	ACACCGCACAAT	GTGCCAGCMGCCGCGGTAA	27.31	Cornell	UK_Twins	Cornell	fecal samples from TwinsUK MiSeq runs	TwinsUK Miseq	Nick	MiSeq	This analysis was done as in Caporaso et al 2011 Genome research. The PCR primers F515 and R806 were developed against the V4 region of the 16S rRNA, both bacteria and archaea, which we determined would yield optimal community clustering with reads of this length The reverse PCR primer is barcoded with a 12-base error-correcting Golay code to facilitate multiplexing of up to 1,500 samples per lane, and both PCR primers contain sequencer adapter regions.	GT	FWD:GTGCCAGCMGCCGCGGTAA; REV:GGACTACHVGGGTWTCTAAT	Plate5	Illumina	V4	Cornell	1/25/13	TwinsUKPlate5	0.1,gram	Kings College London	sequencing by synthesis	16S rRNA	V4	B5	72	years	0	6912	UBERON:feces		UBERON:feces	UBERON:feces	2/7/11	2011-02-07 09:30:00	9:30:00	GAZ:United Kingdom	2/1/39	0	true	10.4516	ENVO:dense settlement biome	ENVO:human-associated habitat	true	691	human	Homo sapiens	6912	9606	6912	51.5	-0.12	true	Cornell	true	false	King's College, London, UK	Stool	female	2	1002585	TwinsUK gut microbiome	MZ	TwinsUK Fecal Sample
2014.Plate5.15	ATCGATCCACAG	GTGCCAGCMGCCGCGGTAA	43.754	Cornell	UK_Twins	Cornell	fecal samples from TwinsUK MiSeq runs	TwinsUK Miseq	Nick	MiSeq	This analysis was done as in Caporaso et al 2011 Genome research. The PCR primers F515 and R806 were developed against the V4 region of the 16S rRNA, both bacteria and archaea, which we determined would yield optimal community clustering with reads of this length The reverse PCR primer is barcoded with a 12-base error-correcting Golay code to facilitate multiplexing of up to 1,500 samples per lane, and both PCR primers contain sequencer adapter regions.	GT	FWD:GTGCCAGCMGCCGCGGTAA; REV:GGACTACHVGGGTWTCTAAT	Plate5	Illumina	V4	Cornell	1/25/13	TwinsUKPlate5	0.1,gram	Kings College London	sequencing by synthesis	16S rRNA	V4	B4	54	years	0	7102	UBERON:feces	23.59560966	UBERON:feces	UBERON:feces	2/11/11	2011-02-11 05:30:00	5:30:00	GAZ:United Kingdom	3/14/56	0	true	10.4516	ENVO:dense settlement biome	ENVO:human-associated habitat	true	710	human	Homo sapiens	7102	9606	7102	51.5	-0.12	true	Cornell	true	false	King's College, London, UK	Stool	female	2	1002587	TwinsUK gut microbiome	DZ	TwinsUK Fecal Sample
2014.Plate5.14	GGAAGAAGTAGC	GTGCCAGCMGCCGCGGTAA	30.476	Cornell	UK_Twins	Cornell	fecal samples from TwinsUK MiSeq runs	TwinsUK Miseq	Nick	MiSeq	This analysis was done as in Caporaso et al 2011 Genome research. The PCR primers F515 and R806 were developed against the V4 region of the 16S rRNA, both bacteria and archaea, which we determined would yield optimal community clustering with reads of this length The reverse PCR primer is barcoded with a 12-base error-correcting Golay code to facilitate multiplexing of up to 1,500 samples per lane, and both PCR primers contain sequencer adapter regions.	GT	FWD:GTGCCAGCMGCCGCGGTAA; REV:GGACTACHVGGGTWTCTAAT	Plate5	Illumina	V4	Cornell	1/25/13	TwinsUKPlate5	0.1,gram	Kings College London	sequencing by synthesis	16S rRNA	V4	B3	55	years	0	7041	UBERON:feces	20.45023918	UBERON:feces	UBERON:feces	2/16/11	2011-02-16 08:30:00	8:30:00	GAZ:United Kingdom	2/21/55	0	true	10.4516	ENVO:dense settlement biome	ENVO:human-associated habitat	true	704	human	Homo sapiens	7041	9606	7041	51.5	-0.12	true	Cornell	true	false	King's College, London, UK	Stool	female	2	1002586	TwinsUK gut microbiome	DZ	TwinsUK Fecal Sample
2014.Plate5.13	GACTCAACCAGT	GTGCCAGCMGCCGCGGTAA	28.536	Cornell	UK_Twins	Cornell	fecal samples from TwinsUK MiSeq runs	TwinsUK Miseq	Nick	MiSeq	This analysis was done as in Caporaso et al 2011 Genome research. The PCR primers F515 and R806 were developed against the V4 region of the 16S rRNA, both bacteria and archaea, which we determined would yield optimal community clustering with reads of this length The reverse PCR primer is barcoded with a 12-base error-correcting Golay code to facilitate multiplexing of up to 1,500 samples per lane, and both PCR primers contain sequencer adapter regions.	GT	FWD:GTGCCAGCMGCCGCGGTAA; REV:GGACTACHVGGGTWTCTAAT	Plate5	Illumina	V4	Cornell	1/25/13	TwinsUKPlate5	0.1,gram	Kings College London	sequencing by synthesis	16S rRNA	V4	B2	55	years	0	5301	UBERON:feces	27.49760056	UBERON:feces	UBERON:feces	2/22/11	2011-02-22 09:15:00	9:15:00	GAZ:United Kingdom	3/1/55	0	true	10.4516	ENVO:dense settlement biome	ENVO:human-associated habitat	true	530	human	Homo sapiens	5301	9606	5301	51.5	-0.12	true	Cornell	true	false	King's College, London, UK	Stool	female	2	1002584	TwinsUK gut microbiome	DZ	TwinsUK Fecal Sample
2014.Plate5.11	TGGAGAGGAGAT	GTGCCAGCMGCCGCGGTAA	25.88	Cornell	UK_Twins	Cornell	fecal samples from TwinsUK MiSeq runs	TwinsUK Miseq	Nick	MiSeq	This analysis was done as in Caporaso et al 2011 Genome research. The PCR primers F515 and R806 were developed against the V4 region of the 16S rRNA, both bacteria and archaea, which we determined would yield optimal community clustering with reads of this length The reverse PCR primer is barcoded with a 12-base error-correcting Golay code to facilitate multiplexing of up to 1,500 samples per lane, and both PCR primers contain sequencer adapter regions.	GT	FWD:GTGCCAGCMGCCGCGGTAA; REV:GGACTACHVGGGTWTCTAAT	Plate5	Illumina	V4	Cornell	1/25/13	TwinsUKPlate5	0.1,gram	Kings College London	sequencing by synthesis	16S rRNA	V4	A11	70	years	0	8251	UBERON:feces	21.63680077	UBERON:feces	UBERON:feces	2/16/11	2011-02-16 13:30:00	13:30:00	GAZ:United Kingdom	1/3/41	0	true	10.4516	ENVO:dense settlement biome	ENVO:human-associated habitat	true	825	human	Homo sapiens	8251	9606	8251	51.5	-0.12	true	Cornell	true	false	King's College, London, UK	Stool	female	2	1002579	TwinsUK gut microbiome	MZ	TwinsUK Fecal Sample
2014.Plate5.10	GTAGTGTCAACA	GTGCCAGCMGCCGCGGTAA	23.225	Cornell	UK_Twins	Cornell	fecal samples from TwinsUK MiSeq runs	TwinsUK Miseq	Nick	MiSeq	This analysis was done as in Caporaso et al 2011 Genome research. The PCR primers F515 and R806 were developed against the V4 region of the 16S rRNA, both bacteria and archaea, which we determined would yield optimal community clustering with reads of this length The reverse PCR primer is barcoded with a 12-base error-correcting Golay code to facilitate multiplexing of up to 1,500 samples per lane, and both PCR primers contain sequencer adapter regions.	GT	FWD:GTGCCAGCMGCCGCGGTAA; REV:GGACTACHVGGGTWTCTAAT	Plate5	Illumina	V4	Cornell	1/25/13	TwinsUKPlate5	0.1,gram	Kings College London	sequencing by synthesis	16S rRNA	V4	A10	57	years	0	7451	UBERON:feces	23.64878082	UBERON:feces	UBERON:feces	2/20/11	2011-02-20 10:30:00	10:30:00	GAZ:United Kingdom	9/23/53	0	true	10.4516	ENVO:dense settlement biome	ENVO:human-associated habitat	true	745	human	Homo sapiens	7451	9606	7451	51.5	-0.12	true	Cornell	true	false	King's College, London, UK	Stool	female	2	1002591	TwinsUK gut microbiome	MZ	TwinsUK Fecal Sample
2014.Plate5.1	ACGTAACCACGT	GTGCCAGCMGCCGCGGTAA	23.378	Cornell	UK_Twins	Cornell	fecal samples from TwinsUK MiSeq runs	TwinsUK Miseq	Nick	MiSeq	This analysis was done as in Caporaso et al 2011 Genome research. The PCR primers F515 and R806 were developed against the V4 region of the 16S rRNA, both bacteria and archaea, which we determined would yield optimal community clustering with reads of this length The reverse PCR primer is barcoded with a 12-base error-correcting Golay code to facilitate multiplexing of up to 1,500 samples per lane, and both PCR primers contain sequencer adapter regions.	GT	FWD:GTGCCAGCMGCCGCGGTAA; REV:GGACTACHVGGGTWTCTAAT	Plate5	Illumina	V4	Cornell	1/25/13	TwinsUKPlate5	0.1,gram	Kings College London	sequencing by synthesis	16S rRNA	V4	A1	63	years	0	4951	UBERON:feces	26.00877953	UBERON:feces	UBERON:feces	1/4/11	2011-01-04 11:15:00	11:15:00	GAZ:United Kingdom	10/11/47	0	true	10.4516	ENVO:dense settlement biome	ENVO:human-associated habitat	true	495	human	Homo sapiens	4951	9606	4951	51.5	-0.12	true	Cornell	true	false	King's College, London, UK	Stool	female	2	1002412	TwinsUK gut microbiome	DZ	TwinsUK Fecal Sample
2014.Plate16.9	GACTCAACCAGT	GTGCCAGCMGCCGCGGTAA	7.222	Cornell	UK_Twins	Cornell	fecal samples from TwinsUK MiSeq runs	TwinsUK Miseq	Jess	MiSeq	This analysis was done as in Caporaso et al 2011 Genome research. The PCR primers F515 and R806 were developed against the V4 region of the 16S rRNA, both bacteria and archaea, which we determined would yield optimal community clustering with reads of this length The reverse PCR primer is barcoded with a 12-base error-correcting Golay code to facilitate multiplexing of up to 1,500 samples per lane, and both PCR primers contain sequencer adapter regions.	GT	FWD:GTGCCAGCMGCCGCGGTAA; REV:GGACTACHVGGGTWTCTAAT	Plate16	Illumina	V4	Cornell	8/14/13	TwinsUKPlate16	0.1,gram	Kings College London	sequencing by synthesis	16S rRNA	V4	B2	74	years	0	8172	UBERON:feces	19.18997002	UBERON:feces	UBERON:feces	3/4/13	2013-03-04 12:30:00	12:30:00	GAZ:United Kingdom	12/27/38	0	true	10.4516	ENVO:dense settlement biome	ENVO:human-associated habitat	true	817	human	Homo sapiens	8172	9606	8172	51.5	-0.12	true	Cornell	true	false	King's College, London, UK	Stool	female	8	1006085	TwinsUK gut microbiome	DZ	TwinsUK Fecal Sample
2014.Plate16.8	GATCAACCCACA	GTGCCAGCMGCCGCGGTAA	4.688	Cornell	UK_Twins	Cornell	fecal samples from TwinsUK MiSeq runs	TwinsUK Miseq	Jess	MiSeq	This analysis was done as in Caporaso et al 2011 Genome research. The PCR primers F515 and R806 were developed against the V4 region of the 16S rRNA, both bacteria and archaea, which we determined would yield optimal community clustering with reads of this length The reverse PCR primer is barcoded with a 12-base error-correcting Golay code to facilitate multiplexing of up to 1,500 samples per lane, and both PCR primers contain sequencer adapter regions.	GT	FWD:GTGCCAGCMGCCGCGGTAA; REV:GGACTACHVGGGTWTCTAAT	Plate16	Illumina	V4	Cornell	8/14/13	TwinsUKPlate16	0.1,gram	Kings College London	sequencing by synthesis	16S rRNA	V4	B1	48	years	0	1021	UBERON:feces	26.67841911	UBERON:feces	UBERON:feces	1/30/13	2013-01-30 11:40:00	11:40:00	GAZ:United Kingdom	3/26/64	0	true	10.4516	ENVO:dense settlement biome	ENVO:human-associated habitat	true	102	human	Homo sapiens	1021	9606	1021	51.5	-0.12	true	Cornell	true	false	King's College, London, UK	Stool	female	8	1006026	TwinsUK gut microbiome	MZ	TwinsUK Fecal Sample
2014.Plate16.74	TGTACGGATAAC	GTGCCAGCMGCCGCGGTAA	9.117	Cornell	UK_Twins	Cornell	fecal samples from TwinsUK MiSeq runs	TwinsUK Miseq	Jess	MiSeq	This analysis was done as in Caporaso et al 2011 Genome research. The PCR primers F515 and R806 were developed against the V4 region of the 16S rRNA, both bacteria and archaea, which we determined would yield optimal community clustering with reads of this length The reverse PCR primer is barcoded with a 12-base error-correcting Golay code to facilitate multiplexing of up to 1,500 samples per lane, and both PCR primers contain sequencer adapter regions.	GT	FWD:GTGCCAGCMGCCGCGGTAA; REV:GGACTACHVGGGTWTCTAAT	Plate16	Illumina	V4	Cornell	8/14/13	TwinsUKPlate16	0.1,gram	Kings College London	sequencing by synthesis	16S rRNA	V4	H9	68	years	0	1792	UBERON:feces	36.09764099	UBERON:feces	UBERON:feces	2/3/13	2013-02-03 07:30:00	7:30:00	GAZ:United Kingdom	8/22/44	0	true	10.4516	ENVO:dense settlement biome	ENVO:human-associated habitat	true	179	human	Homo sapiens	1792	9606	1792	51.5	-0.12	true	Cornell	true	false	King's College, London, UK	Stool	female	8	1005972	TwinsUK gut microbiome	DZ	TwinsUK Fecal Sample
2014.Plate16.73	CAATGCCTCACG	GTGCCAGCMGCCGCGGTAA	5.309	Cornell	UK_Twins	Cornell	fecal samples from TwinsUK MiSeq runs	TwinsUK Miseq	Jess	MiSeq	This analysis was done as in Caporaso et al 2011 Genome research. The PCR primers F515 and R806 were developed against the V4 region of the 16S rRNA, both bacteria and archaea, which we determined would yield optimal community clustering with reads of this length The reverse PCR primer is barcoded with a 12-base error-correcting Golay code to facilitate multiplexing of up to 1,500 samples per lane, and both PCR primers contain sequencer adapter regions.	GT	FWD:GTGCCAGCMGCCGCGGTAA; REV:GGACTACHVGGGTWTCTAAT	Plate16	Illumina	V4	Cornell	8/14/13	TwinsUKPlate16	0.1,gram	Kings College London	sequencing by synthesis	16S rRNA	V4	H8	43	years	0	511	UBERON:feces	21.30427933	UBERON:feces	UBERON:feces	2/19/13	2013-02-19 15:08:00	15:08:00	GAZ:United Kingdom	4/26/69	0	true	10.4516	ENVO:dense settlement biome	ENVO:human-associated habitat	true	51	human	Homo sapiens	511	9606	511	51.5	-0.12	true	Cornell	true	false	King's College, London, UK	Stool	female	8	1006106	TwinsUK gut microbiome	MZ	TwinsUK Fecal Sample
2014.Plate16.72	TTACGTGGCGAT	GTGCCAGCMGCCGCGGTAA	6.583	Cornell	UK_Twins	Cornell	fecal samples from TwinsUK MiSeq runs	TwinsUK Miseq	Jess	MiSeq	This analysis was done as in Caporaso et al 2011 Genome research. The PCR primers F515 and R806 were developed against the V4 region of the 16S rRNA, both bacteria and archaea, which we determined would yield optimal community clustering with reads of this length The reverse PCR primer is barcoded with a 12-base error-correcting Golay code to facilitate multiplexing of up to 1,500 samples per lane, and both PCR primers contain sequencer adapter regions.	GT	FWD:GTGCCAGCMGCCGCGGTAA; REV:GGACTACHVGGGTWTCTAAT	Plate16	Illumina	V4	Cornell	8/14/13	TwinsUKPlate16	0.1,gram	Kings College London	sequencing by synthesis	16S rRNA	V4	H7	65	years	0	3762	UBERON:feces	24.44728088	UBERON:feces	UBERON:feces	1/14/13	2013-01-14 11:00:00	11:00:00	GAZ:United Kingdom	1/3/48	0	true	10.4516	ENVO:dense settlement biome	ENVO:human-associated habitat	true	376	human	Homo sapiens	3762	9606	3762	51.5	-0.12	true	Cornell	true	false	King's College, London, UK	Stool	female	8	1005967	TwinsUK gut microbiome	DZ	TwinsUK Fecal Sample
2014.Plate16.71	TGAGTTCGGTCC	GTGCCAGCMGCCGCGGTAA	17.278	Cornell	UK_Twins	Cornell	fecal samples from TwinsUK MiSeq runs	TwinsUK Miseq	Jess	MiSeq	This analysis was done as in Caporaso et al 2011 Genome research. The PCR primers F515 and R806 were developed against the V4 region of the 16S rRNA, both bacteria and archaea, which we determined would yield optimal community clustering with reads of this length The reverse PCR primer is barcoded with a 12-base error-correcting Golay code to facilitate multiplexing of up to 1,500 samples per lane, and both PCR primers contain sequencer adapter regions.	GT	FWD:GTGCCAGCMGCCGCGGTAA; REV:GGACTACHVGGGTWTCTAAT	Plate16	Illumina	V4	Cornell	8/14/13	TwinsUKPlate16	0.1,gram	Kings College London	sequencing by synthesis	16S rRNA	V4	H6	61	years	0	3542	UBERON:feces	27.54529953	UBERON:feces	UBERON:feces	2/24/13	2013-02-24 21:13:00	21:13:00	GAZ:United Kingdom	6/9/51	0	true	10.4516	ENVO:dense settlement biome	ENVO:human-associated habitat	true	354	human	Homo sapiens	3542	9606	3542	51.5	-0.12	true	Cornell	true	false	King's College, London, UK	Stool	female	8	1006121	TwinsUK gut microbiome	MZ	TwinsUK Fecal Sample
2014.Plate16.70	GTCTGTTGAGTG	GTGCCAGCMGCCGCGGTAA	7.427	Cornell	UK_Twins	Cornell	fecal samples from TwinsUK MiSeq runs	TwinsUK Miseq	Jess	MiSeq	This analysis was done as in Caporaso et al 2011 Genome research. The PCR primers F515 and R806 were developed against the V4 region of the 16S rRNA, both bacteria and archaea, which we determined would yield optimal community clustering with reads of this length The reverse PCR primer is barcoded with a 12-base error-correcting Golay code to facilitate multiplexing of up to 1,500 samples per lane, and both PCR primers contain sequencer adapter regions.	GT	FWD:GTGCCAGCMGCCGCGGTAA; REV:GGACTACHVGGGTWTCTAAT	Plate16	Illumina	V4	Cornell	8/14/13	TwinsUKPlate16	0.1,gram	Kings College London	sequencing by synthesis	16S rRNA	V4	H5	61	years	0	2881	UBERON:feces	26.62047958	UBERON:feces	UBERON:feces	2/7/13	2013-02-07 23:25:00	23:25:00	GAZ:United Kingdom	5/27/51	0	true	10.4516	ENVO:dense settlement biome	ENVO:human-associated habitat	true	288	human	Homo sapiens	2881	9606	2881	51.5	-0.12	true	Cornell	true	false	King's College, London, UK	Stool	female	8	1006069	TwinsUK gut microbiome	MZ	TwinsUK Fecal Sample
2014.Plate16.7	TTCCACACGTGG	GTGCCAGCMGCCGCGGTAA	4.955	Cornell	UK_Twins	Cornell	fecal samples from TwinsUK MiSeq runs	TwinsUK Miseq	Jess	MiSeq	This analysis was done as in Caporaso et al 2011 Genome research. The PCR primers F515 and R806 were developed against the V4 region of the 16S rRNA, both bacteria and archaea, which we determined would yield optimal community clustering with reads of this length The reverse PCR primer is barcoded with a 12-base error-correcting Golay code to facilitate multiplexing of up to 1,500 samples per lane, and both PCR primers contain sequencer adapter regions.	GT	FWD:GTGCCAGCMGCCGCGGTAA; REV:GGACTACHVGGGTWTCTAAT	Plate16	Illumina	V4	Cornell	8/14/13	TwinsUKPlate16	0.1,gram	Kings College London	sequencing by synthesis	16S rRNA	V4	A8	80	years	0	3091	UBERON:feces	20.60153008	UBERON:feces	UBERON:feces	1/10/13	2013-01-10 10:40:00	10:40:00	GAZ:United Kingdom	3/3/32	0	true	10.4516	ENVO:dense settlement biome	ENVO:human-associated habitat	true	309	human	Homo sapiens	3091	9606	3091	51.5	-0.12	true	Cornell	true	false	King's College, London, UK	Stool	female	8	1005954	TwinsUK gut microbiome	MZ	TwinsUK Fecal Sample
2014.Plate16.69	AACATGCATGCC	GTGCCAGCMGCCGCGGTAA	7.427	Cornell	UK_Twins	Cornell	fecal samples from TwinsUK MiSeq runs	TwinsUK Miseq	Jess	MiSeq	This analysis was done as in Caporaso et al 2011 Genome research. The PCR primers F515 and R806 were developed against the V4 region of the 16S rRNA, both bacteria and archaea, which we determined would yield optimal community clustering with reads of this length The reverse PCR primer is barcoded with a 12-base error-correcting Golay code to facilitate multiplexing of up to 1,500 samples per lane, and both PCR primers contain sequencer adapter regions.	GT	FWD:GTGCCAGCMGCCGCGGTAA; REV:GGACTACHVGGGTWTCTAAT	Plate16	Illumina	V4	Cornell	8/14/13	TwinsUKPlate16	0.1,gram	Kings College London	sequencing by synthesis	16S rRNA	V4	H4	70	years	0	2312	UBERON:feces	28.27794075	UBERON:feces	UBERON:feces	2/11/13	2013-02-11 09:25:00	9:25:00	GAZ:United Kingdom	6/23/42	0	true	10.4516	ENVO:dense settlement biome	ENVO:human-associated habitat	true	231	human	Homo sapiens	2312	9606	2312	51.5	-0.12	true	Cornell	true	false	King's College, London, UK	Stool	male	8	1006075	TwinsUK gut microbiome	DZ	TwinsUK Fecal Sample
2014.Plate16.68	TCGTCGCCAAAC	GTGCCAGCMGCCGCGGTAA	5.419	Cornell	UK_Twins	Cornell	fecal samples from TwinsUK MiSeq runs	TwinsUK Miseq	Jess	MiSeq	This analysis was done as in Caporaso et al 2011 Genome research. The PCR primers F515 and R806 were developed against the V4 region of the 16S rRNA, both bacteria and archaea, which we determined would yield optimal community clustering with reads of this length The reverse PCR primer is barcoded with a 12-base error-correcting Golay code to facilitate multiplexing of up to 1,500 samples per lane, and both PCR primers contain sequencer adapter regions.	GT	FWD:GTGCCAGCMGCCGCGGTAA; REV:GGACTACHVGGGTWTCTAAT	Plate16	Illumina	V4	Cornell	8/14/13	TwinsUKPlate16	0.1,gram	Kings College London	sequencing by synthesis	16S rRNA	V4	H3	75	years	0	7932	UBERON:feces	29.70701981	UBERON:feces	UBERON:feces	2/7/13	2013-02-07 10:00:00	10:00:00	GAZ:United Kingdom	4/25/37	0	true	10.4516	ENVO:dense settlement biome	ENVO:human-associated habitat	true	793	human	Homo sapiens	7932	9606	7932	51.5	-0.12	true	Cornell	true	false	King's College, London, UK	Stool	female	8	1006067	TwinsUK gut microbiome	DZ	TwinsUK Fecal Sample
2014.Plate16.67	TGGAAACCATTG	GTGCCAGCMGCCGCGGTAA	5.051	Cornell	UK_Twins	Cornell	fecal samples from TwinsUK MiSeq runs	TwinsUK Miseq	Jess	MiSeq	This analysis was done as in Caporaso et al 2011 Genome research. The PCR primers F515 and R806 were developed against the V4 region of the 16S rRNA, both bacteria and archaea, which we determined would yield optimal community clustering with reads of this length The reverse PCR primer is barcoded with a 12-base error-correcting Golay code to facilitate multiplexing of up to 1,500 samples per lane, and both PCR primers contain sequencer adapter regions.	GT	FWD:GTGCCAGCMGCCGCGGTAA; REV:GGACTACHVGGGTWTCTAAT	Plate16	Illumina	V4	Cornell	8/14/13	TwinsUKPlate16	0.1,gram	Kings College London	sequencing by synthesis	16S rRNA	V4	H2	62	years	0	3141	UBERON:feces	20.56899071	UBERON:feces	UBERON:feces	2/13/13	2013-02-13 08:30:00	8:30:00	GAZ:United Kingdom	5/3/50	0	true	10.4516	ENVO:dense settlement biome	ENVO:human-associated habitat	true	314	human	Homo sapiens	3141	9606	3141	51.5	-0.12	true	Cornell	true	false	King's College, London, UK	Stool	female	8	1006102	TwinsUK gut microbiome	MZ	TwinsUK Fecal Sample
2014.Plate16.66	GTGAGGGCAAGT	GTGCCAGCMGCCGCGGTAA	5.845	Cornell	UK_Twins	Cornell	fecal samples from TwinsUK MiSeq runs	TwinsUK Miseq	Jess	MiSeq	This analysis was done as in Caporaso et al 2011 Genome research. The PCR primers F515 and R806 were developed against the V4 region of the 16S rRNA, both bacteria and archaea, which we determined would yield optimal community clustering with reads of this length The reverse PCR primer is barcoded with a 12-base error-correcting Golay code to facilitate multiplexing of up to 1,500 samples per lane, and both PCR primers contain sequencer adapter regions.	GT	FWD:GTGCCAGCMGCCGCGGTAA; REV:GGACTACHVGGGTWTCTAAT	Plate16	Illumina	V4	Cornell	8/14/13	TwinsUKPlate16	0.1,gram	Kings College London	sequencing by synthesis	16S rRNA	V4	H11	48	years	0	211	UBERON:feces	28.76807976	UBERON:feces	UBERON:feces	2/28/13	2013-02-28 07:00:00	7:00:00	GAZ:United Kingdom	9/19/64	0	true	10.4516	ENVO:dense settlement biome	ENVO:human-associated habitat	true	21	human	Homo sapiens	211	9606	211	51.5	-0.12	true	Cornell	true	false	King's College, London, UK	Stool	female	8	1006080	TwinsUK gut microbiome	DZ	TwinsUK Fecal Sample
2014.Plate16.65	AATCAACTAGGC	GTGCCAGCMGCCGCGGTAA	4.098	Cornell	UK_Twins	Cornell	fecal samples from TwinsUK MiSeq runs	TwinsUK Miseq	Jess	MiSeq	This analysis was done as in Caporaso et al 2011 Genome research. The PCR primers F515 and R806 were developed against the V4 region of the 16S rRNA, both bacteria and archaea, which we determined would yield optimal community clustering with reads of this length The reverse PCR primer is barcoded with a 12-base error-correcting Golay code to facilitate multiplexing of up to 1,500 samples per lane, and both PCR primers contain sequencer adapter regions.	GT	FWD:GTGCCAGCMGCCGCGGTAA; REV:GGACTACHVGGGTWTCTAAT	Plate16	Illumina	V4	Cornell	8/14/13	TwinsUKPlate16	0.1,gram	Kings College London	sequencing by synthesis	16S rRNA	V4	H10	70	years	0	6981	UBERON:feces	31.52136993	UBERON:feces	UBERON:feces	1/17/13	2013-01-17 10:00:00	10:00:00	GAZ:United Kingdom	2/11/42	0	true	10.4516	ENVO:dense settlement biome	ENVO:human-associated habitat	true	698	human	Homo sapiens	6981	9606	6981	51.5	-0.12	true	Cornell	true	false	King's College, London, UK	Stool	female	8	1005983	TwinsUK gut microbiome	MZ	TwinsUK Fecal Sample
2014.Plate16.64	AGTAGGAGGCAC	GTGCCAGCMGCCGCGGTAA	4.347	Cornell	UK_Twins	Cornell	fecal samples from TwinsUK MiSeq runs	TwinsUK Miseq	Jess	MiSeq	This analysis was done as in Caporaso et al 2011 Genome research. The PCR primers F515 and R806 were developed against the V4 region of the 16S rRNA, both bacteria and archaea, which we determined would yield optimal community clustering with reads of this length The reverse PCR primer is barcoded with a 12-base error-correcting Golay code to facilitate multiplexing of up to 1,500 samples per lane, and both PCR primers contain sequencer adapter regions.	GT	FWD:GTGCCAGCMGCCGCGGTAA; REV:GGACTACHVGGGTWTCTAAT	Plate16	Illumina	V4	Cornell	8/14/13	TwinsUKPlate16	0.1,gram	Kings College London	sequencing by synthesis	16S rRNA	V4	H1	35	years	0	4551	UBERON:feces	27.58448982	UBERON:feces	UBERON:feces	2/14/13	2013-02-14 10:00:00	10:00:00	GAZ:United Kingdom	8/9/77	0	true	10.4516	ENVO:dense settlement biome	ENVO:human-associated habitat	true	455	human	Homo sapiens	4551	9606	4551	51.5	-0.12	true	Cornell	true	false	King's College, London, UK	Stool	female	8	1006081	TwinsUK gut microbiome	DZ	TwinsUK Fecal Sample
2014.Plate16.63	GGTCGTGTCTTG	GTGCCAGCMGCCGCGGTAA	5.101	Cornell	UK_Twins	Cornell	fecal samples from TwinsUK MiSeq runs	TwinsUK Miseq	Jess	MiSeq	This analysis was done as in Caporaso et al 2011 Genome research. The PCR primers F515 and R806 were developed against the V4 region of the 16S rRNA, both bacteria and archaea, which we determined would yield optimal community clustering with reads of this length The reverse PCR primer is barcoded with a 12-base error-correcting Golay code to facilitate multiplexing of up to 1,500 samples per lane, and both PCR primers contain sequencer adapter regions.	GT	FWD:GTGCCAGCMGCCGCGGTAA; REV:GGACTACHVGGGTWTCTAAT	Plate16	Illumina	V4	Cornell	8/14/13	TwinsUKPlate16	0.1,gram	Kings College London	sequencing by synthesis	16S rRNA	V4	G9	62	years	0	3151	UBERON:feces	28.37713051	UBERON:feces	UBERON:feces	1/23/13	2013-01-23 22:30:00	22:30:00	GAZ:United Kingdom	1/17/51	0	true	10.4516	ENVO:dense settlement biome	ENVO:human-associated habitat	true	315	human	Homo sapiens	3151	9606	3151	51.5	-0.12	true	Cornell	true	false	King's College, London, UK	Stool	female	8	1006006	TwinsUK gut microbiome	DZ	TwinsUK Fecal Sample
2014.Plate16.62	GAAACGGAAACG	GTGCCAGCMGCCGCGGTAA	7.222	Cornell	UK_Twins	Cornell	fecal samples from TwinsUK MiSeq runs	TwinsUK Miseq	Jess	MiSeq	This analysis was done as in Caporaso et al 2011 Genome research. The PCR primers F515 and R806 were developed against the V4 region of the 16S rRNA, both bacteria and archaea, which we determined would yield optimal community clustering with reads of this length The reverse PCR primer is barcoded with a 12-base error-correcting Golay code to facilitate multiplexing of up to 1,500 samples per lane, and both PCR primers contain sequencer adapter regions.	GT	FWD:GTGCCAGCMGCCGCGGTAA; REV:GGACTACHVGGGTWTCTAAT	Plate16	Illumina	V4	Cornell	8/14/13	TwinsUKPlate16	0.1,gram	Kings College London	sequencing by synthesis	16S rRNA	V4	G8	70	years	0	3192	UBERON:feces	20.86219025	UBERON:feces	UBERON:feces	2/9/13	2013-02-09 09:30:00	9:30:00	GAZ:United Kingdom	12/11/42	0	true	10.4516	ENVO:dense settlement biome	ENVO:human-associated habitat	true	319	human	Homo sapiens	3192	9606	3192	51.5	-0.12	true	Cornell	true	false	King's College, London, UK	Stool	female	8	1006071	TwinsUK gut microbiome	MZ	TwinsUK Fecal Sample
2014.Plate16.61	CACGTTTATTCC	GTGCCAGCMGCCGCGGTAA	4.955	Cornell	UK_Twins	Cornell	fecal samples from TwinsUK MiSeq runs	TwinsUK Miseq	Jess	MiSeq	This analysis was done as in Caporaso et al 2011 Genome research. The PCR primers F515 and R806 were developed against the V4 region of the 16S rRNA, both bacteria and archaea, which we determined would yield optimal community clustering with reads of this length The reverse PCR primer is barcoded with a 12-base error-correcting Golay code to facilitate multiplexing of up to 1,500 samples per lane, and both PCR primers contain sequencer adapter regions.	GT	FWD:GTGCCAGCMGCCGCGGTAA; REV:GGACTACHVGGGTWTCTAAT	Plate16	Illumina	V4	Cornell	8/14/13	TwinsUKPlate16	0.1,gram	Kings College London	sequencing by synthesis	16S rRNA	V4	G7	67	years	0	361	UBERON:feces	25.97477913	UBERON:feces	UBERON:feces	3/4/13	2013-03-04 08:00:00	8:00:00	GAZ:United Kingdom	4/29/45	0	true	10.4516	ENVO:dense settlement biome	ENVO:human-associated habitat	true	36	human	Homo sapiens	361	9606	361	51.5	-0.12	true	Cornell	true	false	King's College, London, UK	Stool	female	8	1006082	TwinsUK gut microbiome	MZ	TwinsUK Fecal Sample
2014.Plate16.60	TCGGTCCATAGC	GTGCCAGCMGCCGCGGTAA	6.501	Cornell	UK_Twins	Cornell	fecal samples from TwinsUK MiSeq runs	TwinsUK Miseq	Jess	MiSeq	This analysis was done as in Caporaso et al 2011 Genome research. The PCR primers F515 and R806 were developed against the V4 region of the 16S rRNA, both bacteria and archaea, which we determined would yield optimal community clustering with reads of this length The reverse PCR primer is barcoded with a 12-base error-correcting Golay code to facilitate multiplexing of up to 1,500 samples per lane, and both PCR primers contain sequencer adapter regions.	GT	FWD:GTGCCAGCMGCCGCGGTAA; REV:GGACTACHVGGGTWTCTAAT	Plate16	Illumina	V4	Cornell	8/14/13	TwinsUKPlate16	0.1,gram	Kings College London	sequencing by synthesis	16S rRNA	V4	G6	67	years	0	7802	UBERON:feces	24.88746071	UBERON:feces	UBERON:feces	2/11/13	2013-02-11 08:40:00	8:40:00	GAZ:United Kingdom	1/27/46	0	true	10.4516	ENVO:dense settlement biome	ENVO:human-associated habitat	true	780	human	Homo sapiens	7802	9606	7802	51.5	-0.12	true	Cornell	true	false	King's College, London, UK	Stool	female	8	1006092	TwinsUK gut microbiome	MZ	TwinsUK Fecal Sample
2014.Plate16.6	GTTGGTTGGCAT	GTGCCAGCMGCCGCGGTAA	5.534	Cornell	UK_Twins	Cornell	fecal samples from TwinsUK MiSeq runs	TwinsUK Miseq	Jess	MiSeq	This analysis was done as in Caporaso et al 2011 Genome research. The PCR primers F515 and R806 were developed against the V4 region of the 16S rRNA, both bacteria and archaea, which we determined would yield optimal community clustering with reads of this length The reverse PCR primer is barcoded with a 12-base error-correcting Golay code to facilitate multiplexing of up to 1,500 samples per lane, and both PCR primers contain sequencer adapter regions.	GT	FWD:GTGCCAGCMGCCGCGGTAA; REV:GGACTACHVGGGTWTCTAAT	Plate16	Illumina	V4	Cornell	8/14/13	TwinsUKPlate16	0.1,gram	Kings College London	sequencing by synthesis	16S rRNA	V4	A7	66	years	0	882	UBERON:feces		UBERON:feces	UBERON:feces	1/22/13	2013-01-22 11:50:00	11:50:00	GAZ:United Kingdom	10/15/46	0	true	10.4516	ENVO:dense settlement biome	ENVO:human-associated habitat	true	88	human	Homo sapiens	882	9606	882	51.5	-0.12	true	Cornell	true	false	King's College, London, UK	Stool	female	8	1006011	TwinsUK gut microbiome	DZ	TwinsUK Fecal Sample
2014.Plate16.59	CTTAGCTACTCT	GTGCCAGCMGCCGCGGTAA	5.476	Cornell	UK_Twins	Cornell	fecal samples from TwinsUK MiSeq runs	TwinsUK Miseq	Jess	MiSeq	This analysis was done as in Caporaso et al 2011 Genome research. The PCR primers F515 and R806 were developed against the V4 region of the 16S rRNA, both bacteria and archaea, which we determined would yield optimal community clustering with reads of this length The reverse PCR primer is barcoded with a 12-base error-correcting Golay code to facilitate multiplexing of up to 1,500 samples per lane, and both PCR primers contain sequencer adapter regions.	GT	FWD:GTGCCAGCMGCCGCGGTAA; REV:GGACTACHVGGGTWTCTAAT	Plate16	Illumina	V4	Cornell	8/14/13	TwinsUKPlate16	0.1,gram	Kings College London	sequencing by synthesis	16S rRNA	V4	G5	75	years	0	7931	UBERON:feces	24.1588192	UBERON:feces	UBERON:feces	2/4/13	2013-02-04 17:45:00	17:45:00	GAZ:United Kingdom	4/25/37	0	true	10.4516	ENVO:dense settlement biome	ENVO:human-associated habitat	true	793	human	Homo sapiens	7931	9606	7931	51.5	-0.12	true	Cornell	true	false	King's College, London, UK	Stool	female	8	1006066	TwinsUK gut microbiome	DZ	TwinsUK Fecal Sample
2014.Plate16.58	ATGCGAGACTTC	GTGCCAGCMGCCGCGGTAA	11.05	Cornell	UK_Twins	Cornell	fecal samples from TwinsUK MiSeq runs	TwinsUK Miseq	Jess	MiSeq	This analysis was done as in Caporaso et al 2011 Genome research. The PCR primers F515 and R806 were developed against the V4 region of the 16S rRNA, both bacteria and archaea, which we determined would yield optimal community clustering with reads of this length The reverse PCR primer is barcoded with a 12-base error-correcting Golay code to facilitate multiplexing of up to 1,500 samples per lane, and both PCR primers contain sequencer adapter regions.	GT	FWD:GTGCCAGCMGCCGCGGTAA; REV:GGACTACHVGGGTWTCTAAT	Plate16	Illumina	V4	Cornell	8/14/13	TwinsUKPlate16	0.1,gram	Kings College London	sequencing by synthesis	16S rRNA	V4	G4	59	years	0	2492	UBERON:feces	31.64557076	UBERON:feces	UBERON:feces	2/21/13	2013-02-21 05:00:00	5:00:00	GAZ:United Kingdom	12/1/53	0	true	10.4516	ENVO:dense settlement biome	ENVO:human-associated habitat	true	249	human	Homo sapiens	2492	9606	2492	51.5	-0.12	true	Cornell	true	false	King's College, London, UK	Stool	female	8	1006110	TwinsUK gut microbiome	MZ	TwinsUK Fecal Sample
2014.Plate16.57	TCAGACCAACTG	GTGCCAGCMGCCGCGGTAA	6.754	Cornell	UK_Twins	Cornell	fecal samples from TwinsUK MiSeq runs	TwinsUK Miseq	Jess	MiSeq	This analysis was done as in Caporaso et al 2011 Genome research. The PCR primers F515 and R806 were developed against the V4 region of the 16S rRNA, both bacteria and archaea, which we determined would yield optimal community clustering with reads of this length The reverse PCR primer is barcoded with a 12-base error-correcting Golay code to facilitate multiplexing of up to 1,500 samples per lane, and both PCR primers contain sequencer adapter regions.	GT	FWD:GTGCCAGCMGCCGCGGTAA; REV:GGACTACHVGGGTWTCTAAT	Plate16	Illumina	V4	Cornell	8/14/13	TwinsUKPlate16	0.1,gram	Kings College London	sequencing by synthesis	16S rRNA	V4	G3	53	years	0	3042	UBERON:feces	23.63237	UBERON:feces	UBERON:feces	2/19/13	2013-02-19 09:00:00	9:00:00	GAZ:United Kingdom	11/5/59	0	true	10.4516	ENVO:dense settlement biome	ENVO:human-associated habitat	true	304	human	Homo sapiens	3042	9606	3042	51.5	-0.12	true	Cornell	true	false	King's College, London, UK	Stool	female	8	1006108	TwinsUK gut microbiome	MZ	TwinsUK Fecal Sample
2014.Plate16.56	GACTTATGCCCG	GTGCCAGCMGCCGCGGTAA	5.151	Cornell	UK_Twins	Cornell	fecal samples from TwinsUK MiSeq runs	TwinsUK Miseq	Jess	MiSeq	This analysis was done as in Caporaso et al 2011 Genome research. The PCR primers F515 and R806 were developed against the V4 region of the 16S rRNA, both bacteria and archaea, which we determined would yield optimal community clustering with reads of this length The reverse PCR primer is barcoded with a 12-base error-correcting Golay code to facilitate multiplexing of up to 1,500 samples per lane, and both PCR primers contain sequencer adapter regions.	GT	FWD:GTGCCAGCMGCCGCGGTAA; REV:GGACTACHVGGGTWTCTAAT	Plate16	Illumina	V4	Cornell	8/14/13	TwinsUKPlate16	0.1,gram	Kings College London	sequencing by synthesis	16S rRNA	V4	G12	63	years	0	8011	UBERON:feces	33.25701904	UBERON:feces	UBERON:feces	2/22/13	2013-02-22 04:45:00	4:45:00	GAZ:United Kingdom	12/3/49	0	true	10.4516	ENVO:dense settlement biome	ENVO:human-associated habitat	true	801	human	Homo sapiens	8011	9606	8011	51.5	-0.12	true	Cornell	true	false	King's College, London, UK	Stool	female	8	1006116	TwinsUK gut microbiome	MZ	TwinsUK Fecal Sample
2014.Plate16.55	CAAGCGTTGTCC	GTGCCAGCMGCCGCGGTAA	6.266	Cornell	UK_Twins	Cornell	fecal samples from TwinsUK MiSeq runs	TwinsUK Miseq	Jess	MiSeq	This analysis was done as in Caporaso et al 2011 Genome research. The PCR primers F515 and R806 were developed against the V4 region of the 16S rRNA, both bacteria and archaea, which we determined would yield optimal community clustering with reads of this length The reverse PCR primer is barcoded with a 12-base error-correcting Golay code to facilitate multiplexing of up to 1,500 samples per lane, and both PCR primers contain sequencer adapter regions.	GT	FWD:GTGCCAGCMGCCGCGGTAA; REV:GGACTACHVGGGTWTCTAAT	Plate16	Illumina	V4	Cornell	8/14/13	TwinsUKPlate16	0.1,gram	Kings College London	sequencing by synthesis	16S rRNA	V4	G11	50	years	0	2981	UBERON:feces	19.30755997	UBERON:feces	UBERON:feces	1/31/13	2013-01-31 16:30:00	16:30:00	GAZ:United Kingdom	9/17/62	0	true	10.4516	ENVO:dense settlement biome	ENVO:human-associated habitat	true	298	human	Homo sapiens	2981	9606	2981	51.5	-0.12	true	Cornell	true	false	King's College, London, UK	Stool	female	8	1005989	TwinsUK gut microbiome	MZ	TwinsUK Fecal Sample
2014.Plate16.54	CGTCGTCTAAGA	GTGCCAGCMGCCGCGGTAA	4.863	Cornell	UK_Twins	Cornell	fecal samples from TwinsUK MiSeq runs	TwinsUK Miseq	Jess	MiSeq	This analysis was done as in Caporaso et al 2011 Genome research. The PCR primers F515 and R806 were developed against the V4 region of the 16S rRNA, both bacteria and archaea, which we determined would yield optimal community clustering with reads of this length The reverse PCR primer is barcoded with a 12-base error-correcting Golay code to facilitate multiplexing of up to 1,500 samples per lane, and both PCR primers contain sequencer adapter regions.	GT	FWD:GTGCCAGCMGCCGCGGTAA; REV:GGACTACHVGGGTWTCTAAT	Plate16	Illumina	V4	Cornell	8/14/13	TwinsUKPlate16	0.1,gram	Kings College London	sequencing by synthesis	16S rRNA	V4	G10	43	years	0	781	UBERON:feces	20.7190609	UBERON:feces	UBERON:feces	1/15/13	2013-01-15 20:25:00	20:25:00	GAZ:United Kingdom	11/16/69	0	true	10.4516	ENVO:dense settlement biome	ENVO:human-associated habitat	true	78	human	Homo sapiens	781	9606	781	51.5	-0.12	true	Cornell	true	false	King's College, London, UK	Stool	female	8	1006040	TwinsUK gut microbiome	MZ	TwinsUK Fecal Sample
2014.Plate16.53	CTGGTGCTGAAT	GTGCCAGCMGCCGCGGTAA	13.713	Cornell	UK_Twins	Cornell	fecal samples from TwinsUK MiSeq runs	TwinsUK Miseq	Jess	MiSeq	This analysis was done as in Caporaso et al 2011 Genome research. The PCR primers F515 and R806 were developed against the V4 region of the 16S rRNA, both bacteria and archaea, which we determined would yield optimal community clustering with reads of this length The reverse PCR primer is barcoded with a 12-base error-correcting Golay code to facilitate multiplexing of up to 1,500 samples per lane, and both PCR primers contain sequencer adapter regions.	GT	FWD:GTGCCAGCMGCCGCGGTAA; REV:GGACTACHVGGGTWTCTAAT	Plate16	Illumina	V4	Cornell	8/14/13	TwinsUKPlate16	0.1,gram	Kings College London	sequencing by synthesis	16S rRNA	V4	G1	70	years	0	3191	UBERON:feces	22.92690086	UBERON:feces	UBERON:feces	2/9/13	2013-02-09 07:45:00	7:45:00	GAZ:United Kingdom	12/11/42	0	true	10.4516	ENVO:dense settlement biome	ENVO:human-associated habitat	true	319	human	Homo sapiens	3191	9606	3191	51.5	-0.12	true	Cornell	true	false	King's College, London, UK	Stool	female	8	1006070	TwinsUK gut microbiome	MZ	TwinsUK Fecal Sample
2014.Plate16.52	CAACTAGACTCG	GTGCCAGCMGCCGCGGTAA	19.186	Cornell	UK_Twins	Cornell	fecal samples from TwinsUK MiSeq runs	TwinsUK Miseq	Jess	MiSeq	This analysis was done as in Caporaso et al 2011 Genome research. The PCR primers F515 and R806 were developed against the V4 region of the 16S rRNA, both bacteria and archaea, which we determined would yield optimal community clustering with reads of this length The reverse PCR primer is barcoded with a 12-base error-correcting Golay code to facilitate multiplexing of up to 1,500 samples per lane, and both PCR primers contain sequencer adapter regions.	GT	FWD:GTGCCAGCMGCCGCGGTAA; REV:GGACTACHVGGGTWTCTAAT	Plate16	Illumina	V4	Cornell	8/14/13	TwinsUKPlate16	0.1,gram	Kings College London	sequencing by synthesis	16S rRNA	V4	F9	58	years	0	2701	UBERON:feces	24.67931938	UBERON:feces	UBERON:feces	2/19/13	2013-02-19 07:30:00	7:30:00	GAZ:United Kingdom	9/21/54	0	true	10.4516	ENVO:dense settlement biome	ENVO:human-associated habitat	true	270	human	Homo sapiens	2701	9606	2701	51.5	-0.12	true	Cornell	true	false	King's College, London, UK	Stool	female	8	1006104	TwinsUK gut microbiome	MZ	TwinsUK Fecal Sample
2014.Plate16.51	GTGCTTGTGTAG	GTGCCAGCMGCCGCGGTAA	10.6	Cornell	UK_Twins	Cornell	fecal samples from TwinsUK MiSeq runs	TwinsUK Miseq	Jess	MiSeq	This analysis was done as in Caporaso et al 2011 Genome research. The PCR primers F515 and R806 were developed against the V4 region of the 16S rRNA, both bacteria and archaea, which we determined would yield optimal community clustering with reads of this length The reverse PCR primer is barcoded with a 12-base error-correcting Golay code to facilitate multiplexing of up to 1,500 samples per lane, and both PCR primers contain sequencer adapter regions.	GT	FWD:GTGCCAGCMGCCGCGGTAA; REV:GGACTACHVGGGTWTCTAAT	Plate16	Illumina	V4	Cornell	8/14/13	TwinsUKPlate16	0.1,gram	Kings College London	sequencing by synthesis	16S rRNA	V4	F8	64	years	0	2922	UBERON:feces	25.59280014	UBERON:feces	UBERON:feces	2/26/13	2013-02-26 19:40:00	19:40:00	GAZ:United Kingdom	4/5/48	0	true	10.4516	ENVO:dense settlement biome	ENVO:human-associated habitat	true	292	human	Homo sapiens	2922	9606	2922	51.5	-0.12	true	Cornell	true	false	King's College, London, UK	Stool	female	8	1006097	TwinsUK gut microbiome	MZ	TwinsUK Fecal Sample
2014.Plate16.50	TGCCGCCGTAAT	GTGCCAGCMGCCGCGGTAA	6.583	Cornell	UK_Twins	Cornell	fecal samples from TwinsUK MiSeq runs	TwinsUK Miseq	Jess	MiSeq	This analysis was done as in Caporaso et al 2011 Genome research. The PCR primers F515 and R806 were developed against the V4 region of the 16S rRNA, both bacteria and archaea, which we determined would yield optimal community clustering with reads of this length The reverse PCR primer is barcoded with a 12-base error-correcting Golay code to facilitate multiplexing of up to 1,500 samples per lane, and both PCR primers contain sequencer adapter regions.	GT	FWD:GTGCCAGCMGCCGCGGTAA; REV:GGACTACHVGGGTWTCTAAT	Plate16	Illumina	V4	Cornell	8/14/13	TwinsUKPlate16	0.1,gram	Kings College London	sequencing by synthesis	16S rRNA	V4	F6	58	years	0	111	UBERON:feces	20.47499084	UBERON:feces	UBERON:feces	3/4/13	2013-03-04 07:30:00	7:30:00	GAZ:United Kingdom	6/1/54	0	true	10.4516	ENVO:dense settlement biome	ENVO:human-associated habitat	true	11	human	Homo sapiens	111	9606	111	51.5	-0.12	true	Cornell	true	false	King's College, London, UK	Stool	female	8	1006079	TwinsUK gut microbiome	MZ	TwinsUK Fecal Sample
2014.Plate16.5	TGTCCGTGGATC	GTGCCAGCMGCCGCGGTAA	13.307	Cornell	UK_Twins	Cornell	fecal samples from TwinsUK MiSeq runs	TwinsUK Miseq	Jess	MiSeq	This analysis was done as in Caporaso et al 2011 Genome research. The PCR primers F515 and R806 were developed against the V4 region of the 16S rRNA, both bacteria and archaea, which we determined would yield optimal community clustering with reads of this length The reverse PCR primer is barcoded with a 12-base error-correcting Golay code to facilitate multiplexing of up to 1,500 samples per lane, and both PCR primers contain sequencer adapter regions.	GT	FWD:GTGCCAGCMGCCGCGGTAA; REV:GGACTACHVGGGTWTCTAAT	Plate16	Illumina	V4	Cornell	8/14/13	TwinsUKPlate16	0.1,gram	Kings College London	sequencing by synthesis	16S rRNA	V4	A5	61	years	0	2882	UBERON:feces	28.66820908	UBERON:feces	UBERON:feces	2/9/13	2013-02-09 10:00:00	10:00:00	GAZ:United Kingdom	5/27/51	0	true	10.4516	ENVO:dense settlement biome	ENVO:human-associated habitat	true	288	human	Homo sapiens	2882	9606	2882	51.5	-0.12	true	Cornell	true	false	King's College, London, UK	Stool	female	8	1006068	TwinsUK gut microbiome	MZ	TwinsUK Fecal Sample
2014.Plate16.49	AAGTGAAGCGAG	GTGCCAGCMGCCGCGGTAA	7.997	Cornell	UK_Twins	Cornell	fecal samples from TwinsUK MiSeq runs	TwinsUK Miseq	Jess	MiSeq	This analysis was done as in Caporaso et al 2011 Genome research. The PCR primers F515 and R806 were developed against the V4 region of the 16S rRNA, both bacteria and archaea, which we determined would yield optimal community clustering with reads of this length The reverse PCR primer is barcoded with a 12-base error-correcting Golay code to facilitate multiplexing of up to 1,500 samples per lane, and both PCR primers contain sequencer adapter regions.	GT	FWD:GTGCCAGCMGCCGCGGTAA; REV:GGACTACHVGGGTWTCTAAT	Plate16	Illumina	V4	Cornell	8/14/13	TwinsUKPlate16	0.1,gram	Kings College London	sequencing by synthesis	16S rRNA	V4	F5	47	years	0	2751	UBERON:feces	21.92613029	UBERON:feces	UBERON:feces	2/17/13	2013-02-17 11:23:00	11:23:00	GAZ:United Kingdom	8/17/65	0	true	10.4516	ENVO:dense settlement biome	ENVO:human-associated habitat	true	275	human	Homo sapiens	2751	9606	2751	51.5	-0.12	true	Cornell	true	false	King's College, London, UK	Stool	female	8	1006093	TwinsUK gut microbiome	MZ	TwinsUK Fecal Sample
2014.Plate16.47	TTCCCTTCTCCG	GTGCCAGCMGCCGCGGTAA	6.933	Cornell	UK_Twins	Cornell	fecal samples from TwinsUK MiSeq runs	TwinsUK Miseq	Jess	MiSeq	This analysis was done as in Caporaso et al 2011 Genome research. The PCR primers F515 and R806 were developed against the V4 region of the 16S rRNA, both bacteria and archaea, which we determined would yield optimal community clustering with reads of this length The reverse PCR primer is barcoded with a 12-base error-correcting Golay code to facilitate multiplexing of up to 1,500 samples per lane, and both PCR primers contain sequencer adapter regions.	GT	FWD:GTGCCAGCMGCCGCGGTAA; REV:GGACTACHVGGGTWTCTAAT	Plate16	Illumina	V4	Cornell	8/14/13	TwinsUKPlate16	0.1,gram	Kings College London	sequencing by synthesis	16S rRNA	V4	F3	60	years	0	3102	UBERON:feces	24.19926071	UBERON:feces	UBERON:feces	2/21/13	2013-02-21 06:20:00	6:20:00	GAZ:United Kingdom	10/24/52	0	true	10.4516	ENVO:dense settlement biome	ENVO:human-associated habitat	true	310	human	Homo sapiens	3102	9606	3102	51.5	-0.12	true	Cornell	true	false	King's College, London, UK	Stool	female	8	1006112	TwinsUK gut microbiome	DZ	TwinsUK Fecal Sample
2014.Plate16.46	GTGGCCTACTAC	GTGCCAGCMGCCGCGGTAA	8.52	Cornell	UK_Twins	Cornell	fecal samples from TwinsUK MiSeq runs	TwinsUK Miseq	Jess	MiSeq	This analysis was done as in Caporaso et al 2011 Genome research. The PCR primers F515 and R806 were developed against the V4 region of the 16S rRNA, both bacteria and archaea, which we determined would yield optimal community clustering with reads of this length The reverse PCR primer is barcoded with a 12-base error-correcting Golay code to facilitate multiplexing of up to 1,500 samples per lane, and both PCR primers contain sequencer adapter regions.	GT	FWD:GTGCCAGCMGCCGCGGTAA; REV:GGACTACHVGGGTWTCTAAT	Plate16	Illumina	V4	Cornell	8/14/13	TwinsUKPlate16	0.1,gram	Kings College London	sequencing by synthesis	16S rRNA	V4	F2	39	years	0	3241	UBERON:feces	28.24785042	UBERON:feces	UBERON:feces	2/13/13	2013-02-13 09:50:00	9:50:00	GAZ:United Kingdom	7/17/73	0	true	10.4516	ENVO:dense settlement biome	ENVO:human-associated habitat	true	324	human	Homo sapiens	3241	9606	3241	51.5	-0.12	true	Cornell	true	false	King's College, London, UK	Stool	male	8	1006088	TwinsUK gut microbiome	MZ	TwinsUK Fecal Sample
2014.Plate16.45	TGTCAGCTGTCG	GTGCCAGCMGCCGCGGTAA	13.307	Cornell	UK_Twins	Cornell	fecal samples from TwinsUK MiSeq runs	TwinsUK Miseq	Jess	MiSeq	This analysis was done as in Caporaso et al 2011 Genome research. The PCR primers F515 and R806 were developed against the V4 region of the 16S rRNA, both bacteria and archaea, which we determined would yield optimal community clustering with reads of this length The reverse PCR primer is barcoded with a 12-base error-correcting Golay code to facilitate multiplexing of up to 1,500 samples per lane, and both PCR primers contain sequencer adapter regions.	GT	FWD:GTGCCAGCMGCCGCGGTAA; REV:GGACTACHVGGGTWTCTAAT	Plate16	Illumina	V4	Cornell	8/14/13	TwinsUKPlate16	0.1,gram	Kings College London	sequencing by synthesis	16S rRNA	V4	F12	58	years	0	3582	UBERON:feces		UBERON:feces	UBERON:feces	2/7/13	2013-02-07 14:45:00	14:45:00	GAZ:United Kingdom	7/26/54	0	true	10.4516	ENVO:dense settlement biome	ENVO:human-associated habitat	true	358	human	Homo sapiens	3582	9606	3582	51.5	-0.12	true	Cornell	true	false	King's College, London, UK	Stool	female	8	1006064	TwinsUK gut microbiome	DZ	TwinsUK Fecal Sample
2014.Plate16.44	AGTGCCCTTGGT	GTGCCAGCMGCCGCGGTAA	7.759	Cornell	UK_Twins	Cornell	fecal samples from TwinsUK MiSeq runs	TwinsUK Miseq	Jess	MiSeq	This analysis was done as in Caporaso et al 2011 Genome research. The PCR primers F515 and R806 were developed against the V4 region of the 16S rRNA, both bacteria and archaea, which we determined would yield optimal community clustering with reads of this length The reverse PCR primer is barcoded with a 12-base error-correcting Golay code to facilitate multiplexing of up to 1,500 samples per lane, and both PCR primers contain sequencer adapter regions.	GT	FWD:GTGCCAGCMGCCGCGGTAA; REV:GGACTACHVGGGTWTCTAAT	Plate16	Illumina	V4	Cornell	8/14/13	TwinsUKPlate16	0.1,gram	Kings College London	sequencing by synthesis	16S rRNA	V4	F10	49	years	0	521	UBERON:feces	23.7010994	UBERON:feces	UBERON:feces	2/18/13	2013-02-18 10:35:00	10:35:00	GAZ:United Kingdom	8/3/63	0	true	10.4516	ENVO:dense settlement biome	ENVO:human-associated habitat	true	52	human	Homo sapiens	521	9606	521	51.5	-0.12	true	Cornell	true	false	King's College, London, UK	Stool	female	8	1006099	TwinsUK gut microbiome	DZ	TwinsUK Fecal Sample
2014.Plate16.43	ACCAACAGATTG	GTGCCAGCMGCCGCGGTAA	5.143	Cornell	UK_Twins	Cornell	fecal samples from TwinsUK MiSeq runs	TwinsUK Miseq	Jess	MiSeq	This analysis was done as in Caporaso et al 2011 Genome research. The PCR primers F515 and R806 were developed against the V4 region of the 16S rRNA, both bacteria and archaea, which we determined would yield optimal community clustering with reads of this length The reverse PCR primer is barcoded with a 12-base error-correcting Golay code to facilitate multiplexing of up to 1,500 samples per lane, and both PCR primers contain sequencer adapter regions.	GT	FWD:GTGCCAGCMGCCGCGGTAA; REV:GGACTACHVGGGTWTCTAAT	Plate16	Illumina	V4	Cornell	8/14/13	TwinsUKPlate16	0.1,gram	Kings College London	sequencing by synthesis	16S rRNA	V4	F1	68	years	0	1791	UBERON:feces	30.3180294	UBERON:feces	UBERON:feces	2/3/13	2013-02-03 09:00:00	9:00:00	GAZ:United Kingdom	8/22/44	0	true	10.4516	ENVO:dense settlement biome	ENVO:human-associated habitat	true	179	human	Homo sapiens	1791	9606	1791	51.5	-0.12	true	Cornell	true	false	King's College, London, UK	Stool	female	8	1006030	TwinsUK gut microbiome	DZ	TwinsUK Fecal Sample
2014.Plate16.42	CTCCAGGTCATG	GTGCCAGCMGCCGCGGTAA	7.323	Cornell	UK_Twins	Cornell	fecal samples from TwinsUK MiSeq runs	TwinsUK Miseq	Jess	MiSeq	This analysis was done as in Caporaso et al 2011 Genome research. The PCR primers F515 and R806 were developed against the V4 region of the 16S rRNA, both bacteria and archaea, which we determined would yield optimal community clustering with reads of this length The reverse PCR primer is barcoded with a 12-base error-correcting Golay code to facilitate multiplexing of up to 1,500 samples per lane, and both PCR primers contain sequencer adapter regions.	GT	FWD:GTGCCAGCMGCCGCGGTAA; REV:GGACTACHVGGGTWTCTAAT	Plate16	Illumina	V4	Cornell	8/14/13	TwinsUKPlate16	0.1,gram	Kings College London	sequencing by synthesis	16S rRNA	V4	E9	65	years	0	3702	UBERON:feces	22.59745979	UBERON:feces	UBERON:feces	1/9/13	2013-01-09 08:15:00	8:15:00	GAZ:United Kingdom	5/1/47	0	true	10.4516	ENVO:dense settlement biome	ENVO:human-associated habitat	true	370	human	Homo sapiens	3702	9606	3702	51.5	-0.12	true	Cornell	true	false	King's College, London, UK	Stool	female	8	1005953	TwinsUK gut microbiome	MZ	TwinsUK Fecal Sample
2014.Plate16.41	TTCACCTGTATC	GTGCCAGCMGCCGCGGTAA	5.979	Cornell	UK_Twins	Cornell	fecal samples from TwinsUK MiSeq runs	TwinsUK Miseq	Jess	MiSeq	This analysis was done as in Caporaso et al 2011 Genome research. The PCR primers F515 and R806 were developed against the V4 region of the 16S rRNA, both bacteria and archaea, which we determined would yield optimal community clustering with reads of this length The reverse PCR primer is barcoded with a 12-base error-correcting Golay code to facilitate multiplexing of up to 1,500 samples per lane, and both PCR primers contain sequencer adapter regions.	GT	FWD:GTGCCAGCMGCCGCGGTAA; REV:GGACTACHVGGGTWTCTAAT	Plate16	Illumina	V4	Cornell	8/14/13	TwinsUKPlate16	0.1,gram	Kings College London	sequencing by synthesis	16S rRNA	V4	E8	58	years	0	2801	UBERON:feces	28.10030937	UBERON:feces	UBERON:feces	2/10/13	2013-02-10 12:10:00	12:10:00	GAZ:United Kingdom	7/23/54	0	true	10.4516	ENVO:dense settlement biome	ENVO:human-associated habitat	true	280	human	Homo sapiens	2801	9606	2801	51.5	-0.12	true	Cornell	true	false	King's College, London, UK	Stool	female	8	1006073	TwinsUK gut microbiome	MZ	TwinsUK Fecal Sample
2014.Plate16.4	CATCTGGGCAAT	GTGCCAGCMGCCGCGGTAA	7.123	Cornell	UK_Twins	Cornell	fecal samples from TwinsUK MiSeq runs	TwinsUK Miseq	Jess	MiSeq	This analysis was done as in Caporaso et al 2011 Genome research. The PCR primers F515 and R806 were developed against the V4 region of the 16S rRNA, both bacteria and archaea, which we determined would yield optimal community clustering with reads of this length The reverse PCR primer is barcoded with a 12-base error-correcting Golay code to facilitate multiplexing of up to 1,500 samples per lane, and both PCR primers contain sequencer adapter regions.	GT	FWD:GTGCCAGCMGCCGCGGTAA; REV:GGACTACHVGGGTWTCTAAT	Plate16	Illumina	V4	Cornell	8/14/13	TwinsUKPlate16	0.1,gram	Kings College London	sequencing by synthesis	16S rRNA	V4	A4	58	years	0	3732	UBERON:feces	28.15546989	UBERON:feces	UBERON:feces	3/30/13	2013-03-30 08:30:00	8:30:00	GAZ:United Kingdom	10/7/54	0	true	10.4516	ENVO:dense settlement biome	ENVO:human-associated habitat	true	373	human	Homo sapiens	3732	9606	3732	51.5	-0.12	true	Cornell	true	false	King's College, London, UK	Stool	female	8	1006087	TwinsUK gut microbiome	MZ	TwinsUK Fecal Sample
2014.Plate16.39	TAAACGCGACTC	GTGCCAGCMGCCGCGGTAA	5.911	Cornell	UK_Twins	Cornell	fecal samples from TwinsUK MiSeq runs	TwinsUK Miseq	Jess	MiSeq	This analysis was done as in Caporaso et al 2011 Genome research. The PCR primers F515 and R806 were developed against the V4 region of the 16S rRNA, both bacteria and archaea, which we determined would yield optimal community clustering with reads of this length The reverse PCR primer is barcoded with a 12-base error-correcting Golay code to facilitate multiplexing of up to 1,500 samples per lane, and both PCR primers contain sequencer adapter regions.	GT	FWD:GTGCCAGCMGCCGCGGTAA; REV:GGACTACHVGGGTWTCTAAT	Plate16	Illumina	V4	Cornell	8/14/13	TwinsUKPlate16	0.1,gram	Kings College London	sequencing by synthesis	16S rRNA	V4	E6	66	years	0	3531	UBERON:feces	26.92869949	UBERON:feces	UBERON:feces	2/6/13	2013-02-06 09:00:00	9:00:00	GAZ:United Kingdom	8/16/46	0	true	10.4516	ENVO:dense settlement biome	ENVO:human-associated habitat	true	353	human	Homo sapiens	3531	9606	3531	51.5	-0.12	true	Cornell	true	false	King's College, London, UK	Stool	female	8	1006084	TwinsUK gut microbiome	MZ	TwinsUK Fecal Sample
2014.Plate16.38	ATTCAGATGGCA	GTGCCAGCMGCCGCGGTAA	6.343	Cornell	UK_Twins	Cornell	fecal samples from TwinsUK MiSeq runs	TwinsUK Miseq	Jess	MiSeq	This analysis was done as in Caporaso et al 2011 Genome research. The PCR primers F515 and R806 were developed against the V4 region of the 16S rRNA, both bacteria and archaea, which we determined would yield optimal community clustering with reads of this length The reverse PCR primer is barcoded with a 12-base error-correcting Golay code to facilitate multiplexing of up to 1,500 samples per lane, and both PCR primers contain sequencer adapter regions.	GT	FWD:GTGCCAGCMGCCGCGGTAA; REV:GGACTACHVGGGTWTCTAAT	Plate16	Illumina	V4	Cornell	8/14/13	TwinsUKPlate16	0.1,gram	Kings College London	sequencing by synthesis	16S rRNA	V4	E5	62	years	0	3221	UBERON:feces	26.81940079	UBERON:feces	UBERON:feces	2/18/13	2013-02-18 18:36:00	18:36:00	GAZ:United Kingdom	2/5/51	0	true	10.4516	ENVO:dense settlement biome	ENVO:human-associated habitat	true	322	human	Homo sapiens	3221	9606	3221	51.5	-0.12	true	Cornell	true	false	King's College, London, UK	Stool	female	8	1006089	TwinsUK gut microbiome	MZ	TwinsUK Fecal Sample
2014.Plate16.37	ATTATACGGCGC	GTGCCAGCMGCCGCGGTAA	6.667	Cornell	UK_Twins	Cornell	fecal samples from TwinsUK MiSeq runs	TwinsUK Miseq	Jess	MiSeq	This analysis was done as in Caporaso et al 2011 Genome research. The PCR primers F515 and R806 were developed against the V4 region of the 16S rRNA, both bacteria and archaea, which we determined would yield optimal community clustering with reads of this length The reverse PCR primer is barcoded with a 12-base error-correcting Golay code to facilitate multiplexing of up to 1,500 samples per lane, and both PCR primers contain sequencer adapter regions.	GT	FWD:GTGCCAGCMGCCGCGGTAA; REV:GGACTACHVGGGTWTCTAAT	Plate16	Illumina	V4	Cornell	8/14/13	TwinsUKPlate16	0.1,gram	Kings College London	sequencing by synthesis	16S rRNA	V4	E4	64	years	0	3131	UBERON:feces	24.76755905	UBERON:feces	UBERON:feces	1/3/13	2013-01-03 10:30:00	10:30:00	GAZ:United Kingdom	8/22/48	0	true	10.4516	ENVO:dense settlement biome	ENVO:human-associated habitat	true	313	human	Homo sapiens	3131	9606	3131	51.5	-0.12	true	Cornell	true	false	King's College, London, UK	Stool	female	8	1006017	TwinsUK gut microbiome	MZ	TwinsUK Fecal Sample
2014.Plate16.36	ACTTACGCCACG	GTGCCAGCMGCCGCGGTAA	6.667	Cornell	UK_Twins	Cornell	fecal samples from TwinsUK MiSeq runs	TwinsUK Miseq	Jess	MiSeq	This analysis was done as in Caporaso et al 2011 Genome research. The PCR primers F515 and R806 were developed against the V4 region of the 16S rRNA, both bacteria and archaea, which we determined would yield optimal community clustering with reads of this length The reverse PCR primer is barcoded with a 12-base error-correcting Golay code to facilitate multiplexing of up to 1,500 samples per lane, and both PCR primers contain sequencer adapter regions.	GT	FWD:GTGCCAGCMGCCGCGGTAA; REV:GGACTACHVGGGTWTCTAAT	Plate16	Illumina	V4	Cornell	8/14/13	TwinsUKPlate16	0.1,gram	Kings College London	sequencing by synthesis	16S rRNA	V4	E3	59	years	0	5022	UBERON:feces	29.29508018	UBERON:feces	UBERON:feces	2/10/13	2013-02-10 09:15:00	9:15:00	GAZ:United Kingdom	7/3/53	0	true	10.4516	ENVO:dense settlement biome	ENVO:human-associated habitat	true	502	human	Homo sapiens	5022	9606	5022	51.5	-0.12	true	Cornell	true	false	King's College, London, UK	Stool	female	8	1006100	TwinsUK gut microbiome	DZ	TwinsUK Fecal Sample
2014.Plate16.34	GCCTCGTACTGA	GTGCCAGCMGCCGCGGTAA	5.476	Cornell	UK_Twins	Cornell	fecal samples from TwinsUK MiSeq runs	TwinsUK Miseq	Jess	MiSeq	This analysis was done as in Caporaso et al 2011 Genome research. The PCR primers F515 and R806 were developed against the V4 region of the 16S rRNA, both bacteria and archaea, which we determined would yield optimal community clustering with reads of this length The reverse PCR primer is barcoded with a 12-base error-correcting Golay code to facilitate multiplexing of up to 1,500 samples per lane, and both PCR primers contain sequencer adapter regions.	GT	FWD:GTGCCAGCMGCCGCGGTAA; REV:GGACTACHVGGGTWTCTAAT	Plate16	Illumina	V4	Cornell	8/14/13	TwinsUKPlate16	0.1,gram	Kings College London	sequencing by synthesis	16S rRNA	V4	E12	46	years	0	3651	UBERON:feces	23.26651001	UBERON:feces	UBERON:feces	1/29/13	2013-01-29 07:20:00	7:20:00	GAZ:United Kingdom	9/18/66	0	true	10.4516	ENVO:dense settlement biome	ENVO:human-associated habitat	true	365	human	Homo sapiens	3651	9606	3651	51.5	-0.12	true	Cornell	true	false	King's College, London, UK	Stool	female	8	1006019	TwinsUK gut microbiome	MZ	TwinsUK Fecal Sample
2014.Plate16.33	CGCATACGACCT	GTGCCAGCMGCCGCGGTAA	6.266	Cornell	UK_Twins	Cornell	fecal samples from TwinsUK MiSeq runs	TwinsUK Miseq	Jess	MiSeq	This analysis was done as in Caporaso et al 2011 Genome research. The PCR primers F515 and R806 were developed against the V4 region of the 16S rRNA, both bacteria and archaea, which we determined would yield optimal community clustering with reads of this length The reverse PCR primer is barcoded with a 12-base error-correcting Golay code to facilitate multiplexing of up to 1,500 samples per lane, and both PCR primers contain sequencer adapter regions.	GT	FWD:GTGCCAGCMGCCGCGGTAA; REV:GGACTACHVGGGTWTCTAAT	Plate16	Illumina	V4	Cornell	8/14/13	TwinsUKPlate16	0.1,gram	Kings College London	sequencing by synthesis	16S rRNA	V4	E11	57	years	0	7921	UBERON:feces	21.01709938	UBERON:feces	UBERON:feces	2/21/13	2013-02-21 17:30:00	17:30:00	GAZ:United Kingdom	3/17/55	0	true	10.4516	ENVO:dense settlement biome	ENVO:human-associated habitat	true	792	human	Homo sapiens	7921	9606	7921	51.5	-0.12	true	Cornell	true	false	King's College, London, UK	Stool	female	8	1006114	TwinsUK gut microbiome	MZ	TwinsUK Fecal Sample
2014.Plate16.32	CAGGATTCGTAC	GTGCCAGCMGCCGCGGTAA	4.337	Cornell	UK_Twins	Cornell	fecal samples from TwinsUK MiSeq runs	TwinsUK Miseq	Jess	MiSeq	This analysis was done as in Caporaso et al 2011 Genome research. The PCR primers F515 and R806 were developed against the V4 region of the 16S rRNA, both bacteria and archaea, which we determined would yield optimal community clustering with reads of this length The reverse PCR primer is barcoded with a 12-base error-correcting Golay code to facilitate multiplexing of up to 1,500 samples per lane, and both PCR primers contain sequencer adapter regions.	GT	FWD:GTGCCAGCMGCCGCGGTAA; REV:GGACTACHVGGGTWTCTAAT	Plate16	Illumina	V4	Cornell	8/14/13	TwinsUKPlate16	0.1,gram	Kings College London	sequencing by synthesis	16S rRNA	V4	E10	53	years	0	3041	UBERON:feces	23.5111599	UBERON:feces	UBERON:feces	2/19/13	2013-02-19 08:30:00	8:30:00	GAZ:United Kingdom	11/5/59	0	true	10.4516	ENVO:dense settlement biome	ENVO:human-associated habitat	true	304	human	Homo sapiens	3041	9606	3041	51.5	-0.12	true	Cornell	true	false	King's College, London, UK	Stool	female	8	1006107	TwinsUK gut microbiome	MZ	TwinsUK Fecal Sample
2014.Plate16.31	ATCCCAGCATGC	GTGCCAGCMGCCGCGGTAA	9.779	Cornell	UK_Twins	Cornell	fecal samples from TwinsUK MiSeq runs	TwinsUK Miseq	Jess	MiSeq	This analysis was done as in Caporaso et al 2011 Genome research. The PCR primers F515 and R806 were developed against the V4 region of the 16S rRNA, both bacteria and archaea, which we determined would yield optimal community clustering with reads of this length The reverse PCR primer is barcoded with a 12-base error-correcting Golay code to facilitate multiplexing of up to 1,500 samples per lane, and both PCR primers contain sequencer adapter regions.	GT	FWD:GTGCCAGCMGCCGCGGTAA; REV:GGACTACHVGGGTWTCTAAT	Plate16	Illumina	V4	Cornell	8/14/13	TwinsUKPlate16	0.1,gram	Kings College London	sequencing by synthesis	16S rRNA	V4	E1	58	years	0	7992	UBERON:feces	26.13018036	UBERON:feces	UBERON:feces	2/3/13	2013-02-03 16:00:00	16:00:00	GAZ:United Kingdom	10/7/54	0	true	10.4516	ENVO:dense settlement biome	ENVO:human-associated habitat	true	799	human	Homo sapiens	7992	9606	7992	51.5	-0.12	true	Cornell	true	false	King's College, London, UK	Stool	female	8	1006090	TwinsUK gut microbiome	MZ	TwinsUK Fecal Sample
2014.Plate16.30	TCCTCACTATCA	GTGCCAGCMGCCGCGGTAA	11.05	Cornell	UK_Twins	Cornell	fecal samples from TwinsUK MiSeq runs	TwinsUK Miseq	Jess	MiSeq	This analysis was done as in Caporaso et al 2011 Genome research. The PCR primers F515 and R806 were developed against the V4 region of the 16S rRNA, both bacteria and archaea, which we determined would yield optimal community clustering with reads of this length The reverse PCR primer is barcoded with a 12-base error-correcting Golay code to facilitate multiplexing of up to 1,500 samples per lane, and both PCR primers contain sequencer adapter regions.	GT	FWD:GTGCCAGCMGCCGCGGTAA; REV:GGACTACHVGGGTWTCTAAT	Plate16	Illumina	V4	Cornell	8/14/13	TwinsUKPlate16	0.1,gram	Kings College London	sequencing by synthesis	16S rRNA	V4	D8	64	years	0	3302	UBERON:feces	36.85976028	UBERON:feces	UBERON:feces	1/21/13	2013-01-21 10:25:00	10:25:00	GAZ:United Kingdom	10/25/48	0	true	10.4516	ENVO:dense settlement biome	ENVO:human-associated habitat	true	330	human	Homo sapiens	3302	9606	3302	51.5	-0.12	true	Cornell	true	false	King's College, London, UK	Stool	female	8	1005974	TwinsUK gut microbiome	MZ	TwinsUK Fecal Sample
2014.Plate16.3	TCTAACGAGTGC	GTGCCAGCMGCCGCGGTAA	10.389	Cornell	UK_Twins	Cornell	fecal samples from TwinsUK MiSeq runs	TwinsUK Miseq	Jess	MiSeq	This analysis was done as in Caporaso et al 2011 Genome research. The PCR primers F515 and R806 were developed against the V4 region of the 16S rRNA, both bacteria and archaea, which we determined would yield optimal community clustering with reads of this length The reverse PCR primer is barcoded with a 12-base error-correcting Golay code to facilitate multiplexing of up to 1,500 samples per lane, and both PCR primers contain sequencer adapter regions.	GT	FWD:GTGCCAGCMGCCGCGGTAA; REV:GGACTACHVGGGTWTCTAAT	Plate16	Illumina	V4	Cornell	8/14/13	TwinsUKPlate16	0.1,gram	Kings College London	sequencing by synthesis	16S rRNA	V4	A3	62	years	0	8461	UBERON:feces	21.0830307	UBERON:feces	UBERON:feces	2/25/13	2013-02-25 05:00:00	5:00:00	GAZ:United Kingdom	11/3/50	0	true	10.4516	ENVO:dense settlement biome	ENVO:human-associated habitat	true	846	human	Homo sapiens	8461	9606	8461	51.5	-0.12	true	Cornell	true	false	King's College, London, UK	Stool	female	8	1006122	TwinsUK gut microbiome	DZ	TwinsUK Fecal Sample
2014.Plate16.29	TCCTAGGTCCGA	GTGCCAGCMGCCGCGGTAA	5.419	Cornell	UK_Twins	Cornell	fecal samples from TwinsUK MiSeq runs	TwinsUK Miseq	Jess	MiSeq	This analysis was done as in Caporaso et al 2011 Genome research. The PCR primers F515 and R806 were developed against the V4 region of the 16S rRNA, both bacteria and archaea, which we determined would yield optimal community clustering with reads of this length The reverse PCR primer is barcoded with a 12-base error-correcting Golay code to facilitate multiplexing of up to 1,500 samples per lane, and both PCR primers contain sequencer adapter regions.	GT	FWD:GTGCCAGCMGCCGCGGTAA; REV:GGACTACHVGGGTWTCTAAT	Plate16	Illumina	V4	Cornell	8/14/13	TwinsUKPlate16	0.1,gram	Kings College London	sequencing by synthesis	16S rRNA	V4	D7	47	years	0	3021	UBERON:feces	23.55244064	UBERON:feces	UBERON:feces	1/17/13	2013-01-17 18:15:00	18:15:00	GAZ:United Kingdom	4/10/65	0	true	10.4516	ENVO:dense settlement biome	ENVO:human-associated habitat	true	302	human	Homo sapiens	3021	9606	3021	51.5	-0.12	true	Cornell	true	false	King's College, London, UK	Stool	male	8	1005990	TwinsUK gut microbiome	MZ	TwinsUK Fecal Sample
2014.Plate16.28	TTGGAACGGCTT	GTGCCAGCMGCCGCGGTAA	5.203	Cornell	UK_Twins	Cornell	fecal samples from TwinsUK MiSeq runs	TwinsUK Miseq	Jess	MiSeq	This analysis was done as in Caporaso et al 2011 Genome research. The PCR primers F515 and R806 were developed against the V4 region of the 16S rRNA, both bacteria and archaea, which we determined would yield optimal community clustering with reads of this length The reverse PCR primer is barcoded with a 12-base error-correcting Golay code to facilitate multiplexing of up to 1,500 samples per lane, and both PCR primers contain sequencer adapter regions.	GT	FWD:GTGCCAGCMGCCGCGGTAA; REV:GGACTACHVGGGTWTCTAAT	Plate16	Illumina	V4	Cornell	8/14/13	TwinsUKPlate16	0.1,gram	Kings College London	sequencing by synthesis	16S rRNA	V4	D6	62	years	0	3222	UBERON:feces	24.95155907	UBERON:feces	UBERON:feces	2/19/13	2013-02-19 06:30:00	6:30:00	GAZ:United Kingdom	2/5/51	0	true	10.4516	ENVO:dense settlement biome	ENVO:human-associated habitat	true	322	human	Homo sapiens	3222	9606	3222	51.5	-0.12	true	Cornell	true	false	King's College, London, UK	Stool	female	8	1006096	TwinsUK gut microbiome	MZ	TwinsUK Fecal Sample
2014.Plate16.27	GACCGTCAATAC	GTGCCAGCMGCCGCGGTAA	4.774	Cornell	UK_Twins	Cornell	fecal samples from TwinsUK MiSeq runs	TwinsUK Miseq	Jess	MiSeq	This analysis was done as in Caporaso et al 2011 Genome research. The PCR primers F515 and R806 were developed against the V4 region of the 16S rRNA, both bacteria and archaea, which we determined would yield optimal community clustering with reads of this length The reverse PCR primer is barcoded with a 12-base error-correcting Golay code to facilitate multiplexing of up to 1,500 samples per lane, and both PCR primers contain sequencer adapter regions.	GT	FWD:GTGCCAGCMGCCGCGGTAA; REV:GGACTACHVGGGTWTCTAAT	Plate16	Illumina	V4	Cornell	8/14/13	TwinsUKPlate16	0.1,gram	Kings College London	sequencing by synthesis	16S rRNA	V4	D5	43	years	0	512	UBERON:feces	19.28033066	UBERON:feces	UBERON:feces	2/20/13	2013-02-20 06:05:00	6:05:00	GAZ:United Kingdom	4/26/69	0	true	10.4516	ENVO:dense settlement biome	ENVO:human-associated habitat	true	51	human	Homo sapiens	512	9606	512	51.5	-0.12	true	Cornell	true	false	King's College, London, UK	Stool	female	8	1006105	TwinsUK gut microbiome	MZ	TwinsUK Fecal Sample
2014.Plate16.26	GGAAATCCCATC	GTGCCAGCMGCCGCGGTAA	11.8	Cornell	UK_Twins	Cornell	fecal samples from TwinsUK MiSeq runs	TwinsUK Miseq	Jess	MiSeq	This analysis was done as in Caporaso et al 2011 Genome research. The PCR primers F515 and R806 were developed against the V4 region of the 16S rRNA, both bacteria and archaea, which we determined would yield optimal community clustering with reads of this length The reverse PCR primer is barcoded with a 12-base error-correcting Golay code to facilitate multiplexing of up to 1,500 samples per lane, and both PCR primers contain sequencer adapter regions.	GT	FWD:GTGCCAGCMGCCGCGGTAA; REV:GGACTACHVGGGTWTCTAAT	Plate16	Illumina	V4	Cornell	8/14/13	TwinsUKPlate16	0.1,gram	Kings College London	sequencing by synthesis	16S rRNA	V4	D4	67	years	0	3292	UBERON:feces	28.18288994	UBERON:feces	UBERON:feces	2/17/13	2013-02-17 08:15:00	8:15:00	GAZ:United Kingdom	7/21/45	0	true	10.4516	ENVO:dense settlement biome	ENVO:human-associated habitat	true	329	human	Homo sapiens	3292	9606	3292	51.5	-0.12	true	Cornell	true	false	King's College, London, UK	Stool	female	8	1006078	TwinsUK gut microbiome	MZ	TwinsUK Fecal Sample
2014.Plate16.25	AATCTTGCGCCG	GTGCCAGCMGCCGCGGTAA	7.535	Cornell	UK_Twins	Cornell	fecal samples from TwinsUK MiSeq runs	TwinsUK Miseq	Jess	MiSeq	This analysis was done as in Caporaso et al 2011 Genome research. The PCR primers F515 and R806 were developed against the V4 region of the 16S rRNA, both bacteria and archaea, which we determined would yield optimal community clustering with reads of this length The reverse PCR primer is barcoded with a 12-base error-correcting Golay code to facilitate multiplexing of up to 1,500 samples per lane, and both PCR primers contain sequencer adapter regions.	GT	FWD:GTGCCAGCMGCCGCGGTAA; REV:GGACTACHVGGGTWTCTAAT	Plate16	Illumina	V4	Cornell	8/14/13	TwinsUKPlate16	0.1,gram	Kings College London	sequencing by synthesis	16S rRNA	V4	D3	62	years	0	8462	UBERON:feces	24.16896057	UBERON:feces	UBERON:feces	2/24/13	2013-02-24 07:45:00	7:45:00	GAZ:United Kingdom	11/3/50	0	true	10.4516	ENVO:dense settlement biome	ENVO:human-associated habitat	true	846	human	Homo sapiens	8462	9606	8462	51.5	-0.12	true	Cornell	true	false	King's College, London, UK	Stool	female	8	1006123	TwinsUK gut microbiome	DZ	TwinsUK Fecal Sample
2014.Plate16.24	GATCTAATCGAG	GTGCCAGCMGCCGCGGTAA	7.997	Cornell	UK_Twins	Cornell	fecal samples from TwinsUK MiSeq runs	TwinsUK Miseq	Jess	MiSeq	This analysis was done as in Caporaso et al 2011 Genome research. The PCR primers F515 and R806 were developed against the V4 region of the 16S rRNA, both bacteria and archaea, which we determined would yield optimal community clustering with reads of this length The reverse PCR primer is barcoded with a 12-base error-correcting Golay code to facilitate multiplexing of up to 1,500 samples per lane, and both PCR primers contain sequencer adapter regions.	GT	FWD:GTGCCAGCMGCCGCGGTAA; REV:GGACTACHVGGGTWTCTAAT	Plate16	Illumina	V4	Cornell	8/14/13	TwinsUKPlate16	0.1,gram	Kings College London	sequencing by synthesis	16S rRNA	V4	D2	67	years	0	3291	UBERON:feces	25.20928955	UBERON:feces	UBERON:feces	2/17/13	2013-02-17 09:00:00	9:00:00	GAZ:United Kingdom	7/21/45	0	true	10.4516	ENVO:dense settlement biome	ENVO:human-associated habitat	true	329	human	Homo sapiens	3291	9606	3291	51.5	-0.12	true	Cornell	true	false	King's College, London, UK	Stool	female	8	1006086	TwinsUK gut microbiome	MZ	TwinsUK Fecal Sample
2014.Plate16.23	GCATGCATCCCA	GTGCCAGCMGCCGCGGTAA	6.838	Cornell	UK_Twins	Cornell	fecal samples from TwinsUK MiSeq runs	TwinsUK Miseq	Jess	MiSeq	This analysis was done as in Caporaso et al 2011 Genome research. The PCR primers F515 and R806 were developed against the V4 region of the 16S rRNA, both bacteria and archaea, which we determined would yield optimal community clustering with reads of this length The reverse PCR primer is barcoded with a 12-base error-correcting Golay code to facilitate multiplexing of up to 1,500 samples per lane, and both PCR primers contain sequencer adapter regions.	GT	FWD:GTGCCAGCMGCCGCGGTAA; REV:GGACTACHVGGGTWTCTAAT	Plate16	Illumina	V4	Cornell	8/14/13	TwinsUKPlate16	0.1,gram	Kings College London	sequencing by synthesis	16S rRNA	V4	D1	74	years	0	8171	UBERON:feces	22.55501938	UBERON:feces	UBERON:feces	3/4/13	2013-03-04 07:45:00	7:45:00	GAZ:United Kingdom	12/27/38	0	true	10.4516	ENVO:dense settlement biome	ENVO:human-associated habitat	true	817	human	Homo sapiens	8171	9606	8171	51.5	-0.12	true	Cornell	true	false	King's College, London, UK	Stool	female	8	1006091	TwinsUK gut microbiome	DZ	TwinsUK Fecal Sample
2014.Plate16.22	ATCGGGCTTAAC	GTGCCAGCMGCCGCGGTAA	11.539	Cornell	UK_Twins	Cornell	fecal samples from TwinsUK MiSeq runs	TwinsUK Miseq	Jess	MiSeq	This analysis was done as in Caporaso et al 2011 Genome research. The PCR primers F515 and R806 were developed against the V4 region of the 16S rRNA, both bacteria and archaea, which we determined would yield optimal community clustering with reads of this length The reverse PCR primer is barcoded with a 12-base error-correcting Golay code to facilitate multiplexing of up to 1,500 samples per lane, and both PCR primers contain sequencer adapter regions.	GT	FWD:GTGCCAGCMGCCGCGGTAA; REV:GGACTACHVGGGTWTCTAAT	Plate16	Illumina	V4	Cornell	8/14/13	TwinsUKPlate16	0.1,gram	Kings College London	sequencing by synthesis	16S rRNA	V4	C8	58	years	0	2802	UBERON:feces	24.46443939	UBERON:feces	UBERON:feces	2/10/13	2013-02-10 00:00:00		GAZ:United Kingdom	7/23/54	0	true	10.4516	ENVO:dense settlement biome	ENVO:human-associated habitat	true	280	human	Homo sapiens	2802	9606	2802	51.5	-0.12	true	Cornell	true	false	King's College, London, UK	Stool	female	8	1006072	TwinsUK gut microbiome	MZ	TwinsUK Fecal Sample
2014.Plate16.21	GAAACTCCTAGA	GTGCCAGCMGCCGCGGTAA	4.266	Cornell	UK_Twins	Cornell	fecal samples from TwinsUK MiSeq runs	TwinsUK Miseq	Jess	MiSeq	This analysis was done as in Caporaso et al 2011 Genome research. The PCR primers F515 and R806 were developed against the V4 region of the 16S rRNA, both bacteria and archaea, which we determined would yield optimal community clustering with reads of this length The reverse PCR primer is barcoded with a 12-base error-correcting Golay code to facilitate multiplexing of up to 1,500 samples per lane, and both PCR primers contain sequencer adapter regions.	GT	FWD:GTGCCAGCMGCCGCGGTAA; REV:GGACTACHVGGGTWTCTAAT	Plate16	Illumina	V4	Cornell	8/14/13	TwinsUKPlate16	0.1,gram	Kings College London	sequencing by synthesis	16S rRNA	V4	C7	63	years	0	372	UBERON:feces		UBERON:feces	UBERON:feces	3/1/13	2013-03-01 09:10:00	9:10:00	GAZ:United Kingdom	7/22/49	0	true	10.4516	ENVO:dense settlement biome	ENVO:human-associated habitat	true	37	human	Homo sapiens	372	9606	372	51.5	-0.12	true	Cornell	true	false	King's College, London, UK	Stool	male	8	1006083	TwinsUK gut microbiome	DZ	TwinsUK Fecal Sample
2014.Plate16.20	GCGTAGAGAGAC	GTGCCAGCMGCCGCGGTAA	4.774	Cornell	UK_Twins	Cornell	fecal samples from TwinsUK MiSeq runs	TwinsUK Miseq	Jess	MiSeq	This analysis was done as in Caporaso et al 2011 Genome research. The PCR primers F515 and R806 were developed against the V4 region of the 16S rRNA, both bacteria and archaea, which we determined would yield optimal community clustering with reads of this length The reverse PCR primer is barcoded with a 12-base error-correcting Golay code to facilitate multiplexing of up to 1,500 samples per lane, and both PCR primers contain sequencer adapter regions.	GT	FWD:GTGCCAGCMGCCGCGGTAA; REV:GGACTACHVGGGTWTCTAAT	Plate16	Illumina	V4	Cornell	8/14/13	TwinsUKPlate16	0.1,gram	Kings College London	sequencing by synthesis	16S rRNA	V4	C6	62	years	0	3142	UBERON:feces	22.01108932	UBERON:feces	UBERON:feces	2/13/13	2013-02-13 07:00:00	7:00:00	GAZ:United Kingdom	5/3/50	0	true	10.4516	ENVO:dense settlement biome	ENVO:human-associated habitat	true	314	human	Homo sapiens	3142	9606	3142	51.5	-0.12	true	Cornell	true	false	King's College, London, UK	Stool	female	8	1006095	TwinsUK gut microbiome	MZ	TwinsUK Fecal Sample
2014.Plate16.19	TCCAGGGCTATA	GTGCCAGCMGCCGCGGTAA	5.363	Cornell	UK_Twins	Cornell	fecal samples from TwinsUK MiSeq runs	TwinsUK Miseq	Jess	MiSeq	This analysis was done as in Caporaso et al 2011 Genome research. The PCR primers F515 and R806 were developed against the V4 region of the 16S rRNA, both bacteria and archaea, which we determined would yield optimal community clustering with reads of this length The reverse PCR primer is barcoded with a 12-base error-correcting Golay code to facilitate multiplexing of up to 1,500 samples per lane, and both PCR primers contain sequencer adapter regions.	GT	FWD:GTGCCAGCMGCCGCGGTAA; REV:GGACTACHVGGGTWTCTAAT	Plate16	Illumina	V4	Cornell	8/14/13	TwinsUKPlate16	0.1,gram	Kings College London	sequencing by synthesis	16S rRNA	V4	C5	57	years	0	1981	UBERON:feces	31.88344955	UBERON:feces	UBERON:feces	2/10/13	2013-02-10 08:00:00	8:00:00	GAZ:United Kingdom	9/27/55	0	true	10.4516	ENVO:dense settlement biome	ENVO:human-associated habitat	true	198	human	Homo sapiens	1981	9606	1981	51.5	-0.12	true	Cornell	true	false	King's College, London, UK	Stool	female	8	1006077	TwinsUK gut microbiome	DZ	TwinsUK Fecal Sample
2014.Plate16.18	TTGGACGTCCAC	GTGCCAGCMGCCGCGGTAA	5.716	Cornell	UK_Twins	Cornell	fecal samples from TwinsUK MiSeq runs	TwinsUK Miseq	Jess	MiSeq	This analysis was done as in Caporaso et al 2011 Genome research. The PCR primers F515 and R806 were developed against the V4 region of the 16S rRNA, both bacteria and archaea, which we determined would yield optimal community clustering with reads of this length The reverse PCR primer is barcoded with a 12-base error-correcting Golay code to facilitate multiplexing of up to 1,500 samples per lane, and both PCR primers contain sequencer adapter regions.	GT	FWD:GTGCCAGCMGCCGCGGTAA; REV:GGACTACHVGGGTWTCTAAT	Plate16	Illumina	V4	Cornell	8/14/13	TwinsUKPlate16	0.1,gram	Kings College London	sequencing by synthesis	16S rRNA	V4	C4	58	years	0	2601	UBERON:feces	27.01635933	UBERON:feces	UBERON:feces	2/18/13	2013-02-18 04:40:00	4:40:00	GAZ:United Kingdom	4/21/54	0	true	10.4516	ENVO:dense settlement biome	ENVO:human-associated habitat	true	260	human	Homo sapiens	2601	9606	2601	51.5	-0.12	true	Cornell	true	false	King's College, London, UK	Stool	female	8	1006101	TwinsUK gut microbiome	MZ	TwinsUK Fecal Sample
2014.Plate16.16	TCCGCAACCTGA	GTGCCAGCMGCCGCGGTAA	18.494	Cornell	UK_Twins	Cornell	fecal samples from TwinsUK MiSeq runs	TwinsUK Miseq	Jess	MiSeq	This analysis was done as in Caporaso et al 2011 Genome research. The PCR primers F515 and R806 were developed against the V4 region of the 16S rRNA, both bacteria and archaea, which we determined would yield optimal community clustering with reads of this length The reverse PCR primer is barcoded with a 12-base error-correcting Golay code to facilitate multiplexing of up to 1,500 samples per lane, and both PCR primers contain sequencer adapter regions.	GT	FWD:GTGCCAGCMGCCGCGGTAA; REV:GGACTACHVGGGTWTCTAAT	Plate16	Illumina	V4	Cornell	8/14/13	TwinsUKPlate16	0.1,gram	Kings College London	sequencing by synthesis	16S rRNA	V4	C1	59	years	0	2491	UBERON:feces	30.5010891	UBERON:feces	UBERON:feces	2/21/13	2013-02-21 06:00:00	6:00:00	GAZ:United Kingdom	12/1/53	0	true	10.4516	ENVO:dense settlement biome	ENVO:human-associated habitat	true	249	human	Homo sapiens	2491	9606	2491	51.5	-0.12	true	Cornell	true	false	King's College, London, UK	Stool	female	8	1006109	TwinsUK gut microbiome	MZ	TwinsUK Fecal Sample
2014.Plate16.11	ATCGATCCACAG	GTGCCAGCMGCCGCGGTAA	9.622	Cornell	UK_Twins	Cornell	fecal samples from TwinsUK MiSeq runs	TwinsUK Miseq	Jess	MiSeq	This analysis was done as in Caporaso et al 2011 Genome research. The PCR primers F515 and R806 were developed against the V4 region of the 16S rRNA, both bacteria and archaea, which we determined would yield optimal community clustering with reads of this length The reverse PCR primer is barcoded with a 12-base error-correcting Golay code to facilitate multiplexing of up to 1,500 samples per lane, and both PCR primers contain sequencer adapter regions.	GT	FWD:GTGCCAGCMGCCGCGGTAA; REV:GGACTACHVGGGTWTCTAAT	Plate16	Illumina	V4	Cornell	8/14/13	TwinsUKPlate16	0.1,gram	Kings College London	sequencing by synthesis	16S rRNA	V4	B4	57	years	0	1982	UBERON:feces	21.88368034	UBERON:feces	UBERON:feces	2/9/13	2013-02-09 22:30:00	22:30:00	GAZ:United Kingdom	9/27/55	0	true	10.4516	ENVO:dense settlement biome	ENVO:human-associated habitat	true	198	human	Homo sapiens	1982	9606	1982	51.5	-0.12	true	Cornell	true	false	King's College, London, UK	Stool	female	8	1006076	TwinsUK gut microbiome	DZ	TwinsUK Fecal Sample
2014.Plate16.10	GGAAGAAGTAGC	GTGCCAGCMGCCGCGGTAA	5.476	Cornell	UK_Twins	Cornell	fecal samples from TwinsUK MiSeq runs	TwinsUK Miseq	Jess	MiSeq	This analysis was done as in Caporaso et al 2011 Genome research. The PCR primers F515 and R806 were developed against the V4 region of the 16S rRNA, both bacteria and archaea, which we determined would yield optimal community clustering with reads of this length The reverse PCR primer is barcoded with a 12-base error-correcting Golay code to facilitate multiplexing of up to 1,500 samples per lane, and both PCR primers contain sequencer adapter regions.	GT	FWD:GTGCCAGCMGCCGCGGTAA; REV:GGACTACHVGGGTWTCTAAT	Plate16	Illumina	V4	Cornell	8/14/13	TwinsUKPlate16	0.1,gram	Kings College London	sequencing by synthesis	16S rRNA	V4	B3	59	years	0	5011	UBERON:feces	29.12896919	UBERON:feces	UBERON:feces	1/10/13	2013-01-10 08:00:00	8:00:00	GAZ:United Kingdom	2/1/53	0	true	10.4516	ENVO:dense settlement biome	ENVO:human-associated habitat	true	501	human	Homo sapiens	5011	9606	5011	51.5	-0.12	true	Cornell	true	false	King's College, London, UK	Stool	female	8	1005955	TwinsUK gut microbiome	MZ	TwinsUK Fecal Sample
2014.Plate16.1	ACGTAACCACGT	GTGCCAGCMGCCGCGGTAA	6.741	Cornell	UK_Twins	Cornell	fecal samples from TwinsUK MiSeq runs	TwinsUK Miseq	Jess	MiSeq	This analysis was done as in Caporaso et al 2011 Genome research. The PCR primers F515 and R806 were developed against the V4 region of the 16S rRNA, both bacteria and archaea, which we determined would yield optimal community clustering with reads of this length The reverse PCR primer is barcoded with a 12-base error-correcting Golay code to facilitate multiplexing of up to 1,500 samples per lane, and both PCR primers contain sequencer adapter regions.	GT	FWD:GTGCCAGCMGCCGCGGTAA; REV:GGACTACHVGGGTWTCTAAT	Plate16	Illumina	V4	Cornell	8/14/13	TwinsUKPlate16	0.1,gram	Kings College London	sequencing by synthesis	16S rRNA	V4	A1	70	years	0	2311	UBERON:feces	26.21756935	UBERON:feces	UBERON:feces	2/11/13	2013-02-11 10:20:00	10:20:00	GAZ:United Kingdom	6/23/42	0	true	10.4516	ENVO:dense settlement biome	ENVO:human-associated habitat	true	231	human	Homo sapiens	2311	9606	2311	51.5	-0.12	true	Cornell	true	false	King's College, London, UK	Stool	male	8	1006074	TwinsUK gut microbiome	DZ	TwinsUK Fecal Sample
2014.Plate15.96	CGTGGGCTCATT	GTGCCAGCMGCCGCGGTAA	8.172	Cornell	UK_Twins	Cornell	fecal samples from TwinsUK MiSeq runs	TwinsUK Miseq	Jess	MiSeq	This analysis was done as in Caporaso et al 2011 Genome research. The PCR primers F515 and R806 were developed against the V4 region of the 16S rRNA, both bacteria and archaea, which we determined would yield optimal community clustering with reads of this length The reverse PCR primer is barcoded with a 12-base error-correcting Golay code to facilitate multiplexing of up to 1,500 samples per lane, and both PCR primers contain sequencer adapter regions.	GT	FWD:GTGCCAGCMGCCGCGGTAA; REV:GGACTACHVGGGTWTCTAAT	Plate15	Illumina	V4	Cornell	4/3/13	TwinsUKPlate15	0.1,gram	Kings College London	sequencing by synthesis	16S rRNA	V4	H12	67	years	0	3181	UBERON:feces	22.12824059	UBERON:feces	UBERON:feces	2/6/13	2013-02-06 09:45:00	9:45:00	GAZ:United Kingdom	1/22/46	0	true	10.4516	ENVO:dense settlement biome	ENVO:human-associated habitat	true	318	human	Homo sapiens	3181	9606	3181	51.5	-0.12	true	Cornell	true	false	King's College, London, UK	Stool	female	8	1006061	TwinsUK gut microbiome	MZ	TwinsUK Fecal Sample
2014.Plate15.95	GACTTATGCCCG	GTGCCAGCMGCCGCGGTAA	16.668	Cornell	UK_Twins	Cornell	fecal samples from TwinsUK MiSeq runs	TwinsUK Miseq	Jess	MiSeq	This analysis was done as in Caporaso et al 2011 Genome research. The PCR primers F515 and R806 were developed against the V4 region of the 16S rRNA, both bacteria and archaea, which we determined would yield optimal community clustering with reads of this length The reverse PCR primer is barcoded with a 12-base error-correcting Golay code to facilitate multiplexing of up to 1,500 samples per lane, and both PCR primers contain sequencer adapter regions.	GT	FWD:GTGCCAGCMGCCGCGGTAA; REV:GGACTACHVGGGTWTCTAAT	Plate15	Illumina	V4	Cornell	4/3/13	TwinsUKPlate15	0.1,gram	Kings College London	sequencing by synthesis	16S rRNA	V4	G12	56	years	0	3711	UBERON:feces	26.56434059	UBERON:feces	UBERON:feces	1/24/13	2013-01-24 19:05:00	19:05:00	GAZ:United Kingdom	5/8/56	0	true	10.4516	ENVO:dense settlement biome	ENVO:human-associated habitat	true	371	human	Homo sapiens	3711	9606	3711	51.5	-0.12	true	Cornell	true	false	King's College, London, UK	Stool	female	8	1006009	TwinsUK gut microbiome	MZ	TwinsUK Fecal Sample
2014.Plate15.94	TGTCAGCTGTCG	GTGCCAGCMGCCGCGGTAA	8.172	Cornell	UK_Twins	Cornell	fecal samples from TwinsUK MiSeq runs	TwinsUK Miseq	Jess	MiSeq	This analysis was done as in Caporaso et al 2011 Genome research. The PCR primers F515 and R806 were developed against the V4 region of the 16S rRNA, both bacteria and archaea, which we determined would yield optimal community clustering with reads of this length The reverse PCR primer is barcoded with a 12-base error-correcting Golay code to facilitate multiplexing of up to 1,500 samples per lane, and both PCR primers contain sequencer adapter regions.	GT	FWD:GTGCCAGCMGCCGCGGTAA; REV:GGACTACHVGGGTWTCTAAT	Plate15	Illumina	V4	Cornell	4/3/13	TwinsUKPlate15	0.1,gram	Kings College London	sequencing by synthesis	16S rRNA	V4	F12	66	years	0	2591	UBERON:feces	20.83470917	UBERON:feces	UBERON:feces	1/24/13	2013-01-24 08:30:00	8:30:00	GAZ:United Kingdom	11/20/46	0	true	10.4516	ENVO:dense settlement biome	ENVO:human-associated habitat	true	259	human	Homo sapiens	2591	9606	2591	51.5	-0.12	true	Cornell	true	false	King's College, London, UK	Stool	female	8	1006002	TwinsUK gut microbiome	MZ	TwinsUK Fecal Sample
2014.Plate15.93	GCCTCGTACTGA	GTGCCAGCMGCCGCGGTAA	12.326	Cornell	UK_Twins	Cornell	fecal samples from TwinsUK MiSeq runs	TwinsUK Miseq	Jess	MiSeq	This analysis was done as in Caporaso et al 2011 Genome research. The PCR primers F515 and R806 were developed against the V4 region of the 16S rRNA, both bacteria and archaea, which we determined would yield optimal community clustering with reads of this length The reverse PCR primer is barcoded with a 12-base error-correcting Golay code to facilitate multiplexing of up to 1,500 samples per lane, and both PCR primers contain sequencer adapter regions.	GT	FWD:GTGCCAGCMGCCGCGGTAA; REV:GGACTACHVGGGTWTCTAAT	Plate15	Illumina	V4	Cornell	4/3/13	TwinsUKPlate15	0.1,gram	Kings College London	sequencing by synthesis	16S rRNA	V4	E12	46	years	0	382	UBERON:feces	23.90756035	UBERON:feces	UBERON:feces	1/23/13	2013-01-23 22:15:00	22:15:00	GAZ:United Kingdom	10/8/66	0	true	10.4516	ENVO:dense settlement biome	ENVO:human-associated habitat	true	38	human	Homo sapiens	382	9606	382	51.5	-0.12	true	Cornell	true	false	King's College, London, UK	Stool	male	8	1005958	TwinsUK gut microbiome	DZ	TwinsUK Fecal Sample
2014.Plate15.91	CACCTGTAGTAG	GTGCCAGCMGCCGCGGTAA	16.102	Cornell	UK_Twins	Cornell	fecal samples from TwinsUK MiSeq runs	TwinsUK Miseq	Jess	MiSeq	This analysis was done as in Caporaso et al 2011 Genome research. The PCR primers F515 and R806 were developed against the V4 region of the 16S rRNA, both bacteria and archaea, which we determined would yield optimal community clustering with reads of this length The reverse PCR primer is barcoded with a 12-base error-correcting Golay code to facilitate multiplexing of up to 1,500 samples per lane, and both PCR primers contain sequencer adapter regions.	GT	FWD:GTGCCAGCMGCCGCGGTAA; REV:GGACTACHVGGGTWTCTAAT	Plate15	Illumina	V4	Cornell	4/3/13	TwinsUKPlate15	0.1,gram	Kings College London	sequencing by synthesis	16S rRNA	V4	C12	66	years	0	881	UBERON:feces		UBERON:feces	UBERON:feces	1/28/13	2013-01-28 08:30:00	8:30:00	GAZ:United Kingdom	10/15/46	0	true	10.4516	ENVO:dense settlement biome	ENVO:human-associated habitat	true	88	human	Homo sapiens	881	9606	881	51.5	-0.12	true	Cornell	true	false	King's College, London, UK	Stool	female	8	1006010	TwinsUK gut microbiome	DZ	TwinsUK Fecal Sample
2014.Plate15.9	GTCGGAAATTGT	GTGCCAGCMGCCGCGGTAA	22.71	Cornell	UK_Twins	Cornell	fecal samples from TwinsUK MiSeq runs	TwinsUK Miseq	Jess	MiSeq	This analysis was done as in Caporaso et al 2011 Genome research. The PCR primers F515 and R806 were developed against the V4 region of the 16S rRNA, both bacteria and archaea, which we determined would yield optimal community clustering with reads of this length The reverse PCR primer is barcoded with a 12-base error-correcting Golay code to facilitate multiplexing of up to 1,500 samples per lane, and both PCR primers contain sequencer adapter regions.	GT	FWD:GTGCCAGCMGCCGCGGTAA; REV:GGACTACHVGGGTWTCTAAT	Plate15	Illumina	V4	Cornell	4/3/13	TwinsUKPlate15	0.1,gram	Kings College London	sequencing by synthesis	16S rRNA	V4	A2	42	years	0	2522	UBERON:feces		UBERON:feces	UBERON:feces	11/25/12	2012-11-25 00:00:00		GAZ:United Kingdom	12/4/69	0	true	10.4516	ENVO:dense settlement biome	ENVO:human-associated habitat	true	252	human	Homo sapiens	2522	9606	2522	51.5	-0.12	true	Cornell	true	false	King's College, London, UK	Stool	female	7	1003181	TwinsUK gut microbiome	MZ	TwinsUK Fecal Sample
2014.Plate15.89	TAAACGCGACTC	GTGCCAGCMGCCGCGGTAA	11.193	Cornell	UK_Twins	Cornell	fecal samples from TwinsUK MiSeq runs	TwinsUK Miseq	Jess	MiSeq	This analysis was done as in Caporaso et al 2011 Genome research. The PCR primers F515 and R806 were developed against the V4 region of the 16S rRNA, both bacteria and archaea, which we determined would yield optimal community clustering with reads of this length The reverse PCR primer is barcoded with a 12-base error-correcting Golay code to facilitate multiplexing of up to 1,500 samples per lane, and both PCR primers contain sequencer adapter regions.	GT	FWD:GTGCCAGCMGCCGCGGTAA; REV:GGACTACHVGGGTWTCTAAT	Plate15	Illumina	V4	Cornell	4/3/13	TwinsUKPlate15	0.1,gram	Kings College London	sequencing by synthesis	16S rRNA	V4	A12	42	years	0	2382	UBERON:feces	31.65343094	UBERON:feces	UBERON:feces	1/24/13	2013-01-24 13:10:00	13:10:00	GAZ:United Kingdom	4/14/70	0	true	10.4516	ENVO:dense settlement biome	ENVO:human-associated habitat	true	238	human	Homo sapiens	2382	9606	2382	51.5	-0.12	true	Cornell	true	false	King's College, London, UK	Stool	male	8	1006005	TwinsUK gut microbiome	DZ	TwinsUK Fecal Sample
2014.Plate15.88	GTGAGGGCAAGT	GTGCCAGCMGCCGCGGTAA	6.473	Cornell	UK_Twins	Cornell	fecal samples from TwinsUK MiSeq runs	TwinsUK Miseq	Jess	MiSeq	This analysis was done as in Caporaso et al 2011 Genome research. The PCR primers F515 and R806 were developed against the V4 region of the 16S rRNA, both bacteria and archaea, which we determined would yield optimal community clustering with reads of this length The reverse PCR primer is barcoded with a 12-base error-correcting Golay code to facilitate multiplexing of up to 1,500 samples per lane, and both PCR primers contain sequencer adapter regions.	GT	FWD:GTGCCAGCMGCCGCGGTAA; REV:GGACTACHVGGGTWTCTAAT	Plate15	Illumina	V4	Cornell	4/3/13	TwinsUKPlate15	0.1,gram	Kings College London	sequencing by synthesis	16S rRNA	V4	H11	58	years	0	2702	UBERON:feces	23.86718941	UBERON:feces	UBERON:feces	2/1/13	2013-02-01 08:15:00	8:15:00	GAZ:United Kingdom	9/21/54	0	true	10.4516	ENVO:dense settlement biome	ENVO:human-associated habitat	true	270	human	Homo sapiens	2702	9606	2702	51.5	-0.12	true	Cornell	true	false	King's College, London, UK	Stool	female	8	1006052	TwinsUK gut microbiome	MZ	TwinsUK Fecal Sample
2014.Plate15.87	CAAGCGTTGTCC	GTGCCAGCMGCCGCGGTAA	10.626	Cornell	UK_Twins	Cornell	fecal samples from TwinsUK MiSeq runs	TwinsUK Miseq	Jess	MiSeq	This analysis was done as in Caporaso et al 2011 Genome research. The PCR primers F515 and R806 were developed against the V4 region of the 16S rRNA, both bacteria and archaea, which we determined would yield optimal community clustering with reads of this length The reverse PCR primer is barcoded with a 12-base error-correcting Golay code to facilitate multiplexing of up to 1,500 samples per lane, and both PCR primers contain sequencer adapter regions.	GT	FWD:GTGCCAGCMGCCGCGGTAA; REV:GGACTACHVGGGTWTCTAAT	Plate15	Illumina	V4	Cornell	4/3/13	TwinsUKPlate15	0.1,gram	Kings College London	sequencing by synthesis	16S rRNA	V4	G11	49	years	0	4641	UBERON:feces	24.85847092	UBERON:feces	UBERON:feces	1/19/13	2013-01-19 11:15:00	11:15:00	GAZ:United Kingdom	2/22/63	0	true	10.4516	ENVO:dense settlement biome	ENVO:human-associated habitat	true	464	human	Homo sapiens	4641	9606	4641	51.5	-0.12	true	Cornell	true	false	King's College, London, UK	Stool	female	8	1006001	TwinsUK gut microbiome	DZ	TwinsUK Fecal Sample
2014.Plate15.84	ATAAAGAGGAGG	GTGCCAGCMGCCGCGGTAA	12.892	Cornell	UK_Twins	Cornell	fecal samples from TwinsUK MiSeq runs	TwinsUK Miseq	Jess	MiSeq	This analysis was done as in Caporaso et al 2011 Genome research. The PCR primers F515 and R806 were developed against the V4 region of the 16S rRNA, both bacteria and archaea, which we determined would yield optimal community clustering with reads of this length The reverse PCR primer is barcoded with a 12-base error-correcting Golay code to facilitate multiplexing of up to 1,500 samples per lane, and both PCR primers contain sequencer adapter regions.	GT	FWD:GTGCCAGCMGCCGCGGTAA; REV:GGACTACHVGGGTWTCTAAT	Plate15	Illumina	V4	Cornell	4/3/13	TwinsUKPlate15	0.1,gram	Kings College London	sequencing by synthesis	16S rRNA	V4	D11	66	years	0	3202	UBERON:feces	19.09985924	UBERON:feces	UBERON:feces	1/23/13	2013-01-23 07:45:00	7:45:00	GAZ:United Kingdom	2/25/46	0	true	10.4516	ENVO:dense settlement biome	ENVO:human-associated habitat	true	320	human	Homo sapiens	3202	9606	3202	51.5	-0.12	true	Cornell	true	false	King's College, London, UK	Stool	female	8	1005982	TwinsUK gut microbiome	MZ	TwinsUK Fecal Sample
2014.Plate15.83	ACTCATCTTCCA	GTGCCAGCMGCCGCGGTAA	12.703	Cornell	UK_Twins	Cornell	fecal samples from TwinsUK MiSeq runs	TwinsUK Miseq	Jess	MiSeq	This analysis was done as in Caporaso et al 2011 Genome research. The PCR primers F515 and R806 were developed against the V4 region of the 16S rRNA, both bacteria and archaea, which we determined would yield optimal community clustering with reads of this length The reverse PCR primer is barcoded with a 12-base error-correcting Golay code to facilitate multiplexing of up to 1,500 samples per lane, and both PCR primers contain sequencer adapter regions.	GT	FWD:GTGCCAGCMGCCGCGGTAA; REV:GGACTACHVGGGTWTCTAAT	Plate15	Illumina	V4	Cornell	4/3/13	TwinsUKPlate15	0.1,gram	Kings College London	sequencing by synthesis	16S rRNA	V4	C11	63	years	0	1712	UBERON:feces	23.89118004	UBERON:feces	UBERON:feces	2/3/13	2013-02-03 09:30:00	9:30:00	GAZ:United Kingdom	3/28/49	0	true	10.4516	ENVO:dense settlement biome	ENVO:human-associated habitat	true	171	human	Homo sapiens	1712	9606	1712	51.5	-0.12	true	Cornell	true	false	King's College, London, UK	Stool	female	8	1006054	TwinsUK gut microbiome	DZ	TwinsUK Fecal Sample
2014.Plate15.81	TGGAGAGGAGAT	GTGCCAGCMGCCGCGGTAA	14.969	Cornell	UK_Twins	Cornell	fecal samples from TwinsUK MiSeq runs	TwinsUK Miseq	Jess	MiSeq	This analysis was done as in Caporaso et al 2011 Genome research. The PCR primers F515 and R806 were developed against the V4 region of the 16S rRNA, both bacteria and archaea, which we determined would yield optimal community clustering with reads of this length The reverse PCR primer is barcoded with a 12-base error-correcting Golay code to facilitate multiplexing of up to 1,500 samples per lane, and both PCR primers contain sequencer adapter regions.	GT	FWD:GTGCCAGCMGCCGCGGTAA; REV:GGACTACHVGGGTWTCTAAT	Plate15	Illumina	V4	Cornell	4/3/13	TwinsUKPlate15	0.1,gram	Kings College London	sequencing by synthesis	16S rRNA	V4	A11	62	years	0	3152	UBERON:feces	25.74529076	UBERON:feces	UBERON:feces	1/25/13	2013-01-25 07:55:00	7:55:00	GAZ:United Kingdom	1/17/51	0	true	10.4516	ENVO:dense settlement biome	ENVO:human-associated habitat	true	315	human	Homo sapiens	3152	9606	3152	51.5	-0.12	true	Cornell	true	false	King's College, London, UK	Stool	female	8	1006007	TwinsUK gut microbiome	DZ	TwinsUK Fecal Sample
2014.Plate15.80	AATCAACTAGGC	GTGCCAGCMGCCGCGGTAA	11.004	Cornell	UK_Twins	Cornell	fecal samples from TwinsUK MiSeq runs	TwinsUK Miseq	Jess	MiSeq	This analysis was done as in Caporaso et al 2011 Genome research. The PCR primers F515 and R806 were developed against the V4 region of the 16S rRNA, both bacteria and archaea, which we determined would yield optimal community clustering with reads of this length The reverse PCR primer is barcoded with a 12-base error-correcting Golay code to facilitate multiplexing of up to 1,500 samples per lane, and both PCR primers contain sequencer adapter regions.	GT	FWD:GTGCCAGCMGCCGCGGTAA; REV:GGACTACHVGGGTWTCTAAT	Plate15	Illumina	V4	Cornell	4/3/13	TwinsUKPlate15	0.1,gram	Kings College London	sequencing by synthesis	16S rRNA	V4	H10	66	years	0	3201	UBERON:feces	19.20627975	UBERON:feces	UBERON:feces	1/23/13	2013-01-23 08:45:00	8:45:00	GAZ:United Kingdom	2/25/46	0	true	10.4516	ENVO:dense settlement biome	ENVO:human-associated habitat	true	320	human	Homo sapiens	3201	9606	3201	51.5	-0.12	true	Cornell	true	false	King's College, London, UK	Stool	female	8	1005984	TwinsUK gut microbiome	MZ	TwinsUK Fecal Sample
2014.Plate15.8	GTGACGTTAGTC	GTGCCAGCMGCCGCGGTAA	19.502	Cornell	UK_Twins	Cornell	fecal samples from TwinsUK MiSeq runs	TwinsUK Miseq	Jess	MiSeq	This analysis was done as in Caporaso et al 2011 Genome research. The PCR primers F515 and R806 were developed against the V4 region of the 16S rRNA, both bacteria and archaea, which we determined would yield optimal community clustering with reads of this length The reverse PCR primer is barcoded with a 12-base error-correcting Golay code to facilitate multiplexing of up to 1,500 samples per lane, and both PCR primers contain sequencer adapter regions.	GT	FWD:GTGCCAGCMGCCGCGGTAA; REV:GGACTACHVGGGTWTCTAAT	Plate15	Illumina	V4	Cornell	4/3/13	TwinsUKPlate15	0.1,gram	Kings College London	sequencing by synthesis	16S rRNA	V4	H1	60	years	0	6112	UBERON:feces	24.34841919	UBERON:feces	UBERON:feces	1/6/13	2013-01-06 00:00:00		GAZ:United Kingdom	7/18/52	0	true	10.4516	ENVO:dense settlement biome	ENVO:human-associated habitat	true	611	human	Homo sapiens	6112	9606	6112	51.5	-0.12	true	Cornell	true	false	King's College, London, UK	Stool	female	7	1003293	TwinsUK gut microbiome	DZ	TwinsUK Fecal Sample
2014.Plate15.79	CGTCGTCTAAGA	GTGCCAGCMGCCGCGGTAA	8.55	Cornell	UK_Twins	Cornell	fecal samples from TwinsUK MiSeq runs	TwinsUK Miseq	Jess	MiSeq	This analysis was done as in Caporaso et al 2011 Genome research. The PCR primers F515 and R806 were developed against the V4 region of the 16S rRNA, both bacteria and archaea, which we determined would yield optimal community clustering with reads of this length The reverse PCR primer is barcoded with a 12-base error-correcting Golay code to facilitate multiplexing of up to 1,500 samples per lane, and both PCR primers contain sequencer adapter regions.	GT	FWD:GTGCCAGCMGCCGCGGTAA; REV:GGACTACHVGGGTWTCTAAT	Plate15	Illumina	V4	Cornell	4/3/13	TwinsUKPlate15	0.1,gram	Kings College London	sequencing by synthesis	16S rRNA	V4	G10	76	years	0	1122	UBERON:feces	37.35206985	UBERON:feces	UBERON:feces	1/6/13	2013-01-06 12:45:00	12:45:00	GAZ:United Kingdom	6/15/36	0	true	10.4516	ENVO:dense settlement biome	ENVO:human-associated habitat	true	112	human	Homo sapiens	1122	9606	1122	51.5	-0.12	true	Cornell	true	false	King's College, London, UK	Stool	female	8	1006063	TwinsUK gut microbiome	MZ	TwinsUK Fecal Sample
2014.Plate15.77	CAGGATTCGTAC	GTGCCAGCMGCCGCGGTAA	12.514	Cornell	UK_Twins	Cornell	fecal samples from TwinsUK MiSeq runs	TwinsUK Miseq	Jess	MiSeq	This analysis was done as in Caporaso et al 2011 Genome research. The PCR primers F515 and R806 were developed against the V4 region of the 16S rRNA, both bacteria and archaea, which we determined would yield optimal community clustering with reads of this length The reverse PCR primer is barcoded with a 12-base error-correcting Golay code to facilitate multiplexing of up to 1,500 samples per lane, and both PCR primers contain sequencer adapter regions.	GT	FWD:GTGCCAGCMGCCGCGGTAA; REV:GGACTACHVGGGTWTCTAAT	Plate15	Illumina	V4	Cornell	4/3/13	TwinsUKPlate15	0.1,gram	Kings College London	sequencing by synthesis	16S rRNA	V4	E10	32	years	0	292	UBERON:feces		UBERON:feces	UBERON:feces	1/24/13	2013-01-24 10:00:00	10:00:00	GAZ:United Kingdom	5/17/80	0	true	10.4516	ENVO:dense settlement biome	ENVO:human-associated habitat	true	29	human	Homo sapiens	292	9606	292	51.5	-0.12	true	Cornell	true	false	King's College, London, UK	Stool	male	8	1006003	TwinsUK gut microbiome	DZ	TwinsUK Fecal Sample
2014.Plate15.75	AAGATCGTACTG	GTGCCAGCMGCCGCGGTAA	13.836	Cornell	UK_Twins	Cornell	fecal samples from TwinsUK MiSeq runs	TwinsUK Miseq	Jess	MiSeq	This analysis was done as in Caporaso et al 2011 Genome research. The PCR primers F515 and R806 were developed against the V4 region of the 16S rRNA, both bacteria and archaea, which we determined would yield optimal community clustering with reads of this length The reverse PCR primer is barcoded with a 12-base error-correcting Golay code to facilitate multiplexing of up to 1,500 samples per lane, and both PCR primers contain sequencer adapter regions.	GT	FWD:GTGCCAGCMGCCGCGGTAA; REV:GGACTACHVGGGTWTCTAAT	Plate15	Illumina	V4	Cornell	4/3/13	TwinsUKPlate15	0.1,gram	Kings College London	sequencing by synthesis	16S rRNA	V4	C10	55	years	0	1342	UBERON:feces	19.9948597	UBERON:feces	UBERON:feces	1/11/13	2013-01-11 06:10:00	6:10:00	GAZ:United Kingdom	2/11/57	0	true	10.4516	ENVO:dense settlement biome	ENVO:human-associated habitat	true	134	human	Homo sapiens	1342	9606	1342	51.5	-0.12	true	Cornell	true	false	King's College, London, UK	Stool	female	8	1005959	TwinsUK gut microbiome	DZ	TwinsUK Fecal Sample
2014.Plate15.74	TCTCGATAAGCG	GTGCCAGCMGCCGCGGTAA	14.969	Cornell	UK_Twins	Cornell	fecal samples from TwinsUK MiSeq runs	TwinsUK Miseq	Jess	MiSeq	This analysis was done as in Caporaso et al 2011 Genome research. The PCR primers F515 and R806 were developed against the V4 region of the 16S rRNA, both bacteria and archaea, which we determined would yield optimal community clustering with reads of this length The reverse PCR primer is barcoded with a 12-base error-correcting Golay code to facilitate multiplexing of up to 1,500 samples per lane, and both PCR primers contain sequencer adapter regions.	GT	FWD:GTGCCAGCMGCCGCGGTAA; REV:GGACTACHVGGGTWTCTAAT	Plate15	Illumina	V4	Cornell	4/3/13	TwinsUKPlate15	0.1,gram	Kings College London	sequencing by synthesis	16S rRNA	V4	B10	67	years	0	1812	UBERON:feces	28.27313042	UBERON:feces	UBERON:feces	2/4/13	2013-02-04 23:07:00	23:07:00	GAZ:United Kingdom	4/30/45	0	true	10.4516	ENVO:dense settlement biome	ENVO:human-associated habitat	true	181	human	Homo sapiens	1812	9606	1812	51.5	-0.12	true	Cornell	true	false	King's College, London, UK	Stool	female	8	1005981	TwinsUK gut microbiome	MZ	TwinsUK Fecal Sample
2014.Plate15.73	GTAGTGTCAACA	GTGCCAGCMGCCGCGGTAA	16.291	Cornell	UK_Twins	Cornell	fecal samples from TwinsUK MiSeq runs	TwinsUK Miseq	Jess	MiSeq	This analysis was done as in Caporaso et al 2011 Genome research. The PCR primers F515 and R806 were developed against the V4 region of the 16S rRNA, both bacteria and archaea, which we determined would yield optimal community clustering with reads of this length The reverse PCR primer is barcoded with a 12-base error-correcting Golay code to facilitate multiplexing of up to 1,500 samples per lane, and both PCR primers contain sequencer adapter regions.	GT	FWD:GTGCCAGCMGCCGCGGTAA; REV:GGACTACHVGGGTWTCTAAT	Plate15	Illumina	V4	Cornell	4/3/13	TwinsUKPlate15	0.1,gram	Kings College London	sequencing by synthesis	16S rRNA	V4	A10	65	years	0	3642	UBERON:feces	24.51530075	UBERON:feces	UBERON:feces	1/14/13	2013-01-14 09:15:00	9:15:00	GAZ:United Kingdom	2/7/47	0	true	10.4516	ENVO:dense settlement biome	ENVO:human-associated habitat	true	364	human	Homo sapiens	3642	9606	3642	51.5	-0.12	true	Cornell	true	false	King's College, London, UK	Stool	female	8	1005962	TwinsUK gut microbiome	DZ	TwinsUK Fecal Sample
2014.Plate15.72	TGTACGGATAAC	GTGCCAGCMGCCGCGGTAA	17.046	Cornell	UK_Twins	Cornell	fecal samples from TwinsUK MiSeq runs	TwinsUK Miseq	Jess	MiSeq	This analysis was done as in Caporaso et al 2011 Genome research. The PCR primers F515 and R806 were developed against the V4 region of the 16S rRNA, both bacteria and archaea, which we determined would yield optimal community clustering with reads of this length The reverse PCR primer is barcoded with a 12-base error-correcting Golay code to facilitate multiplexing of up to 1,500 samples per lane, and both PCR primers contain sequencer adapter regions.	GT	FWD:GTGCCAGCMGCCGCGGTAA; REV:GGACTACHVGGGTWTCTAAT	Plate15	Illumina	V4	Cornell	4/3/13	TwinsUKPlate15	0.1,gram	Kings College London	sequencing by synthesis	16S rRNA	V4	H9	79	years	0	3212	UBERON:feces	25.39447975	UBERON:feces	UBERON:feces	1/30/13	2013-01-30 08:15:00	8:15:00	GAZ:United Kingdom	5/8/33	0	true	10.4516	ENVO:dense settlement biome	ENVO:human-associated habitat	true	321	human	Homo sapiens	3212	9606	3212	51.5	-0.12	true	Cornell	true	false	King's College, London, UK	Stool	female	8	1006024	TwinsUK gut microbiome	MZ	TwinsUK Fecal Sample
2014.Plate15.7	CTGGTGCTGAAT	GTGCCAGCMGCCGCGGTAA	14.335	Cornell	UK_Twins	Cornell	fecal samples from TwinsUK MiSeq runs	TwinsUK Miseq	Jess	MiSeq	This analysis was done as in Caporaso et al 2011 Genome research. The PCR primers F515 and R806 were developed against the V4 region of the 16S rRNA, both bacteria and archaea, which we determined would yield optimal community clustering with reads of this length The reverse PCR primer is barcoded with a 12-base error-correcting Golay code to facilitate multiplexing of up to 1,500 samples per lane, and both PCR primers contain sequencer adapter regions.	GT	FWD:GTGCCAGCMGCCGCGGTAA; REV:GGACTACHVGGGTWTCTAAT	Plate15	Illumina	V4	Cornell	4/3/13	TwinsUKPlate15	0.1,gram	Kings College London	sequencing by synthesis	16S rRNA	V4	G1	46	years	0	901	UBERON:feces	27.23994064	UBERON:feces	UBERON:feces	11/27/12	2012-11-27 00:00:00		GAZ:United Kingdom	10/8/66	0	true	10.4516	ENVO:dense settlement biome	ENVO:human-associated habitat	true	90	human	Homo sapiens	901	9606	901	51.5	-0.12	true	Cornell	true	false	King's College, London, UK	Stool	female	7	1003187	TwinsUK gut microbiome	DZ	TwinsUK Fecal Sample
2014.Plate15.68	GCCTGCAGTACT	GTGCCAGCMGCCGCGGTAA	8.739	Cornell	UK_Twins	Cornell	fecal samples from TwinsUK MiSeq runs	TwinsUK Miseq	Jess	MiSeq	This analysis was done as in Caporaso et al 2011 Genome research. The PCR primers F515 and R806 were developed against the V4 region of the 16S rRNA, both bacteria and archaea, which we determined would yield optimal community clustering with reads of this length The reverse PCR primer is barcoded with a 12-base error-correcting Golay code to facilitate multiplexing of up to 1,500 samples per lane, and both PCR primers contain sequencer adapter regions.	GT	FWD:GTGCCAGCMGCCGCGGTAA; REV:GGACTACHVGGGTWTCTAAT	Plate15	Illumina	V4	Cornell	4/3/13	TwinsUKPlate15	0.1,gram	Kings College London	sequencing by synthesis	16S rRNA	V4	D9	59	years	0	5012	UBERON:feces	31.01143074	UBERON:feces	UBERON:feces	1/14/13	2013-01-14 07:15:00	7:15:00	GAZ:United Kingdom	2/1/53	0	true	10.4516	ENVO:dense settlement biome	ENVO:human-associated habitat	true	501	human	Homo sapiens	5012	9606	5012	51.5	-0.12	true	Cornell	true	false	King's College, London, UK	Stool	female	8	1005966	TwinsUK gut microbiome	MZ	TwinsUK Fecal Sample
2014.Plate15.66	CACGAGCTACTC	GTGCCAGCMGCCGCGGTAA	12.514	Cornell	UK_Twins	Cornell	fecal samples from TwinsUK MiSeq runs	TwinsUK Miseq	Jess	MiSeq	This analysis was done as in Caporaso et al 2011 Genome research. The PCR primers F515 and R806 were developed against the V4 region of the 16S rRNA, both bacteria and archaea, which we determined would yield optimal community clustering with reads of this length The reverse PCR primer is barcoded with a 12-base error-correcting Golay code to facilitate multiplexing of up to 1,500 samples per lane, and both PCR primers contain sequencer adapter regions.	GT	FWD:GTGCCAGCMGCCGCGGTAA; REV:GGACTACHVGGGTWTCTAAT	Plate15	Illumina	V4	Cornell	4/3/13	TwinsUKPlate15	0.1,gram	Kings College London	sequencing by synthesis	16S rRNA	V4	B9	56	years	0	3712	UBERON:feces	22.31657982	UBERON:feces	UBERON:feces	1/25/13	2013-01-25 06:35:00	6:35:00	GAZ:United Kingdom	5/8/56	0	true	10.4516	ENVO:dense settlement biome	ENVO:human-associated habitat	true	371	human	Homo sapiens	3712	9606	3712	51.5	-0.12	true	Cornell	true	false	King's College, London, UK	Stool	female	8	1006031	TwinsUK gut microbiome	MZ	TwinsUK Fecal Sample
2014.Plate15.63	GAAACGGAAACG	GTGCCAGCMGCCGCGGTAA	18.745	Cornell	UK_Twins	Cornell	fecal samples from TwinsUK MiSeq runs	TwinsUK Miseq	Jess	MiSeq	This analysis was done as in Caporaso et al 2011 Genome research. The PCR primers F515 and R806 were developed against the V4 region of the 16S rRNA, both bacteria and archaea, which we determined would yield optimal community clustering with reads of this length The reverse PCR primer is barcoded with a 12-base error-correcting Golay code to facilitate multiplexing of up to 1,500 samples per lane, and both PCR primers contain sequencer adapter regions.	GT	FWD:GTGCCAGCMGCCGCGGTAA; REV:GGACTACHVGGGTWTCTAAT	Plate15	Illumina	V4	Cornell	4/3/13	TwinsUKPlate15	0.1,gram	Kings College London	sequencing by synthesis	16S rRNA	V4	G8	63	years	0	1711	UBERON:feces	21.28079987	UBERON:feces	UBERON:feces	2/3/13	2013-02-03 07:35:00	7:35:00	GAZ:United Kingdom	3/28/49	0	true	10.4516	ENVO:dense settlement biome	ENVO:human-associated habitat	true	171	human	Homo sapiens	1711	9606	1711	51.5	-0.12	true	Cornell	true	false	King's College, London, UK	Stool	female	8	1006053	TwinsUK gut microbiome	DZ	TwinsUK Fecal Sample
2014.Plate15.62	GTGCTTGTGTAG	GTGCCAGCMGCCGCGGTAA	22.332	Cornell	UK_Twins	Cornell	fecal samples from TwinsUK MiSeq runs	TwinsUK Miseq	Jess	MiSeq	This analysis was done as in Caporaso et al 2011 Genome research. The PCR primers F515 and R806 were developed against the V4 region of the 16S rRNA, both bacteria and archaea, which we determined would yield optimal community clustering with reads of this length The reverse PCR primer is barcoded with a 12-base error-correcting Golay code to facilitate multiplexing of up to 1,500 samples per lane, and both PCR primers contain sequencer adapter regions.	GT	FWD:GTGCCAGCMGCCGCGGTAA; REV:GGACTACHVGGGTWTCTAAT	Plate15	Illumina	V4	Cornell	4/3/13	TwinsUKPlate15	0.1,gram	Kings College London	sequencing by synthesis	16S rRNA	V4	F8	57	years	0	1061	UBERON:feces	21.50959969	UBERON:feces	UBERON:feces	1/20/13	2013-01-20 15:00:00	15:00:00	GAZ:United Kingdom	10/28/55	0	true	10.4516	ENVO:dense settlement biome	ENVO:human-associated habitat	true	106	human	Homo sapiens	1061	9606	1061	51.5	-0.12	true	Cornell	true	false	King's College, London, UK	Stool	female	8	1005978	TwinsUK gut microbiome	MZ	TwinsUK Fecal Sample
2014.Plate15.61	TTCACCTGTATC	GTGCCAGCMGCCGCGGTAA	7.983	Cornell	UK_Twins	Cornell	fecal samples from TwinsUK MiSeq runs	TwinsUK Miseq	Jess	MiSeq	This analysis was done as in Caporaso et al 2011 Genome research. The PCR primers F515 and R806 were developed against the V4 region of the 16S rRNA, both bacteria and archaea, which we determined would yield optimal community clustering with reads of this length The reverse PCR primer is barcoded with a 12-base error-correcting Golay code to facilitate multiplexing of up to 1,500 samples per lane, and both PCR primers contain sequencer adapter regions.	GT	FWD:GTGCCAGCMGCCGCGGTAA; REV:GGACTACHVGGGTWTCTAAT	Plate15	Illumina	V4	Cornell	4/3/13	TwinsUKPlate15	0.1,gram	Kings College London	sequencing by synthesis	16S rRNA	V4	E8	64	years	0	1931	UBERON:feces	29.4459095	UBERON:feces	UBERON:feces	1/15/13	2013-01-15 07:45:00	7:45:00	GAZ:United Kingdom	10/28/48	0	true	10.4516	ENVO:dense settlement biome	ENVO:human-associated habitat	true	193	human	Homo sapiens	1931	9606	1931	51.5	-0.12	true	Cornell	true	false	King's College, London, UK	Stool	female	8	1006042	TwinsUK gut microbiome	DZ	TwinsUK Fecal Sample
